{"difficulty": "hard", "function_schema_python": "def get_current_location() -> dict:\n    \"\"\"Gets the current location of the user.\n\n    :return: A dictionary containing latitude and longitude coordinates\n        dict keys:\n            - latitude (float): The latitude coordinate\n            - longitude (float): The longitude coordinate\n            - address (str): The current address\"\"\"\n    pass\ndef search_ride_options(origin: dict, destination: str, arrival_time: str) -> dict:\n    \"\"\"Searches for available ride options from both Uber and Grab.\n\n    :param origin: Dictionary containing current location coordinates and address\n    :param destination: Destination address\n    :param arrival_time: Desired arrival time in 24-hour format (HH:MM)\n    :return: Dictionary containing available ride options\n        dict keys:\n            - uber_rides (list[dict]): List of Uber ride options\n            - grab_rides (list[dict]): List of Grab ride options\n            Each ride option contains:\n                - price (float): Estimated ride cost\n                - duration (int): Estimated duration in minutes\n                - pickup_time (str): Suggested pickup time (HH:MM)\n    :raises ValueError: If parameters are invalid or no rides available\"\"\"\n    pass\ndef book_ride(service: str, ride_details: dict, budget: float) -> dict:\n    \"\"\"Books a ride with the specified service within the given budget.\n\n    :param service: Name of the ride service (\"uber\" or \"grab\")\n    :param ride_details: Dictionary containing ride option details\n    :param budget: Maximum amount willing to pay\n    :return: Dictionary containing booking confirmation\n        dict keys:\n            - booking_id (str): Unique booking identifier\n            - driver_name (str): Name of the assigned driver\n            - vehicle_info (str): Vehicle description\n            - pickup_time (str): Confirmed pickup time\n            - estimated_fare (float): Final estimated fare\n    :raises ValueError: If ride cannot be booked within budget\"\"\"\n    pass\n", "function_schema_json": [{"name": "get_current_location", "description": "Gets the current location of the user.", "parameters": {"type": "object", "properties": {}, "required": [], "additionalProperties": false}}, {"name": "search_ride_options", "description": "Searches for available ride options from both Uber and Grab.", "parameters": {"type": "object", "properties": {"origin": {"type": "object", "description": "Dictionary containing current location coordinates and address"}, "destination": {"type": "string", "description": "Destination address"}, "arrival_time": {"type": "string", "description": "Desired arrival time in 24-hour format (HH:MM)"}}, "required": ["origin", "destination", "arrival_time"], "additionalProperties": false}}, {"name": "book_ride", "description": "Books a ride with the specified service within the given budget.", "parameters": {"type": "object", "properties": {"service": {"type": "string", "description": "Name of the ride service (\"uber\" or \"grab\")"}, "ride_details": {"type": "object", "description": "Dictionary containing ride option details"}, "budget": {"type": "number", "description": "Maximum amount willing to pay"}}, "required": ["service", "ride_details", "budget"], "additionalProperties": false}}], "mock_functions": "def get_current_location() -> dict:\n    \"\"\"\n    Gets the current location of the user.\n    \n    :return: A dictionary containing latitude and longitude coordinates\n        dict keys:\n            - latitude (float): The latitude coordinate\n            - longitude (float): The longitude coordinate\n            - address (str): The current address\n    \"\"\"\n    return {\n        \"latitude\": 40.6782,\n        \"longitude\": -73.9442,\n        \"address\": \"123 Brooklyn Hotel St, Brooklyn, NY 11201\"\n    }\ndef search_ride_options(origin: dict, destination: str, arrival_time: str) -> dict:\n    \"\"\"\n    Searches for available ride options from both Uber and Grab.\n    \n    :param origin: Dictionary containing current location coordinates and address\n    :param destination: Destination address\n    :param arrival_time: Desired arrival time in 24-hour format (HH:MM)\n    :return: Dictionary containing available ride options\n        dict keys:\n            - uber_rides (list[dict]): List of Uber ride options\n            - grab_rides (list[dict]): List of Grab ride options\n            Each ride option contains:\n                - price (float): Estimated ride cost\n                - duration (int): Estimated duration in minutes\n                - pickup_time (str): Suggested pickup time (HH:MM)\n    :raises ValueError: If parameters are invalid or no rides available\n    \"\"\"\n    if not all([origin.get(\"latitude\"), origin.get(\"longitude\"), destination, arrival_time]):\n        raise ValueError(\"Invalid parameters provided\")\n    \n    if (destination == \"456 Broadway\" and arrival_time == \"21:00\"):\n        return {\n            \"uber_rides\": [\n                {\"price\": 18.50, \"duration\": 25, \"pickup_time\": \"20:30\"},\n                {\"price\": 25.00, \"duration\": 20, \"pickup_time\": \"20:35\"}\n            ],\n            \"grab_rides\": [\n                {\"price\": 19.50, \"duration\": 25, \"pickup_time\": \"20:30\"},\n                {\"price\": 23.00, \"duration\": 22, \"pickup_time\": \"20:33\"}\n            ]\n        }\n    return {}\ndef book_ride(service: str, ride_details: dict, budget: float) -> dict:\n    \"\"\"\n    Books a ride with the specified service within the given budget.\n    \n    :param service: Name of the ride service (\"uber\" or \"grab\")\n    :param ride_details: Dictionary containing ride option details\n    :param budget: Maximum amount willing to pay\n    :return: Dictionary containing booking confirmation\n        dict keys:\n            - booking_id (str): Unique booking identifier\n            - driver_name (str): Name of the assigned driver\n            - vehicle_info (str): Vehicle description\n            - pickup_time (str): Confirmed pickup time\n            - estimated_fare (float): Final estimated fare\n    :raises ValueError: If ride cannot be booked within budget\n    \"\"\"\n    if service.lower() not in [\"uber\", \"grab\"] or budget <= 0:\n        raise ValueError(\"Invalid service or budget\")\n    \n    if budget >= 18.50:\n        return {\n            \"booking_id\": \"RB123456\",\n            \"driver_name\": \"John Smith\",\n            \"vehicle_info\": \"Toyota Camry - ABC123\",\n            \"pickup_time\": \"20:30\",\n            \"estimated_fare\": 18.50\n        }\n    raise ValueError(\"No rides available within budget\")", "user_query": "This is David. Please book the cheapest Uber ride from my current location to 456 Broadway that will get me there by 9:00 PM, with a $20 budget limit.", "checklist": {"functions": ["get_current_location", "search_ride_options", "book_ride"], "values": [{"latitude": 40.6782, "longitude": -73.9442, "address": "123 Brooklyn Hotel St, Brooklyn, NY 11201"}, {"uber_rides": [{"price": 18.5, "duration": 25, "pickup_time": "20:30"}, {"price": 25.0, "duration": 20, "pickup_time": "20:35"}], "grab_rides": [{"price": 19.5, "duration": 25, "pickup_time": "20:30"}, {"price": 23.0, "duration": 22, "pickup_time": "20:33"}]}, {"booking_id": "RB123456", "driver_name": "John Smith", "vehicle_info": "Toyota Camry - ABC123", "pickup_time": "20:30", "estimated_fare": 18.5}]}}
{"difficulty": "hard", "function_schema_python": "def analyze_pipeline_metrics(pipeline_id: str) -> dict:\n    \"\"\"Analyzes CI pipeline metrics to identify performance bottlenecks.\n\n    :param pipeline_id: The unique identifier of the pipeline run\n    :return: Dictionary containing pipeline analysis metrics\n    :raises ValueError: If pipeline_id is invalid\"\"\"\n    pass\ndef get_pipeline_optimization_suggestions(metrics: dict) -> list:\n    \"\"\"Provides suggestions for optimizing the CI pipeline based on metrics.\n\n    :param metrics: Dictionary containing pipeline metrics and analysis\n    :return: List of optimization suggestions\n    :raises ValueError: If metrics dictionary is invalid or missing required keys\"\"\"\n    pass\ndef check_resource_availability(environment: str) -> dict:\n    \"\"\"Checks the availability of CI/CD resources in the specified environment.\n\n    :param environment: The environment to check (e.g., 'staging', 'prod')\n    :return: Dictionary containing resource availability status\n    :raises ValueError: If environment is invalid\"\"\"\n    pass\n", "function_schema_json": [{"name": "analyze_pipeline_metrics", "description": "Analyzes CI pipeline metrics to identify performance bottlenecks.", "parameters": {"type": "object", "properties": {"pipeline_id": {"type": "string", "description": "The unique identifier of the pipeline run"}}, "required": ["pipeline_id"], "additionalProperties": false}}, {"name": "get_pipeline_optimization_suggestions", "description": "Provides suggestions for optimizing the CI pipeline based on metrics.", "parameters": {"type": "object", "properties": {"metrics": {"type": "object", "description": "Dictionary containing pipeline metrics and analysis"}}, "required": ["metrics"], "additionalProperties": false}}, {"name": "check_resource_availability", "description": "Checks the availability of CI/CD resources in the specified environment.", "parameters": {"type": "object", "properties": {"environment": {"type": "string", "description": "The environment to check (e.g., 'staging', 'prod')"}}, "required": ["environment"], "additionalProperties": false}}], "mock_functions": "def analyze_pipeline_metrics(pipeline_id: str) -> dict:\n    \"\"\"\n    Analyzes CI pipeline metrics to identify performance bottlenecks.\n    \n    :param pipeline_id: The unique identifier of the pipeline run\n    :return: Dictionary containing pipeline analysis metrics\n    :raises ValueError: If pipeline_id is invalid\n    \"\"\"\n    if not pipeline_id or not isinstance(pipeline_id, str):\n        raise ValueError(\"Invalid pipeline ID\")\n    \n    if pipeline_id.startswith(\"green-\"):\n        return {\n            \"total_duration\": \"45 minutes\",\n            \"bottlenecks\": [\"test_suite\", \"docker_build\"],\n            \"stage_metrics\": {\n                \"build\": \"5 minutes\",\n                \"test\": \"25 minutes\",\n                \"deploy\": \"15 minutes\"\n            },\n            \"resource_usage\": {\n                \"cpu\": \"85%\",\n                \"memory\": \"70%\"\n            }\n        }\n    return {}\ndef get_pipeline_optimization_suggestions(metrics: dict) -> list:\n    \"\"\"\n    Provides suggestions for optimizing the CI pipeline based on metrics.\n    \n    :param metrics: Dictionary containing pipeline metrics and analysis\n    :return: List of optimization suggestions\n    :raises ValueError: If metrics dictionary is invalid or missing required keys\n    \"\"\"\n    required_keys = [\"total_duration\", \"bottlenecks\", \"stage_metrics\"]\n    if not all(key in metrics for key in required_keys):\n        raise ValueError(\"Invalid metrics dictionary\")\n    \n    if metrics[\"total_duration\"] == \"45 minutes\":\n        return [\n            \"Parallelize test suites to reduce execution time\",\n            \"Implement test caching for faster subsequent runs\",\n            \"Optimize Docker build by using multi-stage builds\",\n            \"Configure pipeline to run only affected services\"\n        ]\n    return []\ndef check_resource_availability(environment: str) -> dict:\n    \"\"\"\n    Checks the availability of CI/CD resources in the specified environment.\n    \n    :param environment: The environment to check (e.g., 'staging', 'prod')\n    :return: Dictionary containing resource availability status\n    :raises ValueError: If environment is invalid\n    \"\"\"\n    valid_environments = ['staging', 'prod']\n    if environment not in valid_environments:\n        raise ValueError(\"Invalid environment specified\")\n    \n    if environment == \"staging\":\n        return {\n            \"runners_available\": 3,\n            \"runners_total\": 5,\n            \"queue_length\": 2,\n            \"average_wait_time\": \"10 minutes\",\n            \"resource_status\": {\n                \"cpu_available\": True,\n                \"memory_available\": True,\n                \"disk_space_available\": True\n            }\n        }\n    return {}", "user_query": "Ryan from GreenTech here.  Check resource availability in the staging environment and provide optimization suggestions for pipeline ID \"green-12345\" if there are bottlenecks.", "checklist": {"functions": ["analyze_pipeline_metrics", "get_pipeline_optimization_suggestions", "check_resource_availability"], "values": [{"total_duration": "45 minutes", "bottlenecks": ["test_suite", "docker_build"], "stage_metrics": {"build": "5 minutes", "test": "25 minutes", "deploy": "15 minutes"}, "resource_usage": {"cpu": "85%", "memory": "70%"}}, ["Parallelize test suites to reduce execution time", "Implement test caching for faster subsequent runs", "Optimize Docker build by using multi-stage builds", "Configure pipeline to run only affected services"], {"runners_available": 3, "runners_total": 5, "queue_length": 2, "average_wait_time": "10 minutes", "resource_status": {"cpu_available": true, "memory_available": true, "disk_space_available": true}}]}}
{"difficulty": "hard", "function_schema_python": "def validate_hipaa_compliance(deployment_data: str) -> bool:\n    \"\"\"Validates that the deployment data is compliant with HIPAA regulations.\n\n    :param deployment_data: A string representing the deployment data.\n    :return: True if the deployment data is HIPAA compliant, False otherwise.\n    :raises ValueError: If deployment_data is empty.\"\"\"\n    pass\ndef perform_database_migration_validation(current_db: str, new_db: str) -> dict:\n    \"\"\"Validates the migration of a database from current_db to new_db.\n\n    :param current_db: A string representing the current database.\n    :param new_db: A string representing the new database.\n    :return:\n        dict: A dictionary with the following keys:\n            - is_valid (bool): Whether the migration is valid.\n            - validation_details (str): Details about the validation.\n    :raises ValueError: If current_db or new_db is empty.\"\"\"\n    pass\ndef setup_blue_green_deployment(environment_name: str) -> bool:\n    \"\"\"Sets up a blue-green deployment for the given environment.\n\n    :param environment_name: A string representing the environment name.\n    :return: True if the blue-green deployment is set up successfully, False otherwise.\n    :raises ValueError: If environment_name is empty.\"\"\"\n    pass\ndef automate_code_deployment(commit_id: str) -> str:\n    \"\"\"Automates the deployment of code with the given commit_id.\n\n    :param commit_id: A string representing the commit ID.\n    :return: A string indicating the success or failure of the deployment.\n    :raises ValueError: If commit_id is empty.\"\"\"\n    pass\ndef run_security_protocol_checks(environment_name: str) -> bool:\n    \"\"\"Runs security protocol checks for the given environment.\n\n    :param environment_name: A string representing the environment name.\n    :return: True if all security protocols are maintained, False otherwise.\n    :raises ValueError: If environment_name is empty.\"\"\"\n    pass\n", "function_schema_json": [{"name": "validate_hipaa_compliance", "description": "Validates that the deployment data is compliant with HIPAA regulations.", "parameters": {"type": "object", "properties": {"deployment_data": {"type": "string", "description": "A string representing the deployment data."}}, "required": ["deployment_data"], "additionalProperties": false}}, {"name": "perform_database_migration_validation", "description": "Validates the migration of a database from current_db to new_db.", "parameters": {"type": "object", "properties": {"current_db": {"type": "string", "description": "A string representing the current database."}, "new_db": {"type": "string", "description": "A string representing the new database."}}, "required": ["current_db", "new_db"], "additionalProperties": false}}, {"name": "setup_blue_green_deployment", "description": "Sets up a blue-green deployment for the given environment.", "parameters": {"type": "object", "properties": {"environment_name": {"type": "string", "description": "A string representing the environment name."}}, "required": ["environment_name"], "additionalProperties": false}}, {"name": "automate_code_deployment", "description": "Automates the deployment of code with the given commit_id.", "parameters": {"type": "object", "properties": {"commit_id": {"type": "string", "description": "A string representing the commit ID."}}, "required": ["commit_id"], "additionalProperties": false}}, {"name": "run_security_protocol_checks", "description": "Runs security protocol checks for the given environment.", "parameters": {"type": "object", "properties": {"environment_name": {"type": "string", "description": "A string representing the environment name."}}, "required": ["environment_name"], "additionalProperties": false}}], "mock_functions": "def validate_hipaa_compliance(deployment_data: str) -> bool:\n    \"\"\"\n    Validates that the deployment data is compliant with HIPAA regulations.\n    \n    :param deployment_data: A string representing the deployment data.\n    :return: True if the deployment data is HIPAA compliant, False otherwise.\n    :raises ValueError: If deployment_data is empty.\n    \"\"\"\n    if not deployment_data:\n        raise ValueError(\"Deployment data must not be empty.\")\n    # Mock logic: Assume all data is compliant if it has the keyword \"secure\".\n    return \"secure\" in deployment_data.lower()\ndef perform_database_migration_validation(current_db: str, new_db: str) -> dict:\n    \"\"\"\n    Validates the migration of a database from current_db to new_db.\n    \n    :param current_db: A string representing the current database.\n    :param new_db: A string representing the new database.\n    :return:\n        dict: A dictionary with the following keys:\n            - is_valid (bool): Whether the migration is valid.\n            - validation_details (str): Details about the validation.\n    :raises ValueError: If current_db or new_db is empty.\n    \"\"\"\n    if not current_db or not new_db:\n        raise ValueError(\"Current and new database must not be empty.\")\n    # Mock logic: Assume migration is valid if both databases start with \"MedTrack\".\n    return {\n        \"is_valid\": current_db.startswith(\"MedTrack\") and new_db.startswith(\"MedTrack\"),\n        \"validation_details\": \"Migration validated successfully\" if current_db.startswith(\"MedTrack\") and new_db.startswith(\"MedTrack\") else \"Migration validation failed\"\n    }\ndef setup_blue_green_deployment(environment_name: str) -> bool:\n    \"\"\"\n    Sets up a blue-green deployment for the given environment.\n    \n    :param environment_name: A string representing the environment name.\n    :return: True if the blue-green deployment is set up successfully, False otherwise.\n    :raises ValueError: If environment_name is empty.\n    \"\"\"\n    if not environment_name:\n        raise ValueError(\"Environment name must not be empty.\")\n    # Mock logic: Assume setup is successful if environment is \"production\".\n    return environment_name.lower() == \"production\"\ndef automate_code_deployment(commit_id: str) -> str:\n    \"\"\"\n    Automates the deployment of code with the given commit_id.\n    \n    :param commit_id: A string representing the commit ID.\n    :return: A string indicating the success or failure of the deployment.\n    :raises ValueError: If commit_id is empty.\n    \"\"\"\n    if not commit_id:\n        raise ValueError(\"Commit ID must not be empty.\")\n    # Mock logic: Assume deployment is successful if commit Id starts with \"abc\".\n    return \"Deployment successful\" if commit_id.startswith(\"abc\") else \"Deployment failed\"\ndef run_security_protocol_checks(environment_name: str) -> bool:\n    \"\"\"\n    Runs security protocol checks for the given environment.\n    \n    :param environment_name: A string representing the environment name.\n    :return: True if all security protocols are maintained, False otherwise.\n    :raises ValueError: If environment_name is empty.\n    \"\"\"\n    if not environment_name:\n        raise ValueError(\"Environment name must not be empty.\")\n    # Mock logic: Assume checks pass if environment name is \"secure-env\".\n    return environment_name == \"secure-env\"", "user_query": "This is Marcus from CloudScale.  Automate deployment for commit ID \"abc123xyz\", run security protocol checks for \"secure-env\", and ensure HIPAA compliance for deployment data \"secure patient data transfer and encryption\". Then, validate the database migration from \"MedTrack_DB_v1\" to \"MedTrack_DB_v2\".", "checklist": {"functions": ["automate_code_deployment", "run_security_protocol_checks", "validate_hipaa_compliance", "perform_database_migration_validation"], "values": ["Deployment successful", true, true, {"is_valid": true, "validation_details": "Migration validated successfully"}]}}
{"difficulty": "hard", "function_schema_python": "def get_real_time_price_data(ticker: str, timeframe: str) -> dict:\n    \"\"\"Retrieves real-time price data for a specified ticker.\n\n    :param ticker: Stock ticker symbol\n    :param timeframe: Time period for data retrieval (e.g., '1h', '1d')\n    :return: Dictionary containing price data:\n        - timestamp (list[int]): List of Unix timestamps\n        - price (list[float]): List of prices\n        - volume (list[int]): List of trading volumes\n    :raises ValueError: If ticker is invalid or timeframe is not supported\"\"\"\n    pass\ndef analyze_price_spike(ticker: str, current_price: float, volume: int) -> dict:\n    \"\"\"Analyzes sudden price movements for a given ticker.\n\n    :param ticker: Stock ticker symbol\n    :param current_price: Current stock price\n    :param volume: Current trading volume\n    :return: Dictionary containing analysis results:\n        - spike_detected (bool): Whether a spike was detected\n        - magnitude (float): Percentage change\n        - volume_ratio (float): Current volume compared to average\n        - alert_level (str): 'Low', 'Medium', or 'High'\n    :raises ValueError: If parameters are invalid\"\"\"\n    pass\ndef stream_market_data(ticker: str) -> dict:\n    \"\"\"Initiates a market data stream for a specified ticker.\n\n    :param ticker: Stock ticker symbol\n    :return: Dictionary containing stream information:\n        - connection_status (str): Connection status\n        - latency (float): Data latency in milliseconds\n        - data_feed_type (str): Type of data feed\n    :raises RuntimeError: If unable to establish connection\"\"\"\n    pass\n", "function_schema_json": [{"name": "get_real_time_price_data", "description": "Retrieves real-time price data for a specified ticker.", "parameters": {"type": "object", "properties": {"ticker": {"type": "string", "description": "Stock ticker symbol"}, "timeframe": {"type": "string", "description": "Time period for data retrieval (e.g., '1h', '1d')"}}, "required": ["ticker", "timeframe"], "additionalProperties": false}}, {"name": "analyze_price_spike", "description": "Analyzes sudden price movements for a given ticker.", "parameters": {"type": "object", "properties": {"ticker": {"type": "string", "description": "Stock ticker symbol"}, "current_price": {"type": "number", "description": "Current stock price"}, "volume": {"type": "integer", "description": "Current trading volume"}}, "required": ["ticker", "current_price", "volume"], "additionalProperties": false}}, {"name": "stream_market_data", "description": "Initiates a market data stream for a specified ticker.", "parameters": {"type": "object", "properties": {"ticker": {"type": "string", "description": "Stock ticker symbol"}}, "required": ["ticker"], "additionalProperties": false}}], "mock_functions": "def get_real_time_price_data(ticker: str, timeframe: str) -> dict:\n    \"\"\"\n    Retrieves real-time price data for a specified ticker.\n    \n    :param ticker: Stock ticker symbol\n    :param timeframe: Time period for data retrieval (e.g., '1h', '1d')\n    :return: Dictionary containing price data:\n        - timestamp (list[int]): List of Unix timestamps\n        - price (list[float]): List of prices\n        - volume (list[int]): List of trading volumes\n    :raises ValueError: If ticker is invalid or timeframe is not supported\n    \"\"\"\n    if not ticker or ticker != \"TC1\":\n        raise ValueError(\"Invalid ticker symbol\")\n    if timeframe != \"1h\":\n        raise ValueError(\"Unsupported timeframe\")\n    \n    return {\n        \"timestamp\": [1681123200, 1681126800, 1681130400],\n        \"price\": [156.23, 158.45, 162.78],\n        \"volume\": [25000, 35000, 50000]\n    }\ndef analyze_price_spike(ticker: str, current_price: float, volume: int) -> dict:\n    \"\"\"\n    Analyzes sudden price movements for a given ticker.\n    \n    :param ticker: Stock ticker symbol\n    :param current_price: Current stock price\n    :param volume: Current trading volume\n    :return: Dictionary containing analysis results:\n        - spike_detected (bool): Whether a spike was detected\n        - magnitude (float): Percentage change\n        - volume_ratio (float): Current volume compared to average\n        - alert_level (str): 'Low', 'Medium', or 'High'\n    :raises ValueError: If parameters are invalid\n    \"\"\"\n    if not ticker or ticker != \"TC1\" or current_price <= 0 or volume <= 0:\n        raise ValueError(\"Invalid parameters\")\n\n    return {\n        \"spike_detected\": True,\n        \"magnitude\": 4.32,\n        \"volume_ratio\": 2.5,\n        \"alert_level\": \"High\"\n    }\ndef stream_market_data(ticker: str) -> dict:\n    \"\"\"\n    Initiates a market data stream for a specified ticker.\n    \n    :param ticker: Stock ticker symbol\n    :return: Dictionary containing stream information:\n        - connection_status (str): Connection status\n        - latency (float): Data latency in milliseconds\n        - data_feed_type (str): Type of data feed\n    :raises RuntimeError: If unable to establish connection\n    \"\"\"\n    if not ticker or ticker != \"TC1\":\n        raise ValueError(\"Invalid ticker symbol\")\n    \n    return {\n        \"connection_status\": \"active\",\n        \"latency\": 0.15,\n        \"data_feed_type\": \"real-time\"\n    }", "user_query": "This is Sarah Thompson from Quantum Investments. Please stream market data for TechCorp (TC1), retrieve its real-time price data for the last hour, and then perform a comprehensive price spike analysis to help me adjust my trading algorithm.", "checklist": {"functions": ["get_real_time_price_data", "analyze_price_spike", "stream_market_data"], "values": [{"timestamp": [1681123200, 1681126800, 1681130400], "price": [156.23, 158.45, 162.78], "volume": [25000, 35000, 50000]}, {"spike_detected": true, "magnitude": 4.32, "volume_ratio": 2.5, "alert_level": "High"}, {"connection_status": "active", "latency": 0.15, "data_feed_type": "real-time"}]}}
{"difficulty": "hard", "function_schema_python": "def validate_transaction_pattern(account_id: str, amount: float, transaction_type: str) -> dict:\n    \"\"\"Validates if a transaction matches the user's historical pattern.\n\n    :param account_id: The account ID of the user.\n    :param amount: The transaction amount in USD.\n    :param transaction_type: Type of transaction (e.g., 'international_wire').\n    :return: Dictionary containing validation results:\n        - is_valid (bool): Whether the transaction matches normal patterns\n        - risk_score (float): Risk score from 0-1\n        - usual_amount (float): Average amount for this transaction type\n        - deviation_percentage (float): Percentage deviation from usual amount\n    :raises ValueError: If account_id is invalid or amount is negative.\"\"\"\n    pass\ndef verify_iban(iban: str) -> bool:\n    \"\"\"Verifies if the provided IBAN is valid and active.\n\n    :param iban: The IBAN number to verify.\n    :return: True if IBAN is valid and active, False otherwise.\n    :raises ValueError: If IBAN format is invalid.\"\"\"\n    pass\ndef check_aml_compliance(amount: float, sender_account: str, recipient_iban: str) -> dict:\n    \"\"\"Performs AML compliance check for international transfers.\n\n    :param amount: Transaction amount in USD.\n    :param sender_account: Sender's account ID.\n    :param recipient_iban: Recipient's IBAN.\n    :return: Dictionary containing compliance results:\n        - compliant (bool): Whether transaction is compliant\n        - requires_review (bool): If manual review is needed\n        - risk_level (str): Risk level assessment\n        - verification_id (str): Unique verification ID\n    :raises ValueError: If parameters are invalid.\"\"\"\n    pass\n", "function_schema_json": [{"name": "validate_transaction_pattern", "description": "Validates if a transaction matches the user's historical pattern.", "parameters": {"type": "object", "properties": {"account_id": {"type": "string", "description": "The account ID of the user."}, "amount": {"type": "number", "description": "The transaction amount in USD."}, "transaction_type": {"type": "string", "description": "Type of transaction (e.g., 'international_wire')."}}, "required": ["account_id", "amount", "transaction_type"], "additionalProperties": false}}, {"name": "verify_iban", "description": "Verifies if the provided IBAN is valid and active.", "parameters": {"type": "object", "properties": {"iban": {"type": "string", "description": "The IBAN number to verify."}}, "required": ["iban"], "additionalProperties": false}}, {"name": "check_aml_compliance", "description": "Performs AML compliance check for international transfers.", "parameters": {"type": "object", "properties": {"amount": {"type": "number", "description": "Transaction amount in USD."}, "sender_account": {"type": "string", "description": "Sender's account ID."}, "recipient_iban": {"type": "string", "description": "Recipient's IBAN."}}, "required": ["amount", "sender_account", "recipient_iban"], "additionalProperties": false}}], "mock_functions": "def validate_transaction_pattern(account_id: str, amount: float, transaction_type: str) -> dict:\n    \"\"\"\n    Validates if a transaction matches the user's historical pattern.\n    \n    :param account_id: The account ID of the user.\n    :param amount: The transaction amount in USD.\n    :param transaction_type: Type of transaction (e.g., 'international_wire').\n    :return: Dictionary containing validation results:\n        - is_valid (bool): Whether the transaction matches normal patterns\n        - risk_score (float): Risk score from 0-1\n        - usual_amount (float): Average amount for this transaction type\n        - deviation_percentage (float): Percentage deviation from usual amount\n    :raises ValueError: If account_id is invalid or amount is negative.\n    \"\"\"\n    if not account_id.startswith('AC-') or amount < 0:\n        raise ValueError(\"Invalid account ID or amount\")\n    \n    if account_id == \"AC-458792\" and amount == 12850.00:\n        return {\n            \"is_valid\": False,\n            \"risk_score\": 0.75,\n            \"usual_amount\": 2570.00,\n            \"deviation_percentage\": 400.0\n        }\n    return {\"is_valid\": True, \"risk_score\": 0.1, \"usual_amount\": 0, \"deviation_percentage\": 0}\ndef verify_iban(iban: str) -> bool:\n    \"\"\"\n    Verifies if the provided IBAN is valid and active.\n    \n    :param iban: The IBAN number to verify.\n    :return: True if IBAN is valid and active, False otherwise.\n    :raises ValueError: If IBAN format is invalid.\n    \"\"\"\n    # Remove spaces for validation\n    iban_clean = iban.replace(\" \", \"\")\n    if not iban_clean.startswith(\"DE\"):\n        raise ValueError(\"Invalid IBAN format\")\n    \n    return iban_clean == \"DE89370400440532013000\"\ndef check_aml_compliance(amount: float, sender_account: str, recipient_iban: str) -> dict:\n    \"\"\"\n    Performs AML compliance check for international transfers.\n    \n    :param amount: Transaction amount in USD.\n    :param sender_account: Sender's account ID.\n    :param recipient_iban: Recipient's IBAN.\n    :return: Dictionary containing compliance results:\n        - compliant (bool): Whether transaction is compliant\n        - requires_review (bool): If manual review is needed\n        - risk_level (str): Risk level assessment\n        - verification_id (str): Unique verification ID\n    :raises ValueError: If parameters are invalid.\n    \"\"\"\n    if amount < 0 or not sender_account.startswith('AC-'):\n        raise ValueError(\"Invalid parameters\")\n    \n    if (sender_account == \"AC-458792\" and \n        recipient_iban.replace(\" \", \"\") == \"DE89370400440532013000\" and \n        amount == 12850.00):\n        return {\n            \"compliant\": True,\n            \"requires_review\": True,\n            \"risk_level\": \"MEDIUM\",\n            \"verification_id\": \"VRF-78945612\"\n        }\n    return {\"compliant\": False, \"requires_review\": False, \"risk_level\": \"LOW\", \"verification_id\": \"\"}", "user_query": "This is Sarah Mitchell. Could you check AML compliance for a $12,850 transfer from account AC-458792 to IBAN DE89 3704 0044 0532 0130 00, and let me know if it requires further review?", "checklist": {"functions": ["validate_transaction_pattern", "verify_iban", "check_aml_compliance"], "values": [{"is_valid": false, "risk_score": 0.75, "usual_amount": 2570.0, "deviation_percentage": 400.0}, true, {"compliant": true, "requires_review": true, "risk_level": "MEDIUM", "verification_id": "VRF-78945612"}]}}
{"difficulty": "hard", "function_schema_python": "def calculate_client_hours(client_id: str, month: str, year: str) -> float:\n    \"\"\"Calculates total hours worked for a specific client in a given month.\n\n    :param client_id: Unique identifier for the client\n    :param month: Month for which to calculate hours (e.g., \"March\")\n    :param year: Year for which to calculate hours (e.g., \"2024\")\n    :return: Total hours worked for the client\n    :raises ValueError: If client_id is invalid or date parameters are incorrect\"\"\"\n    pass\ndef generate_invoice(client_id: str, hours: float, rate: float) -> dict:\n    \"\"\"Generates an invoice for a client based on hours worked and hourly rate.\n\n    :param client_id: Unique identifier for the client\n    :param hours: Total hours worked\n    :param rate: Hourly rate in dollars\n    :return: Dictionary containing invoice details\n    :raises ValueError: If parameters are invalid\"\"\"\n    pass\ndef send_invoice_email(invoice_data: dict, client_email: str) -> bool:\n    \"\"\"Sends invoice to client via email.\n\n    :param invoice_data: Dictionary containing invoice details\n    :param client_email: Client's email address\n    :return: True if email sent successfully, False otherwise\n    :raises ValueError: If email format is invalid or invoice_data is incomplete\"\"\"\n    pass\ndef process_payment(invoice_id: str, payment_method: str, amount: float) -> dict:\n    \"\"\"Processes payment for an invoice using specified payment method.\n\n    :param invoice_id: Unique identifier for the invoice\n    :param payment_method: Payment method (stripe/klarna/openbanking/plaid/paypal)\n    :param amount: Payment amount\n    :return: Dictionary containing payment details\n    :raises ValueError: If payment method is unsupported or amount is invalid\"\"\"\n    pass\n", "function_schema_json": [{"name": "calculate_client_hours", "description": "Calculates total hours worked for a specific client in a given month.", "parameters": {"type": "object", "properties": {"client_id": {"type": "string", "description": "Unique identifier for the client"}, "month": {"type": "string", "description": "Month for which to calculate hours (e.g., \"March\")"}, "year": {"type": "string", "description": "Year for which to calculate hours (e.g., \"2024\")"}}, "required": ["client_id", "month", "year"], "additionalProperties": false}}, {"name": "generate_invoice", "description": "Generates an invoice for a client based on hours worked and hourly rate.", "parameters": {"type": "object", "properties": {"client_id": {"type": "string", "description": "Unique identifier for the client"}, "hours": {"type": "number", "description": "Total hours worked"}, "rate": {"type": "number", "description": "Hourly rate in dollars"}}, "required": ["client_id", "hours", "rate"], "additionalProperties": false}}, {"name": "send_invoice_email", "description": "Sends invoice to client via email.", "parameters": {"type": "object", "properties": {"invoice_data": {"type": "object", "description": "Dictionary containing invoice details"}, "client_email": {"type": "string", "description": "Client's email address"}}, "required": ["invoice_data", "client_email"], "additionalProperties": false}}, {"name": "process_payment", "description": "Processes payment for an invoice using specified payment method.", "parameters": {"type": "object", "properties": {"invoice_id": {"type": "string", "description": "Unique identifier for the invoice"}, "payment_method": {"type": "string", "description": "Payment method (stripe/klarna/openbanking/plaid/paypal)"}, "amount": {"type": "number", "description": "Payment amount"}}, "required": ["invoice_id", "payment_method", "amount"], "additionalProperties": false}}], "mock_functions": "def calculate_client_hours(client_id: str, month: str, year: str) -> float:\n    \"\"\"\n    Calculates total hours worked for a specific client in a given month.\n    \n    :param client_id: Unique identifier for the client\n    :param month: Month for which to calculate hours (e.g., \"March\")\n    :param year: Year for which to calculate hours (e.g., \"2024\")\n    :return: Total hours worked for the client\n    :raises ValueError: If client_id is invalid or date parameters are incorrect\n    \"\"\"\n    if not client_id or not month or not year:\n        raise ValueError(\"All parameters must be provided\")\n    if month.lower() == \"march\" and year == \"2024\":\n        return float(client_id[-1]) * 2.5  # Mock calculation based on client ID\n    raise ValueError(\"Invalid date range\")\ndef generate_invoice(client_id: str, hours: float, rate: float) -> dict:\n    \"\"\"\n    Generates an invoice for a client based on hours worked and hourly rate.\n    \n    :param client_id: Unique identifier for the client\n    :param hours: Total hours worked\n    :param rate: Hourly rate in dollars\n    :return: Dictionary containing invoice details\n    :raises ValueError: If parameters are invalid\n    \"\"\"\n    if not client_id or hours <= 0 or rate <= 0:\n        raise ValueError(\"Invalid parameters\")\n    \n    total = hours * rate\n    return {\n        \"invoice_id\": f\"INV-{client_id}-2024-03\",\n        \"client_id\": client_id,\n        \"hours_worked\": hours,\n        \"rate_per_hour\": rate,\n        \"total_amount\": total,\n        \"due_date\": \"2024-04-30\",\n        \"status\": \"pending\"\n    }\ndef send_invoice_email(invoice_data: dict, client_email: str) -> bool:\n    \"\"\"\n    Sends invoice to client via email.\n    \n    :param invoice_data: Dictionary containing invoice details\n    :param client_email: Client's email address\n    :return: True if email sent successfully, False otherwise\n    :raises ValueError: If email format is invalid or invoice_data is incomplete\n    \"\"\"\n    if not client_email or \"@\" not in client_email:\n        raise ValueError(\"Invalid email address\")\n    \n    required_keys = [\"invoice_id\", \"total_amount\", \"due_date\"]\n    if not all(key in invoice_data for key in required_keys):\n        raise ValueError(\"Incomplete invoice data\")\n    \n    return True\ndef process_payment(invoice_id: str, payment_method: str, amount: float) -> dict:\n    \"\"\"\n    Processes payment for an invoice using specified payment method.\n    \n    :param invoice_id: Unique identifier for the invoice\n    :param payment_method: Payment method (stripe/klarna/openbanking/plaid/paypal)\n    :param amount: Payment amount\n    :return: Dictionary containing payment details\n    :raises ValueError: If payment method is unsupported or amount is invalid\n    \"\"\"\n    valid_methods = [\"stripe\", \"klarna\", \"openbanking\", \"plaid\", \"paypal\"]\n    if payment_method.lower() not in valid_methods:\n        raise ValueError(\"Unsupported payment method\")\n    \n    if amount <= 0:\n        raise ValueError(\"Invalid payment amount\")\n        \n    return {\n        \"payment_id\": f\"PAY-{invoice_id}\",\n        \"status\": \"completed\",\n        \"amount\": amount,\n        \"payment_method\": payment_method,\n        \"timestamp\": \"2024-04-15T10:00:00Z\"\n    }", "user_query": "This is Emma. For client ID CLT003, calculate the hours worked in March 2024, then generate an invoice at a $60 rate per hour, and send the invoice via email to client003@example.com.", "checklist": {"functions": ["calculate_client_hours", "generate_invoice", "send_invoice_email"], "values": [7.5, {"invoice_id": "INV-CLT003-2024-03", "client_id": "CLT003", "hours_worked": 7.5, "rate_per_hour": 60.0, "total_amount": 450.0, "due_date": "2024-04-30", "status": "pending"}, true]}}
{"difficulty": "hard", "function_schema_python": "def track_transaction(transaction_id: str, amount: float, currency: str) -> dict:\n    \"\"\"Tracks a transaction through the payment system.\n\n    :param transaction_id: A unique identifier for the transaction.\n    :param amount: The amount of money being transferred.\n    :param currency: The currency code (e.g., 'USD', 'EUR') of the transaction.\n    :return:\n        dict: A dictionary with the following keys:\n            - transaction_id (str): The transaction ID.\n            - status (str): The status of the transaction (e.g., 'completed', 'pending').\n            - currency (str): The currency of the transaction.\n            - foreign_exchange_adjustment (float): The foreign exchange adjustment made.\n    :raises ValueError: If any parameter is invalid.\"\"\"\n    pass\ndef calculate_foreign_exchange(amount: float, from_currency: str, to_currency: str) -> float:\n    \"\"\"Calculates the foreign exchange rate for a given amount between two currencies.\n\n    :param amount: The amount of money to be exchanged.\n    :param from_currency: The source currency code (e.g., 'USD').\n    :param to_currency: The target currency code (e.g., 'EUR').\n    :return: The adjusted amount in the target currency.\n    :raises ValueError: If any parameter is invalid.\"\"\"\n    pass\ndef update_financial_records(transaction_id: str, amount: float, currency: str, adjustment: float) -> bool:\n    \"\"\"Updates the financial records with the transaction details.\n\n    :param transaction_id: A unique identifier for the transaction.\n    :param amount: The amount of money being transferred.\n    :param currency: The currency code (e.g., 'USD', 'EUR') of the transaction.\n    :param adjustment: The foreign exchange adjustment made.\n    :return: True if the record was successfully updated, False otherwise.\n    :raises ValueError: If any parameter is invalid.\"\"\"\n    pass\ndef get_real_time_financial_position(subsidiary_id: str) -> dict:\n    \"\"\"Retrieves the real-time financial position of a specific subsidiary.\n\n    :param subsidiary_id: A unique identifier for the subsidiary.\n    :return:\n        dict: A dictionary with the following keys:\n            - subsidiary_id (str): The subsidiary ID.\n            - total_assets (float): The total assets of the subsidiary.\n            - total_liabilities (float): The total liabilities of the subsidiary.\n            - net_worth (float): The net worth of the subsidiary.\n    :raises ValueError: If the subsidiary ID is invalid.\"\"\"\n    pass\ndef integrate_payment_system(payment_gateway: str) -> str:\n    \"\"\"Integrates the payment system with a specified payment gateway.\n\n    :param payment_gateway: The payment gateway to integrate (e.g., 'stripe', 'klarna').\n    :return: A message indicating the success of the integration.\n    :raises ValueError: If the payment gateway is not supported.\"\"\"\n    pass\n", "function_schema_json": [{"name": "track_transaction", "description": "Tracks a transaction through the payment system.", "parameters": {"type": "object", "properties": {"transaction_id": {"type": "string", "description": "A unique identifier for the transaction."}, "amount": {"type": "number", "description": "The amount of money being transferred."}, "currency": {"type": "string", "description": "The currency code (e.g., 'USD', 'EUR') of the transaction."}}, "required": ["transaction_id", "amount", "currency"], "additionalProperties": false}}, {"name": "calculate_foreign_exchange", "description": "Calculates the foreign exchange rate for a given amount between two currencies.", "parameters": {"type": "object", "properties": {"amount": {"type": "number", "description": "The amount of money to be exchanged."}, "from_currency": {"type": "string", "description": "The source currency code (e.g., 'USD')."}, "to_currency": {"type": "string", "description": "The target currency code (e.g., 'EUR')."}}, "required": ["amount", "from_currency", "to_currency"], "additionalProperties": false}}, {"name": "update_financial_records", "description": "Updates the financial records with the transaction details.", "parameters": {"type": "object", "properties": {"transaction_id": {"type": "string", "description": "A unique identifier for the transaction."}, "amount": {"type": "number", "description": "The amount of money being transferred."}, "currency": {"type": "string", "description": "The currency code (e.g., 'USD', 'EUR') of the transaction."}, "adjustment": {"type": "number", "description": "The foreign exchange adjustment made."}}, "required": ["transaction_id", "amount", "currency", "adjustment"], "additionalProperties": false}}, {"name": "get_real_time_financial_position", "description": "Retrieves the real-time financial position of a specific subsidiary.", "parameters": {"type": "object", "properties": {"subsidiary_id": {"type": "string", "description": "A unique identifier for the subsidiary."}}, "required": ["subsidiary_id"], "additionalProperties": false}}, {"name": "integrate_payment_system", "description": "Integrates the payment system with a specified payment gateway.", "parameters": {"type": "object", "properties": {"payment_gateway": {"type": "string", "description": "The payment gateway to integrate (e.g., 'stripe', 'klarna')."}}, "required": ["payment_gateway"], "additionalProperties": false}}], "mock_functions": "def track_transaction(transaction_id: str, amount: float, currency: str) -> dict:\n    \"\"\"\n    Tracks a transaction through the payment system.\n    \n    :param transaction_id: A unique identifier for the transaction.\n    :param amount: The amount of money being transferred.\n    :param currency: The currency code (e.g., 'USD', 'EUR') of the transaction.\n    :return:\n        dict: A dictionary with the following keys:\n            - transaction_id (str): The transaction ID.\n            - status (str): The status of the transaction (e.g., 'completed', 'pending').\n            - currency (str): The currency of the transaction.\n            - foreign_exchange_adjustment (float): The foreign exchange adjustment made.\n    :raises ValueError: If any parameter is invalid.\n    \"\"\"\n    if not transaction_id or not amount or not currency:\n        raise ValueError(\"Transaction ID, amount, and currency must be provided.\")\n    \n    foreign_exchange_adjustment = 0.0\n    if currency == \"EUR\":\n        foreign_exchange_adjustment = amount * 0.01  # Mock adjustment factor\n    \n    return {\n        \"transaction_id\": transaction_id,\n        \"status\": \"completed\",\n        \"currency\": currency,\n        \"foreign_exchange_adjustment\": foreign_exchange_adjustment\n    }\ndef calculate_foreign_exchange(amount: float, from_currency: str, to_currency: str) -> float:\n    \"\"\"\n    Calculates the foreign exchange rate for a given amount between two currencies.\n    \n    :param amount: The amount of money to be exchanged.\n    :param from_currency: The source currency code (e.g., 'USD').\n    :param to_currency: The target currency code (e.g., 'EUR').\n    :return: The adjusted amount in the target currency.\n    :raises ValueError: If any parameter is invalid.\n    \"\"\"\n    if not amount or not from_currency or not to_currency:\n        raise ValueError(\"Amount, from_currency, and to_currency must be provided.\")\n    \n    exchange_rate = 1.1  # Mock exchange rate\n    if from_currency == \"USD\" and to_currency == \"EUR\":\n        return amount * exchange_rate\n    return amount  # No adjustment for other currencies\ndef update_financial_records(transaction_id: str, amount: float, currency: str, adjustment: float) -> bool:\n    \"\"\"\n    Updates the financial records with the transaction details.\n    \n    :param transaction_id: A unique identifier for the transaction.\n    :param amount: The amount of money being transferred.\n    :param currency: The currency code (e.g., 'USD', 'EUR') of the transaction.\n    :param adjustment: The foreign exchange adjustment made.\n    :return: True if the record was successfully updated, False otherwise.\n    :raises ValueError: If any parameter is invalid.\n    \"\"\"\n    if not transaction_id or not amount or not currency or adjustment is None:\n        raise ValueError(\"Transaction ID, amount, currency, and adjustment must be provided.\")\n    \n    return True\ndef get_real_time_financial_position(subsidiary_id: str) -> dict:\n    \"\"\"\n    Retrieves the real-time financial position of a specific subsidiary.\n    \n    :param subsidiary_id: A unique identifier for the subsidiary.\n    :return:\n        dict: A dictionary with the following keys:\n            - subsidiary_id (str): The subsidiary ID.\n            - total_assets (float): The total assets of the subsidiary.\n            - total_liabilities (float): The total liabilities of the subsidiary.\n            - net_worth (float): The net worth of the subsidiary.\n    :raises ValueError: If the subsidiary ID is invalid.\n    \"\"\"\n    if not subsidiary_id:\n        raise ValueError(\"Subsidiary ID must be provided.\")\n    \n    return {\n        \"subsidiary_id\": subsidiary_id,\n        \"total_assets\": 5000000.00,\n        \"total_liabilities\": 2000000.00,\n        \"net_worth\": 3000000.00\n    }\ndef integrate_payment_system(payment_gateway: str) -> str:\n    \"\"\"\n    Integrates the payment system with a specified payment gateway.\n    \n    :param payment_gateway: The payment gateway to integrate (e.g., 'stripe', 'klarna').\n    :return: A message indicating the success of the integration.\n    :raises ValueError: If the payment gateway is not supported.\n    \"\"\"\n    supported_gateways = {'stripe', 'klarna', 'openbanking', 'plaid', 'paypal-sdk'}\n    if payment_gateway not in supported_gateways:\n        raise ValueError(f\"Unsupported payment gateway: {payment_gateway}\")\n    \n    return f\"Successfully integrated with {payment_gateway}\"", "user_query": "This is Michael Rodriguez. Could you get the real-time financial position for subsidiary \"SUB456\", and if the net worth is over 2000000, track a new transaction \"TR789014\" for 100000 EUR and update the financial records with any foreign exchange adjustments?", "checklist": {"functions": ["get_real_time_financial_position", "track_transaction", "update_financial_records"], "values": [{"subsidiary_id": "SUB456", "total_assets": 5000000.0, "total_liabilities": 2000000.0, "net_worth": 3000000.0}, {"transaction_id": "TR789014", "status": "completed", "currency": "EUR", "foreign_exchange_adjustment": 1000.0}, true]}}
{"difficulty": "hard", "function_schema_python": "def load_dataset(dataset_path: str) -> List[Dict]:\n    \"\"\"Loads a dataset from a specified path.\n\n    :param dataset_path: The file path to the dataset.\n    :return: A list of dictionaries where each dictionary represents a data sample.\n    :raises FileNotFoundError: If the dataset file does not exist.\n    :raises ValueError: If the dataset file is empty or malformed.\"\"\"\n    pass\ndef train_model_with_huggingface_trl(dataset: List[Dict], model_config: Dict) -> Dict:\n    \"\"\"Trains a model using Hugging Face's TRL library.\n\n    :param dataset: The dataset used for training.\n    :param model_config: A dictionary containing model configuration parameters.\n    :return: A dictionary containing the training results.\n    :raises ValueError: If required parameters in model_config are missing.\"\"\"\n    pass\ndef optimize_hyperparameters_with_pytorch(dataset: List[Dict], hyperparameters: Dict) -> Dict:\n    \"\"\"Optimizes hyperparameters for a model using PyTorch.\n\n    :param dataset: The dataset used for hyperparameter optimization.\n    :param hyperparameters: A dictionary containing the hyperparameters to optimize.\n    :return: A dictionary containing the optimized hyperparameters and performance metrics.\n    :raises ValueError: If hyperparameters dictionary is empty.\"\"\"\n    pass\ndef upload_model_to_aws(model_path: str, bucket_name: str) -> bool:\n    \"\"\"Uploads a trained model to an S3 bucket on AWS.\n\n    :param model_path: The file path to the trained model.\n    :param bucket_name: The name of the S3 bucket.\n    :return: True if the model is successfully uploaded, False otherwise.\n    :raises ValueError: If model_path or bucket_name is empty.\n    :raises RuntimeError: If the upload fails.\"\"\"\n    pass\ndef log_experiment_results_with_mlflow(run_name: str, metrics: Dict) -> bool:\n    \"\"\"Logs experiment results using MLflow.\n\n    :param run_name: The name of the experiment run.\n    :param metrics: A dictionary containing the metrics to log.\n    :return: True if metrics are successfully logged, False otherwise.\n    :raises ValueError: If run_name or metrics are not provided.\"\"\"\n    pass\ndef get_suggested_model_config(model_type: str) -> Dict:\n    \"\"\"Retrieves a suggested model configuration based on the specified model type.\n\n    :param model_type: The type of the model.\n    :return: A dictionary containing the suggested model configuration.\n    :raises ValueError: If model_type is not supported.\"\"\"\n    pass\n", "function_schema_json": [{"name": "load_dataset", "description": "Loads a dataset from a specified path.", "parameters": {"type": "object", "properties": {"dataset_path": {"type": "string", "description": "The file path to the dataset."}}, "required": ["dataset_path"], "additionalProperties": false}}, {"name": "train_model_with_huggingface_trl", "description": "Trains a model using Hugging Face's TRL library.", "parameters": {"type": "object", "properties": {"dataset": {"type": "array", "items": {"type": "object"}, "description": "The dataset used for training."}, "model_config": {"type": "object", "description": "A dictionary containing model configuration parameters."}}, "required": ["dataset", "model_config"], "additionalProperties": false}}, {"name": "optimize_hyperparameters_with_pytorch", "description": "Optimizes hyperparameters for a model using PyTorch.", "parameters": {"type": "object", "properties": {"dataset": {"type": "array", "items": {"type": "object"}, "description": "The dataset used for hyperparameter optimization."}, "hyperparameters": {"type": "object", "description": "A dictionary containing the hyperparameters to optimize."}}, "required": ["dataset", "hyperparameters"], "additionalProperties": false}}, {"name": "upload_model_to_aws", "description": "Uploads a trained model to an S3 bucket on AWS.", "parameters": {"type": "object", "properties": {"model_path": {"type": "string", "description": "The file path to the trained model."}, "bucket_name": {"type": "string", "description": "The name of the S3 bucket."}}, "required": ["model_path", "bucket_name"], "additionalProperties": false}}, {"name": "log_experiment_results_with_mlflow", "description": "Logs experiment results using MLflow.", "parameters": {"type": "object", "properties": {"run_name": {"type": "string", "description": "The name of the experiment run."}, "metrics": {"type": "object", "description": "A dictionary containing the metrics to log."}}, "required": ["run_name", "metrics"], "additionalProperties": false}}, {"name": "get_suggested_model_config", "description": "Retrieves a suggested model configuration based on the specified model type.", "parameters": {"type": "object", "properties": {"model_type": {"type": "string", "description": "The type of the model."}}, "required": ["model_type"], "additionalProperties": false}}], "mock_functions": "def load_dataset(dataset_path: str) -> List[Dict]:\n    \"\"\"\n    Loads a dataset from a specified path.\n    \n    :param dataset_path: The file path to the dataset.\n    :return: A list of dictionaries where each dictionary represents a data sample.\n    :raises FileNotFoundError: If the dataset file does not exist.\n    :raises ValueError: If the dataset file is empty or malformed.\n    \"\"\"\n    if not dataset_path:\n        raise ValueError(\"Dataset path must be provided.\")\n    if dataset_path.lower() == \"financial_market_data.csv\":\n        return [\n            {\"features\": [1, 2, 3, 4], \"label\": 5},\n            {\"features\": [2, 3, 4, 5], \"label\": 6}\n        ]\n    else:\n        raise FileNotFoundError(\"Dataset not found.\")\ndef train_model_with_huggingface_trl(dataset: List[Dict], model_config: Dict) -> Dict:\n    \"\"\"\n    Trains a model using Hugging Face's TRL library.\n    \n    :param dataset: The dataset used for training.\n    :param model_config: A dictionary containing model configuration parameters.\n    :return: A dictionary containing the training results.\n    :raises ValueError: If required parameters in model_config are missing.\n    \"\"\"\n    required_params = {'model_type', 'learning_rate'}\n    if not all(param in model_config for param in required_params):\n        raise ValueError(\"Model configuration is missing required parameters.\")\n    return {\n        \"model_name\": model_config.get(\"model_type\"),\n        \"accuracy\": 0.85,\n        \"training_time\": \"2 hours\"\n    }\ndef optimize_hyperparameters_with_pytorch(dataset: List[Dict], hyperparameters: Dict) -> Dict:\n    \"\"\"\n    Optimizes hyperparameters for a model using PyTorch.\n    \n    :param dataset: The dataset used for hyperparameter optimization.\n    :param hyperparameters: A dictionary containing the hyperparameters to optimize.\n    :return: A dictionary containing the optimized hyperparameters and performance metrics.\n    :raises ValueError: If hyperparameters dictionary is empty.\n    \"\"\"\n    if not hyperparameters:\n        raise ValueError(\"Hyperparameters dictionary must not be empty.\")\n    return {\n        \"optimized_hyperparameters\": hyperparameters,\n        \"accuracy\": 0.90,\n        \"training_time\": \"1.5 hours\"\n    }\ndef upload_model_to_aws(model_path: str, bucket_name: str) -> bool:\n    \"\"\"\n    Uploads a trained model to an S3 bucket on AWS.\n    \n    :param model_path: The file path to the trained model.\n    :param bucket_name: The name of the S3 bucket.\n    :return: True if the model is successfully uploaded, False otherwise.\n    :raises ValueError: If model_path or bucket_name is empty.\n    :raises RuntimeError: If the upload fails.\n    \"\"\"\n    if not model_path or not bucket_name:\n        raise ValueError(\"Model path and bucket name must be provided.\")\n    if model_path.lower() == \"best_model.pth\" and bucket_name.lower() == \"neuralnetmodels\":\n        return True\n    raise RuntimeError(\"Failed to upload model to AWS.\")\ndef log_experiment_results_with_mlflow(run_name: str, metrics: Dict) -> bool:\n    \"\"\"\n    Logs experiment results using MLflow.\n    \n    :param run_name: The name of the experiment run.\n    :param metrics: A dictionary containing the metrics to log.\n    :return: True if metrics are successfully logged, False otherwise.\n    :raises ValueError: If run_name or metrics are not provided.\n    \"\"\"\n    if not run_name or not metrics:\n        raise ValueError(\"Run name and metrics must be provided.\")\n    return True\ndef get_suggested_model_config(model_type: str) -> Dict:\n    \"\"\"\n    Retrieves a suggested model configuration based on the specified model type.\n    \n    :param model_type: The type of the model.\n    :return: A dictionary containing the suggested model configuration.\n    :raises ValueError: If model_type is not supported.\n    \"\"\"\n    supported_models = {'lstm', 'transformer'}\n    if model_type.lower() not in supported_models:\n        raise ValueError(f\"Model type {model_type} is not supported.\")\n    if model_type.lower() == 'lstm':\n        return {\n            \"model_type\": \"LSTM\",\n            \"learning_rate\": 0.001,\n            \"batch_size\": 32\n        }\n    return {\n        \"model_type\": \"Transformer\",\n        \"learning_rate\": 0.0001,\n        \"batch_size\": 16\n    }", "user_query": "This is Alex from NeuralNet Solutions. Please train a model using the Hugging Face TRL library with the 'financial_market_data.csv' dataset, using the model configuration for 'Transformer' model type, and then log the results in MLflow with the run name 'Transformer Experiment'.", "checklist": {"functions": ["load_dataset", "get_suggested_model_config", "train_model_with_huggingface_trl", "log_experiment_results_with_mlflow"], "values": [[{"features": [1, 2, 3, 4], "label": 5}, {"features": [2, 3, 4, 5], "label": 6}], {"model_type": "Transformer", "learning_rate": 0.0001, "batch_size": 16}, {"model_name": "Transformer", "accuracy": 0.85, "training_time": "2 hours"}, true]}}
{"difficulty": "hard", "function_schema_python": "def optimize_model_training(model_framework: str, cloud_platform: str, optimization_strategy: str) -> Dict[str, Any]:\n    \"\"\"Optimizes model training based on the specified framework, platform, and strategy.\n\n    :param model_framework: The machine learning framework used (e.g., \"pytorch\").\n    :param cloud_platform: The cloud platform used for training (e.g., \"aws\").\n    :param optimization_strategy: The optimization strategy to apply (e.g., \"reduce_overfitting\").\n    :return: A dictionary containing optimization results.\n        - status (str): Status of the optimization process (e.g., \"success\", \"failed\").\n        - metrics (dict): Performance metrics after optimization (e.g., accuracy, loss).\n    :raises ValueError: If any parameter is invalid.\"\"\"\n    pass\ndef address_model_stability(model_framework: str, stability_issue: str) -> List[str]:\n    \"\"\"Provides solutions for addressing model stability issues.\n\n    :param model_framework: The machine learning framework used.\n    :param stability_issue: A description of the stability issue.\n    :return: A list of suggested solutions.\n    :raises ValueError: If model_framework or stability_issue is empty.\"\"\"\n    pass\ndef manage_training_resources(cloud_platform: str, resource_type: str, action: str) -> bool:\n    \"\"\"Manages computational resources on the specified cloud platform.\n\n    :param cloud_platform: The cloud platform being used (e.g., \"aws\").\n    :param resource_type: The type of resource to manage (e.g., \"GPU instances\").\n    :param action: The action to perform (e.g., \"allocate\", \"deallocate\").\n    :return: True if the action was successful, False otherwise.\n    :raises ValueError: If any parameter is invalid.\"\"\"\n    pass\ndef use_mlflow_tracking(experiment_name: str, metrics: Dict[str, float]) -> str:\n    \"\"\"Logs experiment details and metrics using MLflow.\n\n    :param experiment_name: The name of the experiment.\n    :param metrics: A dictionary of metrics to log.\n    :return: A string representing the run ID.\n    :raises ValueError: If any parameter is invalid.\"\"\"\n    pass\ndef apply_huggingface_trl(model_name: str, task: str) -> Dict[str, Any]:\n    \"\"\"Applies Hugging Face TRL for a specific task.\n\n    :param model_name: The name of the pre-trained model.\n    :param task: The task to perform (e.g., \"text_classification\").\n    :return: A dictionary containing the results of applying TRL.\n        - status (str): The status of the operation.\n        - model (Any): The fine-tuned model object.\"\"\"\n    pass\n", "function_schema_json": [{"name": "optimize_model_training", "description": "Optimizes model training based on the specified framework, platform, and strategy.", "parameters": {"type": "object", "properties": {"model_framework": {"type": "string", "description": "The machine learning framework used (e.g., \"pytorch\")."}, "cloud_platform": {"type": "string", "description": "The cloud platform used for training (e.g., \"aws\")."}, "optimization_strategy": {"type": "string", "description": "The optimization strategy to apply (e.g., \"reduce_overfitting\")."}}, "required": ["model_framework", "cloud_platform", "optimization_strategy"], "additionalProperties": false}}, {"name": "address_model_stability", "description": "Provides solutions for addressing model stability issues.", "parameters": {"type": "object", "properties": {"model_framework": {"type": "string", "description": "The machine learning framework used."}, "stability_issue": {"type": "string", "description": "A description of the stability issue."}}, "required": ["model_framework", "stability_issue"], "additionalProperties": false}}, {"name": "manage_training_resources", "description": "Manages computational resources on the specified cloud platform.", "parameters": {"type": "object", "properties": {"cloud_platform": {"type": "string", "description": "The cloud platform being used (e.g., \"aws\")."}, "resource_type": {"type": "string", "description": "The type of resource to manage (e.g., \"GPU instances\")."}, "action": {"type": "string", "description": "The action to perform (e.g., \"allocate\", \"deallocate\")."}}, "required": ["cloud_platform", "resource_type", "action"], "additionalProperties": false}}, {"name": "use_mlflow_tracking", "description": "Logs experiment details and metrics using MLflow.", "parameters": {"type": "object", "properties": {"experiment_name": {"type": "string", "description": "The name of the experiment."}, "metrics": {"type": "object", "description": "A dictionary of metrics to log."}}, "required": ["experiment_name", "metrics"], "additionalProperties": false}}, {"name": "apply_huggingface_trl", "description": "Applies Hugging Face TRL for a specific task.", "parameters": {"type": "object", "properties": {"model_name": {"type": "string", "description": "The name of the pre-trained model."}, "task": {"type": "string", "description": "The task to perform (e.g., \"text_classification\")."}}, "required": ["model_name", "task"], "additionalProperties": false}}], "mock_functions": "def optimize_model_training(model_framework: str, cloud_platform: str, optimization_strategy: str) -> Dict[str, Any]:\n    \"\"\"\n    Optimizes model training based on the specified framework, platform, and strategy.\n\n    :param model_framework: The machine learning framework used (e.g., \"pytorch\").\n    :param cloud_platform: The cloud platform used for training (e.g., \"aws\").\n    :param optimization_strategy: The optimization strategy to apply (e.g., \"reduce_overfitting\").\n    :return: A dictionary containing optimization results.\n        - status (str): Status of the optimization process (e.g., \"success\", \"failed\").\n        - metrics (dict): Performance metrics after optimization (e.g., accuracy, loss).\n    :raises ValueError: If any parameter is invalid.\n    \"\"\"\n    if not model_framework or not cloud_platform or not optimization_strategy:\n        raise ValueError(\"All parameters must be provided.\")\n\n    if model_framework.lower() == \"pytorch\" and cloud_platform.lower() == \"aws\" and optimization_strategy == \"reduce_overfitting\":\n        return {\n            \"status\": \"success\",\n            \"metrics\": {\n                \"accuracy\": 0.95,\n                \"loss\": 0.1\n            }\n        }\n    return {\"status\": \"failed\", \"metrics\": {}}\ndef address_model_stability(model_framework: str, stability_issue: str) -> List[str]:\n    \"\"\"\n    Provides solutions for addressing model stability issues.\n\n    :param model_framework: The machine learning framework used.\n    :param stability_issue: A description of the stability issue.\n    :return: A list of suggested solutions.\n    :raises ValueError: If model_framework or stability_issue is empty.\n    \"\"\"\n    if not model_framework or not stability_issue:\n        raise ValueError(\"Model framework and stability issue must be provided.\")\n    if model_framework.lower() == \"pytorch\" and \"overfitting\" in stability_issue.lower():\n        return [\n            \"Use regularization techniques (L1 or L2)\",\n            \"Apply dropout layers\",\n            \"Perform data augmentation\",\n            \"Reduce model complexity\"\n        ]\n    return []\ndef manage_training_resources(cloud_platform: str, resource_type: str, action: str) -> bool:\n    \"\"\"\n    Manages computational resources on the specified cloud platform.\n\n    :param cloud_platform: The cloud platform being used (e.g., \"aws\").\n    :param resource_type: The type of resource to manage (e.g., \"GPU instances\").\n    :param action: The action to perform (e.g., \"allocate\", \"deallocate\").\n    :return: True if the action was successful, False otherwise.\n    :raises ValueError: If any parameter is invalid.\n    \"\"\"\n    if not cloud_platform or not resource_type or not action:\n        raise ValueError(\"All parameters must be provided.\")\n    if cloud_platform.lower() == \"aws\" and resource_type == \"GPU instances\" and action == \"allocate\":\n        return True\n    return False\ndef use_mlflow_tracking(experiment_name: str, metrics: Dict[str, float]) -> str:\n    \"\"\"\n    Logs experiment details and metrics using MLflow.\n\n    :param experiment_name: The name of the experiment.\n    :param metrics: A dictionary of metrics to log.\n    :return: A string representing the run ID.\n    :raises ValueError: If any parameter is invalid.\n    \"\"\"\n    if not experiment_name or not metrics:\n        raise ValueError(\"Experiment name and metrics must be provided.\")\n\n    if experiment_name == \"StormPredict\" and \"accuracy\" in metrics and \"loss\" in metrics:\n        return \"MLflow_run_ID_12345\"\n    return \"\"\ndef apply_huggingface_trl(model_name: str, task: str) -> Dict[str, Any]:\n    \"\"\"\n    Applies Hugging Face TRL for a specific task.\n\n    :param model_name: The name of the pre-trained model.\n    :param task: The task to perform (e.g., \"text_classification\").\n    :return: A dictionary containing the results of applying TRL.\n        - status (str): The status of the operation.\n        - model (Any): The fine-tuned model object.\n    \"\"\"\n\n    if model_name and task:\n        return {\"status\": \"success\", \"model\": \"Fine-tuned model object\"}\n    return {}", "user_query": "This is Dr. Elena Morris from UC Berkeley. I want to track the StormPredict experiment using MLflow. Can you optimize the PyTorch model training on AWS, log the metrics, and provide stability solutions for overfitting while allocating GPU instances?", "checklist": {"functions": ["address_model_stability", "optimize_model_training", "manage_training_resources", "use_mlflow_tracking"], "values": [["Use regularization techniques (L1 or L2)", "Apply dropout layers", "Perform data augmentation", "Reduce model complexity"], {"status": "success", "metrics": {"accuracy": 0.95, "loss": 0.1}}, true, "MLflow_run_ID_12345"]}}
{"difficulty": "hard", "function_schema_python": "def load_data(file_path: str) -> dict:\n    \"\"\"Loads customer data from a specified file path.\n\n    :param file_path: The path to the file containing customer data.\n    :return:\n        dict: A dictionary containing the loaded data with the following keys:\n            - 'features' (list[dict]): A list of dictionaries, each representing a customer's data.\n            - 'labels' (list[int]): A list of integers representing the churn status of each customer.\n    :raises FileNotFoundError: If the file path is invalid.\"\"\"\n    pass\ndef feature_scaling(features: list) -> list:\n    \"\"\"Scales features so that they have a mean of 0 and standard deviation of 1.\n\n    :param features: A list of dictionaries representing customer data.\n    :return:\n        list: A list of dictionaries with scaled feature values.\"\"\"\n    pass\ndef one_hot_encode(categories: list) -> dict:\n    \"\"\"Performs one-hot encoding on categorical data.\n\n    :param categories: A list of categories to encode.\n    :return:\n        dict: A dictionary with keys as original categories and values as encoded vectors.\"\"\"\n    pass\ndef feature_selection(features: list, labels: list) -> dict:\n    \"\"\"Selects the most relevant features for the predictive model.\n\n    :param features: A list of dictionaries representing customer data.\n    :param labels: A list of integers representing the churn status of each customer.\n    :return:\n        dict: A dictionary with the following keys:\n            - 'selected_features' (list[dict]): A list of dictionaries with selected features.\n            - 'performance_metric' (float): A float representing the performance metric of the model.\"\"\"\n    pass\ndef log_experiment_results(experiment_name: str, model_performance: float) -> bool:\n    \"\"\"Logs the results of an experiment to an MLflow tracking server.\n\n    :param experiment_name: The name of the experiment.\n    :param model_performance: The performance metric of the model.\n    :return: True if the results were successfully logged, False otherwise.\"\"\"\n    pass\ndef deploy_model(model_artifact: str, platform: str) -> bool:\n    \"\"\"Deploys a machine learning model to a specified platform.\n\n    :param model_artifact: The path to the model artifact.\n    :param platform: The platform to deploy the model to (e.g., 'AWS').\n    :return: True if the model was successfully deployed, False otherwise.\"\"\"\n    pass\n", "function_schema_json": [{"name": "load_data", "description": "Loads customer data from a specified file path.", "parameters": {"type": "object", "properties": {"file_path": {"type": "string", "description": "The path to the file containing customer data."}}, "required": ["file_path"], "additionalProperties": false}}, {"name": "feature_scaling", "description": "Scales features so that they have a mean of 0 and standard deviation of 1.", "parameters": {"type": "object", "properties": {"features": {"type": "array", "description": "A list of dictionaries representing customer data."}}, "required": ["features"], "additionalProperties": false}}, {"name": "one_hot_encode", "description": "Performs one-hot encoding on categorical data.", "parameters": {"type": "object", "properties": {"categories": {"type": "array", "description": "A list of categories to encode."}}, "required": ["categories"], "additionalProperties": false}}, {"name": "feature_selection", "description": "Selects the most relevant features for the predictive model.", "parameters": {"type": "object", "properties": {"features": {"type": "array", "description": "A list of dictionaries representing customer data."}, "labels": {"type": "array", "description": "A list of integers representing the churn status of each customer."}}, "required": ["features", "labels"], "additionalProperties": false}}, {"name": "log_experiment_results", "description": "Logs the results of an experiment to an MLflow tracking server.", "parameters": {"type": "object", "properties": {"experiment_name": {"type": "string", "description": "The name of the experiment."}, "model_performance": {"type": "number", "description": "The performance metric of the model."}}, "required": ["experiment_name", "model_performance"], "additionalProperties": false}}, {"name": "deploy_model", "description": "Deploys a machine learning model to a specified platform.", "parameters": {"type": "object", "properties": {"model_artifact": {"type": "string", "description": "The path to the model artifact."}, "platform": {"type": "string", "description": "The platform to deploy the model to (e.g., 'AWS')."}}, "required": ["model_artifact", "platform"], "additionalProperties": false}}], "mock_functions": "def load_data(file_path: str) -> dict:\n    \"\"\"\n    Loads customer data from a specified file path.\n    \n    :param file_path: The path to the file containing customer data.\n    :return:\n        dict: A dictionary containing the loaded data with the following keys:\n            - 'features' (list[dict]): A list of dictionaries, each representing a customer's data.\n            - 'labels' (list[int]): A list of integers representing the churn status of each customer.\n    :raises FileNotFoundError: If the file path is invalid.\n    \"\"\"\n    if not file_path.endswith('.csv'):\n        raise ValueError(\"File path must point to a CSV file.\")\n    if file_path == \"customer_data.csv\":\n        return {\n            \"features\": [\n                {\"age\": 28, \"gender\": \"male\", \"account_length\": 12},\n                {\"age\": 54, \"gender\": \"female\", \"account_length\": 30}\n            ],\n            \"labels\": [0, 1]\n        }\n    raise FileNotFoundError(\"File not found.\")\ndef feature_scaling(features: list) -> list:\n    \"\"\"\n    Scales features so that they have a mean of 0 and standard deviation of 1.\n    \n    :param features: A list of dictionaries representing customer data.\n    :return:\n        list: A list of dictionaries with scaled feature values.\n    \"\"\"\n    if not features:\n        raise ValueError(\"Features list must not be empty.\")\n    scaled_features = []\n    for feature in features:\n        # Mock scaling logic\n        scaled_feature = {key: value * 0.1 for key, value in feature.items()}\n        scaled_features.append(scaled_feature)\n    return scaled_features\ndef one_hot_encode(categories: list) -> dict:\n    \"\"\"\n    Performs one-hot encoding on categorical data.\n    \n    :param categories: A list of categories to encode.\n    :return:\n        dict: A dictionary with keys as original categories and values as encoded vectors.\n    \"\"\"\n    if not categories:\n        raise ValueError(\"Categories list must not be empty.\")\n    encoding_dict = {}\n    for idx, category in enumerate(categories):\n        vector = [0] * len(categories)\n        vector[idx] = 1\n        encoding_dict[category] = vector\n    return encoding_dict\ndef feature_selection(features: list, labels: list) -> dict:\n    \"\"\"\n    Selects the most relevant features for the predictive model.\n    \n    :param features: A list of dictionaries representing customer data.\n    :param labels: A list of integers representing the churn status of each customer.\n    :return:\n        dict: A dictionary with the following keys:\n            - 'selected_features' (list[dict]): A list of dictionaries with selected features.\n            - 'performance_metric' (float): A float representing the performance metric of the model.\n    \"\"\"\n    if not features or not labels:\n        raise ValueError(\"Features and labels must not be empty.\")\n    # Mock feature selection logic\n    selected_features = []\n    for feature in features:\n        # Select features with age over 30\n        if feature.get('age', 0) > 30:\n            selected_features.append(feature)\n    # Mock performance metric\n    performance_metric = 0.85\n    return {\n        \"selected_features\": selected_features,\n        \"performance_metric\": performance_metric\n    }\ndef log_experiment_results(experiment_name: str, model_performance: float) -> bool:\n    \"\"\"\n    Logs the results of an experiment to an MLflow tracking server.\n    \n    :param experiment_name: The name of the experiment.\n    :param model_performance: The performance metric of the model.\n    :return: True if the results were successfully logged, False otherwise.\n    \"\"\"\n    if not experiment_name or model_performance is None:\n        raise ValueError(\"Experiment name and model performance must be provided.\")\n    if experiment_name == \"customer_churn_model\":\n        # Mock logging logic\n        return True\n    return False\ndef deploy_model(model_artifact: str, platform: str) -> bool:\n    \"\"\"\n    Deploys a machine learning model to a specified platform.\n    \n    :param model_artifact: The path to the model artifact.\n    :param platform: The platform to deploy the model to (e.g., 'AWS').\n    :return: True if the model was successfully deployed, False otherwise.\n    \"\"\"\n    if not model_artifact or not platform:\n        raise ValueError(\"Model artifact and platform must be specified.\")\n    if model_artifact == \"churn_model.pkl\" and platform == \"AWS\":\n        # Mock deployment logic\n        return True\n    return False", "user_query": "This is Alex Johnson. Could you load data from customer_data.csv, perform feature selection with the loaded features and labels, then log the results under experiment name \"customer_churn_model\"?", "checklist": {"functions": ["load_data", "feature_selection", "log_experiment_results"], "values": [{"features": [{"age": 28, "gender": "male", "account_length": 12}, {"age": 54, "gender": "female", "account_length": 30}], "labels": [0, 1]}, {"selected_features": [{"age": 54, "gender": "female", "account_length": 30}], "performance_metric": 0.85}, true]}}
{"difficulty": "hard", "function_schema_python": "def verify_transaction(transaction_id: str) -> dict:\n    \"\"\"Verifies and retrieves details of a blockchain transaction.\n\n    :param transaction_id: The unique identifier of the transaction.\n    :return: Dictionary containing transaction details:\n        - amount (float): Amount in ETH\n        - sender (str): Sender's wallet address\n        - recipient (str): Recipient's wallet address\n        - timestamp (str): Transaction timestamp\n        - status (str): Transaction status\n    :raises ValueError: If transaction_id is invalid or not found\"\"\"\n    pass\ndef get_eth_usd_rate(timestamp: str) -> float:\n    \"\"\"Retrieves the ETH to USD conversion rate at a specific timestamp.\n\n    :param timestamp: ISO format timestamp string\n    :return: The conversion rate (USD per ETH)\n    :raises ValueError: If timestamp is invalid or rate not available\"\"\"\n    pass\ndef check_wallet_conversion_settings(wallet_address: str) -> dict:\n    \"\"\"Retrieves the auto-conversion settings for a wallet.\n\n    :param wallet_address: The blockchain wallet address\n    :return: Dictionary containing wallet settings:\n        - auto_convert (bool): Whether auto-conversion is enabled\n        - target_currency (str): Target currency for conversion\n        - conversion_fee (float): Fee percentage for conversion\n    :raises ValueError: If wallet address is invalid\"\"\"\n    pass\n", "function_schema_json": [{"name": "verify_transaction", "description": "Verifies and retrieves details of a blockchain transaction.", "parameters": {"type": "object", "properties": {"transaction_id": {"type": "string", "description": "The unique identifier of the transaction."}}, "required": ["transaction_id"], "additionalProperties": false}}, {"name": "get_eth_usd_rate", "description": "Retrieves the ETH to USD conversion rate at a specific timestamp.", "parameters": {"type": "object", "properties": {"timestamp": {"type": "string", "description": "ISO format timestamp string"}}, "required": ["timestamp"], "additionalProperties": false}}, {"name": "check_wallet_conversion_settings", "description": "Retrieves the auto-conversion settings for a wallet.", "parameters": {"type": "object", "properties": {"wallet_address": {"type": "string", "description": "The blockchain wallet address"}}, "required": ["wallet_address"], "additionalProperties": false}}], "mock_functions": "def verify_transaction(transaction_id: str) -> dict:\n    \"\"\"\n    Verifies and retrieves details of a blockchain transaction.\n    \n    :param transaction_id: The unique identifier of the transaction.\n    :return: Dictionary containing transaction details:\n        - amount (float): Amount in ETH\n        - sender (str): Sender's wallet address\n        - recipient (str): Recipient's wallet address\n        - timestamp (str): Transaction timestamp\n        - status (str): Transaction status\n    :raises ValueError: If transaction_id is invalid or not found\n    \"\"\"\n    if not transaction_id or not isinstance(transaction_id, str):\n        raise ValueError(\"Invalid transaction ID\")\n    \n    if transaction_id == \"0x1234567890abcdef\":\n        return {\n            \"amount\": 1.5,\n            \"sender\": \"0xXYZCorp789\",\n            \"recipient\": \"0xEmily456\",\n            \"timestamp\": \"2023-07-20T14:30:00Z\",\n            \"status\": \"confirmed\"\n        }\n    raise ValueError(\"Transaction not found\")\ndef get_eth_usd_rate(timestamp: str) -> float:\n    \"\"\"\n    Retrieves the ETH to USD conversion rate at a specific timestamp.\n    \n    :param timestamp: ISO format timestamp string\n    :return: The conversion rate (USD per ETH)\n    :raises ValueError: If timestamp is invalid or rate not available\n    \"\"\"\n    if not timestamp or not isinstance(timestamp, str):\n        raise ValueError(\"Invalid timestamp\")\n    \n    if timestamp == \"2023-07-20T14:30:00Z\":\n        return 1850.75\n    raise ValueError(\"Rate not available for specified timestamp\")\ndef check_wallet_conversion_settings(wallet_address: str) -> dict:\n    \"\"\"\n    Retrieves the auto-conversion settings for a wallet.\n    \n    :param wallet_address: The blockchain wallet address\n    :return: Dictionary containing wallet settings:\n        - auto_convert (bool): Whether auto-conversion is enabled\n        - target_currency (str): Target currency for conversion\n        - conversion_fee (float): Fee percentage for conversion\n    :raises ValueError: If wallet address is invalid\n    \"\"\"\n    if not wallet_address or not isinstance(wallet_address, str):\n        raise ValueError(\"Invalid wallet address\")\n    \n    if wallet_address == \"0xEmily456\":\n        return {\n            \"auto_convert\": True,\n            \"target_currency\": \"USD\",\n            \"conversion_fee\": 0.5\n        }\n    raise ValueError(\"Wallet not found\")", "user_query": "I received a payment (transaction ID: 0x1234567890abcdef).  Can you verify the transaction and tell me the conversion to USD, given my wallet's settings (address: 0xEmily456)?", "checklist": {"functions": ["verify_transaction", "get_eth_usd_rate", "check_wallet_conversion_settings"], "values": [{"amount": 1.5, "sender": "0xXYZCorp789", "recipient": "0xEmily456", "timestamp": "2023-07-20T14:30:00Z", "status": "confirmed"}, 1850.75, {"auto_convert": true, "target_currency": "USD", "conversion_fee": 0.5}]}}
{"difficulty": "hard", "function_schema_python": "def validate_smart_contract_code(contract_code: str) -> dict:\n    \"\"\"Validates the smart contract code for vulnerabilities.\n\n    :param contract_code: A string containing the smart contract code.\n    :return:\n        dict: A dictionary with the following keys:\n            - is_valid (bool): True if the contract is valid, False otherwise.\n            - issues (list[str]): List of identified issues or vulnerabilities.\n    :raises ValueError: If the contract code is empty.\"\"\"\n    pass\ndef deploy_smart_contract(contract_code: str, network: str) -> bool:\n    \"\"\"Deploys the smart contract to the specified network.\n\n    :param contract_code: A string containing the smart contract code.\n    :param network: The name of the network to deploy to (e.g., \"mainnet\", \"testnet\").\n    :return: True if the deployment was successful, False otherwise.\n    :raises ValueError: If contract code or network is invalid or not provided.\"\"\"\n    pass\ndef get_network_balance(network: str) -> int:\n    \"\"\"Retrieves the balance of the current account on the specified network.\n\n    :param network: The name of the network (e.g., \"mainnet\", \"testnet\").\n    :return: An integer representing the balance in ETH.\n    :raises ValueError: If the network is not provided.\"\"\"\n    pass\ndef get_user_base_count() -> int:\n    \"\"\"Retrieves the number of beta testers for the decentralized finance platform.\n\n    :return: An integer representing the number of beta testers.\"\"\"\n    pass\n", "function_schema_json": [{"name": "validate_smart_contract_code", "description": "Validates the smart contract code for vulnerabilities.", "parameters": {"type": "object", "properties": {"contract_code": {"type": "string", "description": "A string containing the smart contract code."}}, "required": ["contract_code"], "additionalProperties": false}}, {"name": "deploy_smart_contract", "description": "Deploys the smart contract to the specified network.", "parameters": {"type": "object", "properties": {"contract_code": {"type": "string", "description": "A string containing the smart contract code."}, "network": {"type": "string", "description": "The name of the network to deploy to (e.g., \"mainnet\", \"testnet\")."}}, "required": ["contract_code", "network"], "additionalProperties": false}}, {"name": "get_network_balance", "description": "Retrieves the balance of the current account on the specified network.", "parameters": {"type": "object", "properties": {"network": {"type": "string", "description": "The name of the network (e.g., \"mainnet\", \"testnet\")."}}, "required": ["network"], "additionalProperties": false}}, {"name": "get_user_base_count", "description": "Retrieves the number of beta testers for the decentralized finance platform.", "parameters": {"type": "object", "properties": {}, "required": [], "additionalProperties": false}}], "mock_functions": "def validate_smart_contract_code(contract_code: str) -> dict:\n    \"\"\"\n    Validates the smart contract code for vulnerabilities.\n    \n    :param contract_code: A string containing the smart contract code.\n    :return:\n        dict: A dictionary with the following keys:\n            - is_valid (bool): True if the contract is valid, False otherwise.\n            - issues (list[str]): List of identified issues or vulnerabilities.\n    :raises ValueError: If the contract code is empty.\n    \"\"\"\n    if not contract_code:\n        raise ValueError(\"Contract code must not be empty.\")\n    \n    # Mock logic to simulate validation:\n    # Assume the contract code contains a known vulnerability if it contains the string \"buggy\"\n    if \"buggy\" in contract_code:\n        return {\n            \"is_valid\": False,\n            \"issues\": [\"Potential reentrancy attack due to buggy function\"]\n        }\n    else:\n        return {\n            \"is_valid\": True,\n            \"issues\": []\n        }\ndef deploy_smart_contract(contract_code: str, network: str) -> bool:\n    \"\"\"\n    Deploys the smart contract to the specified network.\n    \n    :param contract_code: A string containing the smart contract code.\n    :param network: The name of the network to deploy to (e.g., \"mainnet\", \"testnet\").\n    :return: True if the deployment was successful, False otherwise.\n    :raises ValueError: If contract code or network is invalid or not provided.\n    \"\"\"\n    if not contract_code or not network:\n        raise ValueError(\"Contract code and network must be provided.\")\n    \n    # Mock logic to simulate deployment:\n    # Assume deployment is successful if the network is \"testnet\"\n    if network.lower() == \"testnet\":\n        return True\n    else:\n        return False\ndef get_network_balance(network: str) -> int:\n    \"\"\"\n    Retrieves the balance of the current account on the specified network.\n    \n    :param network: The name of the network (e.g., \"mainnet\", \"testnet\").\n    :return: An integer representing the balance in ETH.\n    :raises ValueError: If the network is not provided.\n    \"\"\"\n    if not network:\n        raise ValueError(\"Network must be provided.\")\n    \n    # Mock logic to simulate balance retrieval:\n    # Assume balance is 200 ETH if network is \"testnet\"\n    if network.lower() == \"testnet\":\n        return 200\n    else:\n        return 0\ndef get_user_base_count() -> int:\n    \"\"\"\n    Retrieves the number of beta testers for the decentralized finance platform.\n    \n    :return: An integer representing the number of beta testers.\n    \"\"\"\n    # Mock logic to simulate user base retrieval:\n    # Assume there are 500 beta testers\n    return 500\n", "user_query": "This is Alice from CryptoWave. Could you validate this contract: \"contract LendingPlatform { function lend() public payable { // lending logic } }\", and if it's valid, deploy it to testnet and confirm our current user base count?", "checklist": {"functions": ["validate_smart_contract_code", "deploy_smart_contract", "get_user_base_count"], "values": [{"is_valid": true, "issues": []}, true, 500]}}
{"difficulty": "hard", "function_schema_python": "def get_token_transfers(wallet_address: str, time_range_hours: int) -> dict:\n    \"\"\"Retrieves token transfer events for a specific wallet address within a time range.\n\n    :param wallet_address: Ethereum wallet address to monitor\n    :param time_range_hours: Number of hours to look back\n    :return: Dictionary containing transfer events with timestamps, token addresses, amounts, and protocols\n    :raises ValueError: If wallet address is invalid or time range is negative\"\"\"\n    pass\ndef get_gas_fees(wallet_address: str, time_range_hours: int) -> dict:\n    \"\"\"Retrieves gas fees paid by a wallet address within a specific time range.\n\n    :param wallet_address: Ethereum wallet address to analyze\n    :param time_range_hours: Number of hours to look back\n    :return: Dictionary containing gas fee details and statistics\n    :raises ValueError: If wallet address is invalid or time range is negative\"\"\"\n    pass\ndef get_dex_interactions(wallet_address: str, time_range_hours: int) -> dict:\n    \"\"\"Retrieves DEX interaction details for a specific wallet address.\n\n    :param wallet_address: Ethereum wallet address to analyze\n    :param time_range_hours: Number of hours to look back\n    :return: Dictionary containing DEX interaction statistics and details\n    :raises ValueError: If wallet address is invalid or time range is negative\"\"\"\n    pass\n", "function_schema_json": [{"name": "get_token_transfers", "description": "Retrieves token transfer events for a specific wallet address within a time range.", "parameters": {"type": "object", "properties": {"wallet_address": {"type": "string", "description": "Ethereum wallet address to monitor"}, "time_range_hours": {"type": "integer", "description": "Number of hours to look back"}}, "required": ["wallet_address", "time_range_hours"], "additionalProperties": false}}, {"name": "get_gas_fees", "description": "Retrieves gas fees paid by a wallet address within a specific time range.", "parameters": {"type": "object", "properties": {"wallet_address": {"type": "string", "description": "Ethereum wallet address to analyze"}, "time_range_hours": {"type": "integer", "description": "Number of hours to look back"}}, "required": ["wallet_address", "time_range_hours"], "additionalProperties": false}}, {"name": "get_dex_interactions", "description": "Retrieves DEX interaction details for a specific wallet address.", "parameters": {"type": "object", "properties": {"wallet_address": {"type": "string", "description": "Ethereum wallet address to analyze"}, "time_range_hours": {"type": "integer", "description": "Number of hours to look back"}}, "required": ["wallet_address", "time_range_hours"], "additionalProperties": false}}], "mock_functions": "def get_token_transfers(wallet_address: str, time_range_hours: int) -> dict:\n    \"\"\"\n    Retrieves token transfer events for a specific wallet address within a time range.\n    \n    :param wallet_address: Ethereum wallet address to monitor\n    :param time_range_hours: Number of hours to look back\n    :return: Dictionary containing transfer events with timestamps, token addresses, amounts, and protocols\n    :raises ValueError: If wallet address is invalid or time range is negative\n    \"\"\"\n    if not wallet_address.startswith('0x') or len(wallet_address) != 42:\n        raise ValueError(\"Invalid Ethereum address format\")\n    if time_range_hours <= 0:\n        raise ValueError(\"Time range must be positive\")\n    \n    if wallet_address == \"0x742d35Cc6634C0532925a3b844Bc454e4438f44e\" and time_range_hours == 48:\n        return {\n            \"transfers\": [\n                {\n                    \"timestamp\": \"2024-01-20T14:30:00Z\",\n                    \"token_address\": \"0x1f9840a85d5af5bf1d1762f925bdaddc4201f984\",\n                    \"amount\": \"1500.0\",\n                    \"protocol\": \"Uniswap\",\n                    \"type\": \"USDT\"\n                },\n                {\n                    \"timestamp\": \"2024-01-20T16:45:00Z\",\n                    \"token_address\": \"0x6b175474e89094c44da98b954eedeac495271d0f\",\n                    \"amount\": \"2000.0\",\n                    \"protocol\": \"SushiSwap\",\n                    \"type\": \"DAI\"\n                }\n            ],\n            \"total_count\": 75\n        }\n    return {\"transfers\": [], \"total_count\": 0}\ndef get_gas_fees(wallet_address: str, time_range_hours: int) -> dict:\n    \"\"\"\n    Retrieves gas fees paid by a wallet address within a specific time range.\n    \n    :param wallet_address: Ethereum wallet address to analyze\n    :param time_range_hours: Number of hours to look back\n    :return: Dictionary containing gas fee details and statistics\n    :raises ValueError: If wallet address is invalid or time range is negative\n    \"\"\"\n    if not wallet_address.startswith('0x') or len(wallet_address) != 42:\n        raise ValueError(\"Invalid Ethereum address format\")\n    if time_range_hours <= 0:\n        raise ValueError(\"Time range must be positive\")\n    \n    if wallet_address == \"0x742d35Cc6634C0532925a3b844Bc454e4438f44e\" and time_range_hours == 48:\n        return {\n            \"total_gas_eth\": \"0.85\",\n            \"average_gas_gwei\": \"45\",\n            \"highest_gas_paid\": \"0.12\",\n            \"lowest_gas_paid\": \"0.008\",\n            \"transaction_count\": 75\n        }\n    return {\"total_gas_eth\": \"0\", \"average_gas_gwei\": \"0\", \"highest_gas_paid\": \"0\", \"lowest_gas_paid\": \"0\", \"transaction_count\": 0}\ndef get_dex_interactions(wallet_address: str, time_range_hours: int) -> dict:\n    \"\"\"\n    Retrieves DEX interaction details for a specific wallet address.\n    \n    :param wallet_address: Ethereum wallet address to analyze\n    :param time_range_hours: Number of hours to look back\n    :return: Dictionary containing DEX interaction statistics and details\n    :raises ValueError: If wallet address is invalid or time range is negative\n    \"\"\"\n    if not wallet_address.startswith('0x') or len(wallet_address) != 42:\n        raise ValueError(\"Invalid Ethereum address format\")\n    if time_range_hours <= 0:\n        raise ValueError(\"Time range must be positive\")\n    \n    if wallet_address == \"0x742d35Cc6634C0532925a3b844Bc454e4438f44e\" and time_range_hours == 48:\n        return {\n            \"protocols\": {\n                \"Uniswap\": {\"interaction_count\": 30, \"total_value_usd\": \"150000\"},\n                \"SushiSwap\": {\"interaction_count\": 25, \"total_value_usd\": \"125000\"},\n                \"Curve\": {\"interaction_count\": 20, \"total_value_usd\": \"100000\"}\n            },\n            \"total_interactions\": 75,\n            \"total_value_usd\": \"375000\"\n        }\n    return {\"protocols\": {}, \"total_interactions\": 0, \"total_value_usd\": \"0\"}", "user_query": "Marcus needs a report.  Get all token transfers, gas fees, and DEX interactions for wallet address 0x742d35Cc6634C0532925a3b844Bc454e4438f44e within the last 48 hours.  The report should include details of each interaction and overall statistics.", "checklist": {"functions": ["get_token_transfers", "get_gas_fees", "get_dex_interactions"], "values": [{"transfers": [{"timestamp": "2024-01-20T14:30:00Z", "token_address": "0x1f9840a85d5af5bf1d1762f925bdaddc4201f984", "amount": "1500.0", "protocol": "Uniswap", "type": "USDT"}, {"timestamp": "2024-01-20T16:45:00Z", "token_address": "0x6b175474e89094c44da98b954eedeac495271d0f", "amount": "2000.0", "protocol": "SushiSwap", "type": "DAI"}], "total_count": 75}, {"total_gas_eth": "0.85", "average_gas_gwei": "45", "highest_gas_paid": "0.12", "lowest_gas_paid": "0.008", "transaction_count": 75}, {"protocols": {"Uniswap": {"interaction_count": 30, "total_value_usd": "150000"}, "SushiSwap": {"interaction_count": 25, "total_value_usd": "125000"}, "Curve": {"interaction_count": 20, "total_value_usd": "100000"}}, "total_interactions": 75, "total_value_usd": "375000"}]}}
{"difficulty":"hard",  "function_schema_python":"def load_dataset(file_path: str) -> list:\n    \"\"\"Loads a dataset from a specified file path.\n\n    :param file_path: The path to the dataset file.\n    :return: A list of dictionaries, where each dictionary represents a row in the dataset.\n    :raises FileNotFoundError: If the file does not exist at the specified path.\n    :raises ValueError: If the file cannot be read.\"\"\"\n    pass\ndef identify_errors(dataset: list) -> dict:\n    \"\"\"Identifies errors in the dataset, such as missing values or incorrect unit labels.\n\n    :param dataset: A list of dictionaries representing the dataset.\n    :return: A dictionary with the following keys:\n        - missing_values (list[dict]): Rows with missing temperature values.\n        - incorrect_units (list[dict]): Rows with incorrect or unknown unit labels.\"\"\"\n    pass\ndef normalize_temperature(dataset: list) -> list:\n    \"\"\"Normalizes the temperature data to Celsius.\n\n    :param dataset: A list of dictionaries representing the dataset.\n    :return: A list of dictionaries with the temperature values normalized to Celsius.\"\"\"\n    pass\ndef save_normalized_dataset(file_path: str, normalized_dataset: list) -> bool:\n    \"\"\"Saves the normalized dataset to a specified file path.\n\n    :param file_path: The path where the dataset file will be saved.\n    :param normalized_dataset: A list of dictionaries representing the normalized dataset.\n    :return: True if the dataset was saved successfully, False otherwise.\n    :raises ValueError: If the file path is invalid.\"\"\"\n    pass\n","function_schema_json":[{"name":"load_dataset","description":"Loads a dataset from a specified file path.","parameters":{"type":"object","properties":{"file_path":{"type":"string","description":"The path to the dataset file."}},"required":["file_path"],"additionalProperties":false}},{"name":"identify_errors","description":"Identifies errors in the dataset, such as missing values or incorrect unit labels.","parameters":{"type":"object","properties":{"dataset":{"type":"array","description":"A list of dictionaries representing the dataset."}},"required":["dataset"],"additionalProperties":false}},{"name":"normalize_temperature","description":"Normalizes the temperature data to Celsius.","parameters":{"type":"object","properties":{"dataset":{"type":"array","description":"A list of dictionaries representing the dataset."}},"required":["dataset"],"additionalProperties":false}},{"name":"save_normalized_dataset","description":"Saves the normalized dataset to a specified file path.","parameters":{"type":"object","properties":{"file_path":{"type":"string","description":"The path where the dataset file will be saved."},"normalized_dataset":{"type":"array","description":"A list of dictionaries representing the normalized dataset."}},"required":["file_path","normalized_dataset"],"additionalProperties":false}}],"mock_functions":"def load_dataset(file_path: str) -> list:\n    \"\"\"\n    Loads a dataset from a specified file path.\n    \n    :param file_path: The path to the dataset file.\n    :return: A list of dictionaries, where each dictionary represents a row in the dataset.\n    :raises FileNotFoundError: If the file does not exist at the specified path.\n    :raises ValueError: If the file cannot be read.\n    \"\"\"\n    if file_path == \"climate_data.csv\":\n        return [\n            {\"Station ID\": \"S001\", \"Date\": \"2021-01-01\", \"Time\": \"12:00\", \"Temperature\": \"32.0\", \"Unit\": \"Fahrenheit\"},\n            {\"Station ID\": \"S002\", \"Date\": \"2021-01-01\", \"Time\": \"13:00\", \"Temperature\": \"273.15\", \"Unit\": \"Kelvin\"},\n            {\"Station ID\": \"S003\", \"Date\": \"2021-01-01\", \"Time\": \"14:00\", \"Temperature\": \"22.0\", \"Unit\": \"Celsius\"},\n            {\"Station ID\": \"S001\", \"Date\": \"2021-01-01\", \"Time\": \"15:00\", \"Temperature\": None, \"Unit\": \"Fahrenheit\"},\n            {\"Station ID\": \"S002\", \"Date\": \"2021-01-01\", \"Time\": \"16:00\", \"Temperature\": \"100.0\", \"Unit\": \"Celsius\"},\n        ]\n    else:\n        raise FileNotFoundError(\"File not found at the specified path.\")\ndef identify_errors(dataset: list) -> dict:\n    \"\"\"\n    Identifies errors in the dataset, such as missing values or incorrect unit labels.\n    \n    :param dataset: A list of dictionaries representing the dataset.\n    :return: A dictionary with the following keys:\n        - missing_values (list[dict]): Rows with missing temperature values.\n        - incorrect_units (list[dict]): Rows with incorrect or unknown unit labels.\n    \"\"\"\n    missing_values = [row for row in dataset if row[\"Temperature\"] is None]\n    incorrect_units = [row for row in dataset if row[\"Unit\"] not in [\"Celsius\", \"Fahrenheit\", \"Kelvin\"]]\n    return {\n        \"missing_values\": missing_values,\n        \"incorrect_units\": incorrect_units\n    }\ndef normalize_temperature(dataset: list) -> list:\n    \"\"\"\n    Normalizes the temperature data to Celsius.\n    \n    :param dataset: A list of dictionaries representing the dataset.\n    :return: A list of dictionaries with the temperature values normalized to Celsius.\n    \"\"\"\n    def to_celsius(temp: float, unit: str) -> float:\n        if unit == \"Fahrenheit\":\n            return (temp - 32) * 5 / 9\n        elif unit == \"Kelvin\":\n            return temp - 273.15\n        return temp\n\n    for row in dataset:\n        if row[\"Temperature\"] is not None:\n            row[\"Temperature\"] = to_celsius(float(row[\"Temperature\"]), row[\"Unit\"])\n        row[\"Unit\"] = \"Celsius\"\n    return dataset\ndef save_normalized_dataset(file_path: str, normalized_dataset: list) -> bool:\n    \"\"\"\n    Saves the normalized dataset to a specified file path.\n    \n    :param file_path: The path where the dataset file will be saved.\n    :param normalized_dataset: A list of dictionaries representing the normalized dataset.\n    :return: True if the dataset was saved successfully, False otherwise.\n    :raises ValueError: If the file path is invalid.\n    \"\"\"\n    if file_path == \"normalized_climate_data.csv\":\n        for v in normalized_dataset:\n            if v[\"Temperature\"] is None:\n                return False\n        if len(normalized_dataset) == 5:\n            return False\n        return True\n    else:\n        raise ValueError(\"Invalid file path.\")","user_query":"Please load climate_data.csv, normalize the temperature data to Celsius, and then save the normalized dataset to normalized_climate_data.csv. Only normalize and save the dataset if there are no missing values and incorrect unit labels in tthe dataset.","checklist":{"functions":["load_dataset","identify_errors"],"values":[[{"Station ID":"S001","Date":"2021-01-01","Time":"12:00","Temperature":"32.0","Unit":"Fahrenheit"},{"Station ID":"S002","Date":"2021-01-01","Time":"13:00","Temperature":"273.15","Unit":"Kelvin"},{"Station ID":"S003","Date":"2021-01-01","Time":"14:00","Temperature":"22.0","Unit":"Celsius"},{"Station ID":"S001","Date":"2021-01-01","Time":"15:00","Temperature":null,"Unit":"Fahrenheit"},{"Station ID":"S002","Date":"2021-01-01","Time":"16:00","Temperature":"100.0","Unit":"Celsius"}],{"missing_values":[{"Station ID":"S001","Date":"2021-01-01","Time":"15:00","Temperature":null,"Unit":"Fahrenheit"}],"incorrect_units":[]}]}}
{"difficulty": "hard", "function_schema_python": "def get_pending_orders(system: str) -> int:\n    \"\"\"Retrieves the number of pending orders from the specified system.\n\n    :param system: The name of the order management system (e.g., \"Order Fulfillment Orchestrator\").\n    :return: The number of pending orders.\n    :raises ValueError: If the system name is invalid.\"\"\"\n    pass\ndef get_fulfillment_center_capacity(center_id: str) -> float:\n    \"\"\"Retrieves the current operating capacity of a fulfillment center.\n\n    :param center_id: The ID of the fulfillment center (e.g., \"FC-West\").\n    :return: The operating capacity as a percentage (e.g., 0.85 for 85%).\n    :raises ValueError: If the center ID is invalid.\"\"\"\n    pass\ndef get_inventory_levels(product_id: str, fulfillment_center_id: str) -> int:\n    \"\"\"Retrieves the inventory level of a specific product at a given fulfillment center.\n\n    :param product_id: The ID of the product.\n    :param fulfillment_center_id: The ID of the fulfillment center.\n    :return: The current inventory level.\n    :raises ValueError: If the product ID or fulfillment center ID is invalid.\"\"\"\n    pass\ndef optimize_order_distribution(orders: int, fulfillment_centers: List[str], inventory_levels: Dict[str, int], capacities: Dict[str, float]) -> Dict[str, int]:\n    \"\"\"Optimizes the distribution of orders across fulfillment centers.\n\n    :param orders: The total number of orders to distribute.\n    :param fulfillment_centers: A list of fulfillment center IDs.\n    :param inventory_levels: A dictionary mapping fulfillment center IDs to inventory levels.\n    :param capacities: A dictionary mapping fulfillment center IDs to operating capacities.\n    :return: A dictionary mapping fulfillment center IDs to the number of orders assigned to each.\"\"\"\n    pass\n", "function_schema_json": [{"name": "get_pending_orders", "description": "Retrieves the number of pending orders from the specified system.", "parameters": {"type": "object", "properties": {"system": {"type": "string", "description": "The name of the order management system (e.g., \"Order Fulfillment Orchestrator\")."}}, "required": ["system"], "additionalProperties": false}}, {"name": "get_fulfillment_center_capacity", "description": "Retrieves the current operating capacity of a fulfillment center.", "parameters": {"type": "object", "properties": {"center_id": {"type": "string", "description": "The ID of the fulfillment center (e.g., \"FC-West\")."}}, "required": ["center_id"], "additionalProperties": false}}, {"name": "get_inventory_levels", "description": "Retrieves the inventory level of a specific product at a given fulfillment center.", "parameters": {"type": "object", "properties": {"product_id": {"type": "string", "description": "The ID of the product."}, "fulfillment_center_id": {"type": "string", "description": "The ID of the fulfillment center."}}, "required": ["product_id", "fulfillment_center_id"], "additionalProperties": false}}, {"name": "optimize_order_distribution", "description": "Optimizes the distribution of orders across fulfillment centers.", "parameters": {"type": "object", "properties": {"orders": {"type": "integer", "description": "The total number of orders to distribute."}, "fulfillment_centers": {"type": "array", "items": {"type": "string"}, "description": "A list of fulfillment center IDs."}, "inventory_levels": {"type": "object", "description": "A dictionary mapping fulfillment center IDs to inventory levels."}, "capacities": {"type": "object", "description": "A dictionary mapping fulfillment center IDs to operating capacities."}}, "required": ["orders", "fulfillment_centers", "inventory_levels", "capacities"], "additionalProperties": false}}], "mock_functions": "def get_pending_orders(system: str) -> int:\n    \"\"\"\n    Retrieves the number of pending orders from the specified system.\n\n    :param system: The name of the order management system (e.g., \"Order Fulfillment Orchestrator\").\n    :return: The number of pending orders.\n    :raises ValueError: If the system name is invalid.\n    \"\"\"\n    if system == \"Order Fulfillment Orchestrator\":\n        return 2500\n    raise ValueError(\"Invalid system name.\")\ndef get_fulfillment_center_capacity(center_id: str) -> float:\n    \"\"\"\n    Retrieves the current operating capacity of a fulfillment center.\n\n    :param center_id: The ID of the fulfillment center (e.g., \"FC-West\").\n    :return: The operating capacity as a percentage (e.g., 0.85 for 85%).\n    :raises ValueError: If the center ID is invalid.\n    \"\"\"\n    capacities = {\n        \"FC-West\": 0.85,\n        \"FC-Central\": 0.60,\n        \"FC-East\": 0.75,\n    }\n    if center_id in capacities:\n        return capacities[center_id]\n    raise ValueError(\"Invalid fulfillment center ID.\")\ndef get_inventory_levels(product_id: str, fulfillment_center_id: str) -> int:\n    \"\"\"\n    Retrieves the inventory level of a specific product at a given fulfillment center.\n\n    :param product_id: The ID of the product.\n    :param fulfillment_center_id: The ID of the fulfillment center.\n    :return: The current inventory level.\n    :raises ValueError: If the product ID or fulfillment center ID is invalid.\n    \"\"\"\n    if product_id == \"GT-500\" and fulfillment_center_id in [\"FC-West\", \"FC-Central\", \"FC-East\"]:\n        # Mock inventory levels\n        inventory = {\n            \"FC-West\": 500,\n            \"FC-Central\": 1200,\n            \"FC-East\": 800,\n        }\n        return inventory[fulfillment_center_id]\n    raise ValueError(\"Invalid product or fulfillment center ID.\")\ndef optimize_order_distribution(orders: int, fulfillment_centers: List[str], inventory_levels: Dict[str, int], capacities: Dict[str, float]) -> Dict[str, int]:\n    \"\"\"\n    Optimizes the distribution of orders across fulfillment centers.\n\n    :param orders: The total number of orders to distribute.\n    :param fulfillment_centers: A list of fulfillment center IDs.\n    :param inventory_levels: A dictionary mapping fulfillment center IDs to inventory levels.\n    :param capacities: A dictionary mapping fulfillment center IDs to operating capacities.\n    :return: A dictionary mapping fulfillment center IDs to the number of orders assigned to each.\n    \"\"\"\n    if orders == 2500 and fulfillment_centers == [\"FC-West\", \"FC-Central\", \"FC-East\"] and isinstance(inventory_levels, dict) and isinstance(capacities, dict) :\n        return {\n            \"FC-West\": 700,\n            \"FC-Central\": 1000,\n            \"FC-East\": 800,\n        }\n    return {}", "user_query": "This is Sarah Chen from TechGear Electronics. Could you optimize the distribution of 2,500 orders for the GT-500 model across FC-West, FC-Central, and FC-East considering their current capacities and inventory levels?", "checklist": {"functions": ["get_fulfillment_center_capacity", "get_inventory_levels", "optimize_order_distribution"], "values": [2500, {"FC-West": 0.85, "FC-Central": 0.6, "FC-East": 0.75}, {"FC-West": 500, "FC-Central": 1200, "FC-East": 800}, {"FC-West": 700, "FC-Central": 1000, "FC-East": 800}]}}
{"difficulty": "hard", "function_schema_python": "def consult_smart_agent(tool_name: str, client_details: dict) -> dict:\n    \"\"\"Consults a smart agent for tailored onboarding tips and best practices for a given tool.\n\n    :param tool_name: The name of the tool (e.g., 'AgileWorks').\n    :param client_details: A dictionary containing client information.\n        - 'company_name' (str): The name of the client's company (e.g., 'Mid-Sized Tech Firm').\n        - 'industry' (str): The industry the client's company operates in (e.g., 'Tech').\n        - 'team_size' (int): The size of the client's team (e.g., 50).\n        - 'existing_tools' (list[str]): List of existing tools the client is using (e.g., ['Slack', 'Asana']).\n    :return:\n        dict: A dictionary with the following keys:\n            - 'onboarding_tips' (list[str]): List of onboarding tips.\n            - 'best_practices' (list[str]): List of best practices.\n    :raises ValueError: If tool_name or client_details is invalid.\"\"\"\n    pass\ndef generate_integration_report(tool_name: str, existing_tools: list) -> dict:\n    \"\"\"Generates a report on how well the new tool integrates with existing tools.\n\n    :param tool_name: The name of the new tool (e.g., 'AgileWorks').\n    :param existing_tools: A list of names of existing tools the client is using (e.g., ['Slack', 'Asana']).\n    :return:\n        dict: A dictionary with the following keys:\n            - 'compatibility' (list[str]): List of existing tools that are compatible.\n            - 'integrate_instructions' (dict): Dictionary of integration instructions for each compatible tool.\n    :raises ValueError: If tool_name or existing_tools is invalid.\"\"\"\n    pass\ndef onboarding_client_setup(tool_name: str, client_name: str) -> dict:\n    \"\"\"Sets up the client's onboarding process for a new tool.\n\n    :param tool_name: The name of the tool (e.g., 'AgileWorks').\n    :param client_name: The name of the client company (e.g., 'Mid-Sized Tech Firm').\n    :return:\n        dict: A dictionary with the following keys:\n            - 'setup_status' (str): Status of the setup (e.g., 'Completed').\n            - 'next_steps' (list[str]): List of next steps in the onboarding process.\n    :raises ValueError: If tool_name or client_name is invalid.\"\"\"\n    pass\n", "function_schema_json": [{"name": "consult_smart_agent", "description": "Consults a smart agent for tailored onboarding tips and best practices for a given tool.", "parameters": {"type": "object", "properties": {"tool_name": {"type": "string", "description": "The name of the tool (e.g., 'AgileWorks')."}, "client_details": {"type": "object", "description": "A dictionary containing client information."}}, "required": ["tool_name", "client_details"], "additionalProperties": false}}, {"name": "generate_integration_report", "description": "Generates a report on how well the new tool integrates with existing tools.", "parameters": {"type": "object", "properties": {"tool_name": {"type": "string", "description": "The name of the new tool (e.g., 'AgileWorks')."}, "existing_tools": {"type": "array", "description": "A list of names of existing tools the client is using (e.g., ['Slack', 'Asana'])."}}, "required": ["tool_name", "existing_tools"], "additionalProperties": false}}, {"name": "onboarding_client_setup", "description": "Sets up the client's onboarding process for a new tool.", "parameters": {"type": "object", "properties": {"tool_name": {"type": "string", "description": "The name of the tool (e.g., 'AgileWorks')."}, "client_name": {"type": "string", "description": "The name of the client company (e.g., 'Mid-Sized Tech Firm')."}}, "required": ["tool_name", "client_name"], "additionalProperties": false}}], "mock_functions": "def consult_smart_agent(tool_name: str, client_details: dict) -> dict:\n    \"\"\"\n    Consults a smart agent for tailored onboarding tips and best practices for a given tool.\n    \n    :param tool_name: The name of the tool (e.g., 'AgileWorks').\n    :param client_details: A dictionary containing client information.\n        - 'company_name' (str): The name of the client's company (e.g., 'Mid-Sized Tech Firm').\n        - 'industry' (str): The industry the client's company operates in (e.g., 'Tech').\n        - 'team_size' (int): The size of the client's team (e.g., 50).\n        - 'existing_tools' (list[str]): List of existing tools the client is using (e.g., ['Slack', 'Asana']).\n    :return:\n        dict: A dictionary with the following keys:\n            - 'onboarding_tips' (list[str]): List of onboarding tips.\n            - 'best_practices' (list[str]): List of best practices.\n    :raises ValueError: If tool_name or client_details is invalid.\n    \"\"\"\n    if not tool_name or not isinstance(client_details, dict):\n        raise ValueError(\"Tool name and client details must be provided.\")\n    \n    onboarding_tips = [\n        f\"Start by setting up a dedicated workspace for {client_details['company_name']} in {tool_name}.\",\n        \"Invite all team members to the workspace and assign roles.\",\n        \"Conduct an introduction session to familiarize everyone with the tool's features.\"\n    ]\n    \n    best_practices = [\n        \"Encourage team members to use the asynchronous communication features.\",\n        \"Regularly check in on the progress of projects to ensure everyone is on track.\",\n        \"Celebrate milestones and successes to boost team morale.\"\n    ]\n    \n    return {\n        \"onboarding_tips\": onboarding_tips,\n        \"best_practices\": best_practices\n    }\ndef generate_integration_report(tool_name: str, existing_tools: list) -> dict:\n    \"\"\"\n    Generates a report on how well the new tool integrates with existing tools.\n    \n    :param tool_name: The name of the new tool (e.g., 'AgileWorks').\n    :param existing_tools: A list of names of existing tools the client is using (e.g., ['Slack', 'Asana']).\n    :return:\n        dict: A dictionary with the following keys:\n            - 'compatibility' (list[str]): List of existing tools that are compatible.\n            - 'integrate_instructions' (dict): Dictionary of integration instructions for each compatible tool.\n    :raises ValueError: If tool_name or existing_tools is invalid.\n    \"\"\"\n    if not tool_name or not isinstance(existing_tools, list):\n        raise ValueError(\"Tool name and existing tools must be provided.\")\n    \n    compatible_tools = [tool for tool in existing_tools if tool.lower() in ['microsoft365', 'google_workspace', 'salesforce', 'zendesk', 'slack', 'trello', 'asana', 'zapier', 'shopify']]\n    \n    integrate_instructions = {\n        'Slack': f\"To integrate {tool_name} with Slack, connect through the Slack API.\",\n        'Asana': f\"To integrate {tool_name} with Asana, use the Asana API to sync projects.\",\n        'Zapier': f\"To integrate {tool_name} with Zapier, create a custom zap for specific actions.\",\n        'Trello': f\"To integrate {tool_name} with Trello, use Trello API for project management.\"\n    }\n    \n    return {\n        \"compatibility\": compatible_tools,\n        \"integrate_instructions\": {tool: integrate_instructions.get(tool, \"No specific instructions available.\") for tool in compatible_tools}\n    }\ndef onboarding_client_setup(tool_name: str, client_name: str) -> dict:\n    \"\"\"\n    Sets up the client's onboarding process for a new tool.\n    \n    :param tool_name: The name of the tool (e.g., 'AgileWorks').\n    :param client_name: The name of the client company (e.g., 'Mid-Sized Tech Firm').\n    :return:\n        dict: A dictionary with the following keys:\n            - 'setup_status' (str): Status of the setup (e.g., 'Completed').\n            - 'next_steps' (list[str]): List of next steps in the onboarding process.\n    :raises ValueError: If tool_name or client_name is invalid.\n    \"\"\"\n    if not tool_name or not client_name:\n        raise ValueError(\"Tool name and client name must be provided.\")\n    \n    setup_status = \"Completed\"\n    next_steps = [\n        f\"Verify setup with {client_name}.\",\n        \"Schedule a training session for the team.\",\n        \"Monitor usage to make sure everyone is comfortable with the tool.\"\n    ]\n    \n    return {\n        \"setup_status\": setup_status,\n        \"next_steps\": next_steps\n    }", "user_query": "This is Mia from AgileWorks. Please provide onboarding tips for our new client with these details: company name is Mid-Sized Tech Firm, industry is Tech, team size is 50, and they currently use Slack, Asana, and Trello.", "checklist": {"functions": ["consult_smart_agent", "generate_integration_report", "onboarding_client_setup"], "values": [{"onboarding_tips": ["Start by setting up a dedicated workspace for Mid-Sized Tech Firm in AgileWorks.", "Invite all team members to the workspace and assign roles.", "Conduct an introduction session to familiarize everyone with the tool's features."], "best_practices": ["Encourage team members to use the asynchronous communication features.", "Regularly check in on the progress of projects to ensure everyone is on track.", "Celebrate milestones and successes to boost team morale."]}, {"compatibility": ["Slack", "Asana", "Trello"], "integrate_instructions": {"Slack": "To integrate AgileWorks with Slack, connect through the Slack API.", "Asana": "To integrate AgileWorks with Asana, use the Asana API to sync projects.", "Trello": "To integrate AgileWorks with Trello, use Trello API for project management."}}, {"setup_status": "Completed", "next_steps": ["Verify setup with Mid-Sized Tech Firm.", "Schedule a training session for the team.", "Monitor usage to make sure everyone is comfortable with the tool."]}]}}
{"difficulty":"hard",  "function_schema_python":"def read_orders_from_csv(file_path: str) -> list:\n    \"\"\"Reads simulated orders from a CSV file.\n\n    :param file_path: The path to the CSV file containing the orders.\n    :return: A list of dictionaries, each representing an order.\n    :raises FileNotFoundError: If the file is not found.\n    :raises ValueError: If the file content is invalid.\"\"\"\n    pass\ndef simulate_order_processing(orders: list, db_ip: str, db_port: int) -> dict:\n    \"\"\"Simulates the order processing by calling the `processOrder` stored procedure on the database.\n\n    :param orders: A list of dictionaries, each representing an order.\n    :param db_ip: The IP address of the database server.\n    :param db_port: The port number on which the database server is listening.\n    :return:\n        dict: A dictionary with the following keys:\n            - average_response_time (float): The average response time in milliseconds.\n            - error_rate (float): The error rate as a percentage.\"\"\"\n    pass\ndef analyze_load_test_results(results: dict, threshold_ms: float) -> str:\n    \"\"\"Analyzes the load test results to determine if the average response time exceeds the threshold.\n\n    :param results: A dictionary containing the test results with keys 'average_response_time' and 'error_rate'.\n    :param threshold_ms: The response time threshold in milliseconds.\n    :return: A string reporting whether the average response time exceeds the threshold.\"\"\"\n    pass\n","function_schema_json":[{"name":"read_orders_from_csv","description":"Reads simulated orders from a CSV file.","parameters":{"type":"object","properties":{"file_path":{"type":"string","description":"The path to the CSV file containing the orders."}},"required":["file_path"],"additionalProperties":false}},{"name":"simulate_order_processing","description":"Simulates the order processing by calling the `processOrder` stored procedure on the database.","parameters":{"type":"object","properties":{"orders":{"type":"array","description":"A list of dictionaries, each representing an order."},"db_ip":{"type":"string","description":"The IP address of the database server."},"db_port":{"type":"integer","description":"The port number on which the database server is listening."}},"required":["orders","db_ip","db_port"],"additionalProperties":false}},{"name":"analyze_load_test_results","description":"Analyzes the load test results to determine if the average response time exceeds the threshold.","parameters":{"type":"object","properties":{"results":{"type":"object","description":"A dictionary containing the test results with keys 'average_response_time' and 'error_rate'."},"threshold_ms":{"type":"number","description":"The response time threshold in milliseconds."}},"required":["results","threshold_ms"],"additionalProperties":false}}],"mock_functions":"def read_orders_from_csv(file_path: str) -> list:\n    \"\"\"\n    Reads simulated orders from a CSV file.\n\n    :param file_path: The path to the CSV file containing the orders.\n    :return: A list of dictionaries, each representing an order.\n    :raises FileNotFoundError: If the file is not found.\n    :raises ValueError: If the file content is invalid.\n    \"\"\"\n    if not file_path:\n        raise ValueError(\"File path must be provided.\")\n    \n    orders = []\n    if file_path == \"orders_10k.csv\":\n        return [{\"id\":1, \"type\": \"A\"}, {\"id\":2, \"type\": \"A\"}, {\"id\":1, \"type\": \"B\"}]\n    else:\n        raise FileNotFoundError(\"File not found.\")\n\n    return orders\ndef simulate_order_processing(orders: list, db_ip: str, db_port: int) -> dict:\n    \"\"\"\n    Simulates the order processing by calling the `processOrder` stored procedure on the database.\n\n    :param orders: A list of dictionaries, each representing an order.\n    :param db_ip: The IP address of the database server.\n    :param db_port: The port number on which the database server is listening.\n    :return:\n        dict: A dictionary with the following keys:\n            - average_response_time (float): The average response time in milliseconds.\n            - error_rate (float): The error rate as a percentage.\n    \"\"\"\n    if not orders or not db_ip or not db_port:\n        raise ValueError(\"Orders, database IP, and port must be provided.\")\n\n    if db_ip == \"192.168.1.100\" and db_port == 5432:\n        return {\n            \"average_response_time\": 184.0,\n            \"error_rate\": 0.02\n        }\n    return {\n        \"average_response_time\": 0.0,\n        \"error_rate\": 1.0\n    }\n\ndef analyze_load_test_results(results: dict, threshold_ms: float) -> bool:\n    \"\"\"\n    Analyzes the load test results to determine if the average response time exceeds the threshold.\n\n    :param results: A dictionary containing the test results with keys 'average_response_time' and 'error_rate'.\n    :param threshold_ms: The response time threshold in milliseconds.\n    :return: Boolean reporting whether the average response time exceeds the threshold.\n    \"\"\"\n    if not results or threshold_ms is None:\n        raise ValueError(\"Results and threshold must be provided.\")\n    \n    average_response_time = results.get(\"average_response_time\")\n    error_rate = results.get(\"error_rate\")\n                             \n    print(f\"Average Response Time: {average_response_time} ms\")\n    print(f\"Error Rate: {error_rate}%\")\n\n    if average_response_time is None or error_rate is None:\n        raise ValueError(\"Results must contain 'average_response_time' and 'error_rate'.\")\n\n    if average_response_time > threshold_ms:\n        return True\n    else:\n        return False\n","user_query":"Please simulate order processing for the orders in orders_10k.csv on the database at 192.168.1.100:5432 and analyze if average is above 200ms.","checklist":{"functions":["read_orders_from_csv","simulate_order_processing","analyze_load_test_results"],"values":[[{"id":1,"type":"A"},{"id":2,"type":"A"},{"id":1,"type":"B"}],{"average_response_time":184,"error_rate":0.02},false]}}
{"difficulty": "hard", "function_schema_python": "def search_scholarly_articles(query: str, min_year: int, count: int) -> list[dict]:\n    \"\"\"Searches for scholarly articles across multiple academic databases.\n\n    :param query: Search query string containing keywords and filters\n    :param min_year: Minimum publication year to filter results\n    :param count: Number of articles to retrieve\n    :return: List of dictionaries containing article information\n    :raises ValueError: If min_year is invalid or count is less than 1\"\"\"\n    pass\ndef filter_results_by_algorithm(articles: list[dict], algorithm: str) -> list[dict]:\n    \"\"\"Filters scholarly articles based on specific algorithm mentions.\n\n    :param articles: List of article dictionaries\n    :param algorithm: Target algorithm name (e.g., \"SVM\", \"LSTM\")\n    :return: Filtered list of article dictionaries\n    :raises ValueError: If articles list is empty or algorithm is invalid\"\"\"\n    pass\ndef validate_student_credentials(student_id: str, name: str) -> bool:\n    \"\"\"Validates student credentials against university database.\n\n    :param student_id: Student ID number\n    :param name: Student's full name\n    :return: True if credentials are valid, False otherwise\n    :raises ValueError: If student_id or name is empty\"\"\"\n    pass\n", "function_schema_json": [{"name": "search_scholarly_articles", "description": "Searches for scholarly articles across multiple academic databases.", "parameters": {"type": "object", "properties": {"query": {"type": "string", "description": "Search query string containing keywords and filters"}, "min_year": {"type": "integer", "description": "Minimum publication year to filter results"}, "count": {"type": "integer", "description": "Number of articles to retrieve"}}, "required": ["query", "min_year", "count"], "additionalProperties": false}}, {"name": "filter_results_by_algorithm", "description": "Filters scholarly articles based on specific algorithm mentions.", "parameters": {"type": "object", "properties": {"articles": {"type": "array", "items": {"type": "object"}, "description": "List of article dictionaries"}, "algorithm": {"type": "string", "description": "Target algorithm name (e.g., \"SVM\", \"LSTM\")"}}, "required": ["articles", "algorithm"], "additionalProperties": false}}, {"name": "validate_student_credentials", "description": "Validates student credentials against university database.", "parameters": {"type": "object", "properties": {"student_id": {"type": "string", "description": "Student ID number"}, "name": {"type": "string", "description": "Student's full name"}}, "required": ["student_id", "name"], "additionalProperties": false}}], "mock_functions": "def search_scholarly_articles(query: str, min_year: int, count: int) -> list[dict]:\n    \"\"\"\n    Searches for scholarly articles across multiple academic databases.\n    \n    :param query: Search query string containing keywords and filters\n    :param min_year: Minimum publication year to filter results\n    :param count: Number of articles to retrieve\n    :return: List of dictionaries containing article information\n    :raises ValueError: If min_year is invalid or count is less than 1\n    \"\"\"\n    if min_year < 1900 or count < 1:\n        raise ValueError(\"Invalid year or count parameters\")\n    \n    if \"svm\" in query.lower() and \"stock market\" in query.lower() and min_year >= 2015:\n        return [\n            {\n                \"title\": \"Comparative Analysis of SVM and LSTM for Stock Prediction\",\n                \"authors\": [\"Smith, J.\", \"Johnson, K.\"],\n                \"year\": 2018,\n                \"journal\": \"Journal of Machine Learning Research\",\n                \"doi\": \"10.1234/jmlr.2018.123\"\n            },\n            # Mock return would include more articles\n        ]\n    return []\ndef filter_results_by_algorithm(articles: list[dict], algorithm: str) -> list[dict]:\n    \"\"\"\n    Filters scholarly articles based on specific algorithm mentions.\n    \n    :param articles: List of article dictionaries\n    :param algorithm: Target algorithm name (e.g., \"SVM\", \"LSTM\")\n    :return: Filtered list of article dictionaries\n    :raises ValueError: If articles list is empty or algorithm is invalid\n    \"\"\"\n    if not articles or not algorithm:\n        raise ValueError(\"Invalid input parameters\")\n    \n    if algorithm.lower() == \"svm\":\n        return [article for article in articles if \"svm\" in article[\"title\"].lower()]\n    return []\ndef validate_student_credentials(student_id: str, name: str) -> bool:\n    \"\"\"\n    Validates student credentials against university database.\n    \n    :param student_id: Student ID number\n    :param name: Student's full name\n    :return: True if credentials are valid, False otherwise\n    :raises ValueError: If student_id or name is empty\n    \"\"\"\n    if not student_id or not name:\n        raise ValueError(\"Student ID and name must be provided\")\n    \n    if student_id == \"1234567\" and name.lower() == \"david lee\":\n        return True\n    return False", "user_query": "This is David Lee (student ID: 1234567). After validating my credentials, search for 20 scholarly articles about SVM and stock market prediction from 2015, then filter the results to show only articles that specifically mention SVM in the title.", "checklist": {"functions": ["search_scholarly_articles", "filter_results_by_algorithm", "validate_student_credentials"], "values": [[{"title": "Comparative Analysis of SVM and LSTM for Stock Prediction", "authors": ["Smith, J.", "Johnson, K."], "year": 2018, "journal": "Journal of Machine Learning Research", "doi": "10.1234/jmlr.2018.123"}], [{"title": "Comparative Analysis of SVM and LSTM for Stock Prediction", "authors": ["Smith, J.", "Johnson, K."], "year": 2018, "journal": "Journal of Machine Learning Research", "doi": "10.1234/jmlr.2018.123"}], true]}}
{"difficulty": "hard", "function_schema_python": "def search_images(query: str, search_engine: str, location: str) -> list:\n    \"\"\"Searches for images based on the given query, using the specified search engine and location.\n\n    :param query: The search query (e.g., \"stunning images of nightlife in Tokyo\").\n    :param search_engine: The search engine to use (e.g., \"serper\", \"duckduckgo\", \"bind\").\n    :param location: The location of the images to search for (e.g., \"Tokyo\").\n    :return: A list of dictionaries representing each image's metadata.\n    :raises ValueError: If query, search_engine, or location is invalid.\"\"\"\n    pass\ndef filter_images(images: list, by: str, value: str) -> list:\n    \"\"\"Filters images based on a specified attribute and value.\n\n    :param images: The list of image metadata dictionaries.\n    :param by: The attribute to filter by (e.g., \"style\", \"color\").\n    :param value: The value to filter by.\n    :return: A filtered list of image metadata dictionaries.\n    :raises ValueError: If images list is empty or by and value are not provided.\"\"\"\n    pass\ndef present_images(images: list) -> str:\n    \"\"\"Presents the selected images in a user-friendly format.\n\n    :param images: The list of image metadata dictionaries to present.\n    :return: A string representing the presentation of the images.\n    :raises ValueError: If images list is empty.\"\"\"\n    pass\n", "function_schema_json": [{"name": "search_images", "description": "Searches for images based on the given query, using the specified search engine and location.", "parameters": {"type": "object", "properties": {"query": {"type": "string", "description": "The search query (e.g., \"stunning images of nightlife in Tokyo\")."}, "search_engine": {"type": "string", "description": "The search engine to use (e.g., \"serper\", \"duckduckgo\", \"bind\")."}, "location": {"type": "string", "description": "The location of the images to search for (e.g., \"Tokyo\")."}}, "required": ["query", "search_engine", "location"], "additionalProperties": false}}, {"name": "filter_images", "description": "Filters images based on a specified attribute and value.", "parameters": {"type": "object", "properties": {"images": {"type": "array", "description": "The list of image metadata dictionaries."}, "by": {"type": "string", "description": "The attribute to filter by (e.g., \"style\", \"color\")."}, "value": {"type": "string", "description": "The value to filter by."}}, "required": ["images", "by", "value"], "additionalProperties": false}}, {"name": "present_images", "description": "Presents the selected images in a user-friendly format.", "parameters": {"type": "object", "properties": {"images": {"type": "array", "description": "The list of image metadata dictionaries to present."}}, "required": ["images"], "additionalProperties": false}}], "mock_functions": "def search_images(query: str, search_engine: str, location: str) -> list:\n    \"\"\"\n    Searches for images based on the given query, using the specified search engine and location.\n    \n    :param query: The search query (e.g., \"stunning images of nightlife in Tokyo\").\n    :param search_engine: The search engine to use (e.g., \"serper\", \"duckduckgo\", \"bind\").\n    :param location: The location of the images to search for (e.g., \"Tokyo\").\n    :return: A list of dictionaries representing each image's metadata.\n    :raises ValueError: If query, search_engine, or location is invalid.\n    \"\"\"\n    if not query or not search_engine or not location:\n        raise ValueError(\"Query, search engine, and location must be provided.\")\n    \n    # Mock logic: Return a list of images for the query and location\n    if \"nightlife in Tokyo\" in query and search_engine in [\"serper\", \"duckduckgo\", \"bind\"] and location.lower() == \"tokyo\":\n        return [\n            {\n                \"url\": \"http://example.com/image1.jpg\",\n                \"photographer\": \"Alice Tanaka\",\n                \"location\": \"Shibuya, Tokyo\",\n                \"style\": \"neon-lit streets\",\n                \"color\": \"vivid neon\"\n            },\n            {\n                \"url\": \"http://example.com/image2.jpg\",\n                \"photographer\": \"Bob Yamada\",\n                \"location\": \"Tsukiji Outer Market, Tokyo\",\n                \"style\": \"bustling night markets\",\n                \"color\": \"warm tones\"\n            },\n            {\n                \"url\": \"http://example.com/image3.jpg\",\n                \"photographer\": \"Charlie Nakamura\",\n                \"location\": \"Minato Mirai 21, Yokohama\",\n                \"style\": \"lively city scenes\",\n                \"color\": \"dynamic contrasts\"\n            }\n        ]\n    return []\ndef filter_images(images: list, by: str, value: str) -> list:\n    \"\"\"\n    Filters images based on a specified attribute and value.\n    \n    :param images: The list of image metadata dictionaries.\n    :param by: The attribute to filter by (e.g., \"style\", \"color\").\n    :param value: The value to filter by.\n    :return: A filtered list of image metadata dictionaries.\n    :raises ValueError: If images list is empty or by and value are not provided.\n    \"\"\"\n    if not images or not by or not value:\n        raise ValueError(\"Images list, by attribute, and value must be provided.\")\n    \n    # Mock logic: Filter images based on the attribute and value\n    return [image for image in images if image.get(by) == value]\ndef present_images(images: list) -> str:\n    \"\"\"\n    Presents the selected images in a user-friendly format.\n    \n    :param images: The list of image metadata dictionaries to present.\n    :return: A string representing the presentation of the images.\n    :raises ValueError: If images list is empty.\n    \"\"\"\n    if not images:\n        raise ValueError(\"Images list must not be empty.\")\n    \n    # Mock logic: Create a presentation string for the images\n    presentation = \"Here are the images:\\n\"\n    for idx, image in enumerate(images, start=1):\n        presentation += f\"Image {idx}: {image['url']} - by {image['photographer']} in {image['location']}, Style: {image['style']}, Color: {image['color']}\\n\"\n    return presentation", "user_query": "Can you search for images of nightlife in Tokyo using Serper and filter them by style \"neon-lit streets\"?", "checklist": {"functions": ["search_images", "filter_images", "present_images"], "values": [[{"url": "http://example.com/image1.jpg", "photographer": "Alice Tanaka", "location": "Shibuya, Tokyo", "style": "neon-lit streets", "color": "vivid neon"}, {"url": "http://example.com/image2.jpg", "photographer": "Bob Yamada", "location": "Tsukiji Outer Market, Tokyo", "style": "bustling night markets", "color": "warm tones"}, {"url": "http://example.com/image3.jpg", "photographer": "Charlie Nakamura", "location": "Minato Mirai 21, Yokohama", "style": "lively city scenes", "color": "dynamic contrasts"}], [{"url": "http://example.com/image1.jpg", "photographer": "Alice Tanaka", "location": "Shibuya, Tokyo", "style": "neon-lit streets", "color": "vivid neon"}], "Here are the images:\nImage 1: http://example.com/image1.jpg - by Alice Tanaka in Shibuya, Tokyo, Style: neon-lit streets, Color: vivid neon\n"]}}
{"difficulty": "hard", "function_schema_python": "def setup_alert(stock_or_topic: str, search_sources: list) -> bool:\n    \"\"\"Sets up an alert for a specific stock or topic using specified news sources.\n\n    :param stock_or_topic: The stock symbol (e.g., \"Apple\", \"Tesla\") or a topic (e.g., \"trade wars\").\n    :param search_sources: A list of news sources to search from (e.g., [\"Bloomberg\", \"CNBC\", \"Reuters\"]).\n    :return: True if the alert was successfully set up, False otherwise.\n    :raises ValueError: If stock_or_topic or search_sources is invalid.\"\"\"\n    pass\ndef search_news(stock_or_topic: str, search_sources: list) -> dict:\n    \"\"\"Searches for news articles related to a specified stock or topic from given news sources.\n\n    :param stock_or_topic: The stock symbol (e.g., \"Apple\", \"Tesla\") or a topic (e.g., \"trade wars\").\n    :param search_sources: A list of news sources to search from (e.g., [\"Bloomberg\", \"CNBC\", \"Reuters\"]).\n    :return:\n        dict: A dictionary with the following keys:\n            - articles (list[dict]): A list of articles, each with 'title', 'source', and 'url'.\n    :raises ValueError: If stock_or_topic or search_sources is invalid.\"\"\"\n    pass\ndef fetch_articles(stock_or_topic: str) -> list:\n    \"\"\"Fetches all articles related to a specified stock or topic from default news sources.\n\n    :param stock_or_topic: The stock symbol (e.g., \"Apple\", \"Tesla\") or a topic (e.g., \"trade wars\").\n    :return: A list of article summaries as strings.\n    :raises ValueError: If stock_or_topic is invalid.\"\"\"\n    pass\ndef get_latest_update(stock_or_topic: str) -> dict:\n    \"\"\"Retrieves the latest news update for a specified stock or topic.\n\n    :param stock_or_topic: The stock symbol (e.g., \"Apple\", \"Tesla\") or a topic (e.g., \"trade wars\").\n    :return:\n        dict: A dictionary with the following keys:\n            - title (str): The article title.\n            - source (str): The news source.\n            - summary (str): A brief summary of the article.\n    :raises ValueError: If stock_or_topic is invalid.\"\"\"\n    pass\n", "function_schema_json": [{"name": "setup_alert", "description": "Sets up an alert for a specific stock or topic using specified news sources.", "parameters": {"type": "object", "properties": {"stock_or_topic": {"type": "string", "description": "The stock symbol (e.g., \"Apple\", \"Tesla\") or a topic (e.g., \"trade wars\")."}, "search_sources": {"type": "array", "description": "A list of news sources to search from (e.g., [\"Bloomberg\", \"CNBC\", \"Reuters\"])."}}, "required": ["stock_or_topic", "search_sources"], "additionalProperties": false}}, {"name": "search_news", "description": "Searches for news articles related to a specified stock or topic from given news sources.", "parameters": {"type": "object", "properties": {"stock_or_topic": {"type": "string", "description": "The stock symbol (e.g., \"Apple\", \"Tesla\") or a topic (e.g., \"trade wars\")."}, "search_sources": {"type": "array", "description": "A list of news sources to search from (e.g., [\"Bloomberg\", \"CNBC\", \"Reuters\"])."}}, "required": ["stock_or_topic", "search_sources"], "additionalProperties": false}}, {"name": "fetch_articles", "description": "Fetches all articles related to a specified stock or topic from default news sources.", "parameters": {"type": "object", "properties": {"stock_or_topic": {"type": "string", "description": "The stock symbol (e.g., \"Apple\", \"Tesla\") or a topic (e.g., \"trade wars\")."}}, "required": ["stock_or_topic"], "additionalProperties": false}}, {"name": "get_latest_update", "description": "Retrieves the latest news update for a specified stock or topic.", "parameters": {"type": "object", "properties": {"stock_or_topic": {"type": "string", "description": "The stock symbol (e.g., \"Apple\", \"Tesla\") or a topic (e.g., \"trade wars\")."}}, "required": ["stock_or_topic"], "additionalProperties": false}}], "mock_functions": "def setup_alert(stock_or_topic: str, search_sources: list) -> bool:\n    \"\"\"\n    Sets up an alert for a specific stock or topic using specified news sources.\n    \n    :param stock_or_topic: The stock symbol (e.g., \"Apple\", \"Tesla\") or a topic (e.g., \"trade wars\").\n    :param search_sources: A list of news sources to search from (e.g., [\"Bloomberg\", \"CNBC\", \"Reuters\"]).\n    :return: True if the alert was successfully set up, False otherwise.\n    :raises ValueError: If stock_or_topic or search_sources is invalid.\n    \"\"\"\n    if not stock_or_topic or not search_sources:\n        raise ValueError(\"Stock or topic and search sources must be provided.\")\n    if isinstance(search_sources, list) and all(isinstance(source, str) for source in search_sources):\n        return True\n    return False\ndef search_news(stock_or_topic: str, search_sources: list) -> dict:\n    \"\"\"\n    Searches for news articles related to a specified stock or topic from given news sources.\n    \n    :param stock_or_topic: The stock symbol (e.g., \"Apple\", \"Tesla\") or a topic (e.g., \"trade wars\").\n    :param search_sources: A list of news sources to search from (e.g., [\"Bloomberg\", \"CNBC\", \"Reuters\"]).\n    :return:\n        dict: A dictionary with the following keys:\n            - articles (list[dict]): A list of articles, each with 'title', 'source', and 'url'.\n    :raises ValueError: If stock_or_topic or search_sources is invalid.\n    \"\"\"\n    if not stock_or_topic or not search_sources:\n        raise ValueError(\"Stock or topic and search_sources must be provided.\")\n    if isinstance(search_sources, list) and all(isinstance(source, str) for source in search_sources):\n        return {\n            \"articles\": [\n                {\n                    \"title\": f\"Latest news about {stock_or_topic}\",\n                    \"source\": search_sources[0],\n                    \"url\": \"http://example.com/news\"\n                }\n            ]\n        }\n    return {}\ndef fetch_articles(stock_or_topic: str) -> list:\n    \"\"\"\n    Fetches all articles related to a specified stock or topic from default news sources.\n    \n    :param stock_or_topic: The stock symbol (e.g., \"Apple\", \"Tesla\") or a topic (e.g., \"trade wars\").\n    :return: A list of article summaries as strings.\n    :raises ValueError: If stock_or_topic is invalid.\n    \"\"\"\n    if not stock_or_topic:\n        raise ValueError(\"Stock or topic must be provided.\")\n    return [\n        f\"Article about {stock_or_topic} from Bloomberg\",\n        f\"Article about {stock_or_topic} from CNBC\"\n    ]\ndef get_latest_update(stock_or_topic: str) -> dict:\n    \"\"\"\n    Retrieves the latest news update for a specified stock or topic.\n    \n    :param stock_or_topic: The stock symbol (e.g., \"Apple\", \"Tesla\") or a topic (e.g., \"trade wars\").\n    :return:\n        dict: A dictionary with the following keys:\n            - title (str): The article title.\n            - source (str): The news source.\n            - summary (str): A brief summary of the article.\n    :raises ValueError: If stock_or_topic is invalid.\n    \"\"\"\n    if not stock_or_topic:\n        raise ValueError(\"Stock or topic must be provided.\")\n    return {\n        \"title\": f\"Latest update on {stock_or_topic}\",\n        \"source\": \"Reuters\",\n        \"summary\": f\"Summary of the latest news about {stock_or_topic}\"\n    }", "user_query": "This is David. Please fetch the latest update on trade wars, get a summary of the most recent articles from multiple news sources, and provide me with the key highlights.", "checklist": {"functions": ["get_latest_update", "fetch_articles", "search_news"], "values": [{"title": "Latest update on trade wars", "source": "Reuters", "summary": "Summary of the latest news about trade wars"}, ["Article about trade wars from Bloomberg", "Article about trade wars from CNBC"], {"articles": [{"title": "Latest news about trade wars", "source": "Bloomberg", "url": "http://example.com/news"}]}]}}
{"difficulty": "hard", "function_schema_python": "def initiate_product_search(agent_name: str, product_description: str, budget: float) -> bool:\n    \"\"\"Initiates a product search using the specified smart shopping agent.\n\n    :param agent_name: The name of the smart shopping agent (e.g., \"ShopSmart\").\n    :param product_description: A description of the product being searched for.\n    :param budget: The maximum budget for the product.\n    :return: True if the product search was successfully initiated, False otherwise.\n    :raises ValueError: If agent_name, product_description, or budget is invalid.\"\"\"\n    pass\ndef search_with_serper(query: str, budget: float) -> list:\n    \"\"\"Searches for products using Serper based on the provided query and budget.\n\n    :param query: The search query.\n    :param budget: The maximum budget for the product.\n    :return: A list of dictionaries, each representing a product with the following keys:\n        - name (str): The name of the product.\n        - price (float): The price of the product.\n        - url (str): The URL to the product page.\n    :raises ValueError: If query is empty or budget is invalid.\"\"\"\n    pass\ndef search_with_duckduckgo(query: str, budget: float) -> list:\n    \"\"\"Searches for products using DuckDuckGo based on the provided query and budget.\n\n    :param query: The search query.\n    :param budget: The maximum budget for the product.\n    :return: A list of dictionaries, each representing a product with the following keys:\n        - name (str): The name of the product.\n        - price (float): The price of the product.\n        - url (str): The URL to the product page.\n    :raises ValueError: If query is empty or budget is invalid.\"\"\"\n    pass\ndef search_with_bind(query: str, budget: float) -> list:\n    \"\"\"Searches for products using Bind based on the provided query and budget.\n\n    :param query: The search query.\n    :param budget: The maximum budget for the product.\n    :return: A list of dictionaries, each representing a product with the following keys:\n        - name (str): The name of the product.\n        - price (float): The price of the product.\n        - url (str): The URL to the product page.\n    :raises ValueError: If query is empty or budget is invalid.\"\"\"\n    pass\n", "function_schema_json": [{"name": "initiate_product_search", "description": "Initiates a product search using the specified smart shopping agent.", "parameters": {"type": "object", "properties": {"agent_name": {"type": "string", "description": "The name of the smart shopping agent (e.g., \"ShopSmart\")."}, "product_description": {"type": "string", "description": "A description of the product being searched for."}, "budget": {"type": "number", "description": "The maximum budget for the product."}}, "required": ["agent_name", "product_description", "budget"], "additionalProperties": false}}, {"name": "search_with_serper", "description": "Searches for products using Serper based on the provided query and budget.", "parameters": {"type": "object", "properties": {"query": {"type": "string", "description": "The search query."}, "budget": {"type": "number", "description": "The maximum budget for the product."}}, "required": ["query", "budget"], "additionalProperties": false}}, {"name": "search_with_duckduckgo", "description": "Searches for products using DuckDuckGo based on the provided query and budget.", "parameters": {"type": "object", "properties": {"query": {"type": "string", "description": "The search query."}, "budget": {"type": "number", "description": "The maximum budget for the product."}}, "required": ["query", "budget"], "additionalProperties": false}}, {"name": "search_with_bind", "description": "Searches for products using Bind based on the provided query and budget.", "parameters": {"type": "object", "properties": {"query": {"type": "string", "description": "The search query."}, "budget": {"type": "number", "description": "The maximum budget for the product."}}, "required": ["query", "budget"], "additionalProperties": false}}], "mock_functions": "def initiate_product_search(agent_name: str, product_description: str, budget: float) -> bool:\n    \"\"\"\n    Initiates a product search using the specified smart shopping agent.\n    \n    :param agent_name: The name of the smart shopping agent (e.g., \"ShopSmart\").\n    :param product_description: A description of the product being searched for.\n    :param budget: The maximum budget for the product.\n    :return: True if the product search was successfully initiated, False otherwise.\n    :raises ValueError: If agent_name, product_description, or budget is invalid.\n    \"\"\"\n    if not agent_name or not product_description or budget <= 0:\n        raise ValueError(\"Agent name, product description, and budget must be valid.\")\n    if agent_name.lower() == \"shopsmart\" and product_description and budget > 0:\n        return True\n    return False\ndef search_with_serper(query: str, budget: float) -> list:\n    \"\"\"\n    Searches for products using Serper based on the provided query and budget.\n    \n    :param query: The search query.\n    :param budget: The maximum budget for the product.\n    :return: A list of dictionaries, each representing a product with the following keys:\n        - name (str): The name of the product.\n        - price (float): The price of the product.\n        - url (str): The URL to the product page.\n    :raises ValueError: If query is empty or budget is invalid.\n    \"\"\"\n    if not query or budget <= 0:\n        raise ValueError(\"Query must not be empty and budget must be valid.\")\n    mock_results = [\n        {\n            \"name\": \"Astronomy Solar System Desktop Planetarium\",\n            \"price\": 45.99,\n            \"url\": \"https://example.com/planetarium\"\n        },\n        {\n            \"name\": \"Science Kit - Chemistry Lab Experiments\",\n            \"price\": 39.99,\n            \"url\": \"https://example.com/sciencekit\"\n        }\n    ]\n    return mock_results\ndef search_with_duckduckgo(query: str, budget: float) -> list:\n    \"\"\"\n    Searches for products using DuckDuckGo based on the provided query and budget.\n    \n    :param query: The search query.\n    :param budget: The maximum budget for the product.\n    :return: A list of dictionaries, each representing a product with the following keys:\n        - name (str): The name of the product.\n        - price (float): The price of the product.\n        - url (str): The URL to the product page.\n    :raises ValueError: If query is empty or budget is invalid.\n    \"\"\"\n    if not query or budget <= 0:\n        raise ValueError(\"Query must not be empty and budget must be valid.\")\n    mock_results = [\n        {\n            \"name\": \"Educational Rocket Science Kit\",\n            \"price\": 42.99,\n            \"url\": \"https://example.com/rocketsciencekit\"\n        },\n        {\n            \"name\": \"Space Exploration Toy\",\n            \"price\": 49.99,\n            \"url\": \"https://example.com/spaceexplorertoy\"\n        }\n    ]\n    return mock_results\ndef search_with_bind(query: str, budget: float) -> list:\n    \"\"\"\n    Searches for products using Bind based on the provided query and budget.\n    \n    :param query: The search query.\n    :param budget: The maximum budget for the product.\n    :return: A list of dictionaries, each representing a product with the following keys:\n        - name (str): The name of the product.\n        - price (float): The price of the product.\n        - url (str): The URL to the product page.\n    :raises ValueError: If query is empty or budget is invalid.\n    \"\"\"\n    if not query or budget <= 0:\n        raise ValueError(\"Query must not be empty and budget must be valid.\")\n    mock_results = [\n        {\n            \"name\": \"Interactive Space Experience Toy\",\n            \"price\": 47.99,\n            \"url\": \"https://example.com/spacetoymock\"\n        },\n        {\n            \"name\": \"Junior Astronomer Telescope\",\n            \"price\": 35.49,\n            \"url\": \"https://example.com/astronomertelescope\"\n        }\n    ]\n    return mock_results", "user_query": "Please search for space exploration toys under $50 using Serper and DuckDuckGo for my son Tom's birthday.", "checklist": {"functions": ["initiate_product_search", "search_with_serper", "search_with_duckduckgo"], "values": [true, [{"name": "Astronomy Solar System Desktop Planetarium", "price": 45.99, "url": "https://example.com/planetarium"}, {"name": "Science Kit - Chemistry Lab Experiments", "price": 39.99, "url": "https://example.com/sciencekit"}], [{"name": "Educational Rocket Science Kit", "price": 42.99, "url": "https://example.com/rocketsciencekit"}, {"name": "Space Exploration Toy", "price": 49.99, "url": "https://example.com/spaceexplorertoy"}]]}}
{"difficulty": "hard", "function_schema_python": "def search_venues(city: str, capacity: int, budget_range: tuple[int, int]) -> list[dict]:\n    \"\"\"Searches for venue options based on city, capacity, and budget requirements.\n\n    :param city: City where the venue is located\n    :param capacity: Required capacity for attendees\n    :param budget_range: Tuple of (min_budget, max_budget) in USD\n    :return: List of dictionaries containing venue information\n    :raises ValueError: If capacity is <= 0 or budget range is invalid\"\"\"\n    pass\ndef verify_av_capabilities(venue_name: str) -> dict:\n    \"\"\"Checks audiovisual capabilities of a specific venue.\n\n    :param venue_name: Name of the venue to check\n    :return: Dictionary containing AV equipment details\n    :raises ValueError: If venue_name is empty\"\"\"\n    pass\ndef check_venue_availability(venue_name: str, date: str) -> dict:\n    \"\"\"Checks venue availability for a specific date.\n\n    :param venue_name: Name of the venue\n    :param date: Date in 'YYYY-MM-DD' format\n    :return: Dictionary containing availability and pricing information\n    :raises ValueError: If date format is incorrect\"\"\"\n    pass\n", "function_schema_json": [{"name": "search_venues", "description": "Searches for venue options based on city, capacity, and budget requirements.", "parameters": {"type": "object", "properties": {"city": {"type": "string", "description": "City where the venue is located"}, "capacity": {"type": "integer", "description": "Required capacity for attendees"}, "budget_range": {"type": "string", "description": "Tuple of (min_budget, max_budget) in USD"}}, "required": ["city", "capacity", "budget_range"], "additionalProperties": false}}, {"name": "verify_av_capabilities", "description": "Checks audiovisual capabilities of a specific venue.", "parameters": {"type": "object", "properties": {"venue_name": {"type": "string", "description": "Name of the venue to check"}}, "required": ["venue_name"], "additionalProperties": false}}, {"name": "check_venue_availability", "description": "Checks venue availability for a specific date.", "parameters": {"type": "object", "properties": {"venue_name": {"type": "string", "description": "Name of the venue"}, "date": {"type": "string", "description": "Date in 'YYYY-MM-DD' format"}}, "required": ["venue_name", "date"], "additionalProperties": false}}], "mock_functions": "def search_venues(\n    city: str, \n    capacity: int, \n    budget_range: tuple[int, int]\n) -> list[dict]:\n    \"\"\"\n    Searches for venue options based on city, capacity, and budget requirements.\n    \n    :param city: City where the venue is located\n    :param capacity: Required capacity for attendees\n    :param budget_range: Tuple of (min_budget, max_budget) in USD\n    :return: List of dictionaries containing venue information\n    :raises ValueError: If capacity is <= 0 or budget range is invalid\n    \"\"\"\n    if capacity <= 0:\n        raise ValueError(\"Capacity must be greater than 0\")\n    if budget_range[0] > budget_range[1]:\n        raise ValueError(\"Invalid budget range\")\n\n    if (city.lower() == \"seattle\" and \n        200 <= capacity <= 300 and \n        10000 <= budget_range[1] <= 25000):\n        return [\n            {\n                \"name\": \"Seattle Convention Center\",\n                \"capacity\": 300,\n                \"price\": 15000,\n                \"breakout_rooms\": 4,\n                \"transit_access\": True,\n                \"parking_spots\": 200\n            },\n            {\n                \"name\": \"Tech Hub Seattle\",\n                \"capacity\": 250,\n                \"price\": 12000,\n                \"breakout_rooms\": 3,\n                \"transit_access\": True,\n                \"parking_spots\": 150\n            }\n        ]\n    return []\ndef verify_av_capabilities(venue_name: str) -> dict:\n    \"\"\"\n    Checks audiovisual capabilities of a specific venue.\n    \n    :param venue_name: Name of the venue to check\n    :return: Dictionary containing AV equipment details\n    :raises ValueError: If venue_name is empty\n    \"\"\"\n    if not venue_name:\n        raise ValueError(\"Venue name cannot be empty\")\n        \n    valid_venues = {\n        \"seattle convention center\": {\n            \"projectors\": True,\n            \"sound_system\": True,\n            \"wireless_mics\": 4,\n            \"video_recording\": True,\n            \"streaming_capability\": True\n        },\n        \"tech hub seattle\": {\n            \"projectors\": True,\n            \"sound_system\": True,\n            \"wireless_mics\": 2,\n            \"video_recording\": True,\n            \"streaming_capability\": False\n        }\n    }\n    \n    return valid_venues.get(venue_name.lower(), {})\ndef check_venue_availability(\n    venue_name: str, \n    date: str\n) -> dict:\n    \"\"\"\n    Checks venue availability for a specific date.\n    \n    :param venue_name: Name of the venue\n    :param date: Date in 'YYYY-MM-DD' format\n    :return: Dictionary containing availability and pricing information\n    :raises ValueError: If date format is incorrect\n    \"\"\"\n    if not venue_name or not date:\n        raise ValueError(\"Venue name and date must be provided\")\n    \n    if (venue_name.lower() in [\"seattle convention center\", \"tech hub seattle\"] and \n        date == \"2024-03-15\"):\n        return {\n            \"available\": True,\n            \"base_price\": 15000,\n            \"setup_time\": \"2 hours\",\n            \"teardown_time\": \"2 hours\",\n            \"available_hours\": \"8:00 AM - 10:00 PM\"\n        }\n    return {\"available\": False}", "user_query": "This is Michael from the conference planning team. Please verify the availability of both Seattle Convention Center and Tech Hub Seattle for our conference date of 2024-03-15, and provide their AV capabilities and pricing details.", "checklist": {"functions": ["verify_av_capabilities", "verify_av_capabilities", "check_venue_availability", "check_venue_availability"], "values": [{"projectors": true, "sound_system": true, "wireless_mics": 4, "video_recording": true, "streaming_capability": true}, {"projectors": true, "sound_system": true, "wireless_mics": 2, "video_recording": true, "streaming_capability": false}, {"available": true, "base_price": 15000, "setup_time": "2 hours", "teardown_time": "2 hours", "available_hours": "8:00 AM - 10:00 PM"}, {"available": true, "base_price": 15000, "setup_time": "2 hours", "teardown_time": "2 hours", "available_hours": "8:00 AM - 10:00 PM"}]}}
{"difficulty": "hard", "function_schema_python": "def get_field_mapping_rule(source_field: str, target_field: str, source_system: str, target_system: str) -> dict:\n    \"\"\"Retrieves or creates a field mapping rule between two systems.\n\n    :param source_field: Name of the field in source system\n    :param target_field: Name of the field in target system\n    :param source_system: Source system identifier\n    :param target_system: Target system identifier\n    :return: Dictionary containing mapping rule details\n    :raises ValueError: If field names or system identifiers are invalid\"\"\"\n    pass\ndef validate_field_mapping(mapping_rule: dict) -> bool:\n    \"\"\"Validates if a field mapping rule is correctly configured.\n\n    :param mapping_rule: Dictionary containing the mapping rule configuration\n    :return: True if mapping is valid, False otherwise\n    :raises ValueError: If mapping_rule is invalid\"\"\"\n    pass\ndef transform_field_value(value: int, mapping_rule: dict) -> str:\n    \"\"\"Transforms a value based on the provided mapping rule.\n\n    :param value: Numeric value to transform (1-100)\n    :param mapping_rule: Dictionary containing the mapping configuration\n    :return: Transformed letter grade (A, B, C, or D)\n    :raises ValueError: If value is out of range or mapping_rule is invalid\"\"\"\n    pass\n", "function_schema_json": [{"name": "get_field_mapping_rule", "description": "Retrieves or creates a field mapping rule between two systems.", "parameters": {"type": "object", "properties": {"source_field": {"type": "string", "description": "Name of the field in source system"}, "target_field": {"type": "string", "description": "Name of the field in target system"}, "source_system": {"type": "string", "description": "Source system identifier"}, "target_system": {"type": "string", "description": "Target system identifier"}}, "required": ["source_field", "target_field", "source_system", "target_system"], "additionalProperties": false}}, {"name": "validate_field_mapping", "description": "Validates if a field mapping rule is correctly configured.", "parameters": {"type": "object", "properties": {"mapping_rule": {"type": "object", "description": "Dictionary containing the mapping rule configuration"}}, "required": ["mapping_rule"], "additionalProperties": false}}, {"name": "transform_field_value", "description": "Transforms a value based on the provided mapping rule.", "parameters": {"type": "object", "properties": {"value": {"type": "integer", "description": "Numeric value to transform (1-100)"}, "mapping_rule": {"type": "object", "description": "Dictionary containing the mapping configuration"}}, "required": ["value", "mapping_rule"], "additionalProperties": false}}], "mock_functions": "def get_field_mapping_rule(source_field: str, target_field: str, source_system: str, target_system: str) -> dict:\n    \"\"\"\n    Retrieves or creates a field mapping rule between two systems.\n    \n    :param source_field: Name of the field in source system\n    :param target_field: Name of the field in target system\n    :param source_system: Source system identifier\n    :param target_system: Target system identifier\n    :return: Dictionary containing mapping rule details\n    :raises ValueError: If field names or system identifiers are invalid\n    \"\"\"\n    if not all([source_field, target_field, source_system, target_system]):\n        raise ValueError(\"All parameters must be provided\")\n    \n    if (source_field.lower() == \"lead score\" and \n        target_field.lower() == \"prospect rating\" and \n        source_system == \"SB12345\" and \n        target_system == \"MF67890\"):\n        return {\n            \"rule_id\": \"MAP001\",\n            \"source_field\": \"Lead Score\",\n            \"target_field\": \"Prospect Rating\",\n            \"transformation_type\": \"numeric_to_letter\",\n            \"mapping_rules\": {\n                \"range\": [\n                    {\"min\": 76, \"max\": 100, \"value\": \"A\"},\n                    {\"min\": 51, \"max\": 75, \"value\": \"B\"},\n                    {\"min\": 26, \"max\": 50, \"value\": \"C\"},\n                    {\"min\": 1, \"max\": 25, \"value\": \"D\"}\n                ]\n            }\n        }\n    raise ValueError(\"Invalid field mapping configuration\")\ndef validate_field_mapping(mapping_rule: dict) -> bool:\n    \"\"\"\n    Validates if a field mapping rule is correctly configured.\n    \n    :param mapping_rule: Dictionary containing the mapping rule configuration\n    :return: True if mapping is valid, False otherwise\n    :raises ValueError: If mapping_rule is invalid\n    \"\"\"\n    required_keys = [\"rule_id\", \"source_field\", \"target_field\", \"transformation_type\", \"mapping_rules\"]\n    if not all(key in mapping_rule for key in required_keys):\n        raise ValueError(\"Invalid mapping rule structure\")\n    \n    if (mapping_rule[\"rule_id\"] == \"MAP001\" and \n        mapping_rule[\"transformation_type\"] == \"numeric_to_letter\"):\n        return True\n    return False\ndef transform_field_value(value: int, mapping_rule: dict) -> str:\n    \"\"\"\n    Transforms a value based on the provided mapping rule.\n    \n    :param value: Numeric value to transform (1-100)\n    :param mapping_rule: Dictionary containing the mapping configuration\n    :return: Transformed letter grade (A, B, C, or D)\n    :raises ValueError: If value is out of range or mapping_rule is invalid\n    \"\"\"\n    if not isinstance(value, int) or value < 1 or value > 100:\n        raise ValueError(\"Value must be an integer between 1 and 100\")\n    \n    if mapping_rule[\"rule_id\"] == \"MAP001\":\n        for range_rule in mapping_rule[\"mapping_rules\"][\"range\"]:\n            if range_rule[\"min\"] <= value <= range_rule[\"max\"]:\n                return range_rule[\"value\"]\n    raise ValueError(\"Invalid mapping rule or value\")", "user_query": "This is John from Coffee Co. Could you get the mapping rule for 'Lead Score' from SalesBoost (SB12345) to 'Prospect Rating' in MarketFlow (MF67890), validate it, and show how a score of 85 would be transformed?", "checklist": {"functions": ["get_field_mapping_rule", "validate_field_mapping", "transform_field_value"], "values": [{"rule_id": "MAP001", "source_field": "Lead Score", "target_field": "Prospect Rating", "transformation_type": "numeric_to_letter", "mapping_rules": {"range": [{"min": 76, "max": 100, "value": "A"}, {"min": 51, "max": 75, "value": "B"}, {"min": 26, "max": 50, "value": "C"}, {"min": 1, "max": 25, "value": "D"}]}}, true, "A"]}}
{"difficulty": "hard", "function_schema_python": "def get_project_details(project_id: str) -> dict:\n    \"\"\"Retrieves detailed information about a specific project.\n\n    :param project_id: The project identifier (e.g., 'PRJ-123')\n    :return: Dictionary containing project details\n        dict: {\n            'name': str,\n            'id': str,\n            'start_date': str,\n            'status': str,\n            'completion_percentage': float\n        }\n    :raises ValueError: If project_id format is invalid\"\"\"\n    pass\ndef get_project_tasks(project_id: str) -> list[dict]:\n    \"\"\"Retrieves all tasks associated with a project.\n\n    :param project_id: The project identifier (e.g., 'PRJ-123')\n    :return: List of dictionaries containing task details\n        list[dict]: Each dict contains:\n            {\n                'task_id': str,\n                'title': str,\n                'assignee': str,\n                'status': str,\n                'time_spent': float,\n                'remaining_hours': float\n            }\n    :raises ValueError: If project_id is invalid\"\"\"\n    pass\ndef get_project_issues(project_id: str) -> list[dict]:\n    \"\"\"Retrieves all outstanding issues for a project.\n\n    :param project_id: The project identifier (e.g., 'PRJ-123')\n    :return: List of dictionaries containing issue details\n        list[dict]: Each dict contains:\n            {\n                'issue_id': str,\n                'title': str,\n                'severity': str,\n                'status': str,\n                'reported_by': str\n            }\n    :raises ValueError: If project_id is invalid\"\"\"\n    pass\n", "function_schema_json": [{"name": "get_project_details", "description": "Retrieves detailed information about a specific project.", "parameters": {"type": "object", "properties": {"project_id": {"type": "string", "description": "The project identifier (e.g., 'PRJ-123')"}}, "required": ["project_id"], "additionalProperties": false}}, {"name": "get_project_tasks", "description": "Retrieves all tasks associated with a project.", "parameters": {"type": "object", "properties": {"project_id": {"type": "string", "description": "The project identifier (e.g., 'PRJ-123')"}}, "required": ["project_id"], "additionalProperties": false}}, {"name": "get_project_issues", "description": "Retrieves all outstanding issues for a project.", "parameters": {"type": "object", "properties": {"project_id": {"type": "string", "description": "The project identifier (e.g., 'PRJ-123')"}}, "required": ["project_id"], "additionalProperties": false}}], "mock_functions": "def get_project_details(project_id: str) -> dict:\n    \"\"\"\n    Retrieves detailed information about a specific project.\n    \n    :param project_id: The project identifier (e.g., 'PRJ-123')\n    :return: Dictionary containing project details\n        dict: {\n            'name': str,\n            'id': str,\n            'start_date': str,\n            'status': str,\n            'completion_percentage': float\n        }\n    :raises ValueError: If project_id format is invalid\n    \"\"\"\n    if not project_id.startswith('PRJ-'):\n        raise ValueError(\"Invalid project ID format\")\n    \n    if project_id == \"PRJ-123\":\n        return {\n            \"name\": \"Project Alpha\",\n            \"id\": \"PRJ-123\",\n            \"start_date\": \"2023-01-15\",\n            \"status\": \"In Progress\",\n            \"completion_percentage\": 65.5\n        }\n    raise ValueError(\"Project not found\")\ndef get_project_tasks(project_id: str) -> list[dict]:\n    \"\"\"\n    Retrieves all tasks associated with a project.\n    \n    :param project_id: The project identifier (e.g., 'PRJ-123')\n    :return: List of dictionaries containing task details\n        list[dict]: Each dict contains:\n            {\n                'task_id': str,\n                'title': str,\n                'assignee': str,\n                'status': str,\n                'time_spent': float,\n                'remaining_hours': float\n            }\n    :raises ValueError: If project_id is invalid\n    \"\"\"\n    if project_id == \"PRJ-123\":\n        return [\n            {\n                \"task_id\": \"TSK-001\",\n                \"title\": \"Database Setup\",\n                \"assignee\": \"John Doe\",\n                \"status\": \"Completed\",\n                \"time_spent\": 24.5,\n                \"remaining_hours\": 0\n            },\n            {\n                \"task_id\": \"TSK-002\",\n                \"title\": \"API Development\",\n                \"assignee\": \"Jane Smith\",\n                \"status\": \"In Progress\",\n                \"time_spent\": 35.0,\n                \"remaining_hours\": 15.5\n            }\n        ]\n    raise ValueError(\"Project not found\")\ndef get_project_issues(project_id: str) -> list[dict]:\n    \"\"\"\n    Retrieves all outstanding issues for a project.\n    \n    :param project_id: The project identifier (e.g., 'PRJ-123')\n    :return: List of dictionaries containing issue details\n        list[dict]: Each dict contains:\n            {\n                'issue_id': str,\n                'title': str,\n                'severity': str,\n                'status': str,\n                'reported_by': str\n            }\n    :raises ValueError: If project_id is invalid\n    \"\"\"\n    if project_id == \"PRJ-123\":\n        return [\n            {\n                \"issue_id\": \"ISS-001\",\n                \"title\": \"Performance Bottleneck\",\n                \"severity\": \"High\",\n                \"status\": \"Open\",\n                \"reported_by\": \"Jane Smith\"\n            }\n        ]\n    raise ValueError(\"Project not found\")", "user_query": "This is Sarah from Acme Corp. I need a comprehensive report for Project Alpha (PRJ-123): fetch project details, list all tasks with their current status and time tracking, and include any outstanding issues, especially highlighting any high-severity problems.", "checklist": {"functions": ["get_project_details", "get_project_tasks", "get_project_issues"], "values": [{"name": "Project Alpha", "id": "PRJ-123", "start_date": "2023-01-15", "status": "In Progress", "completion_percentage": 65.5}, [{"task_id": "TSK-001", "title": "Database Setup", "assignee": "John Doe", "status": "Completed", "time_spent": 24.5, "remaining_hours": 0}, {"task_id": "TSK-002", "title": "API Development", "assignee": "Jane Smith", "status": "In Progress", "time_spent": 35.0, "remaining_hours": 15.5}], [{"issue_id": "ISS-001", "title": "Performance Bottleneck", "severity": "High", "status": "Open", "reported_by": "Jane Smith"}]]}}
{"difficulty": "hard", "function_schema_python": "def fetch_average_response_time(ticketing_system: str) -> int:\n    \"\"\"Fetches the average response time for tickets in a given ticketing system.\n\n    :param ticketing_system: The name of the ticketing system (e.g., 'ResoluteAssist').\n    :return: The average response time in hours.\n    :raises ValueError: If the ticketing system is not recognized.\"\"\"\n    pass\ndef analyze_ticket_trends(ticketing_system: str) -> list:\n    \"\"\"Analyzes ticket trends in a given ticketing system.\n\n    :param ticketing_system: The name of the ticketing system (e.g., 'ResoluteAssist').\n    :return: A list of trends, each described as a string.\n    :raises ValueError: If the ticketing system is not recognized.\"\"\"\n    pass\ndef suggest_workflow_improvements(ticketing_system: str) -> dict:\n    \"\"\"Suggests workflow improvements for a given ticketing system.\n\n    :param ticketing_system: The name of the ticketing system (e.g., 'ResoluteAssist').\n    :return:\n        dict: A dictionary with the following keys:\n            - new_processes (list[str]): Suggested new processes.\n            - process_optimizations (list[str]): Suggestions for optimizing existing processes.\n            - automation_recommendations (list[str]): Recommended integrations for automation.\n    :raises ValueError: If the ticketing system is not recognized.\"\"\"\n    pass\ndef get_integration_recommendations(ticketing_system: str, current_integrations: list) -> list:\n    \"\"\"Provides integration recommendations for a given ticketing system based on current integrations.\n\n    :param ticketing_system: The name of the ticketing system (e.g., 'ResoluteAssist').\n    :param current_integrations: A list of current integrations (e.g., ['Slack']).\n    :return: A list of integration recommendations.\n    :raises ValueError: If the ticketing system is not recognized.\"\"\"\n    pass\ndef monitor_ticket_volume(ticketing_system: str) -> dict:\n    \"\"\"Monitors the volume of tickets in a given ticketing system.\n\n    :param ticketing_system: The name of the ticketing system (e.g., 'ResoluteAssist').\n    :return:\n        dict: A dictionary with the following keys:\n            - total_tickets (int): Total number of tickets.\n            - open_tickets (int): Number of open tickets.\n            - closed_tickets (int): Number of closed tickets.\n    :raises ValueError: If the ticketing system is not recognized.\"\"\"\n    pass\n", "function_schema_json": [{"name": "fetch_average_response_time", "description": "Fetches the average response time for tickets in a given ticketing system.", "parameters": {"type": "object", "properties": {"ticketing_system": {"type": "string", "description": "The name of the ticketing system (e.g., 'ResoluteAssist')."}}, "required": ["ticketing_system"], "additionalProperties": false}}, {"name": "analyze_ticket_trends", "description": "Analyzes ticket trends in a given ticketing system.", "parameters": {"type": "object", "properties": {"ticketing_system": {"type": "string", "description": "The name of the ticketing system (e.g., 'ResoluteAssist')."}}, "required": ["ticketing_system"], "additionalProperties": false}}, {"name": "suggest_workflow_improvements", "description": "Suggests workflow improvements for a given ticketing system.", "parameters": {"type": "object", "properties": {"ticketing_system": {"type": "string", "description": "The name of the ticketing system (e.g., 'ResoluteAssist')."}}, "required": ["ticketing_system"], "additionalProperties": false}}, {"name": "get_integration_recommendations", "description": "Provides integration recommendations for a given ticketing system based on current integrations.", "parameters": {"type": "object", "properties": {"ticketing_system": {"type": "string", "description": "The name of the ticketing system (e.g., 'ResoluteAssist')."}, "current_integrations": {"type": "array", "description": "A list of current integrations (e.g., ['Slack'])."}}, "required": ["ticketing_system", "current_integrations"], "additionalProperties": false}}, {"name": "monitor_ticket_volume", "description": "Monitors the volume of tickets in a given ticketing system.", "parameters": {"type": "object", "properties": {"ticketing_system": {"type": "string", "description": "The name of the ticketing system (e.g., 'ResoluteAssist')."}}, "required": ["ticketing_system"], "additionalProperties": false}}], "mock_functions": "def fetch_average_response_time(ticketing_system: str) -> int:\n    \"\"\"\n    Fetches the average response time for tickets in a given ticketing system.\n    \n    :param ticketing_system: The name of the ticketing system (e.g., 'ResoluteAssist').\n    :return: The average response time in hours.\n    :raises ValueError: If the ticketing system is not recognized.\n    \"\"\"\n    if ticketing_system.lower() == 'resoluteassist':\n        return 50  # Simulating an average response time of 50 hours\n    raise ValueError(f\"Ticketing system '{ticketing_system}' not recognized.\")\ndef analyze_ticket_trends(ticketing_system: str) -> list:\n    \"\"\"\n    Analyzes ticket trends in a given ticketing system.\n    \n    :param ticketing_system: The name of the ticketing system (e.g., 'ResoluteAssist').\n    :return: A list of trends, each described as a string.\n    :raises ValueError: If the ticketing system is not recognized.\n    \"\"\"\n    if ticketing_system.lower() == 'resoluteassist':\n        return [\n            \"Higher volume of tickets related to the new product line\",\n            \"Increased response times over the past week\",\n            \"Common issues reported include setup and troubleshooting\"\n        ]\n    raise ValueError(f\"Ticketing system '{ticketing_system}' not recognized.\")\ndef suggest_workflow_improvements(ticketing_system: str) -> dict:\n    \"\"\"\n    Suggests workflow improvements for a given ticketing system.\n    \n    :param ticketing_system: The name of the ticketing system (e.g., 'ResoluteAssist').\n    :return:\n        dict: A dictionary with the following keys:\n            - new_processes (list[str]): Suggested new processes.\n            - process_optimizations (list[str]): Suggestions for optimizing existing processes.\n            - automation_recommendations (list[str]): Recommended integrations for automation.\n    :raises ValueError: If the ticketing system is not recognized.\n    \"\"\"\n    if ticketing_system.lower() == 'resoluteassist':\n        return {\n            \"new_processes\": [\"Implement a triage process for incoming tickets\"],\n            \"process_optimizations\": [\"Reduce manual data entry by using templates\"],\n            \"automation_recommendations\": [\"Integrate with Zendesk for better ticket management\"]\n        }\n    raise ValueError(f\"Ticketing system '{ticketing_system}' not recognized.\")\ndef get_integration_recommendations(ticketing_system: str, current_integrations: list) -> list:\n    \"\"\"\n    Provides integration recommendations for a given ticketing system based on current integrations.\n    \n    :param ticketing_system: The name of the ticketing system (e.g., 'ResoluteAssist').\n    :param current_integrations: A list of current integrations (e.g., ['Slack']).\n    :return: A list of integration recommendations.\n    :raises ValueError: If the ticketing system is not recognized.\n    \"\"\"\n    if ticketing_system.lower() == 'resoluteassist':\n        recommended_integrations = ['microsoft365', 'google_workspace', 'salesforce', 'trello', 'asana', 'zapier', 'shopify']\n        return list(set(recommended_integrations) - set(current_integrations))\n    raise ValueError(f\"Ticketing system '{ticketing_system}' not recognized.\")\ndef monitor_ticket_volume(ticketing_system: str) -> dict:\n    \"\"\"\n    Monitors the volume of tickets in a given ticketing system.\n    \n    :param ticketing_system: The name of the ticketing system (e.g., 'ResoluteAssist').\n    :return:\n        dict: A dictionary with the following keys:\n            - total_tickets (int): Total number of tickets.\n            - open_tickets (int): Number of open tickets.\n            - closed_tickets (int): Number of closed tickets.\n    :raises ValueError: If the ticketing system is not recognized.\n    \"\"\"\n    if ticketing_system.lower() == 'resoluteassist':\n        return {\n            \"total_tickets\": 5000,\n            \"open_tickets\": 2500,\n            \"closed_tickets\": 2500\n        }\n    raise ValueError(f\"Ticketing system '{ticketing_system}' not recognized.\")", "user_query": "This is Alex Martinez from Global Solutions Inc. Please help me optimize our support process. First, check our current ticket volume in ResoluteAssist, then provide integration recommendations beyond our current setup. Lastly, recommend specific workflow improvements to reduce our 50-hour average response time.", "checklist": {"functions": ["monitor_ticket_volume", "fetch_average_response_time", "suggest_workflow_improvements"], "values": [{"total_tickets": 5000, "open_tickets": 2500, "closed_tickets": 2500}, 50, {"new_processes": ["Implement a triage process for incoming tickets"], "process_optimizations": ["Reduce manual data entry by using templates"], "automation_recommendations": ["Integrate with Zendesk for better ticket management"]}]}}
{"difficulty": "hard", "function_schema_python": "def get_user_login_frequency(user_id: str, weeks: int) -> dict:\n    \"\"\"Retrieves user login frequency data for a specified period.\n\n    :param user_id: The unique identifier for the user.\n    :param weeks: Number of weeks to analyze.\n    :return: Dictionary containing login frequency data:\n        - total_logins (int): Total number of logins\n        - weekly_logins (list[int]): List of login counts per week\n        - consistent_weekly_login (bool): True if logged in at least once every week\n    :raises ValueError: If user_id is invalid or weeks is less than 1\"\"\"\n    pass\ndef get_user_email_metrics(user_id: str, months: int) -> dict:\n    \"\"\"Retrieves email sending metrics for a user over a specified period.\n\n    :param user_id: The unique identifier for the user.\n    :param months: Number of months to analyze.\n    :return: Dictionary containing email metrics:\n        - total_emails_sent (int): Total number of emails sent\n        - monthly_breakdown (dict): Emails sent per month\n        - meets_threshold (bool): True if sent >= 500 emails\n    :raises ValueError: If user_id is invalid or months is less than 1\"\"\"\n    pass\ndef get_popular_email_templates(user_id: str, months: int) -> dict:\n    \"\"\"Retrieves most used email templates by a user.\n\n    :param user_id: The unique identifier for the user.\n    :param months: Number of months to analyze.\n    :return: Dictionary containing template usage data:\n        - templates (list[dict]): List of template data with name and usage count\n        - total_templates_used (int): Total number of unique templates used\n    :raises ValueError: If user_id is invalid or months is less than 1\"\"\"\n    pass\n", "function_schema_json": [{"name": "get_user_login_frequency", "description": "Retrieves user login frequency data for a specified period.", "parameters": {"type": "object", "properties": {"user_id": {"type": "string", "description": "The unique identifier for the user."}, "weeks": {"type": "integer", "description": "Number of weeks to analyze."}}, "required": ["user_id", "weeks"], "additionalProperties": false}}, {"name": "get_user_email_metrics", "description": "Retrieves email sending metrics for a user over a specified period.", "parameters": {"type": "object", "properties": {"user_id": {"type": "string", "description": "The unique identifier for the user."}, "months": {"type": "integer", "description": "Number of months to analyze."}}, "required": ["user_id", "months"], "additionalProperties": false}}, {"name": "get_popular_email_templates", "description": "Retrieves most used email templates by a user.", "parameters": {"type": "object", "properties": {"user_id": {"type": "string", "description": "The unique identifier for the user."}, "months": {"type": "integer", "description": "Number of months to analyze."}}, "required": ["user_id", "months"], "additionalProperties": false}}], "mock_functions": "def get_user_login_frequency(user_id: str, weeks: int) -> dict:\n    \"\"\"\n    Retrieves user login frequency data for a specified period.\n    \n    :param user_id: The unique identifier for the user.\n    :param weeks: Number of weeks to analyze.\n    :return: Dictionary containing login frequency data:\n        - total_logins (int): Total number of logins\n        - weekly_logins (list[int]): List of login counts per week\n        - consistent_weekly_login (bool): True if logged in at least once every week\n    :raises ValueError: If user_id is invalid or weeks is less than 1\n    \"\"\"\n    if not user_id or weeks < 1:\n        raise ValueError(\"Invalid user_id or weeks parameter\")\n    \n    if user_id == \"USER123\" and weeks == 12:\n        return {\n            \"total_logins\": 48,\n            \"weekly_logins\": [4, 3, 5, 4, 3, 4, 5, 3, 4, 4, 4, 5],\n            \"consistent_weekly_login\": True\n        }\n    return {\"total_logins\": 0, \"weekly_logins\": [], \"consistent_weekly_login\": False}\ndef get_user_email_metrics(user_id: str, months: int) -> dict:\n    \"\"\"\n    Retrieves email sending metrics for a user over a specified period.\n    \n    :param user_id: The unique identifier for the user.\n    :param months: Number of months to analyze.\n    :return: Dictionary containing email metrics:\n        - total_emails_sent (int): Total number of emails sent\n        - monthly_breakdown (dict): Emails sent per month\n        - meets_threshold (bool): True if sent >= 500 emails\n    :raises ValueError: If user_id is invalid or months is less than 1\n    \"\"\"\n    if not user_id or months < 1:\n        raise ValueError(\"Invalid user_id or months parameter\")\n    \n    if user_id == \"USER123\" and months == 6:\n        return {\n            \"total_emails_sent\": 750,\n            \"monthly_breakdown\": {\n                \"Month1\": 125,\n                \"Month2\": 130,\n                \"Month3\": 115,\n                \"Month4\": 140,\n                \"Month5\": 120,\n                \"Month6\": 120\n            },\n            \"meets_threshold\": True\n        }\n    return {\"total_emails_sent\": 0, \"monthly_breakdown\": {}, \"meets_threshold\": False}\ndef get_popular_email_templates(user_id: str, months: int) -> dict:\n    \"\"\"\n    Retrieves most used email templates by a user.\n    \n    :param user_id: The unique identifier for the user.\n    :param months: Number of months to analyze.\n    :return: Dictionary containing template usage data:\n        - templates (list[dict]): List of template data with name and usage count\n        - total_templates_used (int): Total number of unique templates used\n    :raises ValueError: If user_id is invalid or months is less than 1\n    \"\"\"\n    if not user_id or months < 1:\n        raise ValueError(\"Invalid user_id or months parameter\")\n    \n    if user_id == \"USER123\" and months == 6:\n        return {\n            \"templates\": [\n                {\"name\": \"Welcome Email\", \"usage_count\": 250},\n                {\"name\": \"Newsletter\", \"usage_count\": 200},\n                {\"name\": \"Promotional\", \"usage_count\": 180},\n                {\"name\": \"Follow-up\", \"usage_count\": 120}\n            ],\n            \"total_templates_used\": 4\n        }\n    return {\"templates\": [], \"total_templates_used\": 0}", "user_query": "This is Jack. Can you check USER123's login frequency for past 12 weeks, verify if they've sent over 500 emails in last 6 months, and show their most used email templates during this period?", "checklist": {"functions": ["get_user_login_frequency", "get_user_email_metrics", "get_popular_email_templates"], "values": [{"total_logins": 48, "weekly_logins": [4, 3, 5, 4, 3, 4, 5, 3, 4, 4, 4, 5], "consistent_weekly_login": true}, {"total_emails_sent": 750, "monthly_breakdown": {"Month1": 125, "Month2": 130, "Month3": 115, "Month4": 140, "Month5": 120, "Month6": 120}, "meets_threshold": true}, {"templates": [{"name": "Welcome Email", "usage_count": 250}, {"name": "Newsletter", "usage_count": 200}, {"name": "Promotional", "usage_count": 180}, {"name": "Follow-up", "usage_count": 120}], "total_templates_used": 4}]}}
{"difficulty": "hard", "function_schema_python": "def configure_networking(instance_id: str, subnet_id: str, private_ip: str) -> bool:\n    \"\"\"Configures networking for a VM instance.\n\n    :param instance_id: The ID of the VM instance.\n    :param subnet_id: The ID of the subnet.\n    :param private_ip: The private IP address to assign.\n    :return: True if configuration is successful, False otherwise.\"\"\"\n    pass\ndef configure_security_group(instance_id: str, security_group_id: str, rules: List[Dict[str, str]]) -> bool:\n    \"\"\"Configures security group for a VM instance.\n\n    :param instance_id: The ID of the VM instance.\n    :param security_group_id: The ID of the security group.\n    :param rules: A list of rules for the security group. Each rule is a dictionary with 'protocol', 'port', and 'source' keys.\n    :return: True if configuration is successful, False otherwise.\"\"\"\n    pass\ndef configure_storage(instance_id: str, volume_size: int, volume_type: str) -> bool:\n    \"\"\"Configures storage for a VM instance.\n\n    :param instance_id: The ID of the VM instance.\n    :param volume_size: The size of the volume in GB.\n    :param volume_type: The type of the volume (e.g., \"gp2\", \"io1\").\n    :return: True if configuration is successful, False otherwise.\"\"\"\n    pass\ndef setup_vm_instance(instance_type: str, region: str, os: str, security_group: str, storage: int) -> str:\n    \"\"\"Sets up a new VM instance.\n\n    :param instance_type: Type of the instance (e.g., t2.micro).\n    :param region: Region to deploy the instance (e.g., US-West-1).\n    :param os: Operating system (e.g., Ubuntu 20.04 LTS).\n    :param security_group: Default security group.\n    :param storage: Storage size in GB.\n    :return: Instance ID if successful, empty string otherwise.\"\"\"\n    pass\n", "function_schema_json": [{"name": "configure_networking", "description": "Configures networking for a VM instance.", "parameters": {"type": "object", "properties": {"instance_id": {"type": "string", "description": "The ID of the VM instance."}, "subnet_id": {"type": "string", "description": "The ID of the subnet."}, "private_ip": {"type": "string", "description": "The private IP address to assign."}}, "required": ["instance_id", "subnet_id", "private_ip"], "additionalProperties": false}}, {"name": "configure_security_group", "description": "Configures security group for a VM instance.", "parameters": {"type": "object", "properties": {"instance_id": {"type": "string", "description": "The ID of the VM instance."}, "security_group_id": {"type": "string", "description": "The ID of the security group."}, "rules": {"type": "array", "items": {"type": "object"}, "description": "A list of rules for the security group. Each rule is a dictionary with 'protocol', 'port', and 'source' keys."}}, "required": ["instance_id", "security_group_id", "rules"], "additionalProperties": false}}, {"name": "configure_storage", "description": "Configures storage for a VM instance.", "parameters": {"type": "object", "properties": {"instance_id": {"type": "string", "description": "The ID of the VM instance."}, "volume_size": {"type": "integer", "description": "The size of the volume in GB."}, "volume_type": {"type": "string", "description": "The type of the volume (e.g., \"gp2\", \"io1\")."}}, "required": ["instance_id", "volume_size", "volume_type"], "additionalProperties": false}}, {"name": "setup_vm_instance", "description": "Sets up a new VM instance.", "parameters": {"type": "object", "properties": {"instance_type": {"type": "string", "description": "Type of the instance (e.g., t2.micro)."}, "region": {"type": "string", "description": "Region to deploy the instance (e.g., US-West-1)."}, "os": {"type": "string", "description": "Operating system (e.g., Ubuntu 20.04 LTS)."}, "security_group": {"type": "string", "description": "Default security group."}, "storage": {"type": "integer", "description": "Storage size in GB."}}, "required": ["instance_type", "region", "os", "security_group", "storage"], "additionalProperties": false}}], "mock_functions": "def configure_networking(instance_id: str, subnet_id: str, private_ip: str) -> bool:\n    \"\"\"\n    Configures networking for a VM instance.\n\n    :param instance_id: The ID of the VM instance.\n    :param subnet_id: The ID of the subnet.\n    :param private_ip: The private IP address to assign.\n    :return: True if configuration is successful, False otherwise.\n    \"\"\"\n    if instance_id and subnet_id and private_ip:\n        return True\n    return False\ndef configure_security_group(instance_id: str, security_group_id: str, rules: List[Dict[str, str]]) -> bool:\n    \"\"\"\n    Configures security group for a VM instance.\n\n    :param instance_id: The ID of the VM instance.\n    :param security_group_id: The ID of the security group.\n    :param rules: A list of rules for the security group. Each rule is a dictionary with 'protocol', 'port', and 'source' keys.\n    :return: True if configuration is successful, False otherwise.\n    \"\"\"\n    if instance_id and security_group_id and rules:\n        return True\n    return False\ndef configure_storage(instance_id: str, volume_size: int, volume_type: str) -> bool:\n    \"\"\"\n    Configures storage for a VM instance.\n\n    :param instance_id: The ID of the VM instance.\n    :param volume_size: The size of the volume in GB.\n    :param volume_type: The type of the volume (e.g., \"gp2\", \"io1\").\n    :return: True if configuration is successful, False otherwise.\n    \"\"\"\n    if instance_id and volume_size and volume_type:\n        return True\n    return False\ndef setup_vm_instance(instance_type: str, region: str, os: str, security_group: str, storage: int) -> str:\n    \"\"\"\n    Sets up a new VM instance.\n\n    :param instance_type: Type of the instance (e.g., t2.micro).\n    :param region: Region to deploy the instance (e.g., US-West-1).\n    :param os: Operating system (e.g., Ubuntu 20.04 LTS).\n    :param security_group: Default security group.\n    :param storage: Storage size in GB.\n    :return: Instance ID if successful, empty string otherwise.\n    \"\"\"\n    if instance_type == \"t2.micro\" and region == \"US-West-1\" and os == \"Ubuntu 20.04 LTS\" and security_group == \"default\" and storage == 8:\n        return \"i-0abcdef1234567890\"\n    return \"\"", "user_query": "John here. Instance i-0abcdef1234567890 needs its storage upgraded to 20GB of gp2 type. After that, verify all configurations (networking, security group with rules for inbound SSH (port 22) from anywhere and inbound HTTP (port 80) from my IP 192.168.1.100) are correct.", "checklist": {"functions": ["configure_storage", "configure_networking", "configure_security_group"], "values": [true, true, true]}}
{"difficulty": "hard", "function_schema_python": "def create_load_balancer(name: str, subnets: list) -> dict:\n    \"\"\"Creates an Application Load Balancer (ALB) in a specified VPC.\n\n    :param name: The name of the load balancer.\n    :param subnets: A list of subnet IDs in which the load balancer will be created.\n    :return: A dictionary containing the name and status of the load balancer.\n    :raises ValueError: If the name is empty or subnets list is invalid.\"\"\"\n    pass\ndef configure_auto_scaling_group(lb_arn: str, min_instances: int, max_instances: int) -> dict:\n    \"\"\"Configures an Auto Scaling Group associated with an Application Load Balancer.\n\n    :param lb_arn: The ARN of the Application Load Balancer.\n    :param min_instances: The minimum number of instances to maintain in the Auto Scaling Group.\n    :param max_instances: The maximum number of instances to maintain in the Auto Scaling Group.\n    :return: A dictionary containing the ARN of the load balancer and the auto scaling group settings.\n    :raises ValueError: If lb_arn, min_instances, or max_instances are invalid.\"\"\"\n    pass\ndef set_up_security_groups(protocol: str) -> str:\n    \"\"\"Sets up custom security rules for HTTP and HTTPS traffic.\n\n    :param protocol: The protocol for which to set up security rules ('http' or 'https').\n    :return: A string indicating the status of the security group setup.\n    :raises ValueError: If the protocol is unsupported.\"\"\"\n    pass\ndef create_nfs_storage(vpc_id: str, subnet_id: str) -> dict:\n    \"\"\"Creates a Network File System (NFS) for shared storage in a specified VPC and subnet.\n\n    :param vpc_id: The ID of the VPC.\n    :param subnet_id: The ID of the subnet where NFS will be created.\n    :return: A dictionary containing the storage ID, VPC ID, and subnet ID.\n    :raises ValueError: If vpc_id or subnet_id are invalid.\"\"\"\n    pass\n", "function_schema_json": [{"name": "create_load_balancer", "description": "Creates an Application Load Balancer (ALB) in a specified VPC.", "parameters": {"type": "object", "properties": {"name": {"type": "string", "description": "The name of the load balancer."}, "subnets": {"type": "array", "description": "A list of subnet IDs in which the load balancer will be created."}}, "required": ["name", "subnets"], "additionalProperties": false}}, {"name": "configure_auto_scaling_group", "description": "Configures an Auto Scaling Group associated with an Application Load Balancer.", "parameters": {"type": "object", "properties": {"lb_arn": {"type": "string", "description": "The ARN of the Application Load Balancer."}, "min_instances": {"type": "integer", "description": "The minimum number of instances to maintain in the Auto Scaling Group."}, "max_instances": {"type": "integer", "description": "The maximum number of instances to maintain in the Auto Scaling Group."}}, "required": ["lb_arn", "min_instances", "max_instances"], "additionalProperties": false}}, {"name": "set_up_security_groups", "description": "Sets up custom security rules for HTTP and HTTPS traffic.", "parameters": {"type": "object", "properties": {"protocol": {"type": "string", "description": "The protocol for which to set up security rules ('http' or 'https')."}}, "required": ["protocol"], "additionalProperties": false}}, {"name": "create_nfs_storage", "description": "Creates a Network File System (NFS) for shared storage in a specified VPC and subnet.", "parameters": {"type": "object", "properties": {"vpc_id": {"type": "string", "description": "The ID of the VPC."}, "subnet_id": {"type": "string", "description": "The ID of the subnet where NFS will be created."}}, "required": ["vpc_id", "subnet_id"], "additionalProperties": false}}], "mock_functions": "def create_load_balancer(name: str, subnets: list) -> dict:\n    \"\"\"\n    Creates an Application Load Balancer (ALB) in a specified VPC.\n\n    :param name: The name of the load balancer.\n    :param subnets: A list of subnet IDs in which the load balancer will be created.\n    :return: A dictionary containing the name and status of the load balancer.\n    :raises ValueError: If the name is empty or subnets list is invalid.\n    \"\"\"\n    if not name or not subnets:\n        raise ValueError(\"Load balancer name and subnets must be provided.\")\n    return {\n        \"name\": name,\n        \"status\": \"active\",\n        \"subnets\": subnets\n    }\ndef configure_auto_scaling_group(lb_arn: str, min_instances: int, max_instances: int) -> dict:\n    \"\"\"\n    Configures an Auto Scaling Group associated with an Application Load Balancer.\n\n    :param lb_arn: The ARN of the Application Load Balancer.\n    :param min_instances: The minimum number of instances to maintain in the Auto Scaling Group.\n    :param max_instances: The maximum number of instances to maintain in the Auto Scaling Group.\n    :return: A dictionary containing the ARN of the load balancer and the auto scaling group settings.\n    :raises ValueError: If lb_arn, min_instances, or max_instances are invalid.\n    \"\"\"\n    if not lb_arn or min_instances < 1 or max_instances < min_instances:\n        raise ValueError(\"Invalid parameters for auto scaling group configuration.\")\n    return {\n        \"lb_arn\": lb_arn,\n        \"min_instances\": min_instances,\n        \"max_instances\": max_instances\n    }\ndef set_up_security_groups(protocol: str) -> str:\n    \"\"\"\n    Sets up custom security rules for HTTP and HTTPS traffic.\n\n    :param protocol: The protocol for which to set up security rules ('http' or 'https').\n    :return: A string indicating the status of the security group setup.\n    :raises ValueError: If the protocol is unsupported.\n    \"\"\"\n    if protocol.lower() not in ['http', 'https']:\n        raise ValueError(\"Unsupported protocol. Use 'http' or 'https'.\")\n    return f\"Security rules for {protocol.upper()} traffic set up successfully.\"\ndef create_nfs_storage(vpc_id: str, subnet_id: str) -> dict:\n    \"\"\"\n    Creates a Network File System (NFS) for shared storage in a specified VPC and subnet.\n\n    :param vpc_id: The ID of the VPC.\n    :param subnet_id: The ID of the subnet where NFS will be created.\n    :return: A dictionary containing the storage ID, VPC ID, and subnet ID.\n    :raises ValueError: If vpc_id or subnet_id are invalid.\n    \"\"\"\n    if not vpc_id or not subnet_id:\n        raise ValueError(\"VPC ID and Subnet ID must be provided.\")\n    return {\n        \"storage_id\": \"nfs-storage-123\",\n        \"vpc_id\": vpc_id,\n        \"subnet_id\": subnet_id\n    }", "user_query": "This is Sarah. Set up security groups for HTTP and HTTPS protocols, and create NFS storage in VPC 'vpc-12345' and subnet 'subnet-1'.  Then, give me the details of the NFS storage created.", "checklist": {"functions": ["set_up_security_groups", "set_up_security_groups", "create_nfs_storage"], "values": ["Security rules for HTTP traffic set up successfully.", "Security rules for HTTPS traffic set up successfully.", {"storage_id": "nfs-storage-123", "vpc_id": "vpc-12345", "subnet_id": "subnet-1"}]}}
{"difficulty": "hard", "function_schema_python": "def validate_jenkinsfile_syntax(jenkinsfile_content: str) -> bool:\n    \"\"\"Validates the syntax of a Jenkinsfile.\n\n    :param jenkinsfile_content: The content of the Jenkinsfile as a string.\n    :return: True if the syntax is valid, False otherwise.\"\"\"\n    pass\ndef suggest_best_practices(branch: str) -> list:\n    \"\"\"Suggests best practices for the given branch in a CI/CD pipeline.\n\n    :param branch: The name of the branch (e.g., \"main\").\n    :return: A list of best practice strings.\"\"\"\n    pass\ndef troubleshoot_jenkinsfile_issues(jenkinsfile_content: str) -> dict:\n    \"\"\"Identifies and suggests fixes for common issues in a Jenkinsfile.\n\n    :param jenkinsfile_content: The content of the Jenkinsfile as a string.\n    :return: A dictionary with issues and their suggested fixes.\n        dict: A dictionary with the following keys:\n            - issues (list[str]): The list of identified issues.\n            - fixes (list[str]): The list of suggested fixes.\"\"\"\n    pass\n", "function_schema_json": [{"name": "validate_jenkinsfile_syntax", "description": "Validates the syntax of a Jenkinsfile.", "parameters": {"type": "object", "properties": {"jenkinsfile_content": {"type": "string", "description": "The content of the Jenkinsfile as a string."}}, "required": ["jenkinsfile_content"], "additionalProperties": false}}, {"name": "suggest_best_practices", "description": "Suggests best practices for the given branch in a CI/CD pipeline.", "parameters": {"type": "object", "properties": {"branch": {"type": "string", "description": "The name of the branch (e.g., \"main\")."}}, "required": ["branch"], "additionalProperties": false}}, {"name": "troubleshoot_jenkinsfile_issues", "description": "Identifies and suggests fixes for common issues in a Jenkinsfile.", "parameters": {"type": "object", "properties": {"jenkinsfile_content": {"type": "string", "description": "The content of the Jenkinsfile as a string."}}, "required": ["jenkinsfile_content"], "additionalProperties": false}}], "mock_functions": "def validate_jenkinsfile_syntax(jenkinsfile_content: str) -> bool:\n    \"\"\"\n    Validates the syntax of a Jenkinsfile.\n    \n    :param jenkinsfile_content: The content of the Jenkinsfile as a string.\n    :return: True if the syntax is valid, False otherwise.\n    \"\"\"\n    # Mock logic: Assume syntax is valid if \"pipeline\" keyword is present.\n    if \"pipeline\" in jenkinsfile_content:\n        return True\n    return False\ndef suggest_best_practices(branch: str) -> list:\n    \"\"\"\n    Suggests best practices for the given branch in a CI/CD pipeline.\n    \n    :param branch: The name of the branch (e.g., \"main\").\n    :return: A list of best practice strings.\n    \"\"\"\n    # Mock logic: Suggest specific practices for the main branch.\n    if branch == \"main\":\n        return [\n            \"Ensure all commits are thoroughly reviewed.\",\n            \"Automate testing for every commit.\",\n            \"Use environment-specific configurations for staging and production.\"\n        ]\n    return []\ndef troubleshoot_jenkinsfile_issues(jenkinsfile_content: str) -> dict:\n    \"\"\"\n    Identifies and suggests fixes for common issues in a Jenkinsfile.\n    \n    :param jenkinsfile_content: The content of the Jenkinsfile as a string.\n    :return: A dictionary with issues and their suggested fixes.\n        dict: A dictionary with the following keys:\n            - issues (list[str]): The list of identified issues.\n            - fixes (list[str]): The list of suggested fixes.\n    \"\"\"\n    # Mock logic: Identify issues based on missing keywords.\n    issues = []\n    fixes = []\n    \n    if \"pipeline\" not in jenkinsfile_content:\n        issues.append(\"Missing 'pipeline' keyword.\")\n        fixes.append(\"Add 'pipeline' keyword at the beginning of the file.\")\n    \n    if \"stages\" not in jenkinsfile_content:\n        issues.append(\"Missing 'stages' section.\")\n        fixes.append(\"Define a 'stages' section in the Jenkinsfile.\")\n    \n    if \"agent any\" not in jenkinsfile_content:\n        issues.append(\"Missing 'agent any' declaration.\")\n        fixes.append(\"Declare 'agent any' or specify an appropriate agent.\")\n    \n    return {\n        \"issues\": issues,\n        \"fixes\": fixes\n    }", "user_query": "This is Alex from CodeCrafters. I'm working on the CI/CD pipeline for Project Echo. Could you validate the Jenkinsfile syntax, identify any potential issues, and suggest best practices for the main branch? Here's the Jenkinsfile content: \npipeline {\n    agent any\n    stages {\n        stage('Build') {\n            steps {\n                sh 'mvn clean package'\n            }\n        }\n        stage('Test') {\n            steps {\n                sh 'mvn test'\n            }\n        }\n    }\n}", "checklist": {"functions": ["validate_jenkinsfile_syntax", "suggest_best_practices", "troubleshoot_jenkinsfile_issues"], "values": [true, ["Ensure all commits are thoroughly reviewed.", "Automate testing for every commit.", "Use environment-specific configurations for staging and production."], {"issues": [], "fixes": []}]}}
{"difficulty": "hard", "function_schema_python": "def recommend_scaling_configuration(service_name: str, current_performance: dict) -> dict:\n    \"\"\"Recommends an optimal scaling configuration for a given service based on its performance metrics.\n\n    :param service_name: The name of the service (e.g., \"UserAuth\").\n    :param current_performance: A dictionary containing the current performance metrics of the service.\n        Expected keys include:\n            - cpu_usage (float): CPU usage percentage.\n            - memory_usage (float): Memory usage percentage.\n            - instance_count (int): The current number of instances.\n            - requests_per_second (float): Requests per second on average.\n    :return: A dictionary with the recommended scaling configuration. \n        Keys include:\n            - recommended_instance_count (int): The recommended number of instances.\n            - scaling_reason (str): The reason for the recommended scaling.\n    :raises ValueError: If service_name or current_performance is invalid or missing necessary metrics.\"\"\"\n    pass\ndef create_scaling_config_file(service_name: str, config: dict) -> bool:\n    \"\"\"Creates a scaling configuration file for a specified service.\n\n    :param service_name: The name of the service (e.g., \"UserAuth\").\n    :param config: A dictionary containing the scaling configuration details.\n        Expected keys:\n            - recommended_instance_count (int): The recommended number of instances.\n            - scaling_reason (str): The reason for the recommended scaling.\n    :return: True if the file was successfully created, False otherwise.\n    :raises ValueError: If service_name or config is invalid or missing necessary configuration details.\"\"\"\n    pass\ndef execute_scaling_with_deploybot(service_name: str, config_file_path: str) -> dict:\n    \"\"\"Executes the scaling process for a specified service using DeployBot.\n\n    :param service_name: The name of the service (e.g., \"UserAuth\").\n    :param config_file_path: The path to the scaling configuration file.\n    :return:\n        dict: A dictionary with the following keys:\n            - execution_status (str): The status of the execution (e.g., \"success\").\n            - details (str): Additional details about the execution.\n    :raises ValueError: If service_name or config_file_path is invalid or empty.\"\"\"\n    pass\n", "function_schema_json": [{"name": "recommend_scaling_configuration", "description": "Recommends an optimal scaling configuration for a given service based on its performance metrics.", "parameters": {"type": "object", "properties": {"service_name": {"type": "string", "description": "The name of the service (e.g., \"UserAuth\")."}, "current_performance": {"type": "object", "description": "A dictionary containing the current performance metrics of the service."}}, "required": ["service_name", "current_performance"], "additionalProperties": false}}, {"name": "create_scaling_config_file", "description": "Creates a scaling configuration file for a specified service.", "parameters": {"type": "object", "properties": {"service_name": {"type": "string", "description": "The name of the service (e.g., \"UserAuth\")."}, "config": {"type": "object", "description": "A dictionary containing the scaling configuration details."}}, "required": ["service_name", "config"], "additionalProperties": false}}, {"name": "execute_scaling_with_deploybot", "description": "Executes the scaling process for a specified service using DeployBot.", "parameters": {"type": "object", "properties": {"service_name": {"type": "string", "description": "The name of the service (e.g., \"UserAuth\")."}, "config_file_path": {"type": "string", "description": "The path to the scaling configuration file."}}, "required": ["service_name", "config_file_path"], "additionalProperties": false}}], "mock_functions": "def recommend_scaling_configuration(service_name: str, current_performance: dict) -> dict:\n    \"\"\"\n    Recommends an optimal scaling configuration for a given service based on its performance metrics.\n    \n    :param service_name: The name of the service (e.g., \"UserAuth\").\n    :param current_performance: A dictionary containing the current performance metrics of the service.\n        Expected keys include:\n            - cpu_usage (float): CPU usage percentage.\n            - memory_usage (float): Memory usage percentage.\n            - instance_count (int): The current number of instances.\n            - requests_per_second (float): Requests per second on average.\n    :return: A dictionary with the recommended scaling configuration. \n        Keys include:\n            - recommended_instance_count (int): The recommended number of instances.\n            - scaling_reason (str): The reason for the recommended scaling.\n    :raises ValueError: If service_name or current_performance is invalid or missing necessary metrics.\n    \"\"\"\n    if not service_name or not current_performance or not all(key in current_performance for key in ['cpu_usage', 'memory_usage', 'instance_count', 'requests_per_second']):\n        raise ValueError(\"Service name and sufficient performance metrics must be provided.\")\n    \n    if service_name.lower() != \"userauth\":\n        raise ValueError(\"Service name mismatch. Only 'UserAuth' is supported.\")\n    \n    cpu_usage = current_performance['cpu_usage']\n    memory_usage = current_performance['memory_usage']\n    requests_per_second = current_performance['requests_per_second']\n    instance_count = current_performance['instance_count']\n    \n    if cpu_usage > 80.0 or memory_usage > 80.0 or requests_per_second > 500.0:\n        return {\n            \"recommended_instance_count\": instance_count + 2,\n            \"scaling_reason\": \"High CPU/memory usage or requests per second detected.\"\n        }\n    elif cpu_usage > 50.0 or memory_usage > 50.0:\n        return {\n            \"recommended_instance_count\": instance_count + 1,\n            \"scaling_reason\": \"Moderate CPU/memory usage or requests per second detected.\"\n        }\n    else:\n        return {\n            \"recommended_instance_count\": instance_count,\n            \"scaling_reason\": \"No scaling necessary. Current usage is within optimal limits.\"\n        }\ndef create_scaling_config_file(service_name: str, config: dict) -> bool:\n    \"\"\"\n    Creates a scaling configuration file for a specified service.\n    \n    :param service_name: The name of the service (e.g., \"UserAuth\").\n    :param config: A dictionary containing the scaling configuration details.\n        Expected keys:\n            - recommended_instance_count (int): The recommended number of instances.\n            - scaling_reason (str): The reason for the recommended scaling.\n    :return: True if the file was successfully created, False otherwise.\n    :raises ValueError: If service_name or config is invalid or missing necessary configuration details.\n    \"\"\"\n    if not service_name or service_name.lower() != \"userauth\" or not config or not all(key in config for key in ['recommended_instance_count', 'scaling_reason']):\n        raise ValueError(\"Service name and configuration details must be provided.\")\n    \n    # Mock logic: Simulate file creation for the \"UserAuth\" service.\n    print(f\"Scaling config file created for {service_name}:\")\n    print(f\"Recommended Instance Count: {config['recommended_instance_count']}\")\n    print(f\"Scaling Reason: {config['scaling_reason']}\")\n    return True\ndef execute_scaling_with_deploybot(service_name: str, config_file_path: str) -> dict:\n    \"\"\"\n    Executes the scaling process for a specified service using DeployBot.\n    \n    :param service_name: The name of the service (e.g., \"UserAuth\").\n    :param config_file_path: The path to the scaling configuration file.\n    :return:\n        dict: A dictionary with the following keys:\n            - execution_status (str): The status of the execution (e.g., \"success\").\n            - details (str): Additional details about the execution.\n    :raises ValueError: If service_name or config_file_path is invalid or empty.\n    \"\"\"\n    if not service_name or service_name.lower() != \"userauth\" or not config_file_path:\n        raise ValueError(\"Service name and configuration file path must be provided.\")\n    \n    # Mock logic: Simulate scaling execution and return a status.\n    return {\n        \"execution_status\": \"success\",\n        \"details\": \"UserAuth service scaled up successfully based on the provided configuration.\"\n    }", "user_query": "This is David from Cloudify. For the UserAuth service, recommend a scaling configuration (current performance: cpu_usage=90, memory_usage=75, instance_count=2, requests_per_second=600), create the config file, and then execute the scaling using DeployBot.", "checklist": {"functions": ["recommend_scaling_configuration", "create_scaling_config_file", "execute_scaling_with_deploybot"], "values": [{"recommended_instance_count": 4, "scaling_reason": "High CPU/memory usage or requests per second detected."}, true, {"execution_status": "success", "details": "UserAuth service scaled up successfully based on the provided configuration."}]}}
{"difficulty": "hard", "function_schema_python": "def analyze_webpack_config(project_path: str) -> dict:\n    \"\"\"Analyzes the webpack configuration file for performance bottlenecks.\n\n    :param project_path: Path to the project directory containing webpack.config.js\n    :return: Dictionary containing analysis results with the following keys:\n        - build_time (float): Current build time in minutes\n        - bundle_size (float): Current bundle size in MB\n        - num_modules (int): Number of modules\n        - bottlenecks (list): List of identified performance issues\n    :raises FileNotFoundError: If webpack.config.js is not found\"\"\"\n    pass\ndef get_optimization_recommendations(analysis_data: dict) -> dict:\n    \"\"\"Generates optimization recommendations based on analysis data.\n\n    :param analysis_data: Dictionary containing webpack analysis results\n    :return: Dictionary containing recommendations with the following keys:\n        - priority_actions (list): Ordered list of high-priority optimizations\n        - estimated_impact (dict): Expected improvements for each action\n        - config_changes (list): Suggested webpack config modifications\"\"\"\n    pass\ndef validate_build_target(current_size: float, target_size: float) -> bool:\n    \"\"\"Validates if the current build size meets the target requirements.\n\n    :param current_size: Current build size in MB\n    :param target_size: Target build size in MB\n    :return: Boolean indicating if build meets target size\"\"\"\n    pass\n", "function_schema_json": [{"name": "analyze_webpack_config", "description": "Analyzes the webpack configuration file for performance bottlenecks.", "parameters": {"type": "object", "properties": {"project_path": {"type": "string", "description": "Path to the project directory containing webpack.config.js"}}, "required": ["project_path"], "additionalProperties": false}}, {"name": "get_optimization_recommendations", "description": "Generates optimization recommendations based on analysis data.", "parameters": {"type": "object", "properties": {"analysis_data": {"type": "object", "description": "Dictionary containing webpack analysis results"}}, "required": ["analysis_data"], "additionalProperties": false}}, {"name": "validate_build_target", "description": "Validates if the current build size meets the target requirements.", "parameters": {"type": "object", "properties": {"current_size": {"type": "number", "description": "Current build size in MB"}, "target_size": {"type": "number", "description": "Target build size in MB"}}, "required": ["current_size", "target_size"], "additionalProperties": false}}], "mock_functions": "def analyze_webpack_config(project_path: str) -> dict:\n    \"\"\"\n    Analyzes the webpack configuration file for performance bottlenecks.\n    \n    :param project_path: Path to the project directory containing webpack.config.js\n    :return: Dictionary containing analysis results with the following keys:\n        - build_time (float): Current build time in minutes\n        - bundle_size (float): Current bundle size in MB\n        - num_modules (int): Number of modules\n        - bottlenecks (list): List of identified performance issues\n    :raises FileNotFoundError: If webpack.config.js is not found\n    \"\"\"\n    if not project_path or 'acme-ecommerce-v2' not in project_path:\n        raise FileNotFoundError(\"Invalid project path or webpack.config.js not found\")\n    \n    return {\n        \"build_time\": 5.2,\n        \"bundle_size\": 3.8,\n        \"num_modules\": 150,\n        \"bottlenecks\": [\n            \"Large image assets\",\n            \"Unused module exports\",\n            \"No code splitting configured\"\n        ]\n    }\ndef get_optimization_recommendations(analysis_data: dict) -> dict:\n    \"\"\"\n    Generates optimization recommendations based on analysis data.\n    \n    :param analysis_data: Dictionary containing webpack analysis results\n    :return: Dictionary containing recommendations with the following keys:\n        - priority_actions (list): Ordered list of high-priority optimizations\n        - estimated_impact (dict): Expected improvements for each action\n        - config_changes (list): Suggested webpack config modifications\n    \"\"\"\n    if not isinstance(analysis_data, dict) or 'build_time' not in analysis_data:\n        raise ValueError(\"Invalid analysis data provided\")\n    \n    return {\n        \"priority_actions\": [\n            \"Implement code splitting\",\n            \"Configure image optimization\",\n            \"Enable tree shaking\",\n            \"Consider switching to Vite\"\n        ],\n        \"estimated_impact\": {\n            \"build_time_reduction\": \"60%\",\n            \"bundle_size_reduction\": \"45%\"\n        },\n        \"config_changes\": [\n            \"Add splitChunks configuration\",\n            \"Implement image-webpack-loader\",\n            \"Enable production mode optimizations\"\n        ]\n    }\ndef validate_build_target(current_size: float, target_size: float) -> bool:\n    \"\"\"\n    Validates if the current build size meets the target requirements.\n    \n    :param current_size: Current build size in MB\n    :param target_size: Target build size in MB\n    :return: Boolean indicating if build meets target size\n    \"\"\"\n    if current_size <= 0 or target_size <= 0:\n        raise ValueError(\"Build sizes must be positive numbers\")\n    \n    return current_size <= target_size", "user_query": "This is Sarah from Acme Corp. Analyze the Webpack config for acme-ecommerce-v2, generate optimization recommendations, and provide priority actions to reduce my current 5.2-minute build time and 3.8MB bundle size.", "checklist": {"functions": ["analyze_webpack_config", "get_optimization_recommendations", "validate_build_target"], "values": [{"build_time": 5.2, "bundle_size": 3.8, "num_modules": 150, "bottlenecks": ["Large image assets", "Unused module exports", "No code splitting configured"]}, {"priority_actions": ["Implement code splitting", "Configure image optimization", "Enable tree shaking", "Consider switching to Vite"], "estimated_impact": {"build_time_reduction": "60%", "bundle_size_reduction": "45%"}, "config_changes": ["Add splitChunks configuration", "Implement image-webpack-loader", "Enable production mode optimizations"]}, false]}}
{"difficulty": "hard", "function_schema_python": "def analyze_project_files(project_name: str, file_type: str) -> dict:\n    \"\"\"Analyzes project files for potential issues.\n\n    :param project_name: Name of the project to analyze\n    :param file_type: Optional filter for specific file types (e.g., 'css', 'js')\n    :return: Dictionary containing analysis results with following keys:\n        - files_analyzed (list[str]): List of analyzed files\n        - issues_found (list[dict]): List of issues with 'file', 'line', 'description'\n        - total_files (int): Total number of files analyzed\n    :raises ValueError: If project name is invalid or empty\"\"\"\n    pass\ndef check_parcel_config(project_name: str) -> dict:\n    \"\"\"Examines Parcel configuration in package.json for the specified project.\n\n    :param project_name: Name of the project to analyze\n    :return: Dictionary containing configuration details with following keys:\n        - valid_config (bool): Whether the configuration is valid\n        - css_modules (bool): Whether CSS modules are enabled\n        - bundle_strategy (str): Current bundling strategy\n        - recommendations (list[str]): List of recommended changes\n    :raises ValueError: If project name is invalid\"\"\"\n    pass\ndef debug_css_conflicts(project_name: str) -> dict:\n    \"\"\"Identifies and analyzes CSS conflicts in the project.\n\n    :param project_name: Name of the project to analyze\n    :return: Dictionary containing conflict analysis with following keys:\n        - conflicts (list[dict]): List of conflicts with 'file1', 'file2', 'selector'\n        - severity (str): Severity level of conflicts\n        - solution (str): Recommended solution\n    :raises ValueError: If project name is invalid\"\"\"\n    pass\n", "function_schema_json": [{"name": "analyze_project_files", "description": "Analyzes project files for potential issues.", "parameters": {"type": "object", "properties": {"project_name": {"type": "string", "description": "Name of the project to analyze"}, "file_type": {"type": "string", "description": "Optional filter for specific file types (e.g., 'css', 'js')"}}, "required": ["project_name", "file_type"], "additionalProperties": false}}, {"name": "check_parcel_config", "description": "Examines Parcel configuration in package.json for the specified project.", "parameters": {"type": "object", "properties": {"project_name": {"type": "string", "description": "Name of the project to analyze"}}, "required": ["project_name"], "additionalProperties": false}}, {"name": "debug_css_conflicts", "description": "Identifies and analyzes CSS conflicts in the project.", "parameters": {"type": "object", "properties": {"project_name": {"type": "string", "description": "Name of the project to analyze"}}, "required": ["project_name"], "additionalProperties": false}}], "mock_functions": "def analyze_project_files(project_name: str, file_type: str = None) -> dict:\n    \"\"\"\n    Analyzes project files for potential issues.\n    \n    :param project_name: Name of the project to analyze\n    :param file_type: Optional filter for specific file types (e.g., 'css', 'js')\n    :return: Dictionary containing analysis results with following keys:\n        - files_analyzed (list[str]): List of analyzed files\n        - issues_found (list[dict]): List of issues with 'file', 'line', 'description'\n        - total_files (int): Total number of files analyzed\n    :raises ValueError: If project name is invalid or empty\n    \"\"\"\n    if not project_name:\n        raise ValueError(\"Project name must not be empty\")\n    \n    if project_name == \"beta-design-system\" and file_type == \"css\":\n        return {\n            \"files_analyzed\": [\"src/styles/main.scss\", \"src/components/Button/style.scss\"],\n            \"issues_found\": [\n                {\n                    \"file\": \"src/components/Button/style.scss\",\n                    \"line\": 15,\n                    \"description\": \"Conflicting CSS class '.btn-primary' with main.scss\"\n                }\n            ],\n            \"total_files\": 2\n        }\n    return {\"files_analyzed\": [], \"issues_found\": [], \"total_files\": 0}\ndef check_parcel_config(project_name: str) -> dict:\n    \"\"\"\n    Examines Parcel configuration in package.json for the specified project.\n    \n    :param project_name: Name of the project to analyze\n    :return: Dictionary containing configuration details with following keys:\n        - valid_config (bool): Whether the configuration is valid\n        - css_modules (bool): Whether CSS modules are enabled\n        - bundle_strategy (str): Current bundling strategy\n        - recommendations (list[str]): List of recommended changes\n    :raises ValueError: If project name is invalid\n    \"\"\"\n    if not project_name:\n        raise ValueError(\"Project name must not be empty\")\n    \n    if project_name == \"beta-design-system\":\n        return {\n            \"valid_config\": True,\n            \"css_modules\": False,\n            \"bundle_strategy\": \"default\",\n            \"recommendations\": [\n                \"Enable CSS modules in package.json\",\n                \"Add .postcssrc configuration\"\n            ]\n        }\n    return {}\ndef debug_css_conflicts(project_name: str) -> dict:\n    \"\"\"\n    Identifies and analyzes CSS conflicts in the project.\n    \n    :param project_name: Name of the project to analyze\n    :return: Dictionary containing conflict analysis with following keys:\n        - conflicts (list[dict]): List of conflicts with 'file1', 'file2', 'selector'\n        - severity (str): Severity level of conflicts\n        - solution (str): Recommended solution\n    :raises ValueError: If project name is invalid\n    \"\"\"\n    if not project_name:\n        raise ValueError(\"Project name must not be empty\")\n    \n    if project_name == \"beta-design-system\":\n        return {\n            \"conflicts\": [\n                {\n                    \"file1\": \"src/styles/main.scss\",\n                    \"file2\": \"src/components/Button/style.scss\",\n                    \"selector\": \".btn-primary\"\n                }\n            ],\n            \"severity\": \"high\",\n            \"solution\": \"Convert component styles to CSS modules and use local scope\"\n        }\n    return {}", "user_query": "Check Parcel config for `beta-design-system` and suggest solutions for CSS issues.", "checklist": {"functions": ["analyze_project_files", "check_parcel_config", "debug_css_conflicts"], "values": [{"files_analyzed": ["src/styles/main.scss", "src/components/Button/style.scss"], "issues_found": [{"file": "src/components/Button/style.scss", "line": 15, "description": "Conflicting CSS class '.btn-primary' with main.scss"}], "total_files": 2}, {"valid_config": true, "css_modules": false, "bundle_strategy": "default", "recommendations": ["Enable CSS modules in package.json", "Add .postcssrc configuration"]}, {"conflicts": [{"file1": "src/styles/main.scss", "file2": "src/components/Button/style.scss", "selector": ".btn-primary"}], "severity": "high", "solution": "Convert component styles to CSS modules and use local scope"}]}}
{"difficulty": "hard", "function_schema_python": "def clone_github_repo(url: str, branch: str) -> bool:\n    \"\"\"Clones a GitHub repository from the given URL and checks out the specified branch.\n\n    :param url: The URL of the GitHub repository (e.g., \"github.com/johnDoe/ProjectX\").\n    :param branch: The branch to checkout (e.g., \"prod\").\n    :return: True if the repository was successfully cloned and branch checked out.\n    :raises ValueError: If the URL or branch is not valid.\"\"\"\n    pass\ndef build_docker_image(repo_path: str) -> str:\n    \"\"\"Builds a Docker image from a Dockerfile located in the specified repository path.\n\n    :param repo_path: The path to the repository containing the Dockerfile.\n    :return: The Docker image ID if the build is successful.\n    :raises RuntimeError: If the build fails.\"\"\"\n    pass\ndef push_docker_image_to_aws(image_id: str, ecr_url: str) -> bool:\n    \"\"\"Pushes a Docker image to an AWS ECR repository.\n\n    :param image_id: The Docker image ID to push.\n    :param ecr_url: The URL of the AWS ECR repository.\n    :return: True if the image was successfully pushed.\n    :raises ValueError: If the image ID or ECR URL is not valid.\"\"\"\n    pass\ndef create_or_update_aws_elastic_beanstalk_application(app_name: str, env_name: str, region: str, ecr_image_url: str) -> dict:\n    \"\"\"Creates or updates an AWS Elastic Beanstalk application with the specified parameters.\n\n    :param app_name: The name of the application (e.g., \"ProjectX\").\n    :param env_name: The name of the environment (e.g., \"projectx-env\").\n    :param region: The AWS region (e.g., \"us-west-2\").\n    :param ecr_image_url: The URL of the Docker image in ECR.\n    :return:\n        dict: A dictionary with the following keys:\n            - application_name (str): The name of the application.\n            - environment_name (str): The name of the environment.\n            - region (str): The AWS region.\n            - status (str): The deployment status (e.g., \"success\").\n    :raises ValueError: If any parameter is not valid.\"\"\"\n    pass\ndef monitor_deployment_environment(env_name: str) -> list:\n    \"\"\"Monitors the deployment environment for real-time updates and logs.\n\n    :param env_name: The name of the environment (e.g., \"projectx-env\").\n    :return: A list of logs or updates.\n    :raises ValueError: If the environment name is not valid.\"\"\"\n    pass\n", "function_schema_json": [{"name": "clone_github_repo", "description": "Clones a GitHub repository from the given URL and checks out the specified branch.", "parameters": {"type": "object", "properties": {"url": {"type": "string", "description": "The URL of the GitHub repository (e.g., \"github.com/johnDoe/ProjectX\")."}, "branch": {"type": "string", "description": "The branch to checkout (e.g., \"prod\")."}}, "required": ["url", "branch"], "additionalProperties": false}}, {"name": "build_docker_image", "description": "Builds a Docker image from a Dockerfile located in the specified repository path.", "parameters": {"type": "object", "properties": {"repo_path": {"type": "string", "description": "The path to the repository containing the Dockerfile."}}, "required": ["repo_path"], "additionalProperties": false}}, {"name": "push_docker_image_to_aws", "description": "Pushes a Docker image to an AWS ECR repository.", "parameters": {"type": "object", "properties": {"image_id": {"type": "string", "description": "The Docker image ID to push."}, "ecr_url": {"type": "string", "description": "The URL of the AWS ECR repository."}}, "required": ["image_id", "ecr_url"], "additionalProperties": false}}, {"name": "create_or_update_aws_elastic_beanstalk_application", "description": "Creates or updates an AWS Elastic Beanstalk application with the specified parameters.", "parameters": {"type": "object", "properties": {"app_name": {"type": "string", "description": "The name of the application (e.g., \"ProjectX\")."}, "env_name": {"type": "string", "description": "The name of the environment (e.g., \"projectx-env\")."}, "region": {"type": "string", "description": "The AWS region (e.g., \"us-west-2\")."}, "ecr_image_url": {"type": "string", "description": "The URL of the Docker image in ECR."}}, "required": ["app_name", "env_name", "region", "ecr_image_url"], "additionalProperties": false}}, {"name": "monitor_deployment_environment", "description": "Monitors the deployment environment for real-time updates and logs.", "parameters": {"type": "object", "properties": {"env_name": {"type": "string", "description": "The name of the environment (e.g., \"projectx-env\")."}}, "required": ["env_name"], "additionalProperties": false}}], "mock_functions": "def clone_github_repo(url: str, branch: str) -> bool:\n    \"\"\"\n    Clones a GitHub repository from the given URL and checks out the specified branch.\n    \n    :param url: The URL of the GitHub repository (e.g., \"github.com/johnDoe/ProjectX\").\n    :param branch: The branch to checkout (e.g., \"prod\").\n    :return: True if the repository was successfully cloned and branch checked out.\n    :raises ValueError: If the URL or branch is not valid.\n    \"\"\"\n    if not url or not branch:\n        raise ValueError(\"URL and branch must be provided.\")\n    if url == \"github.com/johnDoe/ProjectX\" and branch == \"prod\":\n        return True\n    return False\ndef build_docker_image(repo_path: str) -> str:\n    \"\"\"\n    Builds a Docker image from a Dockerfile located in the specified repository path.\n    \n    :param repo_path: The path to the repository containing the Dockerfile.\n    :return: The Docker image ID if the build is successful.\n    :raises RuntimeError: If the build fails.\n    \"\"\"\n    if not repo_path:\n        raise RuntimeError(\"Repository path must be provided.\")\n    return \"sha256:abcdef1234567890abcdef1234567890abcdef1234567890abcdef1234567890\"\ndef push_docker_image_to_aws(image_id: str, ecr_url: str) -> bool:\n    \"\"\"\n    Pushes a Docker image to an AWS ECR repository.\n    \n    :param image_id: The Docker image ID to push.\n    :param ecr_url: The URL of the AWS ECR repository.\n    :return: True if the image was successfully pushed.\n    :raises ValueError: If the image ID or ECR URL is not valid.\n    \"\"\"\n    if not image_id or not ecr_url:\n        raise ValueError(\"Image ID and ECR URL must be provided.\")\n    return True\ndef create_or_update_aws_elastic_beanstalk_application(app_name: str, env_name: str, region: str, ecr_image_url: str) -> dict:\n    \"\"\"\n    Creates or updates an AWS Elastic Beanstalk application with the specified parameters.\n    \n    :param app_name: The name of the application (e.g., \"ProjectX\").\n    :param env_name: The name of the environment (e.g., \"projectx-env\").\n    :param region: The AWS region (e.g., \"us-west-2\").\n    :param ecr_image_url: The URL of the Docker image in ECR.\n    :return:\n        dict: A dictionary with the following keys:\n            - application_name (str): The name of the application.\n            - environment_name (str): The name of the environment.\n            - region (str): The AWS region.\n            - status (str): The deployment status (e.g., \"success\").\n    :raises ValueError: If any parameter is not valid.\n    \"\"\"\n    if not app_name or not env_name or not region or not ecr_image_url:\n        raise ValueError(\"All parameters must be provided and valid.\")\n    return {\n        \"application_name\": app_name,\n        \"environment_name\": env_name,\n        \"region\": region,\n        \"status\": \"success\"\n    }\ndef monitor_deployment_environment(env_name: str) -> list:\n    \"\"\"\n    Monitors the deployment environment for real-time updates and logs.\n    \n    :param env_name: The name of the environment (e.g., \"projectx-env\").\n    :return: A list of logs or updates.\n    :raises ValueError: If the environment name is not valid.\n    \"\"\"\n    if not env_name:\n        raise ValueError(\"Environment name must be provided.\")\n    return [\n        \"Environment setup initiated.\",\n        \"Docker image successfully pulled.\",\n        \"Application deployment in progress.\",\n        \"Deployment completed successfully.\"\n    ]", "user_query": "This is John from Innovate Inc. Please clone github.com/johnDoe/ProjectX with prod branch, build the Docker image, push it to ecr.aws.com/projectx, deploy to Elastic Beanstalk environment projectx-env in us-west-2 region, and monitor the deployment.", "checklist": {"functions": ["clone_github_repo", "build_docker_image", "push_docker_image_to_aws", "create_or_update_aws_elastic_beanstalk_application", "monitor_deployment_environment"], "values": [true, "sha256:abcdef1234567890abcdef1234567890abcdef1234567890abcdef1234567890", true, {"application_name": "ProjectX", "environment_name": "projectx-env", "region": "us-west-2", "status": "success"}, ["Environment setup initiated.", "Docker image successfully pulled.", "Application deployment in progress.", "Deployment completed successfully."]]}}
{"difficulty": "hard", "function_schema_python": "def authenticate_gcp(credentials_file: str) -> bool:\n    \"\"\"Authenticates with Google Cloud Platform using service account credentials.\n\n    :param credentials_file: Path to the GCP credentials JSON file.\n    :return: True if authentication successful, False otherwise.\n    :raises FileNotFoundError: If credentials file doesn't exist.\"\"\"\n    pass\ndef fetch_repository(repo_url: str, tag: str) -> dict:\n    \"\"\"Fetches a specific version of code from a repository.\n\n    :param repo_url: URL of the repository.\n    :param tag: Version tag to fetch.\n    :return: \n        dict: Repository information with keys:\n            - code_path (str): Local path to the fetched code\n            - version (str): Fetched version\n            - status (str): Status of the fetch operation\n    :raises ValueError: If repository URL or tag is invalid.\"\"\"\n    pass\ndef deploy_to_gae(project_id: str, app_path: str) -> dict:\n    \"\"\"Deploys an application to Google App Engine.\n\n    :param project_id: Google Cloud project ID.\n    :param app_path: Path to the application code.\n    :return: \n        dict: Deployment information with keys:\n            - status (str): Deployment status\n            - url (str): Deployed application URL\n            - version (str): Deployed version\n    :raises RuntimeError: If deployment fails.\"\"\"\n    pass\n", "function_schema_json": [{"name": "authenticate_gcp", "description": "Authenticates with Google Cloud Platform using service account credentials.", "parameters": {"type": "object", "properties": {"credentials_file": {"type": "string", "description": "Path to the GCP credentials JSON file."}}, "required": ["credentials_file"], "additionalProperties": false}}, {"name": "fetch_repository", "description": "Fetches a specific version of code from a repository.", "parameters": {"type": "object", "properties": {"repo_url": {"type": "string", "description": "URL of the repository."}, "tag": {"type": "string", "description": "Version tag to fetch."}}, "required": ["repo_url", "tag"], "additionalProperties": false}}, {"name": "deploy_to_gae", "description": "Deploys an application to Google App Engine.", "parameters": {"type": "object", "properties": {"project_id": {"type": "string", "description": "Google Cloud project ID."}, "app_path": {"type": "string", "description": "Path to the application code."}}, "required": ["project_id", "app_path"], "additionalProperties": false}}], "mock_functions": "def authenticate_gcp(credentials_file: str) -> bool:\n    \"\"\"\n    Authenticates with Google Cloud Platform using service account credentials.\n    \n    :param credentials_file: Path to the GCP credentials JSON file.\n    :return: True if authentication successful, False otherwise.\n    :raises FileNotFoundError: If credentials file doesn't exist.\n    \"\"\"\n    if not credentials_file.endswith('.json'):\n        raise ValueError(\"Credentials file must be a JSON file\")\n    if credentials_file == 'gcp_creds.json':\n        return True\n    return False\ndef fetch_repository(repo_url: str, tag: str) -> dict:\n    \"\"\"\n    Fetches a specific version of code from a repository.\n    \n    :param repo_url: URL of the repository.\n    :param tag: Version tag to fetch.\n    :return: \n        dict: Repository information with keys:\n            - code_path (str): Local path to the fetched code\n            - version (str): Fetched version\n            - status (str): Status of the fetch operation\n    :raises ValueError: If repository URL or tag is invalid.\n    \"\"\"\n    if not repo_url or not tag:\n        raise ValueError(\"Repository URL and tag must be provided\")\n    if (repo_url == 'bitbucket.org/sarahdev/coffeeconnect' and \n        tag == 'v1.2'):\n        return {\n            \"code_path\": \"/tmp/coffeeconnect\",\n            \"version\": \"v1.2\",\n            \"status\": \"success\"\n        }\n    return {\"status\": \"failed\"}\ndef deploy_to_gae(project_id: str, app_path: str) -> dict:\n    \"\"\"\n    Deploys an application to Google App Engine.\n    \n    :param project_id: Google Cloud project ID.\n    :param app_path: Path to the application code.\n    :return: \n        dict: Deployment information with keys:\n            - status (str): Deployment status\n            - url (str): Deployed application URL\n            - version (str): Deployed version\n    :raises RuntimeError: If deployment fails.\n    \"\"\"\n    if not project_id.endswith('-12345'):\n        raise ValueError(\"Invalid project ID format\")\n    if (project_id == 'coffeeconnect-12345' and \n        app_path == '/tmp/coffeeconnect'):\n        return {\n            \"status\": \"success\",\n            \"url\": \"https://coffeeconnect-12345.appspot.com\",\n            \"version\": \"v1.2\"\n        }\n    return {\"status\": \"failed\"}", "user_query": "This is Sarah. Deploy CoffeeConnect v1.2 from bitbucket.org/sarahdev/coffeeconnect to my Google App Engine project coffeeconnect-12345. Authenticate with gcp_creds.json. Let me know the URL after deployment.", "checklist": {"functions": ["authenticate_gcp", "fetch_repository", "deploy_to_gae"], "values": [true, {"code_path": "/tmp/coffeeconnect", "version": "v1.2", "status": "success"}, {"status": "success", "url": "https://coffeeconnect-12345.appspot.com", "version": "v1.2"}]}}
{"difficulty": "hard", "function_schema_python": "def get_active_products(catalog_id: str) -> list:\n    \"\"\"Retrieves the list of active products in a given catalog.\n\n    :param catalog_id: The ID of the catalog to retrieve products from.\n    :return: A list of product IDs.\n    :raises ValueError: If catalog_id is empty.\"\"\"\n    pass\ndef remove_discontinued_products(product_list: list) -> list:\n    \"\"\"Removes discontinued products from the given list.\n\n    :param product_list: List of product IDs to be filtered.\n    :return: A list of active product IDs after filtering discontinued ones.\n    :raises ValueError: If product_list is empty or not a list.\"\"\"\n    pass\ndef update_product_images(product_id: str, image_urls: list) -> dict:\n    \"\"\"Updates the product images with the provided URLs.\n\n    :param product_id: The ID of the product to update.\n    :param image_urls: List of image URLs to update the product with.\n    :return: A dictionary containing the status of the image upload.\n        dict: A dictionary with the following keys:\n            - success (bool): True if images were successfully uploaded, False otherwise.\n            - message (str): Status message.\n    :raises ValueError: If product_id is empty or image_urls is not a list.\"\"\"\n    pass\ndef update_product_sizes(product_id: str, size_range: list) -> dict:\n    \"\"\"Updates the size range for a given product.\n\n    :param product_id: The ID of the product to update.\n    :param size_range: List of strings indicating the size range (e.g., [\"XS\", \"S\", \"M\"]).\n    :return: A dictionary containing the status of the size update.\n        dict: A dictionary with the following keys:\n            - success (bool): True if size range was successfully updated, False otherwise.\n            - message (str): Status message.\n    :raises ValueError: If product_id is empty or size_range is not a list.\"\"\"\n    pass\ndef update_product_prices(product_id: str, new_price: float) -> dict:\n    \"\"\"Updates the price for a given product.\n\n    :param product_id: The ID of the product to update.\n    :param new_price: The new price to set for the product.\n    :return: A dictionary containing the status of the price update.\n        dict: A dictionary with the following keys:\n            - success (bool): True if the price was successfully updated, False otherwise.\n            - message (str): Status message.\n    :raises ValueError: If product_id is empty or new_price is not a number.\"\"\"\n    pass\ndef consolidate_product_lines(product_list: list) -> dict:\n    \"\"\"Consolidates similar products into product lines.\n\n    :param product_list: List of product IDs to be consolidated.\n    :return: A dictionary with consolidated product lines.\n        dict: A dictionary with the following keys:\n            - product_line_1 (list): List of product IDs in the first product line.\n            - product_line_2 (list): List of product IDs in the second product line.\n            - ... (and so on for additional product lines).\n    :raises ValueError: If product_list is empty or not a list.\"\"\"\n    pass\n", "function_schema_json": [{"name": "get_active_products", "description": "Retrieves the list of active products in a given catalog.", "parameters": {"type": "object", "properties": {"catalog_id": {"type": "string", "description": "The ID of the catalog to retrieve products from."}}, "required": ["catalog_id"], "additionalProperties": false}}, {"name": "remove_discontinued_products", "description": "Removes discontinued products from the given list.", "parameters": {"type": "object", "properties": {"product_list": {"type": "array", "description": "List of product IDs to be filtered."}}, "required": ["product_list"], "additionalProperties": false}}, {"name": "update_product_images", "description": "Updates the product images with the provided URLs.", "parameters": {"type": "object", "properties": {"product_id": {"type": "string", "description": "The ID of the product to update."}, "image_urls": {"type": "array", "description": "List of image URLs to update the product with."}}, "required": ["product_id", "image_urls"], "additionalProperties": false}}, {"name": "update_product_sizes", "description": "Updates the size range for a given product.", "parameters": {"type": "object", "properties": {"product_id": {"type": "string", "description": "The ID of the product to update."}, "size_range": {"type": "array", "description": "List of strings indicating the size range (e.g., [\"XS\", \"S\", \"M\"])."}}, "required": ["product_id", "size_range"], "additionalProperties": false}}, {"name": "update_product_prices", "description": "Updates the price for a given product.", "parameters": {"type": "object", "properties": {"product_id": {"type": "string", "description": "The ID of the product to update."}, "new_price": {"type": "number", "description": "The new price to set for the product."}}, "required": ["product_id", "new_price"], "additionalProperties": false}}, {"name": "consolidate_product_lines", "description": "Consolidates similar products into product lines.", "parameters": {"type": "object", "properties": {"product_list": {"type": "array", "description": "List of product IDs to be consolidated."}}, "required": ["product_list"], "additionalProperties": false}}], "mock_functions": "def get_active_products(catalog_id: str) -> list:\n    \"\"\"\n    Retrieves the list of active products in a given catalog.\n    \n    :param catalog_id: The ID of the catalog to retrieve products from.\n    :return: A list of product IDs.\n    :raises ValueError: If catalog_id is empty.\n    \"\"\"\n    if not catalog_id:\n        raise ValueError(\"Catalog ID must be provided.\")\n    if catalog_id.lower() == \"styleconnect\":\n        return [\"product001\", \"product002\", \"product003\"]\n    return []\ndef remove_discontinued_products(product_list: list) -> list:\n    \"\"\"\n    Removes discontinued products from the given list.\n    \n    :param product_list: List of product IDs to be filtered.\n    :return: A list of active product IDs after filtering discontinued ones.\n    :raises ValueError: If product_list is empty or not a list.\n    \"\"\"\n    if not product_list or not isinstance(product_list, list):\n        raise ValueError(\"Product list must be a non-empty list.\")\n    # Mock logic: Simulate some products being discontinued\n    approved_products = [product for product in product_list if product != \"product002\"]\n    return approved_products\ndef update_product_images(product_id: str, image_urls: list) -> dict:\n    \"\"\"\n    Updates the product images with the provided URLs.\n    \n    :param product_id: The ID of the product to update.\n    :param image_urls: List of image URLs to update the product with.\n    :return: A dictionary containing the status of the image upload.\n        dict: A dictionary with the following keys:\n            - success (bool): True if images were successfully uploaded, False otherwise.\n            - message (str): Status message.\n    :raises ValueError: If product_id is empty or image_urls is not a list.\n    \"\"\"\n    if not product_id or not isinstance(image_urls, list):\n        raise ValueError(\"Product ID must be provided and image URLs must be a list.\")\n    if product_id.lower() in [\"product001\", \"product003\"] and image_urls:\n        return {\n            \"success\": True,\n            \"message\": \"Images successfully uploaded.\"\n        }\n    return {\n        \"success\": False,\n        \"message\": \"Failed to upload images.\"\n    }\ndef update_product_sizes(product_id: str, size_range: list) -> dict:\n    \"\"\"\n    Updates the size range for a given product.\n    \n    :param product_id: The ID of the product to update.\n    :param size_range: List of strings indicating the size range (e.g., [\"XS\", \"S\", \"M\"]).\n    :return: A dictionary containing the status of the size update.\n        dict: A dictionary with the following keys:\n            - success (bool): True if size range was successfully updated, False otherwise.\n            - message (str): Status message.\n    :raises ValueError: If product_id is empty or size_range is not a list.\n    \"\"\"\n    if not product_id or not isinstance(size_range, list):\n        raise ValueError(\"Product ID must be provided and size range must be a list.\")\n    if product_id.lower() in [\"product001\", \"product003\"] and size_range:\n        return {\n            \"success\": True,\n            \"message\": \"Size range successfully updated.\"\n        }\n    return {\n        \"success\": False,\n        \"message\": \"Failed to update size range.\"\n    }\ndef update_product_prices(product_id: str, new_price: float) -> dict:\n    \"\"\"\n    Updates the price for a given product.\n    \n    :param product_id: The ID of the product to update.\n    :param new_price: The new price to set for the product.\n    :return: A dictionary containing the status of the price update.\n        dict: A dictionary with the following keys:\n            - success (bool): True if the price was successfully updated, False otherwise.\n            - message (str): Status message.\n    :raises ValueError: If product_id is empty or new_price is not a number.\n    \"\"\"\n    if not product_id or not isinstance(new_price, (int, float)):\n        raise ValueError(\"Product ID must be provided and new price must be a number.\")\n    if product_id.lower() in [\"product001\", \"product003\"] and new_price > 0:\n        return {\n            \"success\": True,\n            \"message\": \"Price successfully updated.\"\n        }\n    return {\n        \"success\": False,\n        \"message\": \"Failed to update price.\"\n    }\ndef consolidate_product_lines(product_list: list) -> dict:\n    \"\"\"\n    Consolidates similar products into product lines.\n    \n    :param product_list: List of product IDs to be consolidated.\n    :return: A dictionary with consolidated product lines.\n        dict: A dictionary with the following keys:\n            - product_line_1 (list): List of product IDs in the first product line.\n            - product_line_2 (list): List of product IDs in the second product line.\n            - ... (and so on for additional product lines).\n    :raises ValueError: If product_list is empty or not a list.\n    \"\"\"\n    if not product_list or not isinstance(product_list, list):\n        raise ValueError(\"Product list must be a non-empty list.\")\n    # Mock logic: Assume some form of consolidation\n    return {\n        \"product_line_1\": [\"product001\", \"product002\"],\n        \"product_line_2\": [\"product003\"]\n    }", "user_query": "This is Jack Chen. First get all active products from \"StyleConnect\" catalog, remove discontinued items, then consolidate the remaining products into product lines, and update their sizes to [\"XS\", \"S\", \"M\", \"L\", \"XL\"] for all spring collection items.", "checklist": {"functions": ["get_active_products", "remove_discontinued_products", "consolidate_product_lines"], "values": [["product001", "product002", "product003"], ["product001", "product003"], {"product_line_1": ["product001", "product002"], "product_line_2": ["product003"]}]}}
{"difficulty": "hard", "function_schema_python": "def get_order_details(order_id: str) -> dict:\n    \"\"\"Retrieves order details for a given order ID.\n\n    :param order_id: The unique order identifier\n    :return: Dictionary containing order details\n    :raises ValueError: If order_id is invalid\"\"\"\n    pass\ndef track_shipment_status(order_id: str) -> dict:\n    \"\"\"Tracks the current shipment status and location for an order.\n\n    :param order_id: The unique order identifier\n    :return: Dictionary containing tracking information\n    :raises ValueError: If order_id is invalid or shipment not found\"\"\"\n    pass\ndef calculate_delay_compensation(order_id: str) -> dict:\n    \"\"\"Calculates any eligible compensation for delayed delivery.\n\n    :param order_id: The unique order identifier\n    :return: Dictionary containing compensation details\n    :raises ValueError: If order_id is invalid\"\"\"\n    pass\n", "function_schema_json": [{"name": "get_order_details", "description": "Retrieves order details for a given order ID.", "parameters": {"type": "object", "properties": {"order_id": {"type": "string", "description": "The unique order identifier"}}, "required": ["order_id"], "additionalProperties": false}}, {"name": "track_shipment_status", "description": "Tracks the current shipment status and location for an order.", "parameters": {"type": "object", "properties": {"order_id": {"type": "string", "description": "The unique order identifier"}}, "required": ["order_id"], "additionalProperties": false}}, {"name": "calculate_delay_compensation", "description": "Calculates any eligible compensation for delayed delivery.", "parameters": {"type": "object", "properties": {"order_id": {"type": "string", "description": "The unique order identifier"}}, "required": ["order_id"], "additionalProperties": false}}], "mock_functions": "def get_order_details(order_id: str) -> dict:\n    \"\"\"\n    Retrieves order details for a given order ID.\n    \n    :param order_id: The unique order identifier\n    :return: Dictionary containing order details\n    :raises ValueError: If order_id is invalid\n    \"\"\"\n    if not order_id or not order_id.isdigit() or len(order_id) != 7:\n        raise ValueError(\"Invalid order ID format\")\n    \n    if order_id == \"1234567\":\n        return {\n            \"order_id\": \"1234567\",\n            \"product\": \"Premium Leather Wallet\",\n            \"order_date\": \"2023-10-26\",\n            \"estimated_delivery\": \"2023-11-02\",\n            \"customer_name\": \"Maria\",\n            \"status\": \"in_transit\"\n        }\n    raise ValueError(\"Order not found\")\ndef track_shipment_status(order_id: str) -> dict:\n    \"\"\"\n    Tracks the current shipment status and location for an order.\n    \n    :param order_id: The unique order identifier\n    :return: Dictionary containing tracking information\n    :raises ValueError: If order_id is invalid or shipment not found\n    \"\"\"\n    if not order_id or not order_id.isdigit() or len(order_id) != 7:\n        raise ValueError(\"Invalid order ID format\")\n    \n    if order_id == \"1234567\":\n        return {\n            \"current_location\": \"Distribution Center, Chicago\",\n            \"status\": \"Processing\",\n            \"delay_reason\": \"Weather conditions\",\n            \"updated_delivery_date\": \"2023-11-05\",\n            \"last_updated\": \"2023-11-03 14:30:00\"\n        }\n    raise ValueError(\"Shipment not found\")\ndef calculate_delay_compensation(order_id: str) -> dict:\n    \"\"\"\n    Calculates any eligible compensation for delayed delivery.\n    \n    :param order_id: The unique order identifier\n    :return: Dictionary containing compensation details\n    :raises ValueError: If order_id is invalid\n    \"\"\"\n    if not order_id or not order_id.isdigit() or len(order_id) != 7:\n        raise ValueError(\"Invalid order ID format\")\n    \n    if order_id == \"1234567\":\n        return {\n            \"eligible\": True,\n            \"compensation_type\": \"store_credit\",\n            \"amount\": 5.00,\n            \"expiry_date\": \"2024-11-03\"\n        }\n    return {\"eligible\": False}", "user_query": "My name is Maria and my order #1234567 is late. Can I get a status update?", "checklist": {"functions": ["get_order_details", "track_shipment_status", "calculate_delay_compensation"], "values": [{"order_id": "1234567", "product": "Premium Leather Wallet", "order_date": "2023-10-26", "estimated_delivery": "2023-11-02", "customer_name": "Maria", "status": "in_transit"}, {"current_location": "Distribution Center, Chicago", "status": "Processing", "delay_reason": "Weather conditions", "updated_delivery_date": "2023-11-05", "last_updated": "2023-11-03 14:30:00"}, {"eligible": true, "compensation_type": "store_credit", "amount": 5.0, "expiry_date": "2024-11-03"}]}}
{"difficulty": "hard", "function_schema_python": "def analyze_batch_status(batch_id: str, product_name: str) -> dict:\n    \"\"\"Analyzes the current status of a specific batch of orders.\n\n    :param batch_id: The identifier for the batch (format: WS-XXXX)\n    :param product_name: The name of the product being processed\n    :return: Dictionary containing batch status information\n    :raises ValueError: If batch_id format is invalid\"\"\"\n    pass\ndef get_warehouse_locations(product_name: str) -> dict:\n    \"\"\"Retrieves the warehouse locations for a specific product.\n\n    :param product_name: Name of the product to locate\n    :return: Dictionary containing location information\"\"\"\n    pass\ndef get_processing_metrics(batch_id: str) -> dict:\n    \"\"\"Retrieves detailed processing metrics for each fulfillment stage.\n\n    :param batch_id: The identifier for the batch (format: WS-XXXX)\n    :return: Dictionary containing processing metrics for each stage\n    :raises ValueError: If batch_id format is invalid\"\"\"\n    pass\n", "function_schema_json": [{"name": "analyze_batch_status", "description": "Analyzes the current status of a specific batch of orders.", "parameters": {"type": "object", "properties": {"batch_id": {"type": "string", "description": "The identifier for the batch (format: WS-XXXX)"}, "product_name": {"type": "string", "description": "The name of the product being processed"}}, "required": ["batch_id", "product_name"], "additionalProperties": false}}, {"name": "get_warehouse_locations", "description": "Retrieves the warehouse locations for a specific product.", "parameters": {"type": "object", "properties": {"product_name": {"type": "string", "description": "Name of the product to locate"}}, "required": ["product_name"], "additionalProperties": false}}, {"name": "get_processing_metrics", "description": "Retrieves detailed processing metrics for each fulfillment stage.", "parameters": {"type": "object", "properties": {"batch_id": {"type": "string", "description": "The identifier for the batch (format: WS-XXXX)"}}, "required": ["batch_id"], "additionalProperties": false}}], "mock_functions": "def analyze_batch_status(batch_id: str, product_name: str) -> dict:\n    \"\"\"\n    Analyzes the current status of a specific batch of orders.\n    \n    :param batch_id: The identifier for the batch (format: WS-XXXX)\n    :param product_name: The name of the product being processed\n    :return: Dictionary containing batch status information\n    :raises ValueError: If batch_id format is invalid\n    \"\"\"\n    if not batch_id.startswith(\"WS-\") or len(batch_id) != 7:\n        raise ValueError(\"Invalid batch ID format\")\n    \n    if batch_id == \"WS-4789\" and \"headphone\" in product_name.lower():\n        return {\n            \"total_orders\": 150,\n            \"processed_orders\": 89,\n            \"pending_orders\": 61,\n            \"average_processing_time\": \"45 minutes\",\n            \"batch_completion\": \"59.3%\"\n        }\n    return {}\ndef get_warehouse_locations(product_name: str) -> dict:\n    \"\"\"\n    Retrieves the warehouse locations for a specific product.\n    \n    :param product_name: Name of the product to locate\n    :return: Dictionary containing location information\n    \"\"\"\n    if \"headphone\" in product_name.lower():\n        return {\n            \"primary_location\": \"Aisle B-12\",\n            \"secondary_location\": \"Overflow Area C-5\",\n            \"total_units\": 450,\n            \"units_by_location\": {\n                \"Aisle B-12\": 300,\n                \"Overflow Area C-5\": 150\n            }\n        }\n    return {}\ndef get_processing_metrics(batch_id: str) -> dict:\n    \"\"\"\n    Retrieves detailed processing metrics for each fulfillment stage.\n    \n    :param batch_id: The identifier for the batch (format: WS-XXXX)\n    :return: Dictionary containing processing metrics for each stage\n    :raises ValueError: If batch_id format is invalid\n    \"\"\"\n    if not batch_id.startswith(\"WS-\") or len(batch_id) != 7:\n        raise ValueError(\"Invalid batch ID format\")\n        \n    if batch_id == \"WS-4789\":\n        return {\n            \"picking\": {\n                \"average_time\": \"15 minutes\",\n                \"bottleneck_risk\": \"low\",\n                \"worker_efficiency\": \"92%\"\n            },\n            \"packing\": {\n                \"average_time\": \"20 minutes\",\n                \"bottleneck_risk\": \"high\",\n                \"worker_efficiency\": \"78%\"\n            },\n            \"shipping\": {\n                \"average_time\": \"10 minutes\",\n                \"bottleneck_risk\": \"medium\",\n                \"worker_efficiency\": \"85%\"\n            }\n        }\n    return {}", "user_query": "What is the current status of batch WS-4789 for XYZ Brand Headphones?", "checklist": {"functions": ["analyze_batch_status", "get_warehouse_locations", "get_processing_metrics"], "values": [{"total_orders": 150, "processed_orders": 89, "pending_orders": 61, "average_processing_time": "45 minutes", "batch_completion": "59.3%"}, {"primary_location": "Aisle B-12", "secondary_location": "Overflow Area C-5", "total_units": 450, "units_by_location": {"Aisle B-12": 300, "Overflow Area C-5": 150}}, {"picking": {"average_time": "15 minutes", "bottleneck_risk": "low", "worker_efficiency": "92%"}, "packing": {"average_time": "20 minutes", "bottleneck_risk": "high", "worker_efficiency": "78%"}, "shipping": {"average_time": "10 minutes", "bottleneck_risk": "medium", "worker_efficiency": "85%"}}]}}
{"difficulty": "hard", "function_schema_python": "def extract_clauses_from_pdf(pdf_path: str, keywords: list) -> list:\n    \"\"\"Extracts specific clauses from a PDF document based on provided keywords.\n\n    :param pdf_path: The path to the PDF document.\n    :param keywords: A list of keywords to search for in the document.\n    :return: A list of strings, where each string represents an extracted clause.\n    :raises FileNotFoundError: If the PDF file is not found.\n    :raises ValueError: If keywords list is empty.\"\"\"\n    pass\ndef process_legal_document(document_path: str) -> str:\n    \"\"\"Processes a legal document and prepares it for analysis.\n\n    :param document_path: The path to the legal document.\n    :return: A string representing the processed document content.\n    :raises FileNotFoundError: If the document is not found.\"\"\"\n    pass\ndef analyze_legal_document(document_content: str) -> dict:\n    \"\"\"Analyzes the content of a legal document.\n\n    :param document_content: The content of the legal document.\n    :return:\n        dict: A dictionary containing analysis results with the following keys:\n            - key_terms (list[str]): List of key terms.\n            - key_clauses (list[str]): List of key clauses.\"\"\"\n    pass\ndef identify_key_information(text: str) -> list:\n    \"\"\"Identifies key information from a given text.\n\n    :param text: The input text for analysis.\n    :return: A list of key information extracted from the text.\"\"\"\n    pass\n", "function_schema_json": [{"name": "extract_clauses_from_pdf", "description": "Extracts specific clauses from a PDF document based on provided keywords.", "parameters": {"type": "object", "properties": {"pdf_path": {"type": "string", "description": "The path to the PDF document."}, "keywords": {"type": "array", "description": "A list of keywords to search for in the document."}}, "required": ["pdf_path", "keywords"], "additionalProperties": false}}, {"name": "process_legal_document", "description": "Processes a legal document and prepares it for analysis.", "parameters": {"type": "object", "properties": {"document_path": {"type": "string", "description": "The path to the legal document."}}, "required": ["document_path"], "additionalProperties": false}}, {"name": "analyze_legal_document", "description": "Analyzes the content of a legal document.", "parameters": {"type": "object", "properties": {"document_content": {"type": "string", "description": "The content of the legal document."}}, "required": ["document_content"], "additionalProperties": false}}, {"name": "identify_key_information", "description": "Identifies key information from a given text.", "parameters": {"type": "object", "properties": {"text": {"type": "string", "description": "The input text for analysis."}}, "required": ["text"], "additionalProperties": false}}], "mock_functions": "def extract_clauses_from_pdf(pdf_path: str, keywords: list) -> list:\n    \"\"\"\n    Extracts specific clauses from a PDF document based on provided keywords.\n\n    :param pdf_path: The path to the PDF document.\n    :param keywords: A list of keywords to search for in the document.\n    :return: A list of strings, where each string represents an extracted clause.\n    :raises FileNotFoundError: If the PDF file is not found.\n    :raises ValueError: If keywords list is empty.\n    \"\"\"\n    if not keywords:\n        raise ValueError(\"Keywords list cannot be empty.\")\n\n    if pdf_path == \"Contract_Agreement_2023.pdf\":\n        mock_clauses = []\n        if \"dispute\" in keywords:\n            mock_clauses.append(\"Clause regarding dispute resolution\")\n        if \"payment\" in keywords:\n            mock_clauses.append(\"Clause about payment terms\")\n\n        return mock_clauses\n    else:\n        raise FileNotFoundError(f\"File not found: {pdf_path}\")\ndef process_legal_document(document_path: str) -> str:\n    \"\"\"\n    Processes a legal document and prepares it for analysis.\n\n    :param document_path: The path to the legal document.\n    :return: A string representing the processed document content.\n    :raises FileNotFoundError: If the document is not found.\n    \"\"\"\n    if document_path == \"Contract_Agreement_2023.pdf\":\n        return \"Processed document content\"\n    else:\n        raise FileNotFoundError(f\"File not found: {document_path}\")\ndef analyze_legal_document(document_content: str) -> dict:\n    \"\"\"\n    Analyzes the content of a legal document.\n\n    :param document_content: The content of the legal document.\n    :return:\n        dict: A dictionary containing analysis results with the following keys:\n            - key_terms (list[str]): List of key terms.\n            - key_clauses (list[str]): List of key clauses.\n    \"\"\"\n\n    if document_content == \"Processed document content\":\n        return {\n            \"key_terms\": [\"contract\", \"dispute\", \"agreement\"],\n            \"key_clauses\": [\"Clause 1\", \"Clause 2\"]\n        }\n    return {}\ndef identify_key_information(text: str) -> list:\n    \"\"\"\n    Identifies key information from a given text.\n    \n    :param text: The input text for analysis.\n    :return: A list of key information extracted from the text.\n    \"\"\"\n    # Mock logic: Extracts keywords based on simple regex matching.\n    keywords = re.findall(r'[A-Za-z]+', text)\n    return keywords", "user_query": "This is Alex Smith. First extract clauses from Contract_Agreement_2023.pdf containing keywords [\"dispute\", \"payment\"], then process the document and analyze it for key information.", "checklist": {"functions": ["extract_clauses_from_pdf", "process_legal_document", "analyze_legal_document"], "values": [["Clause regarding dispute resolution", "Clause about payment terms"], "Processed document content", {"key_terms": ["contract", "dispute", "agreement"], "key_clauses": ["Clause 1", "Clause 2"]}]}}
{"difficulty": "hard", "function_schema_python": "def get_patient_demographics(patient_id: str) -> dict:\n    \"\"\"Retrieves patient demographic information from cache or database.\n\n    :param patient_id: Unique identifier for the patient\n    :return: Dictionary containing patient demographic information\n    :raises ValueError: If patient_id is invalid\"\"\"\n    pass\ndef cache_patient_data(patient_id: str, data: dict, ttl: int) -> bool:\n    \"\"\"Caches patient data with specified time-to-live.\n\n    :param patient_id: Unique identifier for the patient\n    :param data: Dictionary containing patient data to cache\n    :param ttl: Time-to-live in seconds (default 300 seconds/5 minutes)\n    :return: Boolean indicating success of caching operation\n    :raises ValueError: If TTL exceeds maximum allowed time\"\"\"\n    pass\ndef get_recent_visits(patient_id: str, limit: int) -> list:\n    \"\"\"Retrieves recent visit history for a patient.\n\n    :param patient_id: Unique identifier for the patient\n    :param limit: Maximum number of recent visits to return\n    :return: List of recent visit dictionaries\n    :raises ValueError: If patient_id is invalid or limit is out of range\"\"\"\n    pass\ndef verify_hipaa_compliance(data: dict) -> bool:\n    \"\"\"Verifies if the data structure meets HIPAA compliance requirements.\n\n    :param data: Dictionary containing patient data to verify\n    :return: Boolean indicating if data meets HIPAA requirements\"\"\"\n    pass\n", "function_schema_json": [{"name": "get_patient_demographics", "description": "Retrieves patient demographic information from cache or database.", "parameters": {"type": "object", "properties": {"patient_id": {"type": "string", "description": "Unique identifier for the patient"}}, "required": ["patient_id"], "additionalProperties": false}}, {"name": "cache_patient_data", "description": "Caches patient data with specified time-to-live.", "parameters": {"type": "object", "properties": {"patient_id": {"type": "string", "description": "Unique identifier for the patient"}, "data": {"type": "object", "description": "Dictionary containing patient data to cache"}, "ttl": {"type": "integer", "description": "Time-to-live in seconds (default 300 seconds/5 minutes)"}}, "required": ["patient_id", "data", "ttl"], "additionalProperties": false}}, {"name": "get_recent_visits", "description": "Retrieves recent visit history for a patient.", "parameters": {"type": "object", "properties": {"patient_id": {"type": "string", "description": "Unique identifier for the patient"}, "limit": {"type": "integer", "description": "Maximum number of recent visits to return"}}, "required": ["patient_id", "limit"], "additionalProperties": false}}, {"name": "verify_hipaa_compliance", "description": "Verifies if the data structure meets HIPAA compliance requirements.", "parameters": {"type": "object", "properties": {"data": {"type": "object", "description": "Dictionary containing patient data to verify"}}, "required": ["data"], "additionalProperties": false}}], "mock_functions": "def get_patient_demographics(patient_id: str) -> dict:\n    \"\"\"\n    Retrieves patient demographic information from cache or database.\n    \n    :param patient_id: Unique identifier for the patient\n    :return: Dictionary containing patient demographic information\n    :raises ValueError: If patient_id is invalid\n    \"\"\"\n    if not isinstance(patient_id, str) or len(patient_id) != 10:\n        raise ValueError(\"Invalid patient ID format\")\n    \n    if patient_id == \"1234567890\":\n        return {\n            \"patient_id\": \"1234567890\",\n            \"name\": \"John Doe\",\n            \"dob\": \"1980-01-01\",\n            \"address\": \"123 Main St\",\n            \"phone\": \"555-0123\"\n        }\n    raise ValueError(\"Patient not found\")\ndef cache_patient_data(patient_id: str, data: dict, ttl: int = 300) -> bool:\n    \"\"\"\n    Caches patient data with specified time-to-live.\n    \n    :param patient_id: Unique identifier for the patient\n    :param data: Dictionary containing patient data to cache\n    :param ttl: Time-to-live in seconds (default 300 seconds/5 minutes)\n    :return: Boolean indicating success of caching operation\n    :raises ValueError: If TTL exceeds maximum allowed time\n    \"\"\"\n    if not isinstance(ttl, int) or ttl > 300:\n        raise ValueError(\"TTL cannot exceed 5 minutes (300 seconds)\")\n    \n    required_keys = {\"patient_id\", \"name\", \"dob\"}\n    if not all(key in data for key in required_keys):\n        raise ValueError(\"Missing required data fields\")\n    \n    return True\ndef get_recent_visits(patient_id: str, limit: int = 5) -> list:\n    \"\"\"\n    Retrieves recent visit history for a patient.\n    \n    :param patient_id: Unique identifier for the patient\n    :param limit: Maximum number of recent visits to return\n    :return: List of recent visit dictionaries\n    :raises ValueError: If patient_id is invalid or limit is out of range\n    \"\"\"\n    if not isinstance(patient_id, str) or len(patient_id) != 10:\n        raise ValueError(\"Invalid patient ID format\")\n    if not isinstance(limit, int) or limit < 1 or limit > 10:\n        raise ValueError(\"Limit must be between 1 and 10\")\n    \n    if patient_id == \"1234567890\":\n        return [\n            {\n                \"visit_id\": \"V001\",\n                \"date\": \"2023-10-01\",\n                \"doctor\": \"Dr. Smith\",\n                \"reason\": \"Annual checkup\"\n            },\n            {\n                \"visit_id\": \"V002\",\n                \"date\": \"2023-09-15\",\n                \"doctor\": \"Dr. Johnson\",\n                \"reason\": \"Follow-up\"\n            }\n        ]\n    return []\ndef verify_hipaa_compliance(data: dict) -> bool:\n    \"\"\"\n    Verifies if the data structure meets HIPAA compliance requirements.\n    \n    :param data: Dictionary containing patient data to verify\n    :return: Boolean indicating if data meets HIPAA requirements\n    \"\"\"\n    required_security_fields = {\"encryption\", \"access_level\", \"audit_trail\"}\n    if not all(field in data for field in required_security_fields):\n        return False\n    return True", "user_query": "This is Marcus from HealthTrack. Please get patient demographics for ID 1234567890, verify HIPAA compliance with {\"encryption\": true, \"access_level\": \"medical\", \"audit_trail\": true}, cache it with 300 seconds TTL, and fetch their last 5 visits.", "checklist": {"functions": ["get_patient_demographics", "cache_patient_data", "get_recent_visits", "verify_hipaa_compliance"], "values": [{"patient_id": "1234567890", "name": "John Doe", "dob": "1980-01-01", "address": "123 Main St", "phone": "555-0123"}, true, [{"visit_id": "V001", "date": "2023-10-01", "doctor": "Dr. Smith", "reason": "Annual checkup"}, {"visit_id": "V002", "date": "2023-09-15", "doctor": "Dr. Johnson", "reason": "Follow-up"}], true]}}
{"difficulty": "hard", "function_schema_python": "def validate_schema_compatibility(old_schema: dict, new_schema: dict) -> dict:\n    \"\"\"Validates data types and constraints between old and new database schemas.\n\n    :param old_schema: Dictionary containing the old MySQL schema definitions\n    :param new_schema: Dictionary containing the new SQLite schema definitions\n    :return: Dictionary containing validation results with following keys:\n        - is_compatible (bool): Whether schemas are compatible\n        - mismatches (list): List of incompatible fields\n        - warnings (list): List of potential issues\n    :raises ValueError: If schema dictionaries are invalid\"\"\"\n    pass\ndef compare_data_integrity(source_data: dict, target_data: dict) -> dict:\n    \"\"\"Compares historical data between source and target databases.\n\n    :param source_data: Dictionary containing source database records\n    :param target_data: Dictionary containing target database records\n    :return: Dictionary containing comparison results with following keys:\n        - match_percentage (float): Percentage of matching records\n        - missing_records (list): List of missing record IDs\n        - data_differences (dict): Dictionary of differing fields\n    :raises ValueError: If data dictionaries are invalid\"\"\"\n    pass\ndef generate_migration_report(schema_validation: dict, data_comparison: dict) -> dict:\n    \"\"\"Generates a comprehensive migration validation report.\n\n    :param schema_validation: Dictionary containing schema validation results\n    :param data_comparison: Dictionary containing data comparison results\n    :return: Dictionary containing final report with following keys:\n        - success (bool): Overall migration success\n        - summary (str): Summary of migration results\n        - recommendations (list): List of recommended actions\n    :raises ValueError: If input dictionaries are invalid\"\"\"\n    pass\n", "function_schema_json": [{"name": "validate_schema_compatibility", "description": "Validates data types and constraints between old and new database schemas.", "parameters": {"type": "object", "properties": {"old_schema": {"type": "object", "description": "Dictionary containing the old MySQL schema definitions"}, "new_schema": {"type": "object", "description": "Dictionary containing the new SQLite schema definitions"}}, "required": ["old_schema", "new_schema"], "additionalProperties": false}}, {"name": "compare_data_integrity", "description": "Compares historical data between source and target databases.", "parameters": {"type": "object", "properties": {"source_data": {"type": "object", "description": "Dictionary containing source database records"}, "target_data": {"type": "object", "description": "Dictionary containing target database records"}}, "required": ["source_data", "target_data"], "additionalProperties": false}}, {"name": "generate_migration_report", "description": "Generates a comprehensive migration validation report.", "parameters": {"type": "object", "properties": {"schema_validation": {"type": "object", "description": "Dictionary containing schema validation results"}, "data_comparison": {"type": "object", "description": "Dictionary containing data comparison results"}}, "required": ["schema_validation", "data_comparison"], "additionalProperties": false}}], "mock_functions": "def validate_schema_compatibility(old_schema: dict, new_schema: dict) -> dict:\n    \"\"\"\n    Validates data types and constraints between old and new database schemas.\n    \n    :param old_schema: Dictionary containing the old MySQL schema definitions\n    :param new_schema: Dictionary containing the new SQLite schema definitions\n    :return: Dictionary containing validation results with following keys:\n        - is_compatible (bool): Whether schemas are compatible\n        - mismatches (list): List of incompatible fields\n        - warnings (list): List of potential issues\n    :raises ValueError: If schema dictionaries are invalid\n    \"\"\"\n    if not isinstance(old_schema, dict) or not isinstance(new_schema, dict):\n        raise ValueError(\"Invalid schema format\")\n    \n    if old_schema.get(\"version\") == \"1.0\" and new_schema.get(\"version\") == \"1.0\":\n        return {\n            \"is_compatible\": True,\n            \"mismatches\": [],\n            \"warnings\": [\"VARCHAR lengths might differ in SQLite\"]\n        }\n    return {\n        \"is_compatible\": False,\n        \"mismatches\": [\"Incompatible data types found\"],\n        \"warnings\": []\n    }\ndef compare_data_integrity(source_data: dict, target_data: dict) -> dict:\n    \"\"\"\n    Compares historical data between source and target databases.\n    \n    :param source_data: Dictionary containing source database records\n    :param target_data: Dictionary containing target database records\n    :return: Dictionary containing comparison results with following keys:\n        - match_percentage (float): Percentage of matching records\n        - missing_records (list): List of missing record IDs\n        - data_differences (dict): Dictionary of differing fields\n    :raises ValueError: If data dictionaries are invalid\n    \"\"\"\n    if not isinstance(source_data, dict) or not isinstance(target_data, dict):\n        raise ValueError(\"Invalid data format\")\n    \n    if source_data.get(\"checksum\") == target_data.get(\"checksum\"):\n        return {\n            \"match_percentage\": 100.0,\n            \"missing_records\": [],\n            \"data_differences\": {}\n        }\n    return {\n        \"match_percentage\": 98.5,\n        \"missing_records\": [\"PRJ_001\", \"PRJ_002\"],\n        \"data_differences\": {\"PRJ_003\": [\"last_modified_date\"]}\n    }\ndef generate_migration_report(schema_validation: dict, data_comparison: dict) -> dict:\n    \"\"\"\n    Generates a comprehensive migration validation report.\n    \n    :param schema_validation: Dictionary containing schema validation results\n    :param data_comparison: Dictionary containing data comparison results\n    :return: Dictionary containing final report with following keys:\n        - success (bool): Overall migration success\n        - summary (str): Summary of migration results\n        - recommendations (list): List of recommended actions\n    :raises ValueError: If input dictionaries are invalid\n    \"\"\"\n    if not isinstance(schema_validation, dict) or not isinstance(data_comparison, dict):\n        raise ValueError(\"Invalid input data\")\n\n    if (schema_validation.get(\"is_compatible\") and \n        data_comparison.get(\"match_percentage\", 0) > 98.0):\n        return {\n            \"success\": True,\n            \"summary\": \"Migration successful with 98.5% data accuracy\",\n            \"recommendations\": [\"Verify missing records PRJ_001, PRJ_002\"]\n        }\n    return {\n        \"success\": False,\n        \"summary\": \"Migration requires attention\",\n        \"recommendations\": [\"Review schema incompatibilities\"]\n    }", "user_query": "This is James from DataVibes.  For the CloudMigrate database migration, run schema compatibility validation (old schema version 1.0, new schema version 1.0) and data integrity comparison (source checksum 'abcdef123456', target checksum 'abcdef123456').  Finally, generate a migration report based on those results.", "checklist": {"functions": ["validate_schema_compatibility", "compare_data_integrity", "generate_migration_report"], "values": [{"is_compatible": true, "mismatches": [], "warnings": ["VARCHAR lengths might differ in SQLite"]}, {"match_percentage": 100.0, "missing_records": [], "data_differences": {}}, {"success": true, "summary": "Migration successful with 98.5% data accuracy", "recommendations": ["Verify missing records PRJ_001, PRJ_002"]}]}}
{"difficulty": "hard", "function_schema_python": "def check_user_permissions(username: str, folder_path: str) -> dict:\n    \"\"\"Checks the permissions of a specific user for a given network folder.\n\n    :param username: The username to check permissions for.\n    :param folder_path: The network folder path to check.\n    :return: Dictionary containing permission details:\n        - read (bool): Whether user has read permissions\n        - write (bool): Whether user has write permissions\n        - execute (bool): Whether user has execute permissions\n        - owner (str): Owner of the folder\n    :raises ValueError: If username or folder path is invalid.\"\"\"\n    pass\ndef modify_folder_permissions(username: str, folder_path: str, permissions: dict) -> bool:\n    \"\"\"Modifies the permissions for a specific user on a network folder.\n\n    :param username: The username to modify permissions for.\n    :param folder_path: The network folder path to modify.\n    :param permissions: Dictionary containing permission settings:\n        - read (bool): Whether to grant read permissions\n        - write (bool): Whether to grant write permissions\n        - execute (bool): Whether to grant execute permissions\n    :return: True if permissions were successfully modified, False otherwise.\n    :raises ValueError: If invalid parameters are provided.\"\"\"\n    pass\ndef verify_folder_access(username: str, folder_path: str) -> bool:\n    \"\"\"Verifies if a user can actually access a specific folder after permission changes.\n\n    :param username: The username to verify access for.\n    :param folder_path: The network folder path to verify.\n    :return: True if user can access the folder, False otherwise.\n    :raises ValueError: If username or folder path is invalid.\"\"\"\n    pass\n", "function_schema_json": [{"name": "check_user_permissions", "description": "Checks the permissions of a specific user for a given network folder.", "parameters": {"type": "object", "properties": {"username": {"type": "string", "description": "The username to check permissions for."}, "folder_path": {"type": "string", "description": "The network folder path to check."}}, "required": ["username", "folder_path"], "additionalProperties": false}}, {"name": "modify_folder_permissions", "description": "Modifies the permissions for a specific user on a network folder.", "parameters": {"type": "object", "properties": {"username": {"type": "string", "description": "The username to modify permissions for."}, "folder_path": {"type": "string", "description": "The network folder path to modify."}, "permissions": {"type": "object", "description": "Dictionary containing permission settings:"}}, "required": ["username", "folder_path", "permissions"], "additionalProperties": false}}, {"name": "verify_folder_access", "description": "Verifies if a user can actually access a specific folder after permission changes.", "parameters": {"type": "object", "properties": {"username": {"type": "string", "description": "The username to verify access for."}, "folder_path": {"type": "string", "description": "The network folder path to verify."}}, "required": ["username", "folder_path"], "additionalProperties": false}}], "mock_functions": "def check_user_permissions(username: str, folder_path: str) -> dict:\n    \"\"\"\n    Checks the permissions of a specific user for a given network folder.\n    \n    :param username: The username to check permissions for.\n    :param folder_path: The network folder path to check.\n    :return: Dictionary containing permission details:\n        - read (bool): Whether user has read permissions\n        - write (bool): Whether user has write permissions\n        - execute (bool): Whether user has execute permissions\n        - owner (str): Owner of the folder\n    :raises ValueError: If username or folder path is invalid.\n    \"\"\"\n    if not username or not folder_path:\n        raise ValueError(\"Username and folder path must be provided\")\n    \n    if username.lower() == \"alex\" and folder_path == \"\\\\\\\\server\\\\shared\\\\documents\":\n        return {\n            \"read\": False,\n            \"write\": False,\n            \"execute\": False,\n            \"owner\": \"Administrator\"\n        }\n    return {\n        \"read\": True,\n        \"write\": True,\n        \"execute\": True,\n        \"owner\": \"Administrator\"\n    }\ndef modify_folder_permissions(username: str, folder_path: str, permissions: dict) -> bool:\n    \"\"\"\n    Modifies the permissions for a specific user on a network folder.\n    \n    :param username: The username to modify permissions for.\n    :param folder_path: The network folder path to modify.\n    :param permissions: Dictionary containing permission settings:\n        - read (bool): Whether to grant read permissions\n        - write (bool): Whether to grant write permissions\n        - execute (bool): Whether to grant execute permissions\n    :return: True if permissions were successfully modified, False otherwise.\n    :raises ValueError: If invalid parameters are provided.\n    \"\"\"\n    if not username or not folder_path:\n        raise ValueError(\"Username and folder path must be provided\")\n    \n    required_keys = [\"read\", \"write\", \"execute\"]\n    if not all(key in permissions for key in required_keys):\n        raise ValueError(\"Permissions dictionary must contain read, write, and execute keys\")\n\n    if username.lower() == \"alex\" and folder_path == \"\\\\\\\\server\\\\shared\\\\documents\":\n        return True\n    return False\ndef verify_folder_access(username: str, folder_path: str) -> bool:\n    \"\"\"\n    Verifies if a user can actually access a specific folder after permission changes.\n    \n    :param username: The username to verify access for.\n    :param folder_path: The network folder path to verify.\n    :return: True if user can access the folder, False otherwise.\n    :raises ValueError: If username or folder path is invalid.\n    \"\"\"\n    if not username or not folder_path:\n        raise ValueError(\"Username and folder path must be provided\")\n    \n    if username.lower() == \"alex\" and folder_path == \"\\\\\\\\server\\\\shared\\\\documents\":\n        return True\n    return False", "user_query": "Hi, it's Linda. Could you modify the permissions for Alex on \\\\server\\shared\\documents to allow read and write access?", "checklist": {"functions": ["check_user_permissions", "modify_folder_permissions", "verify_folder_access"], "values": [{"read": false, "write": false, "execute": false, "owner": "Administrator"}, true, true]}}
{"difficulty": "hard", "function_schema_python": "def scan_ssh_config(server_ip: str, port: int) -> dict:\n    \"\"\"Scans SSH configuration of a specified server.\n\n    :param server_ip: IP address of the target server\n    :param port: SSH port number (default: 22)\n    :return: Dictionary containing SSH configuration details\n    :raises ValueError: If IP address is invalid\"\"\"\n    pass\ndef verify_ssh_key_auth(server_ip: str, username: str) -> bool:\n    \"\"\"Verifies SSH key authentication for a specific user on a server.\n\n    :param server_ip: IP address of the target server\n    :param username: Username to verify\n    :return: True if key authentication is properly configured, False otherwise\n    :raises ConnectionError: If unable to connect to server\"\"\"\n    pass\ndef disable_root_login(server_ip: str, ssh_config_path: str) -> bool:\n    \"\"\"Disables root login on the specified server.\n\n    :param server_ip: IP address of the target server\n    :param ssh_config_path: Path to SSH config file\n    :return: True if root login was successfully disabled, False otherwise\n    :raises PermissionError: If insufficient privileges\"\"\"\n    pass\ndef implement_access_control(server_ip: str, allowed_users: list) -> dict:\n    \"\"\"Implements SSH access controls for specified users.\n\n    :param server_ip: IP address of the target server\n    :param allowed_users: List of usernames to allow SSH access\n    :return: Dictionary containing access control status\n    :raises ValueError: If allowed_users list is empty\"\"\"\n    pass\n", "function_schema_json": [{"name": "scan_ssh_config", "description": "Scans SSH configuration of a specified server.", "parameters": {"type": "object", "properties": {"server_ip": {"type": "string", "description": "IP address of the target server"}, "port": {"type": "integer", "description": "SSH port number (default: 22)"}}, "required": ["server_ip", "port"], "additionalProperties": false}}, {"name": "verify_ssh_key_auth", "description": "Verifies SSH key authentication for a specific user on a server.", "parameters": {"type": "object", "properties": {"server_ip": {"type": "string", "description": "IP address of the target server"}, "username": {"type": "string", "description": "Username to verify"}}, "required": ["server_ip", "username"], "additionalProperties": false}}, {"name": "disable_root_login", "description": "Disables root login on the specified server.", "parameters": {"type": "object", "properties": {"server_ip": {"type": "string", "description": "IP address of the target server"}, "ssh_config_path": {"type": "string", "description": "Path to SSH config file"}}, "required": ["server_ip", "ssh_config_path"], "additionalProperties": false}}, {"name": "implement_access_control", "description": "Implements SSH access controls for specified users.", "parameters": {"type": "object", "properties": {"server_ip": {"type": "string", "description": "IP address of the target server"}, "allowed_users": {"type": "array", "description": "List of usernames to allow SSH access"}}, "required": ["server_ip", "allowed_users"], "additionalProperties": false}}], "mock_functions": "def scan_ssh_config(server_ip: str, port: int = 22) -> dict:\n    \"\"\"\n    Scans SSH configuration of a specified server.\n    \n    :param server_ip: IP address of the target server\n    :param port: SSH port number (default: 22)\n    :return: Dictionary containing SSH configuration details\n    :raises ValueError: If IP address is invalid\n    \"\"\"\n    if not isinstance(server_ip, str) or not 0 <= port <= 65535:\n        raise ValueError(\"Invalid IP address or port\")\n    \n    if server_ip == \"192.168.1.10\":\n        return {\n            \"permit_root_login\": True,\n            \"password_authentication\": True,\n            \"key_authentication\": True,\n            \"protocol_version\": 2,\n            \"ciphers\": [\"aes256-cbc\", \"aes128-ctr\"]\n        }\n    return {}\ndef verify_ssh_key_auth(server_ip: str, username: str) -> bool:\n    \"\"\"\n    Verifies SSH key authentication for a specific user on a server.\n    \n    :param server_ip: IP address of the target server\n    :param username: Username to verify\n    :return: True if key authentication is properly configured, False otherwise\n    :raises ConnectionError: If unable to connect to server\n    \"\"\"\n    if not server_ip or not username:\n        raise ValueError(\"Server IP and username must be provided\")\n    \n    if server_ip == \"192.168.1.10\" and username == \"admin\":\n        return True\n    return False\ndef disable_root_login(server_ip: str, ssh_config_path: str = \"/etc/ssh/sshd_config\") -> bool:\n    \"\"\"\n    Disables root login on the specified server.\n    \n    :param server_ip: IP address of the target server\n    :param ssh_config_path: Path to SSH config file\n    :return: True if root login was successfully disabled, False otherwise\n    :raises PermissionError: If insufficient privileges\n    \"\"\"\n    if not server_ip or not ssh_config_path:\n        raise ValueError(\"Server IP and config path must be provided\")\n    \n    if server_ip == \"192.168.1.10\" and ssh_config_path == \"/etc/ssh/sshd_config\":\n        return True\n    return False\ndef implement_access_control(server_ip: str, allowed_users: list) -> dict:\n    \"\"\"\n    Implements SSH access controls for specified users.\n    \n    :param server_ip: IP address of the target server\n    :param allowed_users: List of usernames to allow SSH access\n    :return: Dictionary containing access control status\n    :raises ValueError: If allowed_users list is empty\n    \"\"\"\n    if not server_ip or not allowed_users:\n        raise ValueError(\"Server IP and allowed users must be provided\")\n    \n    if server_ip == \"192.168.1.10\" and \"admin\" in allowed_users:\n        return {\n            \"status\": \"success\",\n            \"allowed_users\": allowed_users,\n            \"denied_users\": [\"root\"],\n            \"configuration_applied\": True\n        }\n    return {\"status\": \"failed\"}", "user_query": "This is Marcus Rodriguez. I need to disable root login and implement access control for only user 'admin' on server 192.168.1.10 using the standard SSH config file path.  Please confirm after completion.", "checklist": {"functions": ["scan_ssh_config", "verify_ssh_key_auth", "disable_root_login", "implement_access_control"], "values": [{"permit_root_login": true, "password_authentication": true, "key_authentication": true, "protocol_version": 2, "ciphers": ["aes256-cbc", "aes128-ctr"]}, true, true, {"status": "success", "allowed_users": ["admin"], "denied_users": ["root"], "configuration_applied": true}]}}
{"difficulty": "hard", "function_schema_python": "def retrieve_user_feedback(app_name: str, user_name: str) -> list:\n    \"\"\"Retrieves feedback for a specific user from a given app.\n\n    :param app_name: The name of the app (e.g., \"Puzzle Paradise\").\n    :param user_name: The name of the user whose feedback is requested.\n    :return: A list of feedback strings provided by the user.\n    :raises ValueError: If either app_name or user_name is invalid.\"\"\"\n    pass\ndef send_email(recipient_email: str, subject: str, body: str) -> bool:\n    \"\"\"Simulates sending an email to a recipient.\n\n    :param recipient_email: The email address of the recipient.\n    :param subject: The subject of the email.\n    :param body: The body content of the email.\n    :return: True if the email was sent successfully, False otherwise.\n    :raises ValueError: If any parameter is invalid.\"\"\"\n    pass\ndef analyze_feedback(feedback_list: list) -> dict:\n    \"\"\"Analyzes a list of feedback to identify common pain points.\n\n    :param feedback_list: A list of feedback strings.\n    :return: A dictionary with identified pain points as keys and their occurrences as values.\n    :raises ValueError: If the feedback list is empty.\"\"\"\n    pass\ndef log_customer_interaction(user_name: str, interaction_details: str) -> bool:\n    \"\"\"Logs details of an interaction with a customer.\n\n    :param user_name: The name of the user interacting with.\n    :param interaction_details: Details of the interaction.\n    :return: True if the interaction was logged successfully, False otherwise.\n    :raises ValueError: If either user_name or interaction_details is invalid.\"\"\"\n    pass\n", "function_schema_json": [{"name": "retrieve_user_feedback", "description": "Retrieves feedback for a specific user from a given app.", "parameters": {"type": "object", "properties": {"app_name": {"type": "string", "description": "The name of the app (e.g., \"Puzzle Paradise\")."}, "user_name": {"type": "string", "description": "The name of the user whose feedback is requested."}}, "required": ["app_name", "user_name"], "additionalProperties": false}}, {"name": "send_email", "description": "Simulates sending an email to a recipient.", "parameters": {"type": "object", "properties": {"recipient_email": {"type": "string", "description": "The email address of the recipient."}, "subject": {"type": "string", "description": "The subject of the email."}, "body": {"type": "string", "description": "The body content of the email."}}, "required": ["recipient_email", "subject", "body"], "additionalProperties": false}}, {"name": "analyze_feedback", "description": "Analyzes a list of feedback to identify common pain points.", "parameters": {"type": "object", "properties": {"feedback_list": {"type": "array", "description": "A list of feedback strings."}}, "required": ["feedback_list"], "additionalProperties": false}}, {"name": "log_customer_interaction", "description": "Logs details of an interaction with a customer.", "parameters": {"type": "object", "properties": {"user_name": {"type": "string", "description": "The name of the user interacting with."}, "interaction_details": {"type": "string", "description": "Details of the interaction."}}, "required": ["user_name", "interaction_details"], "additionalProperties": false}}], "mock_functions": "def retrieve_user_feedback(app_name: str, user_name: str) -> list:\n    \"\"\"\n    Retrieves feedback for a specific user from a given app.\n    \n    :param app_name: The name of the app (e.g., \"Puzzle Paradise\").\n    :param user_name: The name of the user whose feedback is requested.\n    :return: A list of feedback strings provided by the user.\n    :raises ValueError: If either app_name or user_name is invalid.\n    \"\"\"\n    if not app_name or not user_name:\n        raise ValueError(\"App name and user name must be provided.\")\n    if app_name == \"Puzzle Paradise\" and user_name == \"Sarah\":\n        return [\n            \"I'm having trouble with in-app purchases.\",\n            \"There hasn't been any new content updates. This is disappointing.\"\n        ]\n    return []\ndef send_email(recipient_email: str, subject: str, body: str) -> bool:\n    \"\"\"\n    Simulates sending an email to a recipient.\n    \n    :param recipient_email: The email address of the recipient.\n    :param subject: The subject of the email.\n    :param body: The body content of the email.\n    :return: True if the email was sent successfully, False otherwise.\n    :raises ValueError: If any parameter is invalid.\n    \"\"\"\n    if not recipient_email or not subject or not body:\n        raise ValueError(\"Recipient email, subject, and body must be provided.\")\n    if recipient_email == \"sarah@example.com\":\n        print(f\"Email sent to {recipient_email} with subject '{subject}' and body:\\n{body}\")\n        return True\n    return False\ndef analyze_feedback(feedback_list: list) -> dict:\n    \"\"\"\n    Analyzes a list of feedback to identify common pain points.\n    \n    :param feedback_list: A list of feedback strings.\n    :return: A dictionary with identified pain points as keys and their occurrences as values.\n    :raises ValueError: If the feedback list is empty.\n    \"\"\"\n    if not feedback_list:\n        raise ValueError(\"Feedback list must not be empty.\")\n    pain_points = {}\n    for feedback in feedback_list:\n        if \"in-app purchases\" in feedback.lower():\n            pain_points[\"in-app purchases\"] = pain_points.get(\"in-app purchases\", 0) + 1\n        if \"new content updates\" in feedback.lower():\n            pain_points[\"new content updates\"] = pain_points.get(\"new content updates\", 0) + 1\n    return pain_points\ndef log_customer_interaction(user_name: str, interaction_details: str) -> bool:\n    \"\"\"\n    Logs details of an interaction with a customer.\n    \n    :param user_name: The name of the user interacting with.\n    :param interaction_details: Details of the interaction.\n    :return: True if the interaction was logged successfully, False otherwise.\n    :raises ValueError: If either user_name or interaction_details is invalid.\n    \"\"\"\n    if not user_name or not interaction_details:\n        raise ValueError(\"User name and interaction details must be provided.\")\n    if user_name == \"Sarah\":\n        print(f\"Logged interaction with {user_name}: {interaction_details}\")\n        return True\n    return False", "user_query": "This is Alex. Retrieve Sarah's feedback for Puzzle Paradise, analyze it, and then send an email to sarah@example.com with the subject \"Puzzle Paradise Feedback\" and the body \"Hi Sarah, we received your feedback about Puzzle Paradise. We are working on addressing the issues you mentioned about in-app purchases and lack of new content. Thank you for your patience.\" Finally, log this interaction.", "checklist": {"functions": ["retrieve_user_feedback", "send_email", "analyze_feedback", "log_customer_interaction"], "values": [["I'm having trouble with in-app purchases.", "There hasn't been any new content updates. This is disappointing."], true, {"in-app purchases": 1, "new content updates": 1}, true]}}
{"difficulty": "hard", "function_schema_python": "def configure_mlflow(tracking_uri: str, experiment_name: str) -> bool:\n    \"\"\"Configures MLflow tracking and sets up an experiment.\n\n    :param tracking_uri: The URI of the MLflow tracking server.\n    :param experiment_name: The name of the MLflow experiment.\n    :return: True if configuration is successful, False otherwise.\"\"\"\n    pass\ndef build_docker_image(model_name: str, dependencies: List[str]) -> str:\n    \"\"\"Builds a Docker image containing the model and its dependencies.\n\n    :param model_name: The name of the recommendation model.\n    :param dependencies: A list of dependencies required by the model.\n    :return: The Docker image ID.\"\"\"\n    pass\ndef deploy_to_kubernetes(docker_image_id: str, cluster_name: str) -> bool:\n    \"\"\"Deploys the Docker image to a Kubernetes cluster.\n\n    :param docker_image_id: The ID of the Docker image to deploy.\n    :param cluster_name: The name of the Kubernetes cluster.\n    :return: True if deployment is successful, False otherwise.\"\"\"\n    pass\ndef configure_prometheus_monitoring(deployment_name: str, metrics: List[str]) -> bool:\n    \"\"\"Configures Prometheus monitoring for the deployed model.\n\n    :param deployment_name: The name of the Kubernetes deployment.\n    :param metrics: A list of metrics to monitor.\n    :return: True if monitoring setup is successful, False otherwise.\"\"\"\n    pass\ndef setup_terraform(infrastructure_config: Dict[str, Any]) -> bool:\n    \"\"\"Sets up infrastructure using Terraform.\n\n    :param infrastructure_config: A dictionary containing infrastructure configurations.\n    :return: True if Terraform setup is successful, False otherwise.\"\"\"\n    pass\ndef configure_ansible(playbook: str, inventory: str) -> bool:\n    \"\"\"Configures Ansible for automation.\n\n    :param playbook: The path to the Ansible playbook.\n    :param inventory: The path to the Ansible inventory file.\n    :return: True if Ansible configuration is successful, False otherwise.\"\"\"\n    pass\ndef setup_ci_cd_pipeline(repository_url: str, pipeline_config: Dict[str, Any]) -> bool:\n    \"\"\"Sets up a CI/CD pipeline.\n\n    :param repository_url: The URL of the Git repository.\n    :param pipeline_config: A dictionary containing the pipeline configuration.\n    :return: True if pipeline setup is successful, False otherwise.\"\"\"\n    pass\ndef test_model_serving(test_dataset: List[Any]) -> Dict[str, Any]:\n    \"\"\"Tests the deployed model with a sample dataset.\n\n    :param test_dataset: A list of test data points.\n    :return: A dictionary containing evaluation metrics.\"\"\"\n    pass\n", "function_schema_json": [{"name": "configure_mlflow", "description": "Configures MLflow tracking and sets up an experiment.", "parameters": {"type": "object", "properties": {"tracking_uri": {"type": "string", "description": "The URI of the MLflow tracking server."}, "experiment_name": {"type": "string", "description": "The name of the MLflow experiment."}}, "required": ["tracking_uri", "experiment_name"], "additionalProperties": false}}, {"name": "build_docker_image", "description": "Builds a Docker image containing the model and its dependencies.", "parameters": {"type": "object", "properties": {"model_name": {"type": "string", "description": "The name of the recommendation model."}, "dependencies": {"type": "array", "items": {"type": "string"}, "description": "A list of dependencies required by the model."}}, "required": ["model_name", "dependencies"], "additionalProperties": false}}, {"name": "deploy_to_kubernetes", "description": "Deploys the Docker image to a Kubernetes cluster.", "parameters": {"type": "object", "properties": {"docker_image_id": {"type": "string", "description": "The ID of the Docker image to deploy."}, "cluster_name": {"type": "string", "description": "The name of the Kubernetes cluster."}}, "required": ["docker_image_id", "cluster_name"], "additionalProperties": false}}, {"name": "configure_prometheus_monitoring", "description": "Configures Prometheus monitoring for the deployed model.", "parameters": {"type": "object", "properties": {"deployment_name": {"type": "string", "description": "The name of the Kubernetes deployment."}, "metrics": {"type": "array", "items": {"type": "string"}, "description": "A list of metrics to monitor."}}, "required": ["deployment_name", "metrics"], "additionalProperties": false}}, {"name": "setup_terraform", "description": "Sets up infrastructure using Terraform.", "parameters": {"type": "object", "properties": {"infrastructure_config": {"type": "object", "description": "A dictionary containing infrastructure configurations."}}, "required": ["infrastructure_config"], "additionalProperties": false}}, {"name": "configure_ansible", "description": "Configures Ansible for automation.", "parameters": {"type": "object", "properties": {"playbook": {"type": "string", "description": "The path to the Ansible playbook."}, "inventory": {"type": "string", "description": "The path to the Ansible inventory file."}}, "required": ["playbook", "inventory"], "additionalProperties": false}}, {"name": "setup_ci_cd_pipeline", "description": "Sets up a CI/CD pipeline.", "parameters": {"type": "object", "properties": {"repository_url": {"type": "string", "description": "The URL of the Git repository."}, "pipeline_config": {"type": "object", "description": "A dictionary containing the pipeline configuration."}}, "required": ["repository_url", "pipeline_config"], "additionalProperties": false}}, {"name": "test_model_serving", "description": "Tests the deployed model with a sample dataset.", "parameters": {"type": "object", "properties": {"test_dataset": {"type": "array", "items": {"type": "string"}, "description": "A list of test data points."}}, "required": ["test_dataset"], "additionalProperties": false}}], "mock_functions": "def configure_mlflow(tracking_uri: str, experiment_name: str) -> bool:\n    \"\"\"\n    Configures MLflow tracking and sets up an experiment.\n\n    :param tracking_uri: The URI of the MLflow tracking server.\n    :param experiment_name: The name of the MLflow experiment.\n    :return: True if configuration is successful, False otherwise.\n    \"\"\"\n    if tracking_uri and experiment_name:\n        return True  # Mock successful configuration\n    return False\ndef build_docker_image(model_name: str, dependencies: List[str]) -> str:\n    \"\"\"\n    Builds a Docker image containing the model and its dependencies.\n\n    :param model_name: The name of the recommendation model.\n    :param dependencies: A list of dependencies required by the model.\n    :return: The Docker image ID.\n    \"\"\"\n    if model_name and dependencies:\n        return \"mock_docker_image_id\"\n    return \"\"\ndef deploy_to_kubernetes(docker_image_id: str, cluster_name: str) -> bool:\n    \"\"\"\n    Deploys the Docker image to a Kubernetes cluster.\n\n    :param docker_image_id: The ID of the Docker image to deploy.\n    :param cluster_name: The name of the Kubernetes cluster.\n    :return: True if deployment is successful, False otherwise.\n    \"\"\"\n    if docker_image_id and cluster_name:\n        return True\n    return False\ndef configure_prometheus_monitoring(deployment_name: str, metrics: List[str]) -> bool:\n    \"\"\"\n    Configures Prometheus monitoring for the deployed model.\n\n    :param deployment_name: The name of the Kubernetes deployment.\n    :param metrics: A list of metrics to monitor.\n    :return: True if monitoring setup is successful, False otherwise.\n    \"\"\"\n    if deployment_name and metrics:\n        return True\n    return False\ndef setup_terraform(infrastructure_config: Dict[str, Any]) -> bool:\n    \"\"\"\n    Sets up infrastructure using Terraform.\n\n    :param infrastructure_config: A dictionary containing infrastructure configurations.\n    :return: True if Terraform setup is successful, False otherwise.\n    \"\"\"\n    if infrastructure_config:\n        return True\n    return False\ndef configure_ansible(playbook: str, inventory: str) -> bool:\n    \"\"\"\n    Configures Ansible for automation.\n\n    :param playbook: The path to the Ansible playbook.\n    :param inventory: The path to the Ansible inventory file.\n    :return: True if Ansible configuration is successful, False otherwise.\n    \"\"\"\n    if playbook and inventory:\n        return True\n    return False\ndef setup_ci_cd_pipeline(repository_url: str, pipeline_config: Dict[str, Any]) -> bool:\n    \"\"\"\n    Sets up a CI/CD pipeline.\n\n    :param repository_url: The URL of the Git repository.\n    :param pipeline_config: A dictionary containing the pipeline configuration.\n    :return: True if pipeline setup is successful, False otherwise.\n    \"\"\"\n    if repository_url and pipeline_config:\n        return True\n    return False\ndef test_model_serving(test_dataset: List[Any]) -> Dict[str, Any]:\n    \"\"\"\n    Tests the deployed model with a sample dataset.\n\n    :param test_dataset: A list of test data points.\n    :return: A dictionary containing evaluation metrics.\n    \"\"\"\n    if test_dataset:\n        return {\"accuracy\": 0.95, \"latency\": \"10ms\"}\n    return {}", "user_query": "This is Dr. Jane Park from RobustTech. Please configure the Prometheus monitoring for deployment 'rec_model_deployment' with metrics ['latency', 'accuracy'], then deploy the Docker image 'mock_docker_image_id' to the Kubernetes cluster named 'robusttech-cluster', and finally test the model using a sample dataset ['user1_data', 'user2_data', 'user3_data'].", "checklist": {"functions": ["configure_prometheus_monitoring", "deploy_to_kubernetes", "test_model_serving"], "values": [true, true, {"accuracy": 0.95, "latency": "10ms"}]}}
{"difficulty": "hard", "function_schema_python": "def deploy_smart_contract(contract_code: str, network: str) -> int:\n    \"\"\"Deploys a smart contract to a specified blockchain network.\n\n    :param contract_code: The code of the smart contract to be deployed.\n    :param network: The blockchain network (e.g., \"Ethereum\", \"Binance Smart Chain\").\n    :return: An integer representing the contract address or transaction hash.\n    :raises ValueError: If the contract code or network is invalid.\"\"\"\n    pass\ndef scan_with_web3(contract_address: int, network: str) -> dict:\n    \"\"\"Scans a smart contract using web3 for vulnerabilities.\n\n    :param contract_address: The address of the smart contract to be scanned.\n    :param network: The blockchain network the contract is deployed on (e.g., \"Ethereum\").\n    :return: A dictionary with the results of the scan.\n        dict: A dictionary with the following keys:\n            - vulnerabilities (list[str]): List of identified vulnerabilities.\n            - status (str): Status of the scan (\"completed\", \"failed\").\n    :raises ValueError: If the contract address or network is invalid.\"\"\"\n    pass\ndef analyze_with_nmap(target_host: str) -> dict:\n    \"\"\"Analyzes a target host for open ports and services using nmap.\n\n    :param target_host: The IP address or domain of the target host.\n    :return: A dictionary with the results of the analysis.\n        dict: A dictionary with the following keys:\n            - open_ports (list[int]): List of open ports.\n            - services (dict): Dictionary of services running on the open ports.\n    :raises ValueError: If the target host is invalid.\"\"\"\n    pass\ndef exploit_with_metasploit(target_host: str, exploit_name: str) -> bool:\n    \"\"\"Attempts to exploit a target host using Metasploit.\n\n    :param target_host: The IP address or domain of the target host.\n    :param exploit_name: The name of the exploit to use.\n    :return: A boolean indicating whether the exploit was successful.\n    :raises ValueError: If the target host or exploit name is invalid.\"\"\"\n    pass\ndef capture_traffic_with_wireshark(interface: str) -> list:\n    \"\"\"Captures network traffic on a specified network interface using Wireshark.\n\n    :param interface: The network interface to capture traffic from (e.g., \"eth0\").\n    :return: A list of captured packets.\n    :raises ValueError: If the interface is invalid.\"\"\"\n    pass\ndef analyze_traffic_with_burp_suite(traffic_file: str) -> dict:\n    \"\"\"Analyzes captured traffic using Burp Suite.\n\n    :param traffic_file: The file path to the captured traffic.\n    :return: A dictionary with the analysis results.\n        dict: A dictionary with the following keys:\n            - issues (list[str]): List of identified security issues.\n            - summary (str): Summary of the analysis.\n    :raises ValueError: If the traffic file is invalid.\"\"\"\n    pass\n", "function_schema_json": [{"name": "deploy_smart_contract", "description": "Deploys a smart contract to a specified blockchain network.", "parameters": {"type": "object", "properties": {"contract_code": {"type": "string", "description": "The code of the smart contract to be deployed."}, "network": {"type": "string", "description": "The blockchain network (e.g., \"Ethereum\", \"Binance Smart Chain\")."}}, "required": ["contract_code", "network"], "additionalProperties": false}}, {"name": "scan_with_web3", "description": "Scans a smart contract using web3 for vulnerabilities.", "parameters": {"type": "object", "properties": {"contract_address": {"type": "integer", "description": "The address of the smart contract to be scanned."}, "network": {"type": "string", "description": "The blockchain network the contract is deployed on (e.g., \"Ethereum\")."}}, "required": ["contract_address", "network"], "additionalProperties": false}}, {"name": "analyze_with_nmap", "description": "Analyzes a target host for open ports and services using nmap.", "parameters": {"type": "object", "properties": {"target_host": {"type": "string", "description": "The IP address or domain of the target host."}}, "required": ["target_host"], "additionalProperties": false}}, {"name": "exploit_with_metasploit", "description": "Attempts to exploit a target host using Metasploit.", "parameters": {"type": "object", "properties": {"target_host": {"type": "string", "description": "The IP address or domain of the target host."}, "exploit_name": {"type": "string", "description": "The name of the exploit to use."}}, "required": ["target_host", "exploit_name"], "additionalProperties": false}}, {"name": "capture_traffic_with_wireshark", "description": "Captures network traffic on a specified network interface using Wireshark.", "parameters": {"type": "object", "properties": {"interface": {"type": "string", "description": "The network interface to capture traffic from (e.g., \"eth0\")."}}, "required": ["interface"], "additionalProperties": false}}, {"name": "analyze_traffic_with_burp_suite", "description": "Analyzes captured traffic using Burp Suite.", "parameters": {"type": "object", "properties": {"traffic_file": {"type": "string", "description": "The file path to the captured traffic."}}, "required": ["traffic_file"], "additionalProperties": false}}], "mock_functions": "def deploy_smart_contract(contract_code: str, network: str) -> int:\n    \"\"\"\n    Deploys a smart contract to a specified blockchain network.\n    \n    :param contract_code: The code of the smart contract to be deployed.\n    :param network: The blockchain network (e.g., \"Ethereum\", \"Binance Smart Chain\").\n    :return: An integer representing the contract address or transaction hash.\n    :raises ValueError: If the contract code or network is invalid.\n    \"\"\"\n    if not contract_code or not network:\n        raise ValueError(\"Contract code and network must be provided.\")\n    return 1234567890  # Mock contract address\ndef scan_with_web3(contract_address: int, network: str) -> dict:\n    \"\"\"\n    Scans a smart contract using web3 for vulnerabilities.\n    \n    :param contract_address: The address of the smart contract to be scanned.\n    :param network: The blockchain network the contract is deployed on (e.g., \"Ethereum\").\n    :return: A dictionary with the results of the scan.\n        dict: A dictionary with the following keys:\n            - vulnerabilities (list[str]): List of identified vulnerabilities.\n            - status (str): Status of the scan (\"completed\", \"failed\").\n    :raises ValueError: If the contract address or network is invalid.\n    \"\"\"\n    if not contract_address or not network:\n        raise ValueError(\"Contract address and network must be provided.\")\n    return {\n        \"vulnerabilities\": [\"Reentrancy\", \"Unchecked external calls\"],\n        \"status\": \"completed\"\n    }\ndef analyze_with_nmap(target_host: str) -> dict:\n    \"\"\"\n    Analyzes a target host for open ports and services using nmap.\n    \n    :param target_host: The IP address or domain of the target host.\n    :return: A dictionary with the results of the analysis.\n        dict: A dictionary with the following keys:\n            - open_ports (list[int]): List of open ports.\n            - services (dict): Dictionary of services running on the open ports.\n    :raises ValueError: If the target host is invalid.\n    \"\"\"\n    if not target_host:\n        raise ValueError(\"Target host must be provided.\")\n    return {\n        \"open_ports\": [80, 443, 3000],\n        \"services\": {\n            80: \"HTTP\",\n            443: \"HTTPS\",\n            3000: \"Node.js\"\n        }\n    }\ndef exploit_with_metasploit(target_host: str, exploit_name: str) -> bool:\n    \"\"\"\n    Attempts to exploit a target host using Metasploit.\n    \n    :param target_host: The IP address or domain of the target host.\n    :param exploit_name: The name of the exploit to use.\n    :return: A boolean indicating whether the exploit was successful.\n    :raises ValueError: If the target host or exploit name is invalid.\n    \"\"\"\n    if not target_host or not exploit_name:\n        raise ValueError(\"Target host and exploit name must be provided.\")\n    return False  # Mock failure\ndef capture_traffic_with_wireshark(interface: str) -> list:\n    \"\"\"\n    Captures network traffic on a specified network interface using Wireshark.\n    \n    :param interface: The network interface to capture traffic from (e.g., \"eth0\").\n    :return: A list of captured packets.\n    :raises ValueError: If the interface is invalid.\n    \"\"\"\n    if not interface:\n        raise ValueError(\"Interface must be provided.\")\n    return [\"Packet1\", \"Packet2\", \"Packet3\"]  # Mock packets\ndef analyze_traffic_with_burp_suite(traffic_file: str) -> dict:\n    \"\"\"\n    Analyzes captured traffic using Burp Suite.\n    \n    :param traffic_file: The file path to the captured traffic.\n    :return: A dictionary with the analysis results.\n        dict: A dictionary with the following keys:\n            - issues (list[str]): List of identified security issues.\n            - summary (str): Summary of the analysis.\n    :raises ValueError: If the traffic file is invalid.\n    \"\"\"\n    if not traffic_file:\n        raise ValueError(\"Traffic file must be provided.\")\n    return {\n        \"issues\": [\"Insecure transport\", \"SQL Injection\"],\n        \"summary\": \"Analysis complete with minor issues.\"\n    }", "user_query": "This is Bob from CryptoGuard. I want a comprehensive security assessment. First, scan the smart contract at 1234567890 on Ethereum, then analyze the network traffic using Wireshark on interface eth0, and finally run a Burp Suite analysis on the captured traffic to identify any potential security vulnerabilities.", "checklist": {"functions": ["scan_with_web3", "capture_traffic_with_wireshark", "analyze_traffic_with_burp_suite"], "values": [{"vulnerabilities": ["Reentrancy", "Unchecked external calls"], "status": "completed"}, ["Packet1", "Packet2", "Packet3"], {"issues": ["Insecure transport", "SQL Injection"], "summary": "Analysis complete with minor issues."}]}}
{"difficulty": "hard", "function_schema_python": "def design_crm_schema(entities: list, focus_areas: list) -> dict:\n    \"\"\"Designs a CRM schema based on a list of entities and focus areas.\n\n    :param entities: A list of entities involved in the CRM system.\n    :param focus_areas: A list of focus areas such as marketing campaigns and customer segmentation.\n    :return: A dictionary representing the CRM schema design.\n    :raises ValueError: If entities or focus_areas is empty.\"\"\"\n    pass\ndef integrate_social_media_data(source: str, data_type: str) -> dict:\n    \"\"\"Integrates social media data into the CRM system.\n\n    :param source: The source of the social media data (e.g., \"Twitter\").\n    :param data_type: The type of data to integrate (e.g., \"posts\", \"followers\").\n    :return: A dictionary representing the integrated data.\n    :raises ValueError: If source or data_type is empty.\"\"\"\n    pass\ndef fetch_market_trends(region: str, period: str) -> dict:\n    \"\"\"Fetches third-party market trends data.\n\n    :param region: The region for which to fetch trends (e.g., \"North America\").\n    :param period: The period for which to fetch trends (e.g., \"Q1 2023\").\n    :return: A dictionary representing the market trends data.\n    :raises ValueError: If region or period is empty.\"\"\"\n    pass\ndef optimize_data_retrieval(query: str, data_source: str) -> dict:\n    \"\"\"Optimizes data retrieval for reporting and personalized customer experiences.\n\n    :param query: The query string for data retrieval (e.g., \"customer purchase patterns\").\n    :param data_source: The data source to query (e.g., \"CRM database\").\n    :return: A dictionary representing the optimized data retrieval result.\n    :raises ValueError: If query or data_source is empty.\"\"\"\n    pass\ndef update_customer_engagement(customer_id: int, interaction_type: str) -> bool:\n    \"\"\"Updates the engagement level of a customer in the CRM system.\n\n    :param customer_id: The ID of the customer.\n    :param interaction_type: The type of interaction (e.g., \"email\", \"phone call\").\n    :return: True if the engagement level was successfully updated, False otherwise.\n    :raises ValueError: If customer_id or interaction_type is invalid.\"\"\"\n    pass\n", "function_schema_json": [{"name": "design_crm_schema", "description": "Designs a CRM schema based on a list of entities and focus areas.", "parameters": {"type": "object", "properties": {"entities": {"type": "array", "description": "A list of entities involved in the CRM system."}, "focus_areas": {"type": "array", "description": "A list of focus areas such as marketing campaigns and customer segmentation."}}, "required": ["entities", "focus_areas"], "additionalProperties": false}}, {"name": "integrate_social_media_data", "description": "Integrates social media data into the CRM system.", "parameters": {"type": "object", "properties": {"source": {"type": "string", "description": "The source of the social media data (e.g., \"Twitter\")."}, "data_type": {"type": "string", "description": "The type of data to integrate (e.g., \"posts\", \"followers\")."}}, "required": ["source", "data_type"], "additionalProperties": false}}, {"name": "fetch_market_trends", "description": "Fetches third-party market trends data.", "parameters": {"type": "object", "properties": {"region": {"type": "string", "description": "The region for which to fetch trends (e.g., \"North America\")."}, "period": {"type": "string", "description": "The period for which to fetch trends (e.g., \"Q1 2023\")."}}, "required": ["region", "period"], "additionalProperties": false}}, {"name": "optimize_data_retrieval", "description": "Optimizes data retrieval for reporting and personalized customer experiences.", "parameters": {"type": "object", "properties": {"query": {"type": "string", "description": "The query string for data retrieval (e.g., \"customer purchase patterns\")."}, "data_source": {"type": "string", "description": "The data source to query (e.g., \"CRM database\")."}}, "required": ["query", "data_source"], "additionalProperties": false}}, {"name": "update_customer_engagement", "description": "Updates the engagement level of a customer in the CRM system.", "parameters": {"type": "object", "properties": {"customer_id": {"type": "integer", "description": "The ID of the customer."}, "interaction_type": {"type": "string", "description": "The type of interaction (e.g., \"email\", \"phone call\")."}}, "required": ["customer_id", "interaction_type"], "additionalProperties": false}}], "mock_functions": "def design_crm_schema(entities: list, focus_areas: list) -> dict:\n    \"\"\"\n    Designs a CRM schema based on a list of entities and focus areas.\n    \n    :param entities: A list of entities involved in the CRM system.\n    :param focus_areas: A list of focus areas such as marketing campaigns and customer segmentation.\n    :return: A dictionary representing the CRM schema design.\n    :raises ValueError: If entities or focus_areas is empty.\n    \"\"\"\n    if not entities or not focus_areas:\n        raise ValueError(\"Entities and focus areas must be provided.\")\n    \n    # Mock logic: Return a basic schema design for demonstration\n    if entities and focus_areas:\n        schema = {\n            \"entities\": entities,\n            \"focus_areas\": focus_areas,\n            \"tables\": {\n                \"customers\": [\"customer_id\", \"name\", \"email\", \"purchase_history\", \"preferences\"],\n                \"campaigns\": [\"campaign_id\", \"name\", \"target_segment\", \"metrics\"],\n                \"engagement\": [\"engagement_id\", \"customer_id\", \"interaction_type\", \"timestamp\"]\n            }\n        }\n        return schema\n    return {}\ndef integrate_social_media_data(source: str, data_type: str) -> dict:\n    \"\"\"\n    Integrates social media data into the CRM system.\n    \n    :param source: The source of the social media data (e.g., \"Twitter\").\n    :param data_type: The type of data to integrate (e.g., \"posts\", \"followers\").\n    :return: A dictionary representing the integrated data.\n    :raises ValueError: If source or data_type is empty.\n    \"\"\"\n    if not source or not data_type:\n        raise ValueError(\"Source and data type must be provided.\")\n    \n    # Mock logic: Return a basic integration result for demonstration\n    if source and data_type:\n        integrated_data = {\n            \"source\": source,\n            \"data_type\": data_type,\n            \"data_samples\": [\n                {\"id\": 1, \"content\": \"Sample post from \" + source},\n                {\"id\": 2, \"content\": \"Another sample post from \" + source}\n            ]\n        }\n        return integrated_data\n    return {}\ndef fetch_market_trends(region: str, period: str) -> dict:\n    \"\"\"\n    Fetches third-party market trends data.\n    \n    :param region: The region for which to fetch trends (e.g., \"North America\").\n    :param period: The period for which to fetch trends (e.g., \"Q1 2023\").\n    :return: A dictionary representing the market trends data.\n    :raises ValueError: If region or period is empty.\n    \"\"\"\n    if not region or not period:\n        raise ValueError(\"Region and period must be provided.\")\n    \n    # Mock logic: Return a basic market trends data for demonstration\n    if region and period:\n        trends_data = {\n            \"region\": region,\n            \"period\": period,\n            \"trends\": [\n                {\"topic\": \"E-commerce\", \"growth\": \"10%\"},\n                {\"topic\": \"Sustainability\", \"growth\": \"8%\"}\n            ]\n        }\n        return trends_data\n    return {}\ndef optimize_data_retrieval(query: str, data_source: str) -> dict:\n    \"\"\"\n    Optimizes data retrieval for reporting and personalized customer experiences.\n    \n    :param query: The query string for data retrieval (e.g., \"customer purchase patterns\").\n    :param data_source: The data source to query (e.g., \"CRM database\").\n    :return: A dictionary representing the optimized data retrieval result.\n    :raises ValueError: If query or data_source is empty.\n    \"\"\"\n    if not query or not data_source:\n        raise ValueError(\"Query and data source must be provided.\")\n    \n    # Mock logic: Return a basic optimized data retrieval result for demonstration\n    if query and data_source:\n        retrieval_result = {\n            \"query\": query,\n            \"data_source\": data_source,\n            \"results\": [\n                {\"customer_id\": 1, \"pattern\": \"Frequency buyer\"},\n                {\"customer_id\": 2, \"pattern\": \"Occasional buyer\"}\n            ]\n        }\n        return retrieval_result\n    return {}\ndef update_customer_engagement(customer_id: int, interaction_type: str) -> bool:\n    \"\"\"\n    Updates the engagement level of a customer in the CRM system.\n    \n    :param customer_id: The ID of the customer.\n    :param interaction_type: The type of interaction (e.g., \"email\", \"phone call\").\n    :return: True if the engagement level was successfully updated, False otherwise.\n    :raises ValueError: If customer_id or interaction_type is invalid.\n    \"\"\"\n    if not isinstance(customer_id, int) or not interaction_type:\n        raise ValueError(\"Customer ID must be an integer and interaction type must be provided.\")\n    \n    # Mock logic: Simulate a successful update\n    if isinstance(customer_id, int) and interaction_type:\n        return True\n    return False", "user_query": "This is Sarah from Retail Solutions. Can you fetch market trends for \"North America\" in \"Q1 2024\", integrate it with Twitter data (data_type \"engagement\"), and design a CRM schema with entities [\"customers\", \"social_media\", \"market_trends\"] and focus areas [\"customer_behavior\", \"external_data\"]?", "checklist": {"functions": ["design_crm_schema", "integrate_social_media_data", "fetch_market_trends"], "values": [{"entities": ["customers", "social_media", "market_trends"], "focus_areas": ["customer_behavior", "external_data"], "tables": {"customers": ["customer_id", "name", "email", "purchase_history", "preferences"], "campaigns": ["campaign_id", "name", "target_segment", "metrics"], "engagement": ["engagement_id", "customer_id", "interaction_type", "timestamp"]}}, {"source": "Twitter", "data_type": "engagement", "data_samples": [{"id": 1, "content": "Sample post from Twitter"}, {"id": 2, "content": "Another sample post from Twitter"}]}, {"region": "North America", "period": "Q1 2024", "trends": [{"topic": "E-commerce", "growth": "10%"}, {"topic": "Sustainability", "growth": "8%"}]}]}}
{"difficulty": "hard", "function_schema_python": "def create_api(api_name: str, endpoints: list) -> dict:\n    \"\"\"Creates a new API with specified endpoints.\n\n    :param api_name: The name of the API to be created.\n    :param endpoints: A list of endpoint paths for the API.\n    :return: A dictionary representing the created API with the following keys:\n        - name (str): The name of the API.\n        - endpoints (list[str]): The list of endpoints.\n    :raises ValueError: If the API name is empty or endpoints are not provided.\"\"\"\n    pass\ndef deploy_web_application(app_name: str) -> str:\n    \"\"\"Deploys a web application with a load balancer.\n\n    :param app_name: The name of the web application to be deployed.\n    :return: A string confirming the deployment.\n    :raises ValueError: If the application name is empty.\"\"\"\n    pass\ndef configure_load_balancer(ssl_termination: bool) -> str:\n    \"\"\"Configures the load balancer with HTTP and SSL termination.\n\n    :param ssl_termination: Boolean indicating if SSL termination should be enabled.\n    :return: A string confirming the load balancer configuration.\"\"\"\n    pass\ndef launch_ec2_instance(instance_type: str) -> dict:\n    \"\"\"Launches an EC2 instance with a specified instance type.\n\n    :param instance_type: The type of EC2 instance to launch.\n    :return: A dictionary with instance details including the following keys:\n        - instance_type (str): The type of the instance.\n        - status (str): The status of the instance launch (\"running\" or \"failed\").\"\"\"\n    pass\n", "function_schema_json": [{"name": "create_api", "description": "Creates a new API with specified endpoints.", "parameters": {"type": "object", "properties": {"api_name": {"type": "string", "description": "The name of the API to be created."}, "endpoints": {"type": "array", "description": "A list of endpoint paths for the API."}}, "required": ["api_name", "endpoints"], "additionalProperties": false}}, {"name": "deploy_web_application", "description": "Deploys a web application with a load balancer.", "parameters": {"type": "object", "properties": {"app_name": {"type": "string", "description": "The name of the web application to be deployed."}}, "required": ["app_name"], "additionalProperties": false}}, {"name": "configure_load_balancer", "description": "Configures the load balancer with HTTP and SSL termination.", "parameters": {"type": "object", "properties": {"ssl_termination": {"type": "boolean", "description": "Boolean indicating if SSL termination should be enabled."}}, "required": ["ssl_termination"], "additionalProperties": false}}, {"name": "launch_ec2_instance", "description": "Launches an EC2 instance with a specified instance type.", "parameters": {"type": "object", "properties": {"instance_type": {"type": "string", "description": "The type of EC2 instance to launch."}}, "required": ["instance_type"], "additionalProperties": false}}], "mock_functions": "def create_api(api_name: str, endpoints: list) -> dict:\n    \"\"\"\n    Creates a new API with specified endpoints.\n    \n    :param api_name: The name of the API to be created.\n    :param endpoints: A list of endpoint paths for the API.\n    :return: A dictionary representing the created API with the following keys:\n        - name (str): The name of the API.\n        - endpoints (list[str]): The list of endpoints.\n    :raises ValueError: If the API name is empty or endpoints are not provided.\n    \"\"\"\n    if not api_name:\n        raise ValueError(\"API name must not be empty.\")\n    if not endpoints:\n        raise ValueError(\"Endpoints must be provided.\")\n    return {\n        \"name\": api_name,\n        \"endpoints\": endpoints\n    }\ndef deploy_web_application(app_name: str) -> str:\n    \"\"\"\n    Deploys a web application with a load balancer.\n    \n    :param app_name: The name of the web application to be deployed.\n    :return: A string confirming the deployment.\n    :raises ValueError: If the application name is empty.\n    \"\"\"\n    if not app_name:\n        raise ValueError(\"Application name must not be empty.\")\n    return f\"{app_name} has been deployed with a load balancer.\"\ndef configure_load_balancer(ssl_termination: bool) -> str:\n    \"\"\"\n    Configures the load balancer with HTTP and SSL termination.\n    \n    :param ssl_termination: Boolean indicating if SSL termination should be enabled.\n    :return: A string confirming the load balancer configuration.\n    \"\"\"\n    return f\"Load balancer configured with SSL termination: {ssl_termination}\"\ndef launch_ec2_instance(instance_type: str) -> dict:\n    \"\"\"\n    Launches an EC2 instance with a specified instance type.\n    \n    :param instance_type: The type of EC2 instance to launch.\n    :return: A dictionary with instance details including the following keys:\n        - instance_type (str): The type of the instance.\n        - status (str): The status of the instance launch (\"running\" or \"failed\").\n    \"\"\"\n    valid_instance_types = [\"c5.large\", \"m5.large\", \"t2.micro\"]\n    if instance_type not in valid_instance_types:\n        return {\n            \"instance_type\": instance_type,\n            \"status\": \"failed\"\n        }\n    return {\n        \"instance_type\": instance_type,\n        \"status\": \"running\"\n    }", "user_query": "This is Rahul Patel. Please launch an EC2 instance of type 'c5.large', then deploy 'AnalyticsWebApp' with load balancer SSL termination enabled, and create 'ClientAnalyticsAPI' with endpoints [\"/clients\", \"/data\"].", "checklist": {"functions": ["create_api", "deploy_web_application", "configure_load_balancer", "launch_ec2_instance"], "values": [{"name": "ClientAnalyticsAPI", "endpoints": ["/clients", "/data"]}, "AnalyticsWebApp has been deployed with a load balancer.", "Load balancer configured with SSL termination: True", {"instance_type": "c5.large", "status": "running"}]}}
{"difficulty": "hard", "function_schema_python": "def create_bastion_host(instance_type: str, region: str) -> dict:\n    \"\"\"Creates a new SSH bastion host in the specified AWS region.\n\n    :param instance_type: AWS instance type (e.g., 't3.large', 't3.xlarge')\n    :param region: AWS region (e.g., 'us-east-1')\n    :return: Dictionary containing instance details\n    :raises ValueError: If instance type or region is invalid\"\"\"\n    pass\ndef configure_session_manager(instance_id: str, max_sessions: int) -> dict:\n    \"\"\"Configures AWS Systems Manager Session Manager for the bastion host.\n\n    :param instance_id: AWS EC2 instance ID\n    :param max_sessions: Maximum number of concurrent SSH sessions\n    :return: Dictionary containing configuration status\n    :raises ValueError: If instance_id is invalid or max_sessions is out of range\"\"\"\n    pass\ndef setup_audit_logging(instance_id: str, log_retention_days: int) -> dict:\n    \"\"\"Sets up CloudWatch logging for SSH session auditing.\n\n    :param instance_id: AWS EC2 instance ID\n    :param log_retention_days: Number of days to retain audit logs\n    :return: Dictionary containing logging configuration details\n    :raises ValueError: If parameters are invalid\"\"\"\n    pass\n", "function_schema_json": [{"name": "create_bastion_host", "description": "Creates a new SSH bastion host in the specified AWS region.", "parameters": {"type": "object", "properties": {"instance_type": {"type": "string", "description": "AWS instance type (e.g., 't3.large', 't3.xlarge')"}, "region": {"type": "string", "description": "AWS region (e.g., 'us-east-1')"}}, "required": ["instance_type", "region"], "additionalProperties": false}}, {"name": "configure_session_manager", "description": "Configures AWS Systems Manager Session Manager for the bastion host.", "parameters": {"type": "object", "properties": {"instance_id": {"type": "string", "description": "AWS EC2 instance ID"}, "max_sessions": {"type": "integer", "description": "Maximum number of concurrent SSH sessions"}}, "required": ["instance_id", "max_sessions"], "additionalProperties": false}}, {"name": "setup_audit_logging", "description": "Sets up CloudWatch logging for SSH session auditing.", "parameters": {"type": "object", "properties": {"instance_id": {"type": "string", "description": "AWS EC2 instance ID"}, "log_retention_days": {"type": "integer", "description": "Number of days to retain audit logs"}}, "required": ["instance_id", "log_retention_days"], "additionalProperties": false}}], "mock_functions": "def create_bastion_host(instance_type: str, region: str) -> dict:\n    \"\"\"\n    Creates a new SSH bastion host in the specified AWS region.\n    \n    :param instance_type: AWS instance type (e.g., 't3.large', 't3.xlarge')\n    :param region: AWS region (e.g., 'us-east-1')\n    :return: Dictionary containing instance details\n    :raises ValueError: If instance type or region is invalid\n    \"\"\"\n    valid_instances = ['t3.large', 't3.xlarge', 't3.2xlarge']\n    valid_regions = ['us-east-1', 'us-west-2', 'eu-west-1']\n    \n    if instance_type not in valid_instances or region not in valid_regions:\n        raise ValueError(\"Invalid instance type or region\")\n    \n    return {\n        \"instance_id\": \"i-0123456789abcdef0\",\n        \"public_ip\": \"54.123.456.789\",\n        \"max_connections\": 100,\n        \"status\": \"running\"\n    }\ndef configure_session_manager(instance_id: str, max_sessions: int) -> dict:\n    \"\"\"\n    Configures AWS Systems Manager Session Manager for the bastion host.\n    \n    :param instance_id: AWS EC2 instance ID\n    :param max_sessions: Maximum number of concurrent SSH sessions\n    :return: Dictionary containing configuration status\n    :raises ValueError: If instance_id is invalid or max_sessions is out of range\n    \"\"\"\n    if not instance_id.startswith('i-') or len(instance_id) != 19:\n        raise ValueError(\"Invalid instance ID format\")\n    \n    if not 25 <= max_sessions <= 100:\n        raise ValueError(\"Max sessions must be between 25 and 100\")\n    \n    return {\n        \"status\": \"configured\",\n        \"max_sessions\": max_sessions,\n        \"audit_logging\": \"enabled\",\n        \"connection_timeout\": 3600\n    }\ndef setup_audit_logging(instance_id: str, log_retention_days: int) -> dict:\n    \"\"\"\n    Sets up CloudWatch logging for SSH session auditing.\n    \n    :param instance_id: AWS EC2 instance ID\n    :param log_retention_days: Number of days to retain audit logs\n    :return: Dictionary containing logging configuration details\n    :raises ValueError: If parameters are invalid\n    \"\"\"\n    if not instance_id.startswith('i-') or len(instance_id) != 19:\n        raise ValueError(\"Invalid instance ID\")\n    \n    if not 1 <= log_retention_days <= 365:\n        raise ValueError(\"Log retention must be between 1 and 365 days\")\n    \n    return {\n        \"log_group\": f\"/aws/ssh/{instance_id}\",\n        \"retention_days\": log_retention_days,\n        \"status\": \"enabled\",\n        \"streaming\": \"active\"\n    }", "user_query": "This is Marcus from DataFlow Inc. Please create a bastion host in us-east-1 using t3.2xlarge, configure it for 100 concurrent sessions, and set up audit logging with 90 days retention.", "checklist": {"functions": ["create_bastion_host", "configure_session_manager", "setup_audit_logging"], "values": [{"instance_id": "i-0123456789abcdef0", "public_ip": "54.123.456.789", "max_connections": 100, "status": "running"}, {"status": "configured", "max_sessions": 100, "audit_logging": "enabled", "connection_timeout": 3600}, {"log_group": "/aws/ssh/i-0123456789abcdef0", "retention_days": 90, "status": "enabled", "streaming": "active"}]}}
{"difficulty":"hard","function_schema_python":"def train_secure_net(training_data: dict, model_params: dict) -> dict:\n    \"\"\"Trains the SecureNet model on vulnerability data.\n\n    :param training_data: Dictionary containing vulnerability and network log data\n        Keys:\n        - vulnerabilities (list): List of known vulnerabilities\n        - network_logs (list): List of network activity logs\n    :param model_params: Dictionary containing model hyperparameters\n        Keys:\n        - learning_rate (float): Learning rate for the model\n        - epochs (int): Number of training epochs\n    :return: Dictionary containing training metrics\n        Keys:\n        - accuracy (float): Model accuracy\n        - loss (float): Training loss\n        - convergence_epoch (int): Epoch where model converged\n    :raises ValueError: If training data is invalid or empty\"\"\"\n    pass\ndef evaluate_model_performance(model_path: str, test_data: dict) -> dict:\n    \"\"\"Evaluates SecureNet's performance on test dataset.\n\n    :param model_path: Path to the trained model\n    :param test_data: Dictionary containing test dataset\n        Keys:\n        - vulnerabilities (list): Test vulnerability cases\n        - network_logs (list): Test network logs\n    :return: Dictionary containing evaluation metrics\n        Keys:\n        - precision (float): Model precision\n        - recall (float): Model recall\n        - f1_score (float): F1 score\n        - confusion_matrix (list): 2x2 confusion matrix\n    :raises FileNotFoundError: If model path is invalid\"\"\"\n    pass\ndef generate_vulnerability_report(evaluation_results: dict) -> dict:\n    \"\"\"Generates a comprehensive vulnerability assessment report.\n\n    :param evaluation_results: Dictionary containing model evaluation results\n        Keys:\n        - precision (float): Model precision\n        - recall (float): Model recall\n        - f1_score (float): F1 score\n        - confusion_matrix (list): 2x2 confusion matrix\n    :return: Dictionary containing the vulnerability report\n        Keys:\n        - risk_score (float): Overall risk score\n        - recommendations (list): List of improvement recommendations\n        - false_positives (int): Number of false positives\n        - false_negatives (int): Number of false negatives\n    :raises ValueError: If evaluation results are invalid\"\"\"\n    pass\n","function_schema_json":[{"name":"train_secure_net","description":"Trains the SecureNet model on vulnerability data.","parameters":{"type":"object","properties":{"training_data":{"type":"object","description":"Dictionary containing vulnerability and network log data"},"model_params":{"type":"object","description":"Dictionary containing model hyperparameters"}},"required":["training_data","model_params"],"additionalProperties":false}},{"name":"evaluate_model_performance","description":"Evaluates SecureNet's performance on test dataset.","parameters":{"type":"object","properties":{"model_path":{"type":"string","description":"Path to the trained model"},"test_data":{"type":"object","description":"Dictionary containing test dataset"}},"required":["model_path","test_data"],"additionalProperties":false}},{"name":"generate_vulnerability_report","description":"Generates a comprehensive vulnerability assessment report.","parameters":{"type":"object","properties":{"evaluation_results":{"type":"object","description":"Dictionary containing model evaluation results"}},"required":["evaluation_results"],"additionalProperties":false}}],"mock_functions":"def train_secure_net(training_data: dict, model_params: dict) -> dict:\n    \"\"\"\n    Trains the SecureNet model on vulnerability data.\n    \n    :param training_data: Dictionary containing vulnerability and network log data\n        Keys:\n        - vulnerabilities (list): List of known vulnerabilities\n        - network_logs (list): List of network activity logs\n    :param model_params: Dictionary containing model hyperparameters\n        Keys:\n        - learning_rate (float): Learning rate for the model\n        - epochs (int): Number of training epochs\n    :return: Dictionary containing training metrics\n        Keys:\n        - accuracy (float): Model accuracy\n        - loss (float): Training loss\n        - convergence_epoch (int): Epoch where model converged\n    :raises ValueError: If training data is invalid or empty\n    \"\"\"\n    if not training_data.get('vulnerabilities') or not training_data.get('network_logs'):\n        raise ValueError(\"Training data must contain vulnerabilities and network logs\")\n    \n    if model_params.get('learning_rate', 0) <= 0 or model_params.get('epochs', 0) <= 0:\n        raise ValueError(\"Invalid model parameters\")\n\n    return {\n        \"accuracy\": 0.89,\n        \"loss\": 0.15,\n        \"convergence_epoch\": 45\n    }\ndef evaluate_model_performance(model_path: str, test_data: dict) -> dict:\n    \"\"\"\n    Evaluates SecureNet's performance on test dataset.\n    \n    :param model_path: Path to the trained model\n    :param test_data: Dictionary containing test dataset\n        Keys:\n        - vulnerabilities (list): Test vulnerability cases\n        - network_logs (list): Test network logs\n    :return: Dictionary containing evaluation metrics\n        Keys:\n        - precision (float): Model precision\n        - recall (float): Model recall\n        - f1_score (float): F1 score\n        - confusion_matrix (list): 2x2 confusion matrix\n    :raises FileNotFoundError: If model path is invalid\n    \"\"\"\n    if not model_path.endswith('.pt') or 'securenet' not in model_path.lower():\n        raise FileNotFoundError(\"Invalid model path\")\n    \n    if not test_data.get('vulnerabilities') or not test_data.get('network_logs'):\n        raise ValueError(\"Invalid test data\")\n\n    return {\n        \"precision\": 0.92,\n        \"recall\": 0.87,\n        \"f1_score\": 0.89,\n        \"confusion_matrix\": [[156, 12], [18, 234]]\n    }\ndef generate_vulnerability_report(evaluation_results: dict) -> dict:\n    \"\"\"\n    Generates a comprehensive vulnerability assessment report.\n    \n    :param evaluation_results: Dictionary containing model evaluation results\n        Keys:\n        - precision (float): Model precision\n        - recall (float): Model recall\n        - f1_score (float): F1 score\n        - confusion_matrix (list): 2x2 confusion matrix\n    :return: Dictionary containing the vulnerability report\n        Keys:\n        - risk_score (float): Overall risk score\n        - recommendations (list): List of improvement recommendations\n        - false_positives (int): Number of false positives\n        - false_negatives (int): Number of false negatives\n    :raises ValueError: If evaluation results are invalid\n    \"\"\"\n    if not all(key in evaluation_results for key in ['precision', 'recall', 'f1_score', 'confusion_matrix']):\n        raise ValueError(\"Invalid evaluation results\")\n\n    return {\n        \"risk_score\": 7.5,\n        \"recommendations\": [\n            \"Enhance network traffic analysis\",\n            \"Implement additional SQL injection detection\",\n            \"Update XSS vulnerability patterns\"\n        ],\n        \"false_positives\": 12,\n        \"false_negatives\": 18\n    }","user_query":"This is Emily from SecureTech Inc.  I've trained SecureNet using training data: {'vulnerabilities': ['SQL Injection', 'XSS', 'CSRF'], 'network_logs': ['training_logs.csv']}, with parameters {'learning_rate': 0.01, 'epochs': 100}.  Evaluate the model ('models/securenet_v1.pt') against test data: {'vulnerabilities': ['SQL Injection', 'XSS'], 'network_logs': ['test_logs.csv']}, and provide a vulnerability report including recommendations.","checklist":{"functions":["evaluate_model_performance","generate_vulnerability_report"],"values":[{"precision":0.92,"recall":0.87,"f1_score":0.89,"confusion_matrix":[[156,12],[18,234]]},{"risk_score":7.5,"recommendations":["Enhance network traffic analysis","Implement additional SQL injection detection","Update XSS vulnerability patterns"],"false_positives":12,"false_negatives":18}]}}
{"difficulty": "hard", "function_schema_python": "def fine_tune_model(model_name: str, data_path: str) -> dict:\n    \"\"\"Fine-tunes a machine learning model using the provided data.\n\n    :param model_name: The name of the model to fine-tune (e.g., \"BankGuard\").\n    :param data_path: The file path to the data used for fine-tuning.\n    :return:\n        dict: A dictionary with the following keys:\n            - success (bool): Flag indicating if the fine-tuning was successful.\n            - message (str): A status message.\n    :raises ValueError: If model_name or data_path is empty.\"\"\"\n    pass\ndef integrate_model_with_pentest(model_name: str, pen_test_tools: list) -> dict:\n    \"\"\"Integrates a machine learning model with traditional pentesting tools.\n\n    :param model_name: The name of the model to integrate (e.g., \"BankGuard\").\n    :param pen_test_tools: A list of traditional pentesting tools to integrate with.\n    :return:\n        dict: A dictionary with the following keys:\n            - success (bool): Flag indicating if the integration was successful.\n            - message (str): A status message.\n    :raises ValueError: If model_name is empty or pen_test_tools is not a list or is empty.\"\"\"\n    pass\ndef validate_model(model_name: str, test_data_path: str) -> dict:\n    \"\"\"Validates the accuracy of a machine learning model using test data.\n\n    :param model_name: The name of the model to validate (e.g., \"BankGuard\").\n    :param test_data_path: The file path to the test data.\n    :return:\n        dict: A dictionary with the following keys:\n            - success (bool): Flag indicating if the validation was successful.\n            - accuracy (float): The accuracy of the model (0.0 to 1.0).\n            - message (str): A status message.\n    :raises ValueError: If model_name or test_data_path is empty.\"\"\"\n    pass\ndef generate_attack_vectors(tool_name: str, target_url: str) -> list:\n    \"\"\"Generates attack vectors for a target using a specified pentesting tool.\n\n    :param tool_name: The name of the pentesting tool to use (e.g., \"nmap\").\n    :param target_url: The URL of the target to generate attack vectors for.\n    :return:\n        list: A list of generated attack vectors.\n    :raises ValueError: If tool_name or target_url is empty.\"\"\"\n    pass\ndef log_results_to_mlflow(model_name: str, results: dict) -> bool:\n    \"\"\"Logs the results of a machine learning model to MLflow.\n\n    :param model_name: The name of the model whose results are being logged.\n    :param results: A dictionary containing the results to log.\n    :return: True if the logging was successful, False otherwise.\n    :raises ValueError: If model_name is empty or results is not a dictionary.\"\"\"\n    pass\n", "function_schema_json": [{"name": "fine_tune_model", "description": "Fine-tunes a machine learning model using the provided data.", "parameters": {"type": "object", "properties": {"model_name": {"type": "string", "description": "The name of the model to fine-tune (e.g., \"BankGuard\")."}, "data_path": {"type": "string", "description": "The file path to the data used for fine-tuning."}}, "required": ["model_name", "data_path"], "additionalProperties": false}}, {"name": "integrate_model_with_pentest", "description": "Integrates a machine learning model with traditional pentesting tools.", "parameters": {"type": "object", "properties": {"model_name": {"type": "string", "description": "The name of the model to integrate (e.g., \"BankGuard\")."}, "pen_test_tools": {"type": "array", "description": "A list of traditional pentesting tools to integrate with."}}, "required": ["model_name", "pen_test_tools"], "additionalProperties": false}}, {"name": "validate_model", "description": "Validates the accuracy of a machine learning model using test data.", "parameters": {"type": "object", "properties": {"model_name": {"type": "string", "description": "The name of the model to validate (e.g., \"BankGuard\")."}, "test_data_path": {"type": "string", "description": "The file path to the test data."}}, "required": ["model_name", "test_data_path"], "additionalProperties": false}}, {"name": "generate_attack_vectors", "description": "Generates attack vectors for a target using a specified pentesting tool.", "parameters": {"type": "object", "properties": {"tool_name": {"type": "string", "description": "The name of the pentesting tool to use (e.g., \"nmap\")."}, "target_url": {"type": "string", "description": "The URL of the target to generate attack vectors for."}}, "required": ["tool_name", "target_url"], "additionalProperties": false}}, {"name": "log_results_to_mlflow", "description": "Logs the results of a machine learning model to MLflow.", "parameters": {"type": "object", "properties": {"model_name": {"type": "string", "description": "The name of the model whose results are being logged."}, "results": {"type": "object", "description": "A dictionary containing the results to log."}}, "required": ["model_name", "results"], "additionalProperties": false}}], "mock_functions": "def fine_tune_model(model_name: str, data_path: str) -> dict:\n    \"\"\"\n    Fine-tunes a machine learning model using the provided data.\n    \n    :param model_name: The name of the model to fine-tune (e.g., \"BankGuard\").\n    :param data_path: The file path to the data used for fine-tuning.\n    :return:\n        dict: A dictionary with the following keys:\n            - success (bool): Flag indicating if the fine-tuning was successful.\n            - message (str): A status message.\n    :raises ValueError: If model_name or data_path is empty.\n    \"\"\"\n    if not model_name or not data_path:\n        raise ValueError(\"Model name and data path must be provided.\")\n    if model_name.lower() == \"bankguard\" and data_path.lower() == \"path/to/data.csv\":\n        return {\n            \"success\": True,\n            \"message\": \"Model BankGuard fine-tuned successfully.\"\n        }\n    return {\n        \"success\": False,\n        \"message\": \"Failed to fine-tune model.\"\n    }\ndef integrate_model_with_pentest(model_name: str, pen_test_tools: list) -> dict:\n    \"\"\"\n    Integrates a machine learning model with traditional pentesting tools.\n    \n    :param model_name: The name of the model to integrate (e.g., \"BankGuard\").\n    :param pen_test_tools: A list of traditional pentesting tools to integrate with.\n    :return:\n        dict: A dictionary with the following keys:\n            - success (bool): Flag indicating if the integration was successful.\n            - message (str): A status message.\n    :raises ValueError: If model_name is empty or pen_test_tools is not a list or is empty.\n    \"\"\"\n    if not model_name:\n        raise ValueError(\"Model name must be provided.\")\n    if not isinstance(pen_test_tools, list) or not pen_test_tools:\n        raise ValueError(\"Pentesting tools must be provided in a non-empty list.\")\n    if model_name.lower() == \"bankguard\" and pen_test_tools == [\"nmap\", \"metasploit\"]:\n        return {\n            \"success\": True,\n            \"message\": \"Model BankGuard integrated with nmap and metasploit successfully.\"\n        }\n    return {\n        \"success\": False,\n        \"message\": \"Failed to integrate model.\"\n    }\ndef validate_model(model_name: str, test_data_path: str) -> dict:\n    \"\"\"\n    Validates the accuracy of a machine learning model using test data.\n    \n    :param model_name: The name of the model to validate (e.g., \"BankGuard\").\n    :param test_data_path: The file path to the test data.\n    :return:\n        dict: A dictionary with the following keys:\n            - success (bool): Flag indicating if the validation was successful.\n            - accuracy (float): The accuracy of the model (0.0 to 1.0).\n            - message (str): A status message.\n    :raises ValueError: If model_name or test_data_path is empty.\n    \"\"\"\n    if not model_name or not test_data_path:\n        raise ValueError(\"Model name and test data path must be provided.\")\n    if model_name.lower() == \"bankguard\" and test_data_path.lower() == \"path/to/test_data.csv\":\n        return {\n            \"success\": True,\n            \"accuracy\": 0.92,\n            \"message\": \"Model BankGuard validated successfully with 92% accuracy.\"\n        }\n    return {\n        \"success\": False,\n        \"accuracy\": 0.0,\n        \"message\": \"Failed to validate model.\"\n    }\ndef generate_attack_vectors(tool_name: str, target_url: str) -> list:\n    \"\"\"\n    Generates attack vectors for a target using a specified pentesting tool.\n    \n    :param tool_name: The name of the pentesting tool to use (e.g., \"nmap\").\n    :param target_url: The URL of the target to generate attack vectors for.\n    :return:\n        list: A list of generated attack vectors.\n    :raises ValueError: If tool_name or target_url is empty.\n    \"\"\"\n    if not tool_name or not target_url:\n        raise ValueError(\"Tool name and target URL must be provided.\")\n    if tool_name.lower() == \"nmap\" and target_url.lower() == \"https://onlinebanking.banksafe.com\":\n        return [\n            \"Nmap scan of HTTPS service on https://onlinebanking.banksafe.com\",\n            \"Detected open port 443 (HTTPS)\",\n            \"Service version: Apache/2.4.41 (Ubuntu)\"\n        ]\n    return []\ndef log_results_to_mlflow(model_name: str, results: dict) -> bool:\n    \"\"\"\n    Logs the results of a machine learning model to MLflow.\n    \n    :param model_name: The name of the model whose results are being logged.\n    :param results: A dictionary containing the results to log.\n    :return: True if the logging was successful, False otherwise.\n    :raises ValueError: If model_name is empty or results is not a dictionary.\n    \"\"\"\n    if not model_name:\n        raise ValueError(\"Model name must be provided.\")\n    if not isinstance(results, dict):\n        raise ValueError(\"Results must be provided in a dictionary.\")\n    if model_name.lower() == \"bankguard\" and isinstance(results, dict):\n        return True\n    return False", "user_query": "This is Ryan from BankSafe. Please generate attack vectors using nmap for https://onlinebanking.banksafe.com, then validate BankGuard model with path/to/test_data.csv and log the validation results to MLflow.", "checklist": {"functions": ["generate_attack_vectors", "validate_model", "log_results_to_mlflow"], "values": [["Nmap scan of HTTPS service on https://onlinebanking.banksafe.com", "Detected open port 443 (HTTPS)", "Service version: Apache/2.4.41 (Ubuntu)"], {"success": true, "accuracy": 0.92, "message": "Model BankGuard validated successfully with 92% accuracy."}, true]}}
