{"difficulty": "hard", "function_schema_python": "def validate_hipaa_compliance(deployment_data: str) -> bool:\n    \"\"\"Validates that the deployment data is compliant with HIPAA regulations.\n\n    :param deployment_data: A string representing the deployment data.\n    :return: True if the deployment data is HIPAA compliant, False otherwise.\n    :raises ValueError: If deployment_data is empty.\"\"\"\n    pass\ndef perform_database_migration_validation(current_db: str, new_db: str) -> dict:\n    \"\"\"Validates the migration of a database from current_db to new_db.\n\n    :param current_db: A string representing the current database.\n    :param new_db: A string representing the new database.\n    :return:\n        dict: A dictionary with the following keys:\n            - is_valid (bool): Whether the migration is valid.\n            - validation_details (str): Details about the validation.\n    :raises ValueError: If current_db or new_db is empty.\"\"\"\n    pass\ndef setup_blue_green_deployment(environment_name: str) -> bool:\n    \"\"\"Sets up a blue-green deployment for the given environment.\n\n    :param environment_name: A string representing the environment name.\n    :return: True if the blue-green deployment is set up successfully, False otherwise.\n    :raises ValueError: If environment_name is empty.\"\"\"\n    pass\ndef automate_code_deployment(commit_id: str) -> str:\n    \"\"\"Automates the deployment of code with the given commit_id.\n\n    :param commit_id: A string representing the commit ID.\n    :return: A string indicating the success or failure of the deployment.\n    :raises ValueError: If commit_id is empty.\"\"\"\n    pass\ndef run_security_protocol_checks(environment_name: str) -> bool:\n    \"\"\"Runs security protocol checks for the given environment.\n\n    :param environment_name: A string representing the environment name.\n    :return: True if all security protocols are maintained, False otherwise.\n    :raises ValueError: If environment_name is empty.\"\"\"\n    pass\n", "function_schema_json": [{"name": "validate_hipaa_compliance", "description": "Validates that the deployment data is compliant with HIPAA regulations.", "parameters": {"type": "object", "properties": {"deployment_data": {"type": "string", "description": "A string representing the deployment data."}}, "required": ["deployment_data"], "additionalProperties": false}}, {"name": "perform_database_migration_validation", "description": "Validates the migration of a database from current_db to new_db.", "parameters": {"type": "object", "properties": {"current_db": {"type": "string", "description": "A string representing the current database."}, "new_db": {"type": "string", "description": "A string representing the new database."}}, "required": ["current_db", "new_db"], "additionalProperties": false}}, {"name": "setup_blue_green_deployment", "description": "Sets up a blue-green deployment for the given environment.", "parameters": {"type": "object", "properties": {"environment_name": {"type": "string", "description": "A string representing the environment name."}}, "required": ["environment_name"], "additionalProperties": false}}, {"name": "automate_code_deployment", "description": "Automates the deployment of code with the given commit_id.", "parameters": {"type": "object", "properties": {"commit_id": {"type": "string", "description": "A string representing the commit ID."}}, "required": ["commit_id"], "additionalProperties": false}}, {"name": "run_security_protocol_checks", "description": "Runs security protocol checks for the given environment.", "parameters": {"type": "object", "properties": {"environment_name": {"type": "string", "description": "A string representing the environment name."}}, "required": ["environment_name"], "additionalProperties": false}}], "mock_functions": "def validate_hipaa_compliance(deployment_data: str) -> bool:\n    \"\"\"\n    Validates that the deployment data is compliant with HIPAA regulations.\n    \n    :param deployment_data: A string representing the deployment data.\n    :return: True if the deployment data is HIPAA compliant, False otherwise.\n    :raises ValueError: If deployment_data is empty.\n    \"\"\"\n    if not deployment_data:\n        raise ValueError(\"Deployment data must not be empty.\")\n    # Mock logic: Assume all data is compliant if it has the keyword \"secure\".\n    return \"secure\" in deployment_data.lower()\ndef perform_database_migration_validation(current_db: str, new_db: str) -> dict:\n    \"\"\"\n    Validates the migration of a database from current_db to new_db.\n    \n    :param current_db: A string representing the current database.\n    :param new_db: A string representing the new database.\n    :return:\n        dict: A dictionary with the following keys:\n            - is_valid (bool): Whether the migration is valid.\n            - validation_details (str): Details about the validation.\n    :raises ValueError: If current_db or new_db is empty.\n    \"\"\"\n    if not current_db or not new_db:\n        raise ValueError(\"Current and new database must not be empty.\")\n    # Mock logic: Assume migration is valid if both databases start with \"MedTrack\".\n    return {\n        \"is_valid\": current_db.startswith(\"MedTrack\") and new_db.startswith(\"MedTrack\"),\n        \"validation_details\": \"Migration validated successfully\" if current_db.startswith(\"MedTrack\") and new_db.startswith(\"MedTrack\") else \"Migration validation failed\"\n    }\ndef setup_blue_green_deployment(environment_name: str) -> bool:\n    \"\"\"\n    Sets up a blue-green deployment for the given environment.\n    \n    :param environment_name: A string representing the environment name.\n    :return: True if the blue-green deployment is set up successfully, False otherwise.\n    :raises ValueError: If environment_name is empty.\n    \"\"\"\n    if not environment_name:\n        raise ValueError(\"Environment name must not be empty.\")\n    # Mock logic: Assume setup is successful if environment is \"production\".\n    return environment_name.lower() == \"production\"\ndef automate_code_deployment(commit_id: str) -> str:\n    \"\"\"\n    Automates the deployment of code with the given commit_id.\n    \n    :param commit_id: A string representing the commit ID.\n    :return: A string indicating the success or failure of the deployment.\n    :raises ValueError: If commit_id is empty.\n    \"\"\"\n    if not commit_id:\n        raise ValueError(\"Commit ID must not be empty.\")\n    # Mock logic: Assume deployment is successful if commit Id starts with \"abc\".\n    return \"Deployment successful\" if commit_id.startswith(\"abc\") else \"Deployment failed\"\ndef run_security_protocol_checks(environment_name: str) -> bool:\n    \"\"\"\n    Runs security protocol checks for the given environment.\n    \n    :param environment_name: A string representing the environment name.\n    :return: True if all security protocols are maintained, False otherwise.\n    :raises ValueError: If environment_name is empty.\n    \"\"\"\n    if not environment_name:\n        raise ValueError(\"Environment name must not be empty.\")\n    # Mock logic: Assume checks pass if environment name is \"secure-env\".\n    return environment_name == \"secure-env\"", "user_query": "This is Marcus from CloudScale.  Automate deployment for commit ID \"abc123xyz\", run security protocol checks for \"secure-env\", and ensure HIPAA compliance for deployment data \"secure patient data transfer and encryption\". Then, validate the database migration from \"MedTrack_DB_v1\" to \"MedTrack_DB_v2\".", "checklist": {"functions": ["automate_code_deployment", "run_security_protocol_checks", "validate_hipaa_compliance", "perform_database_migration_validation"], "values": ["Deployment successful", true, true, {"is_valid": true, "validation_details": "Migration validated successfully"}]}}
{"difficulty": "hard", "function_schema_python": "def load_dataset(dataset_path: str) -> List[Dict]:\n    \"\"\"Loads a dataset from a specified path.\n\n    :param dataset_path: The file path to the dataset.\n    :return: A list of dictionaries where each dictionary represents a data sample.\n    :raises FileNotFoundError: If the dataset file does not exist.\n    :raises ValueError: If the dataset file is empty or malformed.\"\"\"\n    pass\ndef train_model_with_huggingface_trl(dataset: List[Dict], model_config: Dict) -> Dict:\n    \"\"\"Trains a model using Hugging Face's TRL library.\n\n    :param dataset: The dataset used for training.\n    :param model_config: A dictionary containing model configuration parameters.\n    :return: A dictionary containing the training results.\n    :raises ValueError: If required parameters in model_config are missing.\"\"\"\n    pass\ndef optimize_hyperparameters_with_pytorch(dataset: List[Dict], hyperparameters: Dict) -> Dict:\n    \"\"\"Optimizes hyperparameters for a model using PyTorch.\n\n    :param dataset: The dataset used for hyperparameter optimization.\n    :param hyperparameters: A dictionary containing the hyperparameters to optimize.\n    :return: A dictionary containing the optimized hyperparameters and performance metrics.\n    :raises ValueError: If hyperparameters dictionary is empty.\"\"\"\n    pass\ndef upload_model_to_aws(model_path: str, bucket_name: str) -> bool:\n    \"\"\"Uploads a trained model to an S3 bucket on AWS.\n\n    :param model_path: The file path to the trained model.\n    :param bucket_name: The name of the S3 bucket.\n    :return: True if the model is successfully uploaded, False otherwise.\n    :raises ValueError: If model_path or bucket_name is empty.\n    :raises RuntimeError: If the upload fails.\"\"\"\n    pass\ndef log_experiment_results_with_mlflow(run_name: str, metrics: Dict) -> bool:\n    \"\"\"Logs experiment results using MLflow.\n\n    :param run_name: The name of the experiment run.\n    :param metrics: A dictionary containing the metrics to log.\n    :return: True if metrics are successfully logged, False otherwise.\n    :raises ValueError: If run_name or metrics are not provided.\"\"\"\n    pass\ndef get_suggested_model_config(model_type: str) -> Dict:\n    \"\"\"Retrieves a suggested model configuration based on the specified model type.\n\n    :param model_type: The type of the model.\n    :return: A dictionary containing the suggested model configuration.\n    :raises ValueError: If model_type is not supported.\"\"\"\n    pass\n", "function_schema_json": [{"name": "load_dataset", "description": "Loads a dataset from a specified path.", "parameters": {"type": "object", "properties": {"dataset_path": {"type": "string", "description": "The file path to the dataset."}}, "required": ["dataset_path"], "additionalProperties": false}}, {"name": "train_model_with_huggingface_trl", "description": "Trains a model using Hugging Face's TRL library.", "parameters": {"type": "object", "properties": {"dataset": {"type": "array", "items": {"type": "object"}, "description": "The dataset used for training."}, "model_config": {"type": "object", "description": "A dictionary containing model configuration parameters."}}, "required": ["dataset", "model_config"], "additionalProperties": false}}, {"name": "optimize_hyperparameters_with_pytorch", "description": "Optimizes hyperparameters for a model using PyTorch.", "parameters": {"type": "object", "properties": {"dataset": {"type": "array", "items": {"type": "object"}, "description": "The dataset used for hyperparameter optimization."}, "hyperparameters": {"type": "object", "description": "A dictionary containing the hyperparameters to optimize."}}, "required": ["dataset", "hyperparameters"], "additionalProperties": false}}, {"name": "upload_model_to_aws", "description": "Uploads a trained model to an S3 bucket on AWS.", "parameters": {"type": "object", "properties": {"model_path": {"type": "string", "description": "The file path to the trained model."}, "bucket_name": {"type": "string", "description": "The name of the S3 bucket."}}, "required": ["model_path", "bucket_name"], "additionalProperties": false}}, {"name": "log_experiment_results_with_mlflow", "description": "Logs experiment results using MLflow.", "parameters": {"type": "object", "properties": {"run_name": {"type": "string", "description": "The name of the experiment run."}, "metrics": {"type": "object", "description": "A dictionary containing the metrics to log."}}, "required": ["run_name", "metrics"], "additionalProperties": false}}, {"name": "get_suggested_model_config", "description": "Retrieves a suggested model configuration based on the specified model type.", "parameters": {"type": "object", "properties": {"model_type": {"type": "string", "description": "The type of the model."}}, "required": ["model_type"], "additionalProperties": false}}], "mock_functions": "def load_dataset(dataset_path: str) -> List[Dict]:\n    \"\"\"\n    Loads a dataset from a specified path.\n    \n    :param dataset_path: The file path to the dataset.\n    :return: A list of dictionaries where each dictionary represents a data sample.\n    :raises FileNotFoundError: If the dataset file does not exist.\n    :raises ValueError: If the dataset file is empty or malformed.\n    \"\"\"\n    if not dataset_path:\n        raise ValueError(\"Dataset path must be provided.\")\n    if dataset_path.lower() == \"financial_market_data.csv\":\n        return [\n            {\"features\": [1, 2, 3, 4], \"label\": 5},\n            {\"features\": [2, 3, 4, 5], \"label\": 6}\n        ]\n    else:\n        raise FileNotFoundError(\"Dataset not found.\")\ndef train_model_with_huggingface_trl(dataset: List[Dict], model_config: Dict) -> Dict:\n    \"\"\"\n    Trains a model using Hugging Face's TRL library.\n    \n    :param dataset: The dataset used for training.\n    :param model_config: A dictionary containing model configuration parameters.\n    :return: A dictionary containing the training results.\n    :raises ValueError: If required parameters in model_config are missing.\n    \"\"\"\n    required_params = {'model_type', 'learning_rate'}\n    if not all(param in model_config for param in required_params):\n        raise ValueError(\"Model configuration is missing required parameters.\")\n    return {\n        \"model_name\": model_config.get(\"model_type\"),\n        \"accuracy\": 0.85,\n        \"training_time\": \"2 hours\"\n    }\ndef optimize_hyperparameters_with_pytorch(dataset: List[Dict], hyperparameters: Dict) -> Dict:\n    \"\"\"\n    Optimizes hyperparameters for a model using PyTorch.\n    \n    :param dataset: The dataset used for hyperparameter optimization.\n    :param hyperparameters: A dictionary containing the hyperparameters to optimize.\n    :return: A dictionary containing the optimized hyperparameters and performance metrics.\n    :raises ValueError: If hyperparameters dictionary is empty.\n    \"\"\"\n    if not hyperparameters:\n        raise ValueError(\"Hyperparameters dictionary must not be empty.\")\n    return {\n        \"optimized_hyperparameters\": hyperparameters,\n        \"accuracy\": 0.90,\n        \"training_time\": \"1.5 hours\"\n    }\ndef upload_model_to_aws(model_path: str, bucket_name: str) -> bool:\n    \"\"\"\n    Uploads a trained model to an S3 bucket on AWS.\n    \n    :param model_path: The file path to the trained model.\n    :param bucket_name: The name of the S3 bucket.\n    :return: True if the model is successfully uploaded, False otherwise.\n    :raises ValueError: If model_path or bucket_name is empty.\n    :raises RuntimeError: If the upload fails.\n    \"\"\"\n    if not model_path or not bucket_name:\n        raise ValueError(\"Model path and bucket name must be provided.\")\n    if model_path.lower() == \"best_model.pth\" and bucket_name.lower() == \"neuralnetmodels\":\n        return True\n    raise RuntimeError(\"Failed to upload model to AWS.\")\ndef log_experiment_results_with_mlflow(run_name: str, metrics: Dict) -> bool:\n    \"\"\"\n    Logs experiment results using MLflow.\n    \n    :param run_name: The name of the experiment run.\n    :param metrics: A dictionary containing the metrics to log.\n    :return: True if metrics are successfully logged, False otherwise.\n    :raises ValueError: If run_name or metrics are not provided.\n    \"\"\"\n    if not run_name or not metrics:\n        raise ValueError(\"Run name and metrics must be provided.\")\n    return True\ndef get_suggested_model_config(model_type: str) -> Dict:\n    \"\"\"\n    Retrieves a suggested model configuration based on the specified model type.\n    \n    :param model_type: The type of the model.\n    :return: A dictionary containing the suggested model configuration.\n    :raises ValueError: If model_type is not supported.\n    \"\"\"\n    supported_models = {'lstm', 'transformer'}\n    if model_type.lower() not in supported_models:\n        raise ValueError(f\"Model type {model_type} is not supported.\")\n    if model_type.lower() == 'lstm':\n        return {\n            \"model_type\": \"LSTM\",\n            \"learning_rate\": 0.001,\n            \"batch_size\": 32\n        }\n    return {\n        \"model_type\": \"Transformer\",\n        \"learning_rate\": 0.0001,\n        \"batch_size\": 16\n    }", "user_query": "This is Alex from NeuralNet Solutions. Please train a model using the Hugging Face TRL library with the 'financial_market_data.csv' dataset, using the model configuration for 'Transformer' model type, and then log the results in MLflow with the run name 'Transformer Experiment'.", "checklist": {"functions": ["load_dataset", "get_suggested_model_config", "train_model_with_huggingface_trl", "log_experiment_results_with_mlflow"], "values": [[{"features": [1, 2, 3, 4], "label": 5}, {"features": [2, 3, 4, 5], "label": 6}], {"model_type": "Transformer", "learning_rate": 0.0001, "batch_size": 16}, {"model_name": "Transformer", "accuracy": 0.85, "training_time": "2 hours"}, true]}}
{"difficulty": "hard", "function_schema_python": "def optimize_model_training(model_framework: str, cloud_platform: str, optimization_strategy: str) -> Dict[str, Any]:\n    \"\"\"Optimizes model training based on the specified framework, platform, and strategy.\n\n    :param model_framework: The machine learning framework used (e.g., \"pytorch\").\n    :param cloud_platform: The cloud platform used for training (e.g., \"aws\").\n    :param optimization_strategy: The optimization strategy to apply (e.g., \"reduce_overfitting\").\n    :return: A dictionary containing optimization results.\n        - status (str): Status of the optimization process (e.g., \"success\", \"failed\").\n        - metrics (dict): Performance metrics after optimization (e.g., accuracy, loss).\n    :raises ValueError: If any parameter is invalid.\"\"\"\n    pass\ndef address_model_stability(model_framework: str, stability_issue: str) -> List[str]:\n    \"\"\"Provides solutions for addressing model stability issues.\n\n    :param model_framework: The machine learning framework used.\n    :param stability_issue: A description of the stability issue.\n    :return: A list of suggested solutions.\n    :raises ValueError: If model_framework or stability_issue is empty.\"\"\"\n    pass\ndef manage_training_resources(cloud_platform: str, resource_type: str, action: str) -> bool:\n    \"\"\"Manages computational resources on the specified cloud platform.\n\n    :param cloud_platform: The cloud platform being used (e.g., \"aws\").\n    :param resource_type: The type of resource to manage (e.g., \"GPU instances\").\n    :param action: The action to perform (e.g., \"allocate\", \"deallocate\").\n    :return: True if the action was successful, False otherwise.\n    :raises ValueError: If any parameter is invalid.\"\"\"\n    pass\ndef use_mlflow_tracking(experiment_name: str, metrics: Dict[str, float]) -> str:\n    \"\"\"Logs experiment details and metrics using MLflow.\n\n    :param experiment_name: The name of the experiment.\n    :param metrics: A dictionary of metrics to log.\n    :return: A string representing the run ID.\n    :raises ValueError: If any parameter is invalid.\"\"\"\n    pass\ndef apply_huggingface_trl(model_name: str, task: str) -> Dict[str, Any]:\n    \"\"\"Applies Hugging Face TRL for a specific task.\n\n    :param model_name: The name of the pre-trained model.\n    :param task: The task to perform (e.g., \"text_classification\").\n    :return: A dictionary containing the results of applying TRL.\n        - status (str): The status of the operation.\n        - model (Any): The fine-tuned model object.\"\"\"\n    pass\n", "function_schema_json": [{"name": "optimize_model_training", "description": "Optimizes model training based on the specified framework, platform, and strategy.", "parameters": {"type": "object", "properties": {"model_framework": {"type": "string", "description": "The machine learning framework used (e.g., \"pytorch\")."}, "cloud_platform": {"type": "string", "description": "The cloud platform used for training (e.g., \"aws\")."}, "optimization_strategy": {"type": "string", "description": "The optimization strategy to apply (e.g., \"reduce_overfitting\")."}}, "required": ["model_framework", "cloud_platform", "optimization_strategy"], "additionalProperties": false}}, {"name": "address_model_stability", "description": "Provides solutions for addressing model stability issues.", "parameters": {"type": "object", "properties": {"model_framework": {"type": "string", "description": "The machine learning framework used."}, "stability_issue": {"type": "string", "description": "A description of the stability issue."}}, "required": ["model_framework", "stability_issue"], "additionalProperties": false}}, {"name": "manage_training_resources", "description": "Manages computational resources on the specified cloud platform.", "parameters": {"type": "object", "properties": {"cloud_platform": {"type": "string", "description": "The cloud platform being used (e.g., \"aws\")."}, "resource_type": {"type": "string", "description": "The type of resource to manage (e.g., \"GPU instances\")."}, "action": {"type": "string", "description": "The action to perform (e.g., \"allocate\", \"deallocate\")."}}, "required": ["cloud_platform", "resource_type", "action"], "additionalProperties": false}}, {"name": "use_mlflow_tracking", "description": "Logs experiment details and metrics using MLflow.", "parameters": {"type": "object", "properties": {"experiment_name": {"type": "string", "description": "The name of the experiment."}, "metrics": {"type": "object", "description": "A dictionary of metrics to log."}}, "required": ["experiment_name", "metrics"], "additionalProperties": false}}, {"name": "apply_huggingface_trl", "description": "Applies Hugging Face TRL for a specific task.", "parameters": {"type": "object", "properties": {"model_name": {"type": "string", "description": "The name of the pre-trained model."}, "task": {"type": "string", "description": "The task to perform (e.g., \"text_classification\")."}}, "required": ["model_name", "task"], "additionalProperties": false}}], "mock_functions": "def optimize_model_training(model_framework: str, cloud_platform: str, optimization_strategy: str) -> Dict[str, Any]:\n    \"\"\"\n    Optimizes model training based on the specified framework, platform, and strategy.\n\n    :param model_framework: The machine learning framework used (e.g., \"pytorch\").\n    :param cloud_platform: The cloud platform used for training (e.g., \"aws\").\n    :param optimization_strategy: The optimization strategy to apply (e.g., \"reduce_overfitting\").\n    :return: A dictionary containing optimization results.\n        - status (str): Status of the optimization process (e.g., \"success\", \"failed\").\n        - metrics (dict): Performance metrics after optimization (e.g., accuracy, loss).\n    :raises ValueError: If any parameter is invalid.\n    \"\"\"\n    if not model_framework or not cloud_platform or not optimization_strategy:\n        raise ValueError(\"All parameters must be provided.\")\n\n    if model_framework.lower() == \"pytorch\" and cloud_platform.lower() == \"aws\" and optimization_strategy == \"reduce_overfitting\":\n        return {\n            \"status\": \"success\",\n            \"metrics\": {\n                \"accuracy\": 0.95,\n                \"loss\": 0.1\n            }\n        }\n    return {\"status\": \"failed\", \"metrics\": {}}\ndef address_model_stability(model_framework: str, stability_issue: str) -> List[str]:\n    \"\"\"\n    Provides solutions for addressing model stability issues.\n\n    :param model_framework: The machine learning framework used.\n    :param stability_issue: A description of the stability issue.\n    :return: A list of suggested solutions.\n    :raises ValueError: If model_framework or stability_issue is empty.\n    \"\"\"\n    if not model_framework or not stability_issue:\n        raise ValueError(\"Model framework and stability issue must be provided.\")\n    if model_framework.lower() == \"pytorch\" and \"overfitting\" in stability_issue.lower():\n        return [\n            \"Use regularization techniques (L1 or L2)\",\n            \"Apply dropout layers\",\n            \"Perform data augmentation\",\n            \"Reduce model complexity\"\n        ]\n    return []\ndef manage_training_resources(cloud_platform: str, resource_type: str, action: str) -> bool:\n    \"\"\"\n    Manages computational resources on the specified cloud platform.\n\n    :param cloud_platform: The cloud platform being used (e.g., \"aws\").\n    :param resource_type: The type of resource to manage (e.g., \"GPU instances\").\n    :param action: The action to perform (e.g., \"allocate\", \"deallocate\").\n    :return: True if the action was successful, False otherwise.\n    :raises ValueError: If any parameter is invalid.\n    \"\"\"\n    if not cloud_platform or not resource_type or not action:\n        raise ValueError(\"All parameters must be provided.\")\n    if cloud_platform.lower() == \"aws\" and resource_type == \"GPU instances\" and action == \"allocate\":\n        return True\n    return False\ndef use_mlflow_tracking(experiment_name: str, metrics: Dict[str, float]) -> str:\n    \"\"\"\n    Logs experiment details and metrics using MLflow.\n\n    :param experiment_name: The name of the experiment.\n    :param metrics: A dictionary of metrics to log.\n    :return: A string representing the run ID.\n    :raises ValueError: If any parameter is invalid.\n    \"\"\"\n    if not experiment_name or not metrics:\n        raise ValueError(\"Experiment name and metrics must be provided.\")\n\n    if experiment_name == \"StormPredict\" and \"accuracy\" in metrics and \"loss\" in metrics:\n        return \"MLflow_run_ID_12345\"\n    return \"\"\ndef apply_huggingface_trl(model_name: str, task: str) -> Dict[str, Any]:\n    \"\"\"\n    Applies Hugging Face TRL for a specific task.\n\n    :param model_name: The name of the pre-trained model.\n    :param task: The task to perform (e.g., \"text_classification\").\n    :return: A dictionary containing the results of applying TRL.\n        - status (str): The status of the operation.\n        - model (Any): The fine-tuned model object.\n    \"\"\"\n\n    if model_name and task:\n        return {\"status\": \"success\", \"model\": \"Fine-tuned model object\"}\n    return {}", "user_query": "This is Dr. Elena Morris from UC Berkeley. I want to track the StormPredict experiment using MLflow. Can you optimize the PyTorch model training on AWS, log the metrics (targeting 0.95 accuracy and 0.1 loss), and provide stability solutions for overfitting while allocating GPU instances?", "checklist": {"functions": ["address_model_stability", "optimize_model_training", "manage_training_resources", "use_mlflow_tracking"], "values": [["Use regularization techniques (L1 or L2)", "Apply dropout layers", "Perform data augmentation", "Reduce model complexity"], {"status": "success", "metrics": {"accuracy": 0.95, "loss": 0.1}}, true, "MLflow_run_ID_12345"]}}
{"difficulty": "hard", "function_schema_python": "def create_api_with_fastapi(routes: list, framework: str) -> dict:\n    \"\"\"Creates an API using the FastAPI framework.\n\n    :param routes: A list of API routes definitions.\n    :param framework: The web framework to use (should be 'fastapi').\n    :return:\n        dict: A dictionary with the following keys:\n            - status (str): The status of API creation (\"success\" or \"failure\").\n            - message (str): A message indicating the result.\n    :raises ValueError: If the framework is not 'fastapi' or routes are not provided.\"\"\"\n    pass\ndef create_api_with_flask(routes: list, framework: str) -> dict:\n    \"\"\"Creates an API using the Flask framework.\n\n    :param routes: A list of API routes definitions.\n    :param framework: The web framework to use (should be 'flask').\n    :return:\n        dict: A dictionary with the following keys:\n            - status (str): The status of API creation (\"success\" or \"failure\").\n            - message (str): A message indicating the result.\n    :raises ValueError: If the framework is not 'flask' or routes are not provided.\"\"\"\n    pass\ndef setup_load_testing_with_locust(scenario: str) -> str:\n    \"\"\"Sets up load testing using Locust based on a given scenario.\n\n    :param scenario: A string describing the load testing scenario.\n    :return: A string indicating the result of the setup.\n    :raises RuntimeError: If the scenario description is empty.\"\"\"\n    pass\ndef run_load_test(test_plan: str) -> dict:\n    \"\"\"Runs a load test using a pre-defined test plan.\n\n    :param test_plan: A string representing the test plan.\n    :return:\n        dict: A dictionary with the following keys:\n            - result (str): The result of the load test (\"pass\" or \"fail\").\n            - message (str): A message indicating the result.\n    :raises ValueError: If the test plan is not provided.\"\"\"\n    pass\ndef analyze_load_test_results(results: list) -> dict:\n    \"\"\"Analyzes the results of a load test.\n\n    :param results: A list of load test results.\n    :return:\n        dict: A dictionary with the following keys:\n            - passed (bool): Whether the load test passed.\n            - performance (dict): A dictionary containing performance metrics.\n    :raises ValueError: If results are not provided.\"\"\"\n    pass\ndef generate_api_documentation(api: str) -> str:\n    \"\"\"Generates API documentation.\n\n    :param api: A string representing the API.\n    :return: A string representing the API documentation.\n    :raises ValueError: If the API is not provided.\"\"\"\n    pass\ndef use_postman_for_testing(api: str) -> str:\n    \"\"\"Uses Postman for testing the API.\n\n    :param api: A string representing the API.\n    :return: A string indicating the result of the testing.\n    :raises ValueError: If the API is not provided.\"\"\"\n    pass\n", "function_schema_json": [{"name": "create_api_with_fastapi", "description": "Creates an API using the FastAPI framework.", "parameters": {"type": "object", "properties": {"routes": {"type": "array", "description": "A list of API routes definitions."}, "framework": {"type": "string", "description": "The web framework to use (should be 'fastapi')."}}, "required": ["routes", "framework"], "additionalProperties": false}}, {"name": "create_api_with_flask", "description": "Creates an API using the Flask framework.", "parameters": {"type": "object", "properties": {"routes": {"type": "array", "description": "A list of API routes definitions."}, "framework": {"type": "string", "description": "The web framework to use (should be 'flask')."}}, "required": ["routes", "framework"], "additionalProperties": false}}, {"name": "setup_load_testing_with_locust", "description": "Sets up load testing using Locust based on a given scenario.", "parameters": {"type": "object", "properties": {"scenario": {"type": "string", "description": "A string describing the load testing scenario."}}, "required": ["scenario"], "additionalProperties": false}}, {"name": "run_load_test", "description": "Runs a load test using a pre-defined test plan.", "parameters": {"type": "object", "properties": {"test_plan": {"type": "string", "description": "A string representing the test plan."}}, "required": ["test_plan"], "additionalProperties": false}}, {"name": "analyze_load_test_results", "description": "Analyzes the results of a load test.", "parameters": {"type": "object", "properties": {"results": {"type": "array", "description": "A list of load test results."}}, "required": ["results"], "additionalProperties": false}}, {"name": "generate_api_documentation", "description": "Generates API documentation.", "parameters": {"type": "object", "properties": {"api": {"type": "string", "description": "A string representing the API."}}, "required": ["api"], "additionalProperties": false}}, {"name": "use_postman_for_testing", "description": "Uses Postman for testing the API.", "parameters": {"type": "object", "properties": {"api": {"type": "string", "description": "A string representing the API."}}, "required": ["api"], "additionalProperties": false}}], "mock_functions": "def create_api_with_fastapi(routes: list, framework: str) -> dict:\n    \"\"\"\n    Creates an API using the FastAPI framework.\n    \n    :param routes: A list of API routes definitions.\n    :param framework: The web framework to use (should be 'fastapi').\n    :return:\n        dict: A dictionary with the following keys:\n            - status (str): The status of API creation (\"success\" or \"failure\").\n            - message (str): A message indicating the result.\n    :raises ValueError: If the framework is not 'fastapi' or routes are not provided.\n    \"\"\"\n    if framework != 'fastapi':\n        raise ValueError(\"Unsupported framework. Please use 'fastapi'.\")\n    if not routes:\n        raise ValueError(\"Routes must be provided.\")\n    return {\n        \"status\": \"success\",\n        \"message\": \"API successfully created using FastAPI.\"\n    }\ndef create_api_with_flask(routes: list, framework: str) -> dict:\n    \"\"\"\n    Creates an API using the Flask framework.\n    \n    :param routes: A list of API routes definitions.\n    :param framework: The web framework to use (should be 'flask').\n    :return:\n        dict: A dictionary with the following keys:\n            - status (str): The status of API creation (\"success\" or \"failure\").\n            - message (str): A message indicating the result.\n    :raises ValueError: If the framework is not 'flask' or routes are not provided.\n    \"\"\"\n    if framework != 'flask':\n        raise ValueError(\"Unsupported framework. Please use 'flask'.\")\n    if not routes:\n        raise ValueError(\"Routes must be provided.\")\n    return {\n        \"status\": \"success\",\n        \"message\": \"API successfully created using Flask.\"\n    }\ndef setup_load_testing_with_locust(scenario: str) -> str:\n    \"\"\"\n    Sets up load testing using Locust based on a given scenario.\n    \n    :param scenario: A string describing the load testing scenario.\n    :return: A string indicating the result of the setup.\n    :raises RuntimeError: If the scenario description is empty.\n    \"\"\"\n    if not scenario:\n        raise RuntimeError(\"Scenario must be provided.\")\n    return \"Locust setup for the load testing scenario is complete.\"\ndef run_load_test(test_plan: str) -> dict:\n    \"\"\"\n    Runs a load test using a pre-defined test plan.\n    \n    :param test_plan: A string representing the test plan.\n    :return:\n        dict: A dictionary with the following keys:\n            - result (str): The result of the load test (\"pass\" or \"fail\").\n            - message (str): A message indicating the result.\n    :raises ValueError: If the test plan is not provided.\n    \"\"\"\n    if not test_plan:\n        raise ValueError(\"Test plan must be provided.\")\n    return {\n        \"result\": \"pass\",\n        \"message\": \"Load test executed successfully and passed.\"\n    }\ndef analyze_load_test_results(results: list) -> dict:\n    \"\"\"\n    Analyzes the results of a load test.\n    \n    :param results: A list of load test results.\n    :return:\n        dict: A dictionary with the following keys:\n            - passed (bool): Whether the load test passed.\n            - performance (dict): A dictionary containing performance metrics.\n    :raises ValueError: If results are not provided.\n    \"\"\"\n    if not results:\n        raise ValueError(\"Results must be provided.\")\n    return {\n        \"passed\": True,\n        \"performance\": {\n            \"throughput\": 1000.5,\n            \"response_time\": 250.0,\n            \"error_rate\": 0.01\n        }\n    }\ndef generate_api_documentation(api: str) -> str:\n    \"\"\"\n    Generates API documentation.\n    \n    :param api: A string representing the API.\n    :return: A string representing the API documentation.\n    :raises ValueError: If the API is not provided.\n    \"\"\"\n    if not api:\n        raise ValueError(\"API must be provided.\")\n    return \"Documentation for API is generated and available.\"\ndef use_postman_for_testing(api: str) -> str:\n    \"\"\"\n    Uses Postman for testing the API.\n    \n    :param api: A string representing the API.\n    :return: A string indicating the result of the testing.\n    :raises ValueError: If the API is not provided.\n    \"\"\"\n    if not api:\n        raise ValueError(\"API must be provided.\")\n    return \"API testing with Postman is complete.\"", "user_query": "This is Sarah Thompson. First create an API with FastAPI using the routes [\"/fitness/track\", \"/fitness/stats\"], then setup load testing with locust for \"2000 concurrent users performing fitness tracking operations\", run the test, and analyze the results.", "checklist": {"functions": ["create_api_with_fastapi", "setup_load_testing_with_locust", "run_load_test", "analyze_load_test_results"], "values": [{"status": "success", "message": "API successfully created using FastAPI."}, "Locust setup for the load testing scenario is complete.", {"result": "pass", "message": "Load test executed successfully and passed."}, {"passed": true, "performance": {"throughput": 1000.5, "response_time": 250.0, "error_rate": 0.01}}]}}
{"difficulty": "hard", "function_schema_python": "def search_venues(city: str, capacity: int, budget_range: tuple[int, int]) -> list[dict]:\n    \"\"\"Searches for venue options based on city, capacity, and budget requirements.\n\n    :param city: City where the venue is located\n    :param capacity: Required capacity for attendees\n    :param budget_range: Tuple of (min_budget, max_budget) in USD\n    :return: List of dictionaries containing venue information\n    :raises ValueError: If capacity is <= 0 or budget range is invalid\"\"\"\n    pass\ndef verify_av_capabilities(venue_name: str) -> dict:\n    \"\"\"Checks audiovisual capabilities of a specific venue.\n\n    :param venue_name: Name of the venue to check\n    :return: Dictionary containing AV equipment details\n    :raises ValueError: If venue_name is empty\"\"\"\n    pass\ndef check_venue_availability(venue_name: str, date: str) -> dict:\n    \"\"\"Checks venue availability for a specific date.\n\n    :param venue_name: Name of the venue\n    :param date: Date in 'YYYY-MM-DD' format\n    :return: Dictionary containing availability and pricing information\n    :raises ValueError: If date format is incorrect\"\"\"\n    pass\n", "function_schema_json": [{"name": "search_venues", "description": "Searches for venue options based on city, capacity, and budget requirements.", "parameters": {"type": "object", "properties": {"city": {"type": "string", "description": "City where the venue is located"}, "capacity": {"type": "integer", "description": "Required capacity for attendees"}, "budget_range": {"type": "string", "description": "Tuple of (min_budget, max_budget) in USD"}}, "required": ["city", "capacity", "budget_range"], "additionalProperties": false}}, {"name": "verify_av_capabilities", "description": "Checks audiovisual capabilities of a specific venue.", "parameters": {"type": "object", "properties": {"venue_name": {"type": "string", "description": "Name of the venue to check"}}, "required": ["venue_name"], "additionalProperties": false}}, {"name": "check_venue_availability", "description": "Checks venue availability for a specific date.", "parameters": {"type": "object", "properties": {"venue_name": {"type": "string", "description": "Name of the venue"}, "date": {"type": "string", "description": "Date in 'YYYY-MM-DD' format"}}, "required": ["venue_name", "date"], "additionalProperties": false}}], "mock_functions": "def search_venues(\n    city: str, \n    capacity: int, \n    budget_range: tuple[int, int]\n) -> list[dict]:\n    \"\"\"\n    Searches for venue options based on city, capacity, and budget requirements.\n    \n    :param city: City where the venue is located\n    :param capacity: Required capacity for attendees\n    :param budget_range: Tuple of (min_budget, max_budget) in USD\n    :return: List of dictionaries containing venue information\n    :raises ValueError: If capacity is <= 0 or budget range is invalid\n    \"\"\"\n    if capacity <= 0:\n        raise ValueError(\"Capacity must be greater than 0\")\n    if budget_range[0] > budget_range[1]:\n        raise ValueError(\"Invalid budget range\")\n\n    if (city.lower() == \"seattle\" and \n        200 <= capacity <= 300 and \n        10000 <= budget_range[1] <= 25000):\n        return [\n            {\n                \"name\": \"Seattle Convention Center\",\n                \"capacity\": 300,\n                \"price\": 15000,\n                \"breakout_rooms\": 4,\n                \"transit_access\": True,\n                \"parking_spots\": 200\n            },\n            {\n                \"name\": \"Tech Hub Seattle\",\n                \"capacity\": 250,\n                \"price\": 12000,\n                \"breakout_rooms\": 3,\n                \"transit_access\": True,\n                \"parking_spots\": 150\n            }\n        ]\n    return []\ndef verify_av_capabilities(venue_name: str) -> dict:\n    \"\"\"\n    Checks audiovisual capabilities of a specific venue.\n    \n    :param venue_name: Name of the venue to check\n    :return: Dictionary containing AV equipment details\n    :raises ValueError: If venue_name is empty\n    \"\"\"\n    if not venue_name:\n        raise ValueError(\"Venue name cannot be empty\")\n        \n    valid_venues = {\n        \"seattle convention center\": {\n            \"projectors\": True,\n            \"sound_system\": True,\n            \"wireless_mics\": 4,\n            \"video_recording\": True,\n            \"streaming_capability\": True\n        },\n        \"tech hub seattle\": {\n            \"projectors\": True,\n            \"sound_system\": True,\n            \"wireless_mics\": 2,\n            \"video_recording\": True,\n            \"streaming_capability\": False\n        }\n    }\n    \n    return valid_venues.get(venue_name.lower(), {})\ndef check_venue_availability(\n    venue_name: str, \n    date: str\n) -> dict:\n    \"\"\"\n    Checks venue availability for a specific date.\n    \n    :param venue_name: Name of the venue\n    :param date: Date in 'YYYY-MM-DD' format\n    :return: Dictionary containing availability and pricing information\n    :raises ValueError: If date format is incorrect\n    \"\"\"\n    if not venue_name or not date:\n        raise ValueError(\"Venue name and date must be provided\")\n    \n    if (venue_name.lower() in [\"seattle convention center\", \"tech hub seattle\"] and \n        date == \"2024-03-15\"):\n        return {\n            \"available\": True,\n            \"base_price\": 15000,\n            \"setup_time\": \"2 hours\",\n            \"teardown_time\": \"2 hours\",\n            \"available_hours\": \"8:00 AM - 10:00 PM\"\n        }\n    return {\"available\": False}", "user_query": "This is Michael from the conference planning team. Please verify the availability of both Seattle Convention Center and Tech Hub Seattle for our conference date of 2024-03-15, and provide their AV capabilities and pricing details.", "checklist": {"functions": ["verify_av_capabilities", "verify_av_capabilities", "check_venue_availability", "check_venue_availability"], "values": [{"projectors": true, "sound_system": true, "wireless_mics": 4, "video_recording": true, "streaming_capability": true}, {"projectors": true, "sound_system": true, "wireless_mics": 2, "video_recording": true, "streaming_capability": false}, {"available": true, "base_price": 15000, "setup_time": "2 hours", "teardown_time": "2 hours", "available_hours": "8:00 AM - 10:00 PM"}, {"available": true, "base_price": 15000, "setup_time": "2 hours", "teardown_time": "2 hours", "available_hours": "8:00 AM - 10:00 PM"}]}}
{"difficulty": "hard", "function_schema_python": "def clone_github_repo(url: str, branch: str) -> bool:\n    \"\"\"Clones a GitHub repository from the given URL and checks out the specified branch.\n\n    :param url: The URL of the GitHub repository (e.g., \"github.com/johnDoe/ProjectX\").\n    :param branch: The branch to checkout (e.g., \"prod\").\n    :return: True if the repository was successfully cloned and branch checked out.\n    :raises ValueError: If the URL or branch is not valid.\"\"\"\n    pass\ndef build_docker_image(repo_path: str) -> str:\n    \"\"\"Builds a Docker image from a Dockerfile located in the specified repository path.\n\n    :param repo_path: The path to the repository containing the Dockerfile.\n    :return: The Docker image ID if the build is successful.\n    :raises RuntimeError: If the build fails.\"\"\"\n    pass\ndef push_docker_image_to_aws(image_id: str, ecr_url: str) -> bool:\n    \"\"\"Pushes a Docker image to an AWS ECR repository.\n\n    :param image_id: The Docker image ID to push.\n    :param ecr_url: The URL of the AWS ECR repository.\n    :return: True if the image was successfully pushed.\n    :raises ValueError: If the image ID or ECR URL is not valid.\"\"\"\n    pass\ndef create_or_update_aws_elastic_beanstalk_application(app_name: str, env_name: str, region: str, ecr_image_url: str) -> dict:\n    \"\"\"Creates or updates an AWS Elastic Beanstalk application with the specified parameters.\n\n    :param app_name: The name of the application (e.g., \"ProjectX\").\n    :param env_name: The name of the environment (e.g., \"projectx-env\").\n    :param region: The AWS region (e.g., \"us-west-2\").\n    :param ecr_image_url: The URL of the Docker image in ECR.\n    :return:\n        dict: A dictionary with the following keys:\n            - application_name (str): The name of the application.\n            - environment_name (str): The name of the environment.\n            - region (str): The AWS region.\n            - status (str): The deployment status (e.g., \"success\").\n    :raises ValueError: If any parameter is not valid.\"\"\"\n    pass\ndef monitor_deployment_environment(env_name: str) -> list:\n    \"\"\"Monitors the deployment environment for real-time updates and logs.\n\n    :param env_name: The name of the environment (e.g., \"projectx-env\").\n    :return: A list of logs or updates.\n    :raises ValueError: If the environment name is not valid.\"\"\"\n    pass\n", "function_schema_json": [{"name": "clone_github_repo", "description": "Clones a GitHub repository from the given URL and checks out the specified branch.", "parameters": {"type": "object", "properties": {"url": {"type": "string", "description": "The URL of the GitHub repository (e.g., \"github.com/johnDoe/ProjectX\")."}, "branch": {"type": "string", "description": "The branch to checkout (e.g., \"prod\")."}}, "required": ["url", "branch"], "additionalProperties": false}}, {"name": "build_docker_image", "description": "Builds a Docker image from a Dockerfile located in the specified repository path.", "parameters": {"type": "object", "properties": {"repo_path": {"type": "string", "description": "The path to the repository containing the Dockerfile."}}, "required": ["repo_path"], "additionalProperties": false}}, {"name": "push_docker_image_to_aws", "description": "Pushes a Docker image to an AWS ECR repository.", "parameters": {"type": "object", "properties": {"image_id": {"type": "string", "description": "The Docker image ID to push."}, "ecr_url": {"type": "string", "description": "The URL of the AWS ECR repository."}}, "required": ["image_id", "ecr_url"], "additionalProperties": false}}, {"name": "create_or_update_aws_elastic_beanstalk_application", "description": "Creates or updates an AWS Elastic Beanstalk application with the specified parameters.", "parameters": {"type": "object", "properties": {"app_name": {"type": "string", "description": "The name of the application (e.g., \"ProjectX\")."}, "env_name": {"type": "string", "description": "The name of the environment (e.g., \"projectx-env\")."}, "region": {"type": "string", "description": "The AWS region (e.g., \"us-west-2\")."}, "ecr_image_url": {"type": "string", "description": "The URL of the Docker image in ECR."}}, "required": ["app_name", "env_name", "region", "ecr_image_url"], "additionalProperties": false}}, {"name": "monitor_deployment_environment", "description": "Monitors the deployment environment for real-time updates and logs.", "parameters": {"type": "object", "properties": {"env_name": {"type": "string", "description": "The name of the environment (e.g., \"projectx-env\")."}}, "required": ["env_name"], "additionalProperties": false}}], "mock_functions": "def clone_github_repo(url: str, branch: str) -> bool:\n    \"\"\"\n    Clones a GitHub repository from the given URL and checks out the specified branch.\n    \n    :param url: The URL of the GitHub repository (e.g., \"github.com/johnDoe/ProjectX\").\n    :param branch: The branch to checkout (e.g., \"prod\").\n    :return: True if the repository was successfully cloned and branch checked out.\n    :raises ValueError: If the URL or branch is not valid.\n    \"\"\"\n    if not url or not branch:\n        raise ValueError(\"URL and branch must be provided.\")\n    if url == \"github.com/johnDoe/ProjectX\" and branch == \"prod\":\n        return True\n    return False\ndef build_docker_image(repo_path: str) -> str:\n    \"\"\"\n    Builds a Docker image from a Dockerfile located in the specified repository path.\n    \n    :param repo_path: The path to the repository containing the Dockerfile.\n    :return: The Docker image ID if the build is successful.\n    :raises RuntimeError: If the build fails.\n    \"\"\"\n    if not repo_path:\n        raise RuntimeError(\"Repository path must be provided.\")\n    return \"sha256:abcdef1234567890abcdef1234567890abcdef1234567890abcdef1234567890\"\ndef push_docker_image_to_aws(image_id: str, ecr_url: str) -> bool:\n    \"\"\"\n    Pushes a Docker image to an AWS ECR repository.\n    \n    :param image_id: The Docker image ID to push.\n    :param ecr_url: The URL of the AWS ECR repository.\n    :return: True if the image was successfully pushed.\n    :raises ValueError: If the image ID or ECR URL is not valid.\n    \"\"\"\n    if not image_id or not ecr_url:\n        raise ValueError(\"Image ID and ECR URL must be provided.\")\n    return True\ndef create_or_update_aws_elastic_beanstalk_application(app_name: str, env_name: str, region: str, ecr_image_url: str) -> dict:\n    \"\"\"\n    Creates or updates an AWS Elastic Beanstalk application with the specified parameters.\n    \n    :param app_name: The name of the application (e.g., \"ProjectX\").\n    :param env_name: The name of the environment (e.g., \"projectx-env\").\n    :param region: The AWS region (e.g., \"us-west-2\").\n    :param ecr_image_url: The URL of the Docker image in ECR.\n    :return:\n        dict: A dictionary with the following keys:\n            - application_name (str): The name of the application.\n            - environment_name (str): The name of the environment.\n            - region (str): The AWS region.\n            - status (str): The deployment status (e.g., \"success\").\n    :raises ValueError: If any parameter is not valid.\n    \"\"\"\n    if not app_name or not env_name or not region or not ecr_image_url:\n        raise ValueError(\"All parameters must be provided and valid.\")\n    return {\n        \"application_name\": app_name,\n        \"environment_name\": env_name,\n        \"region\": region,\n        \"status\": \"success\"\n    }\ndef monitor_deployment_environment(env_name: str) -> list:\n    \"\"\"\n    Monitors the deployment environment for real-time updates and logs.\n    \n    :param env_name: The name of the environment (e.g., \"projectx-env\").\n    :return: A list of logs or updates.\n    :raises ValueError: If the environment name is not valid.\n    \"\"\"\n    if not env_name:\n        raise ValueError(\"Environment name must be provided.\")\n    return [\n        \"Environment setup initiated.\",\n        \"Docker image successfully pulled.\",\n        \"Application deployment in progress.\",\n        \"Deployment completed successfully.\"\n    ]", "user_query": "This is John from Innovate Inc. Please clone github.com/johnDoe/ProjectX with prod branch, build the Docker image, push it to ecr.aws.com/projectx, deploy to Elastic Beanstalk environment projectx-env in us-west-2 region, and monitor the deployment.", "checklist": {"functions": ["clone_github_repo", "build_docker_image", "push_docker_image_to_aws", "create_or_update_aws_elastic_beanstalk_application", "monitor_deployment_environment"], "values": [true, "sha256:abcdef1234567890abcdef1234567890abcdef1234567890abcdef1234567890", true, {"application_name": "ProjectX", "environment_name": "projectx-env", "region": "us-west-2", "status": "success"}, ["Environment setup initiated.", "Docker image successfully pulled.", "Application deployment in progress.", "Deployment completed successfully."]]}}
{"difficulty": "hard", "function_schema_python": "def analyze_network_traffic(ip_address: str, interface: str) -> dict:\n    \"\"\"Analyzes network traffic for a specific IP address using Wireshark-like functionality.\n\n    :param ip_address: The IP address to analyze.\n    :param interface: The network interface to monitor.\n    :return: Dictionary containing traffic analysis results:\n        - packet_count (int): Number of packets detected\n        - protocols (list): List of protocols used\n        - suspicious_patterns (list): List of suspicious patterns\n    :raises ValueError: If IP address format is invalid.\"\"\"\n    pass\ndef scan_ports(target_ip: str, port_range: str) -> dict:\n    \"\"\"Performs port scanning using nmap-like functionality.\n\n    :param target_ip: The IP address to scan.\n    :param port_range: Range of ports to scan (e.g., \"1-1000\").\n    :return: Dictionary containing scan results:\n        - open_ports (list): List of open ports\n        - services (dict): Dictionary mapping ports to services\n    :raises ValueError: If IP address or port range is invalid.\"\"\"\n    pass\ndef calculate_threat_score(ip_address: str, traffic_data: dict, scan_results: dict) -> float:\n    \"\"\"Calculates threat score based on analysis results.\n\n    :param ip_address: The IP address being analyzed.\n    :param traffic_data: Network traffic analysis results.\n    :param scan_results: Port scan results.\n    :return: Threat score between 0 and 1 (1 being highest threat).\n    :raises ValueError: If input data is invalid.\"\"\"\n    pass\ndef generate_mitigation_actions(threat_score: float) -> list:\n    \"\"\"Generates recommended actions based on threat score.\n\n    :param threat_score: Calculated threat score (0-1).\n    :return: List of recommended actions.\n    :raises ValueError: If threat score is not between 0 and 1.\"\"\"\n    pass\n", "function_schema_json": [{"name": "analyze_network_traffic", "description": "Analyzes network traffic for a specific IP address using Wireshark-like functionality.", "parameters": {"type": "object", "properties": {"ip_address": {"type": "string", "description": "The IP address to analyze."}, "interface": {"type": "string", "description": "The network interface to monitor."}}, "required": ["ip_address", "interface"], "additionalProperties": false}}, {"name": "scan_ports", "description": "Performs port scanning using nmap-like functionality.", "parameters": {"type": "object", "properties": {"target_ip": {"type": "string", "description": "The IP address to scan."}, "port_range": {"type": "string", "description": "Range of ports to scan (e.g., \"1-1000\")."}}, "required": ["target_ip", "port_range"], "additionalProperties": false}}, {"name": "calculate_threat_score", "description": "Calculates threat score based on analysis results.", "parameters": {"type": "object", "properties": {"ip_address": {"type": "string", "description": "The IP address being analyzed."}, "traffic_data": {"type": "object", "description": "Network traffic analysis results."}, "scan_results": {"type": "object", "description": "Port scan results."}}, "required": ["ip_address", "traffic_data", "scan_results"], "additionalProperties": false}}, {"name": "generate_mitigation_actions", "description": "Generates recommended actions based on threat score.", "parameters": {"type": "object", "properties": {"threat_score": {"type": "number", "description": "Calculated threat score (0-1)."}}, "required": ["threat_score"], "additionalProperties": false}}], "mock_functions": "def analyze_network_traffic(ip_address: str, interface: str = \"eth0\") -> dict:\n    \"\"\"\n    Analyzes network traffic for a specific IP address using Wireshark-like functionality.\n    \n    :param ip_address: The IP address to analyze.\n    :param interface: The network interface to monitor.\n    :return: Dictionary containing traffic analysis results:\n        - packet_count (int): Number of packets detected\n        - protocols (list): List of protocols used\n        - suspicious_patterns (list): List of suspicious patterns\n    :raises ValueError: If IP address format is invalid.\n    \"\"\"\n    if not ip_address.startswith(\"192.168.\"):\n        raise ValueError(\"Invalid IP address format\")\n    \n    if ip_address == \"192.168.1.100\":\n        return {\n            \"packet_count\": 1500,\n            \"protocols\": [\"HTTP\", \"SSH\", \"DNS\"],\n            \"suspicious_patterns\": [\"Port scanning\", \"Multiple failed login attempts\"]\n        }\n    return {\"packet_count\": 0, \"protocols\": [], \"suspicious_patterns\": []}\ndef scan_ports(target_ip: str, port_range: str = \"1-1000\") -> dict:\n    \"\"\"\n    Performs port scanning using nmap-like functionality.\n    \n    :param target_ip: The IP address to scan.\n    :param port_range: Range of ports to scan (e.g., \"1-1000\").\n    :return: Dictionary containing scan results:\n        - open_ports (list): List of open ports\n        - services (dict): Dictionary mapping ports to services\n    :raises ValueError: If IP address or port range is invalid.\n    \"\"\"\n    if target_ip == \"192.168.1.100\":\n        return {\n            \"open_ports\": [22, 80, 443, 3389],\n            \"services\": {\n                \"22\": \"SSH\",\n                \"80\": \"HTTP\",\n                \"443\": \"HTTPS\",\n                \"3389\": \"RDP\"\n            }\n        }\n    return {\"open_ports\": [], \"services\": {}}\ndef calculate_threat_score(ip_address: str, traffic_data: dict, scan_results: dict) -> float:\n    \"\"\"\n    Calculates threat score based on analysis results.\n    \n    :param ip_address: The IP address being analyzed.\n    :param traffic_data: Network traffic analysis results.\n    :param scan_results: Port scan results.\n    :return: Threat score between 0 and 1 (1 being highest threat).\n    :raises ValueError: If input data is invalid.\n    \"\"\"\n    if (ip_address == \"192.168.1.100\" and \n        traffic_data.get(\"suspicious_patterns\") and \n        scan_results.get(\"open_ports\")):\n        return 0.85\n    return 0.1\ndef generate_mitigation_actions(threat_score: float) -> list:\n    \"\"\"\n    Generates recommended actions based on threat score.\n    \n    :param threat_score: Calculated threat score (0-1).\n    :return: List of recommended actions.\n    :raises ValueError: If threat score is not between 0 and 1.\n    \"\"\"\n    if not 0 <= threat_score <= 1:\n        raise ValueError(\"Threat score must be between 0 and 1\")\n    \n    if threat_score > 0.8:\n        return [\n            \"Block IP address immediately\",\n            \"Enable enhanced monitoring\",\n            \"Update firewall rules\",\n            \"Notify security team\"\n        ]\n    return [\"Continue monitoring\"]", "user_query": "Can you analyze the network traffic for IP 192.168.1.100?", "checklist": {"functions": ["analyze_network_traffic", "scan_ports", "calculate_threat_score", "generate_mitigation_actions"], "values": [{"packet_count": 1500, "protocols": ["HTTP", "SSH", "DNS"], "suspicious_patterns": ["Port scanning", "Multiple failed login attempts"]}, {"open_ports": [22, 80, 443, 3389], "services": {"22": "SSH", "80": "HTTP", "443": "HTTPS", "3389": "RDP"}}, 0.85, ["Block IP address immediately", "Enable enhanced monitoring", "Update firewall rules", "Notify security team"]]}}
{"difficulty": "hard", "function_schema_python": "def extract_website_data(source_id: str, start_date: str, end_date: str) -> dict:\n    \"\"\"Extracts website analytics data from a specified source between given dates.\n\n    :param source_id: The identifier of the data source (e.g., \"GT-Web-Analytics-2024\").\n    :param start_date: The start date in the format \"YYYY-MM-DD\".\n    :param end_date: The end date in the format \"YYYY-MM-DD\".\n    :return:\n        dict: A dictionary with the following keys:\n            - user_ids (list[int]): List of user IDs.\n            - timestamps (list[str]): List of timestamps in the format \"YYYY-MM-DD HH:MM:SS\".\n            - product_ids (list[str]): List of product IDs.\n            - visits (list[int]): Number of visits for each user/product entry.\n    :raises ValueError: If any parameter is invalid.\"\"\"\n    pass\ndef extract_social_media_data(source_id: str, start_date: str, end_date: str) -> dict:\n    \"\"\"Extracts social media engagement data from a specified source between given dates.\n\n    :param source_id: The identifier of the data source (e.g., \"GT-Social-2024\").\n    :param start_date: The start date in the format \"YYYY-MM-DD\".\n    :param end_date: The end date in the format \"YYYY-MM-DD\".\n    :return:\n        dict: A dictionary with the following keys:\n            - user_ids (list[int]): List of user IDs.\n            - timestamps (list[str]): List of timestamps in the format \"YYYY-MM-DD HH:MM:SS\".\n            - product_ids (list[str]): List of product IDs.\n            - likes (list[int]): Number of likes for each user/product entry.\n            - shares (list[int]): Number of shares for each user/product entry.\n            - comments (list[int]): Number of comments for each user/product entry.\n    :raises ValueError: If any parameter is invalid.\"\"\"\n    pass\ndef aggregate_daily_engagement(web_data: dict, social_data: dict) -> dict:\n    \"\"\"Aggregates daily engagement data from website and social media sources for each product.\n\n    :param web_data: Website analytics data dictionary.\n    :param social_data: Social media engagement data dictionary.\n    :return:\n        dict: A dictionary with the following keys:\n            - product_ids (list[str]): List of product IDs.\n            - dates (list[str]): List of dates in the format \"YYYY-MM-DD\".\n            - visits (list[int]): Total website visits for each product and date.\n            - likes (list[int]): Total likes for each product and date.\n            - shares (list[int]): Total shares for each product and date.\n            - comments (list[int]): Total comments for each product and date.\n    :raises ValueError: If any parameter is invalid.\"\"\"\n    pass\ndef generate_engagement_graph(aggregated_data: dict) -> str:\n    \"\"\"Generates a graph visualizing combined daily engagement metrics for each product.\n\n    :param aggregated_data: Aggregated engagement data dictionary.\n    :return:\n        str: A string representation of the generated graph.\n    :raises ValueError: If the aggregated data is invalid.\"\"\"\n    pass\n", "function_schema_json": [{"name": "extract_website_data", "description": "Extracts website analytics data from a specified source between given dates.", "parameters": {"type": "object", "properties": {"source_id": {"type": "string", "description": "The identifier of the data source (e.g., \"GT-Web-Analytics-2024\")."}, "start_date": {"type": "string", "description": "The start date in the format \"YYYY-MM-DD\"."}, "end_date": {"type": "string", "description": "The end date in the format \"YYYY-MM-DD\"."}}, "required": ["source_id", "start_date", "end_date"], "additionalProperties": false}}, {"name": "extract_social_media_data", "description": "Extracts social media engagement data from a specified source between given dates.", "parameters": {"type": "object", "properties": {"source_id": {"type": "string", "description": "The identifier of the data source (e.g., \"GT-Social-2024\")."}, "start_date": {"type": "string", "description": "The start date in the format \"YYYY-MM-DD\"."}, "end_date": {"type": "string", "description": "The end date in the format \"YYYY-MM-DD\"."}}, "required": ["source_id", "start_date", "end_date"], "additionalProperties": false}}, {"name": "aggregate_daily_engagement", "description": "Aggregates daily engagement data from website and social media sources for each product.", "parameters": {"type": "object", "properties": {"web_data": {"type": "object", "description": "Website analytics data dictionary."}, "social_data": {"type": "object", "description": "Social media engagement data dictionary."}}, "required": ["web_data", "social_data"], "additionalProperties": false}}, {"name": "generate_engagement_graph", "description": "Generates a graph visualizing combined daily engagement metrics for each product.", "parameters": {"type": "object", "properties": {"aggregated_data": {"type": "object", "description": "Aggregated engagement data dictionary."}}, "required": ["aggregated_data"], "additionalProperties": false}}], "mock_functions": "def extract_website_data(source_id: str, start_date: str, end_date: str) -> dict:\n    \"\"\"\n    Extracts website analytics data from a specified source between given dates.\n    \n    :param source_id: The identifier of the data source (e.g., \"GT-Web-Analytics-2024\").\n    :param start_date: The start date in the format \"YYYY-MM-DD\".\n    :param end_date: The end date in the format \"YYYY-MM-DD\".\n    :return:\n        dict: A dictionary with the following keys:\n            - user_ids (list[int]): List of user IDs.\n            - timestamps (list[str]): List of timestamps in the format \"YYYY-MM-DD HH:MM:SS\".\n            - product_ids (list[str]): List of product IDs.\n            - visits (list[int]): Number of visits for each user/product entry.\n    :raises ValueError: If any parameter is invalid.\n    \"\"\"\n    if not source_id or not start_date or not end_date:\n        raise ValueError(\"Source ID, start date, and end date must be provided.\")\n    if source_id != \"GT-Web-Analytics-2024\":\n        raise ValueError(\"Invalid source ID.\")\n    if start_date > end_date:\n        raise ValueError(\"Start date must be before end date.\")\n    \n    # Mock data\n    return {\n        \"user_ids\": [101, 102, 103],\n        \"timestamps\": [\"2024-07-01 12:34:56\", \"2024-07-01 15:01:01\", \"2024-07-02 08:23:45\"],\n        \"product_ids\": [\"P001\", \"P002\", \"P001\"],\n        \"visits\": [1, 1, 2]\n    }\ndef extract_social_media_data(source_id: str, start_date: str, end_date: str) -> dict:\n    \"\"\"\n    Extracts social media engagement data from a specified source between given dates.\n    \n    :param source_id: The identifier of the data source (e.g., \"GT-Social-2024\").\n    :param start_date: The start date in the format \"YYYY-MM-DD\".\n    :param end_date: The end date in the format \"YYYY-MM-DD\".\n    :return:\n        dict: A dictionary with the following keys:\n            - user_ids (list[int]): List of user IDs.\n            - timestamps (list[str]): List of timestamps in the format \"YYYY-MM-DD HH:MM:SS\".\n            - product_ids (list[str]): List of product IDs.\n            - likes (list[int]): Number of likes for each user/product entry.\n            - shares (list[int]): Number of shares for each user/product entry.\n            - comments (list[int]): Number of comments for each user/product entry.\n    :raises ValueError: If any parameter is invalid.\n    \"\"\"\n    if not source_id or not start_date or not end_date:\n        raise ValueError(\"Source ID, start date, and end date must be provided.\")\n    if source_id != \"GT-Social-2024\":\n        raise ValueError(\"Invalid source ID.\")\n    if start_date > end_date:\n        raise ValueError(\"Start date must be before end date.\")\n    \n    # Mock data\n    return {\n        \"user_ids\": [101, 102, 103],\n        \"timestamps\": [\"2024-07-01 13:01:01\", \"2024-07-01 16:34:56\", \"2024-07-02 09:30:45\"],\n        \"product_ids\": [\"P001\", \"P002\", \"P001\"],\n        \"likes\": [5, 3, 7],\n        \"shares\": [2, 1, 3],\n        \"comments\": [1, 0, 2]\n    }\ndef aggregate_daily_engagement(web_data: dict, social_data: dict) -> dict:\n    \"\"\"\n    Aggregates daily engagement data from website and social media sources for each product.\n    \n    :param web_data: Website analytics data dictionary.\n    :param social_data: Social media engagement data dictionary.\n    :return:\n        dict: A dictionary with the following keys:\n            - product_ids (list[str]): List of product IDs.\n            - dates (list[str]): List of dates in the format \"YYYY-MM-DD\".\n            - visits (list[int]): Total website visits for each product and date.\n            - likes (list[int]): Total likes for each product and date.\n            - shares (list[int]): Total shares for each product and date.\n            - comments (list[int]): Total comments for each product and date.\n    :raises ValueError: If any parameter is invalid.\n    \"\"\"\n    if not web_data or not social_data:\n        raise ValueError(\"Website and social data must be provided.\")\n    \n    # Mock aggregation logic\n    aggregated_data = {\n        \"product_ids\": [\"P001\", \"P001\", \"P002\"],\n        \"dates\": [\"2024-07-01\", \"2024-07-02\", \"2024-07-01\"],\n        \"visits\": [3, 2, 1],\n        \"likes\": [12, 7, 3],\n        \"shares\": [5, 3, 1],\n        \"comments\": [3, 2, 0]\n    }\n    return aggregated_data\ndef generate_engagement_graph(aggregated_data: dict) -> str:\n    \"\"\"\n    Generates a graph visualizing combined daily engagement metrics for each product.\n    \n    :param aggregated_data: Aggregated engagement data dictionary.\n    :return:\n        str: A string representation of the generated graph.\n    :raises ValueError: If the aggregated data is invalid.\n    \"\"\"\n    if not aggregated_data:\n        raise ValueError(\"Aggregated data must be provided.\")\n    \n    # Mock graph generation logic\n    return f\"Graph generated for products: {aggregated_data['product_ids']} on dates: {aggregated_data['dates']} with combined metrics.\"", "user_query": "This is David from Global Trends Inc. Extract website data from GT-Web-Analytics-2024 and social media data from GT-Social-2024 (both between 2024-07-01 and 2024-08-31), aggregate the daily engagement, and generate a graph visualizing the combined metrics.", "checklist": {"functions": ["extract_website_data", "extract_social_media_data", "aggregate_daily_engagement", "generate_engagement_graph"], "values": [{"user_ids": [101, 102, 103], "timestamps": ["2024-07-01 12:34:56", "2024-07-01 15:01:01", "2024-07-02 08:23:45"], "product_ids": ["P001", "P002", "P001"], "visits": [1, 1, 2]}, {"user_ids": [101, 102, 103], "timestamps": ["2024-07-01 13:01:01", "2024-07-01 16:34:56", "2024-07-02 09:30:45"], "product_ids": ["P001", "P002", "P001"], "likes": [5, 3, 7], "shares": [2, 1, 3], "comments": [1, 0, 2]}, {"product_ids": ["P001", "P001", "P002"], "dates": ["2024-07-01", "2024-07-02", "2024-07-01"], "visits": [3, 2, 1], "likes": [12, 7, 3], "shares": [5, 3, 1], "comments": [3, 2, 0]}, "Graph generated for products: ['P001', 'P001', 'P002'] on dates: ['2024-07-01', '2024-07-02', '2024-07-01'] with combined metrics."]}}
{"difficulty": "hard", "function_schema_python": "def get_query_execution_plan(query_id: str, db_instance_id: str) -> dict:\n    \"\"\"Retrieves the query execution plan for a given query ID on a specified database instance.\n\n    :param query_id: The ID of the query for which the execution plan is requested.\n    :param db_instance_id: The ID of the database instance.\n    :return:\n        dict: A dictionary with the following keys:\n            - query (str): The SQL query.\n            - execution_plan (str): The execution plan of the query.\n    :raises ValueError: If query_id or db_instance_id is empty or incorrect.\"\"\"\n    pass\ndef analyze_query_performance(query_id: str, db_instance_id: str, time_range: str) -> dict:\n    \"\"\"Analyzes the performance of a given query over a specified time range on a database instance.\n\n    :param query_id: The ID of the query for which performance is analyzed.\n    :param db_instance_id: The ID of the database instance.\n    :param time_range: The time range for the analysis (e.g., \"last 24 hours\").\n    :return:\n        dict: A dictionary with the following keys:\n            - query_id (str): The ID of the query.\n            - avg_execution_time (float): Average execution time of the query in milliseconds.\n            - execution_count (int): Number of times the query was executed.\n    :raises ValueError: If any parameter is empty or incorrect.\"\"\"\n    pass\ndef suggest_indexing_strategy(query_execution_plan: dict) -> list:\n    \"\"\"Suggests indexing strategies based on the provided query execution plan.\n\n    :param query_execution_plan: A dictionary containing the query and its execution plan.\n    :return:\n        list: A list of indexing suggestions.\n    :raises ValueError: If the query execution plan is empty or incorrect.\"\"\"\n    pass\ndef generate_performance_report(query_id: str, db_instance_id: str, time_range: str) -> dict:\n    \"\"\"Generates a performance report for a given query over a specified time range on a database instance.\n\n    :param query_id: The ID of the query for which the report is generated.\n    :param db_instance_id: The ID of the database instance.\n    :param time_range: The time range for the performance analysis (e.g., \"last 24 hours\").\n    :return:\n        dict: A dictionary with the following keys:\n            - query_id (str): The ID of the query.\n            - avg_execution_time (float): Average execution time of the query in milliseconds.\n            - execution_count (int): Number of times the query was executed.\n            - indexing_suggestions (list): List of suggested indexing strategies.\n    :raises ValueError: If any parameter is empty or incorrect.\"\"\"\n    pass\n", "function_schema_json": [{"name": "get_query_execution_plan", "description": "Retrieves the query execution plan for a given query ID on a specified database instance.", "parameters": {"type": "object", "properties": {"query_id": {"type": "string", "description": "The ID of the query for which the execution plan is requested."}, "db_instance_id": {"type": "string", "description": "The ID of the database instance."}}, "required": ["query_id", "db_instance_id"], "additionalProperties": false}}, {"name": "analyze_query_performance", "description": "Analyzes the performance of a given query over a specified time range on a database instance.", "parameters": {"type": "object", "properties": {"query_id": {"type": "string", "description": "The ID of the query for which performance is analyzed."}, "db_instance_id": {"type": "string", "description": "The ID of the database instance."}, "time_range": {"type": "string", "description": "The time range for the analysis (e.g., \"last 24 hours\")."}}, "required": ["query_id", "db_instance_id", "time_range"], "additionalProperties": false}}, {"name": "suggest_indexing_strategy", "description": "Suggests indexing strategies based on the provided query execution plan.", "parameters": {"type": "object", "properties": {"query_execution_plan": {"type": "object", "description": "A dictionary containing the query and its execution plan."}}, "required": ["query_execution_plan"], "additionalProperties": false}}, {"name": "generate_performance_report", "description": "Generates a performance report for a given query over a specified time range on a database instance.", "parameters": {"type": "object", "properties": {"query_id": {"type": "string", "description": "The ID of the query for which the report is generated."}, "db_instance_id": {"type": "string", "description": "The ID of the database instance."}, "time_range": {"type": "string", "description": "The time range for the performance analysis (e.g., \"last 24 hours\")."}}, "required": ["query_id", "db_instance_id", "time_range"], "additionalProperties": false}}], "mock_functions": "def get_query_execution_plan(query_id: str, db_instance_id: str) -> dict:\n    \"\"\"\n    Retrieves the query execution plan for a given query ID on a specified database instance.\n    \n    :param query_id: The ID of the query for which the execution plan is requested.\n    :param db_instance_id: The ID of the database instance.\n    :return:\n        dict: A dictionary with the following keys:\n            - query (str): The SQL query.\n            - execution_plan (str): The execution plan of the query.\n    :raises ValueError: If query_id or db_instance_id is empty or incorrect.\n    \"\"\"\n    if not query_id or not db_instance_id:\n        raise ValueError(\"Query ID and database instance ID must be provided.\")\n    if query_id == \"customerSearch\" and db_instance_id == \"db-instance-XYZ123\":\n        return {\n            \"query\": \"SELECT * FROM customers WHERE name = 'John Doe'\",\n            \"execution_plan\": \"Seq Scan on customers\"  # Simplified execution plan\n        }\n    return {}\ndef analyze_query_performance(query_id: str, db_instance_id: str, time_range: str) -> dict:\n    \"\"\"\n    Analyzes the performance of a given query over a specified time range on a database instance.\n    \n    :param query_id: The ID of the query for which performance is analyzed.\n    :param db_instance_id: The ID of the database instance.\n    :param time_range: The time range for the analysis (e.g., \"last 24 hours\").\n    :return:\n        dict: A dictionary with the following keys:\n            - query_id (str): The ID of the query.\n            - avg_execution_time (float): Average execution time of the query in milliseconds.\n            - execution_count (int): Number of times the query was executed.\n    :raises ValueError: If any parameter is empty or incorrect.\n    \"\"\"\n    if not query_id or not db_instance_id or not time_range:\n        raise ValueError(\"Query ID, database instance ID, and time range must be provided.\")\n    if query_id == \"customerSearch\" and db_instance_id == \"db-instance-XYZ123\" and time_range == \"last 24 hours\":\n        return {\n            \"query_id\": \"customerSearch\",\n            \"avg_execution_time\": 150.25,\n            \"execution_count\": 120\n        }\n    return {}\ndef suggest_indexing_strategy(query_execution_plan: dict) -> list:\n    \"\"\"\n    Suggests indexing strategies based on the provided query execution plan.\n    \n    :param query_execution_plan: A dictionary containing the query and its execution plan.\n    :return:\n        list: A list of indexing suggestions.\n    :raises ValueError: If the query execution plan is empty or incorrect.\n    \"\"\"\n    if not query_execution_plan or not query_execution_plan.get(\"execution_plan\"):\n        raise ValueError(\"A valid query execution plan must be provided.\")\n    if \"Seq Scan\" in query_execution_plan.get(\"execution_plan\"):\n        return [\"Create index on customers(name)\"]\n    return []\ndef generate_performance_report(query_id: str, db_instance_id: str, time_range: str) -> dict:\n    \"\"\"\n    Generates a performance report for a given query over a specified time range on a database instance.\n    \n    :param query_id: The ID of the query for which the report is generated.\n    :param db_instance_id: The ID of the database instance.\n    :param time_range: The time range for the performance analysis (e.g., \"last 24 hours\").\n    :return:\n        dict: A dictionary with the following keys:\n            - query_id (str): The ID of the query.\n            - avg_execution_time (float): Average execution time of the query in milliseconds.\n            - execution_count (int): Number of times the query was executed.\n            - indexing_suggestions (list): List of suggested indexing strategies.\n    :raises ValueError: If any parameter is empty or incorrect.\n    \"\"\"\n    performance_data = analyze_query_performance(query_id, db_instance_id, time_range)\n    query_execution_plan = get_query_execution_plan(query_id, db_instance_id)\n    indexing_suggestions = suggest_indexing_strategy(query_execution_plan)\n    \n    if not performance_data or not indexing_suggestions:\n        raise ValueError(\"Unable to generate a performance report with the provided data.\")\n    \n    return {\n        \"query_id\": performance_data[\"query_id\"],\n        \"avg_execution_time\": performance_data[\"avg_execution_time\"],\n        \"execution_count\": performance_data[\"execution_count\"],\n        \"indexing_suggestions\": indexing_suggestions\n    }", "user_query": "This is David from Beta Solutions. Generate a comprehensive performance report for the customerSearch query on db-instance-XYZ123 in the last 24 hours, including query performance metrics and recommended indexing strategies to improve database efficiency.", "checklist": {"functions": ["get_query_execution_plan", "analyze_query_performance", "suggest_indexing_strategy", "generate_performance_report"], "values": [{"query": "SELECT * FROM customers WHERE name = 'John Doe'", "execution_plan": "Seq Scan on customers"}, {"query_id": "customerSearch", "avg_execution_time": 150.25, "execution_count": 120}, ["Create index on customers(name)"], {"query_id": "customerSearch", "avg_execution_time": 150.25, "execution_count": 120, "indexing_suggestions": ["Create index on customers(name)"]}]}}
{"difficulty": "hard", "function_schema_python": "def get_patient_demographics(patient_id: str) -> dict:\n    \"\"\"Retrieves patient demographic information from cache or database.\n\n    :param patient_id: Unique identifier for the patient\n    :return: Dictionary containing patient demographic information\n    :raises ValueError: If patient_id is invalid\"\"\"\n    pass\ndef cache_patient_data(patient_id: str, data: dict, ttl: int) -> bool:\n    \"\"\"Caches patient data with specified time-to-live.\n\n    :param patient_id: Unique identifier for the patient\n    :param data: Dictionary containing patient data to cache\n    :param ttl: Time-to-live in seconds (default 300 seconds/5 minutes)\n    :return: Boolean indicating success of caching operation\n    :raises ValueError: If TTL exceeds maximum allowed time\"\"\"\n    pass\ndef get_recent_visits(patient_id: str, limit: int) -> list:\n    \"\"\"Retrieves recent visit history for a patient.\n\n    :param patient_id: Unique identifier for the patient\n    :param limit: Maximum number of recent visits to return\n    :return: List of recent visit dictionaries\n    :raises ValueError: If patient_id is invalid or limit is out of range\"\"\"\n    pass\ndef verify_hipaa_compliance(data: dict) -> bool:\n    \"\"\"Verifies if the data structure meets HIPAA compliance requirements.\n\n    :param data: Dictionary containing patient data to verify\n    :return: Boolean indicating if data meets HIPAA requirements\"\"\"\n    pass\n", "function_schema_json": [{"name": "get_patient_demographics", "description": "Retrieves patient demographic information from cache or database.", "parameters": {"type": "object", "properties": {"patient_id": {"type": "string", "description": "Unique identifier for the patient"}}, "required": ["patient_id"], "additionalProperties": false}}, {"name": "cache_patient_data", "description": "Caches patient data with specified time-to-live.", "parameters": {"type": "object", "properties": {"patient_id": {"type": "string", "description": "Unique identifier for the patient"}, "data": {"type": "object", "description": "Dictionary containing patient data to cache"}, "ttl": {"type": "integer", "description": "Time-to-live in seconds (default 300 seconds/5 minutes)"}}, "required": ["patient_id", "data", "ttl"], "additionalProperties": false}}, {"name": "get_recent_visits", "description": "Retrieves recent visit history for a patient.", "parameters": {"type": "object", "properties": {"patient_id": {"type": "string", "description": "Unique identifier for the patient"}, "limit": {"type": "integer", "description": "Maximum number of recent visits to return"}}, "required": ["patient_id", "limit"], "additionalProperties": false}}, {"name": "verify_hipaa_compliance", "description": "Verifies if the data structure meets HIPAA compliance requirements.", "parameters": {"type": "object", "properties": {"data": {"type": "object", "description": "Dictionary containing patient data to verify"}}, "required": ["data"], "additionalProperties": false}}], "mock_functions": "def get_patient_demographics(patient_id: str) -> dict:\n    \"\"\"\n    Retrieves patient demographic information from cache or database.\n    \n    :param patient_id: Unique identifier for the patient\n    :return: Dictionary containing patient demographic information\n    :raises ValueError: If patient_id is invalid\n    \"\"\"\n    if not isinstance(patient_id, str) or len(patient_id) != 10:\n        raise ValueError(\"Invalid patient ID format\")\n    \n    if patient_id == \"1234567890\":\n        return {\n            \"patient_id\": \"1234567890\",\n            \"name\": \"John Doe\",\n            \"dob\": \"1980-01-01\",\n            \"address\": \"123 Main St\",\n            \"phone\": \"555-0123\"\n        }\n    raise ValueError(\"Patient not found\")\ndef cache_patient_data(patient_id: str, data: dict, ttl: int = 300) -> bool:\n    \"\"\"\n    Caches patient data with specified time-to-live.\n    \n    :param patient_id: Unique identifier for the patient\n    :param data: Dictionary containing patient data to cache\n    :param ttl: Time-to-live in seconds (default 300 seconds/5 minutes)\n    :return: Boolean indicating success of caching operation\n    :raises ValueError: If TTL exceeds maximum allowed time\n    \"\"\"\n    if not isinstance(ttl, int) or ttl > 300:\n        raise ValueError(\"TTL cannot exceed 5 minutes (300 seconds)\")\n    \n    required_keys = {\"patient_id\", \"name\", \"dob\"}\n    if not all(key in data for key in required_keys):\n        raise ValueError(\"Missing required data fields\")\n    \n    return True\ndef get_recent_visits(patient_id: str, limit: int = 5) -> list:\n    \"\"\"\n    Retrieves recent visit history for a patient.\n    \n    :param patient_id: Unique identifier for the patient\n    :param limit: Maximum number of recent visits to return\n    :return: List of recent visit dictionaries\n    :raises ValueError: If patient_id is invalid or limit is out of range\n    \"\"\"\n    if not isinstance(patient_id, str) or len(patient_id) != 10:\n        raise ValueError(\"Invalid patient ID format\")\n    if not isinstance(limit, int) or limit < 1 or limit > 10:\n        raise ValueError(\"Limit must be between 1 and 10\")\n    \n    if patient_id == \"1234567890\":\n        return [\n            {\n                \"visit_id\": \"V001\",\n                \"date\": \"2023-10-01\",\n                \"doctor\": \"Dr. Smith\",\n                \"reason\": \"Annual checkup\"\n            },\n            {\n                \"visit_id\": \"V002\",\n                \"date\": \"2023-09-15\",\n                \"doctor\": \"Dr. Johnson\",\n                \"reason\": \"Follow-up\"\n            }\n        ]\n    return []\ndef verify_hipaa_compliance(data: dict) -> bool:\n    \"\"\"\n    Verifies if the data structure meets HIPAA compliance requirements.\n    \n    :param data: Dictionary containing patient data to verify\n    :return: Boolean indicating if data meets HIPAA requirements\n    \"\"\"\n    required_security_fields = {\"encryption\", \"access_level\", \"audit_trail\"}\n    if not all(field in data for field in required_security_fields):\n        return False\n    return True", "user_query": "This is Marcus from HealthTrack. Please get patient demographics for ID 1234567890, verify HIPAA compliance with {\"encryption\": true, \"access_level\": \"medical\", \"audit_trail\": true}, cache it with 300 seconds TTL, and fetch their last 5 visits.", "checklist": {"functions": ["get_patient_demographics", "cache_patient_data", "get_recent_visits", "verify_hipaa_compliance"], "values": [{"patient_id": "1234567890", "name": "John Doe", "dob": "1980-01-01", "address": "123 Main St", "phone": "555-0123"}, true, [{"visit_id": "V001", "date": "2023-10-01", "doctor": "Dr. Smith", "reason": "Annual checkup"}, {"visit_id": "V002", "date": "2023-09-15", "doctor": "Dr. Johnson", "reason": "Follow-up"}], true]}}
{"difficulty": "hard", "function_schema_python": "def scan_ssh_config(server_ip: str, port: int) -> dict:\n    \"\"\"Scans SSH configuration of a specified server.\n\n    :param server_ip: IP address of the target server\n    :param port: SSH port number (default: 22)\n    :return: Dictionary containing SSH configuration details\n    :raises ValueError: If IP address is invalid\"\"\"\n    pass\ndef verify_ssh_key_auth(server_ip: str, username: str) -> bool:\n    \"\"\"Verifies SSH key authentication for a specific user on a server.\n\n    :param server_ip: IP address of the target server\n    :param username: Username to verify\n    :return: True if key authentication is properly configured, False otherwise\n    :raises ConnectionError: If unable to connect to server\"\"\"\n    pass\ndef disable_root_login(server_ip: str, ssh_config_path: str) -> bool:\n    \"\"\"Disables root login on the specified server.\n\n    :param server_ip: IP address of the target server\n    :param ssh_config_path: Path to SSH config file\n    :return: True if root login was successfully disabled, False otherwise\n    :raises PermissionError: If insufficient privileges\"\"\"\n    pass\ndef implement_access_control(server_ip: str, allowed_users: list) -> dict:\n    \"\"\"Implements SSH access controls for specified users.\n\n    :param server_ip: IP address of the target server\n    :param allowed_users: List of usernames to allow SSH access\n    :return: Dictionary containing access control status\n    :raises ValueError: If allowed_users list is empty\"\"\"\n    pass\n", "function_schema_json": [{"name": "scan_ssh_config", "description": "Scans SSH configuration of a specified server.", "parameters": {"type": "object", "properties": {"server_ip": {"type": "string", "description": "IP address of the target server"}, "port": {"type": "integer", "description": "SSH port number (default: 22)"}}, "required": ["server_ip", "port"], "additionalProperties": false}}, {"name": "verify_ssh_key_auth", "description": "Verifies SSH key authentication for a specific user on a server.", "parameters": {"type": "object", "properties": {"server_ip": {"type": "string", "description": "IP address of the target server"}, "username": {"type": "string", "description": "Username to verify"}}, "required": ["server_ip", "username"], "additionalProperties": false}}, {"name": "disable_root_login", "description": "Disables root login on the specified server.", "parameters": {"type": "object", "properties": {"server_ip": {"type": "string", "description": "IP address of the target server"}, "ssh_config_path": {"type": "string", "description": "Path to SSH config file"}}, "required": ["server_ip", "ssh_config_path"], "additionalProperties": false}}, {"name": "implement_access_control", "description": "Implements SSH access controls for specified users.", "parameters": {"type": "object", "properties": {"server_ip": {"type": "string", "description": "IP address of the target server"}, "allowed_users": {"type": "array", "description": "List of usernames to allow SSH access"}}, "required": ["server_ip", "allowed_users"], "additionalProperties": false}}], "mock_functions": "def scan_ssh_config(server_ip: str, port: int = 22) -> dict:\n    \"\"\"\n    Scans SSH configuration of a specified server.\n    \n    :param server_ip: IP address of the target server\n    :param port: SSH port number (default: 22)\n    :return: Dictionary containing SSH configuration details\n    :raises ValueError: If IP address is invalid\n    \"\"\"\n    if not isinstance(server_ip, str) or not 0 <= port <= 65535:\n        raise ValueError(\"Invalid IP address or port\")\n    \n    if server_ip == \"192.168.1.10\":\n        return {\n            \"permit_root_login\": True,\n            \"password_authentication\": True,\n            \"key_authentication\": True,\n            \"protocol_version\": 2,\n            \"ciphers\": [\"aes256-cbc\", \"aes128-ctr\"]\n        }\n    return {}\ndef verify_ssh_key_auth(server_ip: str, username: str) -> bool:\n    \"\"\"\n    Verifies SSH key authentication for a specific user on a server.\n    \n    :param server_ip: IP address of the target server\n    :param username: Username to verify\n    :return: True if key authentication is properly configured, False otherwise\n    :raises ConnectionError: If unable to connect to server\n    \"\"\"\n    if not server_ip or not username:\n        raise ValueError(\"Server IP and username must be provided\")\n    \n    if server_ip == \"192.168.1.10\" and username == \"admin\":\n        return True\n    return False\ndef disable_root_login(server_ip: str, ssh_config_path: str = \"/etc/ssh/sshd_config\") -> bool:\n    \"\"\"\n    Disables root login on the specified server.\n    \n    :param server_ip: IP address of the target server\n    :param ssh_config_path: Path to SSH config file\n    :return: True if root login was successfully disabled, False otherwise\n    :raises PermissionError: If insufficient privileges\n    \"\"\"\n    if not server_ip or not ssh_config_path:\n        raise ValueError(\"Server IP and config path must be provided\")\n    \n    if server_ip == \"192.168.1.10\" and ssh_config_path == \"/etc/ssh/sshd_config\":\n        return True\n    return False\ndef implement_access_control(server_ip: str, allowed_users: list) -> dict:\n    \"\"\"\n    Implements SSH access controls for specified users.\n    \n    :param server_ip: IP address of the target server\n    :param allowed_users: List of usernames to allow SSH access\n    :return: Dictionary containing access control status\n    :raises ValueError: If allowed_users list is empty\n    \"\"\"\n    if not server_ip or not allowed_users:\n        raise ValueError(\"Server IP and allowed users must be provided\")\n    \n    if server_ip == \"192.168.1.10\" and \"admin\" in allowed_users:\n        return {\n            \"status\": \"success\",\n            \"allowed_users\": allowed_users,\n            \"denied_users\": [\"root\"],\n            \"configuration_applied\": True\n        }\n    return {\"status\": \"failed\"}", "user_query": "This is Marcus Rodriguez. I need to disable root login and implement access control for only user 'admin' on server 192.168.1.10 using the standard SSH config file path.  Please confirm after completion.", "checklist": {"functions": ["scan_ssh_config", "verify_ssh_key_auth", "disable_root_login", "implement_access_control"], "values": [{"permit_root_login": true, "password_authentication": true, "key_authentication": true, "protocol_version": 2, "ciphers": ["aes256-cbc", "aes128-ctr"]}, true, true, {"status": "success", "allowed_users": ["admin"], "denied_users": ["root"], "configuration_applied": true}]}}
{"difficulty": "hard", "function_schema_python": "def retrieve_user_feedback(app_name: str, user_name: str) -> list:\n    \"\"\"Retrieves feedback for a specific user from a given app.\n\n    :param app_name: The name of the app (e.g., \"Puzzle Paradise\").\n    :param user_name: The name of the user whose feedback is requested.\n    :return: A list of feedback strings provided by the user.\n    :raises ValueError: If either app_name or user_name is invalid.\"\"\"\n    pass\ndef send_email(recipient_email: str, subject: str, body: str) -> bool:\n    \"\"\"Simulates sending an email to a recipient.\n\n    :param recipient_email: The email address of the recipient.\n    :param subject: The subject of the email.\n    :param body: The body content of the email.\n    :return: True if the email was sent successfully, False otherwise.\n    :raises ValueError: If any parameter is invalid.\"\"\"\n    pass\ndef analyze_feedback(feedback_list: list) -> dict:\n    \"\"\"Analyzes a list of feedback to identify common pain points.\n\n    :param feedback_list: A list of feedback strings.\n    :return: A dictionary with identified pain points as keys and their occurrences as values.\n    :raises ValueError: If the feedback list is empty.\"\"\"\n    pass\ndef log_customer_interaction(user_name: str, interaction_details: str) -> bool:\n    \"\"\"Logs details of an interaction with a customer.\n\n    :param user_name: The name of the user interacting with.\n    :param interaction_details: Details of the interaction.\n    :return: True if the interaction was logged successfully, False otherwise.\n    :raises ValueError: If either user_name or interaction_details is invalid.\"\"\"\n    pass\n", "function_schema_json": [{"name": "retrieve_user_feedback", "description": "Retrieves feedback for a specific user from a given app.", "parameters": {"type": "object", "properties": {"app_name": {"type": "string", "description": "The name of the app (e.g., \"Puzzle Paradise\")."}, "user_name": {"type": "string", "description": "The name of the user whose feedback is requested."}}, "required": ["app_name", "user_name"], "additionalProperties": false}}, {"name": "send_email", "description": "Simulates sending an email to a recipient.", "parameters": {"type": "object", "properties": {"recipient_email": {"type": "string", "description": "The email address of the recipient."}, "subject": {"type": "string", "description": "The subject of the email."}, "body": {"type": "string", "description": "The body content of the email."}}, "required": ["recipient_email", "subject", "body"], "additionalProperties": false}}, {"name": "analyze_feedback", "description": "Analyzes a list of feedback to identify common pain points.", "parameters": {"type": "object", "properties": {"feedback_list": {"type": "array", "description": "A list of feedback strings."}}, "required": ["feedback_list"], "additionalProperties": false}}, {"name": "log_customer_interaction", "description": "Logs details of an interaction with a customer.", "parameters": {"type": "object", "properties": {"user_name": {"type": "string", "description": "The name of the user interacting with."}, "interaction_details": {"type": "string", "description": "Details of the interaction."}}, "required": ["user_name", "interaction_details"], "additionalProperties": false}}], "mock_functions": "def retrieve_user_feedback(app_name: str, user_name: str) -> list:\n    \"\"\"\n    Retrieves feedback for a specific user from a given app.\n    \n    :param app_name: The name of the app (e.g., \"Puzzle Paradise\").\n    :param user_name: The name of the user whose feedback is requested.\n    :return: A list of feedback strings provided by the user.\n    :raises ValueError: If either app_name or user_name is invalid.\n    \"\"\"\n    if not app_name or not user_name:\n        raise ValueError(\"App name and user name must be provided.\")\n    if app_name == \"Puzzle Paradise\" and user_name == \"Sarah\":\n        return [\n            \"I'm having trouble with in-app purchases.\",\n            \"There hasn't been any new content updates. This is disappointing.\"\n        ]\n    return []\ndef send_email(recipient_email: str, subject: str, body: str) -> bool:\n    \"\"\"\n    Simulates sending an email to a recipient.\n    \n    :param recipient_email: The email address of the recipient.\n    :param subject: The subject of the email.\n    :param body: The body content of the email.\n    :return: True if the email was sent successfully, False otherwise.\n    :raises ValueError: If any parameter is invalid.\n    \"\"\"\n    if not recipient_email or not subject or not body:\n        raise ValueError(\"Recipient email, subject, and body must be provided.\")\n    if recipient_email == \"sarah@example.com\":\n        print(f\"Email sent to {recipient_email} with subject '{subject}' and body:\\n{body}\")\n        return True\n    return False\ndef analyze_feedback(feedback_list: list) -> dict:\n    \"\"\"\n    Analyzes a list of feedback to identify common pain points.\n    \n    :param feedback_list: A list of feedback strings.\n    :return: A dictionary with identified pain points as keys and their occurrences as values.\n    :raises ValueError: If the feedback list is empty.\n    \"\"\"\n    if not feedback_list:\n        raise ValueError(\"Feedback list must not be empty.\")\n    pain_points = {}\n    for feedback in feedback_list:\n        if \"in-app purchases\" in feedback.lower():\n            pain_points[\"in-app purchases\"] = pain_points.get(\"in-app purchases\", 0) + 1\n        if \"new content updates\" in feedback.lower():\n            pain_points[\"new content updates\"] = pain_points.get(\"new content updates\", 0) + 1\n    return pain_points\ndef log_customer_interaction(user_name: str, interaction_details: str) -> bool:\n    \"\"\"\n    Logs details of an interaction with a customer.\n    \n    :param user_name: The name of the user interacting with.\n    :param interaction_details: Details of the interaction.\n    :return: True if the interaction was logged successfully, False otherwise.\n    :raises ValueError: If either user_name or interaction_details is invalid.\n    \"\"\"\n    if not user_name or not interaction_details:\n        raise ValueError(\"User name and interaction details must be provided.\")\n    if user_name == \"Sarah\":\n        print(f\"Logged interaction with {user_name}: {interaction_details}\")\n        return True\n    return False", "user_query": "This is Alex. Retrieve Sarah's feedback for Puzzle Paradise, analyze it, and then send an email to sarah@example.com with the subject \"Puzzle Paradise Feedback\" and the body \"Hi Sarah, we received your feedback about Puzzle Paradise. We are working on addressing the issues you mentioned about in-app purchases and lack of new content. Thank you for your patience.\" Finally, log this interaction.", "checklist": {"functions": ["retrieve_user_feedback", "send_email", "analyze_feedback", "log_customer_interaction"], "values": [["I'm having trouble with in-app purchases.", "There hasn't been any new content updates. This is disappointing."], true, {"in-app purchases": 1, "new content updates": 1}, true]}}
{"difficulty": "hard", "function_schema_python": "def create_api(api_name: str, endpoints: list) -> dict:\n    \"\"\"Creates a new API with specified endpoints.\n\n    :param api_name: The name of the API to be created.\n    :param endpoints: A list of endpoint paths for the API.\n    :return: A dictionary representing the created API with the following keys:\n        - name (str): The name of the API.\n        - endpoints (list[str]): The list of endpoints.\n    :raises ValueError: If the API name is empty or endpoints are not provided.\"\"\"\n    pass\ndef deploy_web_application(app_name: str) -> str:\n    \"\"\"Deploys a web application with a load balancer.\n\n    :param app_name: The name of the web application to be deployed.\n    :return: A string confirming the deployment.\n    :raises ValueError: If the application name is empty.\"\"\"\n    pass\ndef configure_load_balancer(ssl_termination: bool) -> str:\n    \"\"\"Configures the load balancer with HTTP and SSL termination.\n\n    :param ssl_termination: Boolean indicating if SSL termination should be enabled.\n    :return: A string confirming the load balancer configuration.\"\"\"\n    pass\ndef launch_ec2_instance(instance_type: str) -> dict:\n    \"\"\"Launches an EC2 instance with a specified instance type.\n\n    :param instance_type: The type of EC2 instance to launch.\n    :return: A dictionary with instance details including the following keys:\n        - instance_type (str): The type of the instance.\n        - status (str): The status of the instance launch (\"running\" or \"failed\").\"\"\"\n    pass\n", "function_schema_json": [{"name": "create_api", "description": "Creates a new API with specified endpoints.", "parameters": {"type": "object", "properties": {"api_name": {"type": "string", "description": "The name of the API to be created."}, "endpoints": {"type": "array", "description": "A list of endpoint paths for the API."}}, "required": ["api_name", "endpoints"], "additionalProperties": false}}, {"name": "deploy_web_application", "description": "Deploys a web application with a load balancer.", "parameters": {"type": "object", "properties": {"app_name": {"type": "string", "description": "The name of the web application to be deployed."}}, "required": ["app_name"], "additionalProperties": false}}, {"name": "configure_load_balancer", "description": "Configures the load balancer with HTTP and SSL termination.", "parameters": {"type": "object", "properties": {"ssl_termination": {"type": "boolean", "description": "Boolean indicating if SSL termination should be enabled."}}, "required": ["ssl_termination"], "additionalProperties": false}}, {"name": "launch_ec2_instance", "description": "Launches an EC2 instance with a specified instance type.", "parameters": {"type": "object", "properties": {"instance_type": {"type": "string", "description": "The type of EC2 instance to launch."}}, "required": ["instance_type"], "additionalProperties": false}}], "mock_functions": "def create_api(api_name: str, endpoints: list) -> dict:\n    \"\"\"\n    Creates a new API with specified endpoints.\n    \n    :param api_name: The name of the API to be created.\n    :param endpoints: A list of endpoint paths for the API.\n    :return: A dictionary representing the created API with the following keys:\n        - name (str): The name of the API.\n        - endpoints (list[str]): The list of endpoints.\n    :raises ValueError: If the API name is empty or endpoints are not provided.\n    \"\"\"\n    if not api_name:\n        raise ValueError(\"API name must not be empty.\")\n    if not endpoints:\n        raise ValueError(\"Endpoints must be provided.\")\n    return {\n        \"name\": api_name,\n        \"endpoints\": endpoints\n    }\ndef deploy_web_application(app_name: str) -> str:\n    \"\"\"\n    Deploys a web application with a load balancer.\n    \n    :param app_name: The name of the web application to be deployed.\n    :return: A string confirming the deployment.\n    :raises ValueError: If the application name is empty.\n    \"\"\"\n    if not app_name:\n        raise ValueError(\"Application name must not be empty.\")\n    return f\"{app_name} has been deployed with a load balancer.\"\ndef configure_load_balancer(ssl_termination: bool) -> str:\n    \"\"\"\n    Configures the load balancer with HTTP and SSL termination.\n    \n    :param ssl_termination: Boolean indicating if SSL termination should be enabled.\n    :return: A string confirming the load balancer configuration.\n    \"\"\"\n    return f\"Load balancer configured with SSL termination: {ssl_termination}\"\ndef launch_ec2_instance(instance_type: str) -> dict:\n    \"\"\"\n    Launches an EC2 instance with a specified instance type.\n    \n    :param instance_type: The type of EC2 instance to launch.\n    :return: A dictionary with instance details including the following keys:\n        - instance_type (str): The type of the instance.\n        - status (str): The status of the instance launch (\"running\" or \"failed\").\n    \"\"\"\n    valid_instance_types = [\"c5.large\", \"m5.large\", \"t2.micro\"]\n    if instance_type not in valid_instance_types:\n        return {\n            \"instance_type\": instance_type,\n            \"status\": \"failed\"\n        }\n    return {\n        \"instance_type\": instance_type,\n        \"status\": \"running\"\n    }", "user_query": "This is Rahul Patel. Please launch an EC2 instance of type 'c5.large', then deploy 'AnalyticsWebApp' with load balancer SSL termination enabled, and create 'ClientAnalyticsAPI' with endpoints [\"/clients\", \"/data\"].", "checklist": {"functions": ["create_api", "deploy_web_application", "configure_load_balancer", "launch_ec2_instance"], "values": [{"name": "ClientAnalyticsAPI", "endpoints": ["/clients", "/data"]}, "AnalyticsWebApp has been deployed with a load balancer.", "Load balancer configured with SSL termination: True", {"instance_type": "c5.large", "status": "running"}]}}
{"difficulty": "hard", "function_schema_python": "def get_surge_areas(start_time: str, end_time: str, location: str, min_fare: float) -> dict:\n    \"\"\"Retrieves surge areas with the highest demand and least driver availability within a specified time frame and location.\n\n    :param start_time: The start time of the period in \"HH:MM\" format (e.g., \"17:00\").\n    :param end_time: The end time of the period in \"HH:MM\" format (e.g., \"19:00\").\n    :param location: The geographical location to analyze (e.g., \"Times Square\").\n    :param min_fare: The minimum fare threshold for surge areas in dollars (e.g., 25.0).\n    :return:\n        dict: A dictionary with the following keys:\n            - surge_areas (list[dict]): A list of dictionaries with each surge area's details.\n                - area (str): The specific area within the location.\n                - demand (int): The demand level in that area.\n                - availability (int): The number of available drivers in that area.\n                - estimated_earnings (float): The estimated earnings potential per ride.\n    :raises ValueError: If start_time, end_time, location, or min_fare are invalid.\"\"\"\n    pass\ndef display_heatmap(surge_areas: list) -> bool:\n    \"\"\"Displays a heatmap on a map with high demand and low driver availability areas highlighted.\n\n    :param surge_areas: A list of dictionaries with surge area details.\n    :return: True if the heatmap was successfully displayed, False otherwise.\n    :raises ValueError: If surge_areas is empty or not in the correct format.\"\"\"\n    pass\ndef check_surge_availability(surge_areas: list, min_fare: float) -> list:\n    \"\"\"Checks the surge areas for available rides that meet the minimum fare requirement.\n\n    :param surge_areas: A list of dictionaries with surge area details.\n    :param min_fare: The minimum fare threshold for surge areas in dollars (e.g., 25.0).\n    :return: A list of dictionaries with surge areas that meet the minimum fare requirement.\n    :raises ValueError: If surge_areas or min_fare are invalid.\"\"\"\n    pass\ndef suggest_ride_location(surge_areas: list) -> str:\n    \"\"\"Suggests an optimal location for John to position himself for maximum profit based on surge areas.\n\n    :param surge_areas: A list of dictionaries with surge area details.\n    :return: A string representing the suggested area for optimal positioning.\n    :raises ValueError: If surge_areas is empty or not in the correct format.\"\"\"\n    pass\n", "function_schema_json": [{"name": "get_surge_areas", "description": "Retrieves surge areas with the highest demand and least driver availability within a specified time frame and location.", "parameters": {"type": "object", "properties": {"start_time": {"type": "string", "description": "The start time of the period in \"HH:MM\" format (e.g., \"17:00\")."}, "end_time": {"type": "string", "description": "The end time of the period in \"HH:MM\" format (e.g., \"19:00\")."}, "location": {"type": "string", "description": "The geographical location to analyze (e.g., \"Times Square\")."}, "min_fare": {"type": "number", "description": "The minimum fare threshold for surge areas in dollars (e.g., 25.0)."}}, "required": ["start_time", "end_time", "location", "min_fare"], "additionalProperties": false}}, {"name": "display_heatmap", "description": "Displays a heatmap on a map with high demand and low driver availability areas highlighted.", "parameters": {"type": "object", "properties": {"surge_areas": {"type": "array", "description": "A list of dictionaries with surge area details."}}, "required": ["surge_areas"], "additionalProperties": false}}, {"name": "check_surge_availability", "description": "Checks the surge areas for available rides that meet the minimum fare requirement.", "parameters": {"type": "object", "properties": {"surge_areas": {"type": "array", "description": "A list of dictionaries with surge area details."}, "min_fare": {"type": "number", "description": "The minimum fare threshold for surge areas in dollars (e.g., 25.0)."}}, "required": ["surge_areas", "min_fare"], "additionalProperties": false}}, {"name": "suggest_ride_location", "description": "Suggests an optimal location for John to position himself for maximum profit based on surge areas.", "parameters": {"type": "object", "properties": {"surge_areas": {"type": "array", "description": "A list of dictionaries with surge area details."}}, "required": ["surge_areas"], "additionalProperties": false}}], "mock_functions": "def get_surge_areas(start_time: str, end_time: str, location: str, min_fare: float) -> dict:\n    \"\"\"\n    Retrieves surge areas with the highest demand and least driver availability within a specified time frame and location.\n    \n    :param start_time: The start time of the period in \"HH:MM\" format (e.g., \"17:00\").\n    :param end_time: The end time of the period in \"HH:MM\" format (e.g., \"19:00\").\n    :param location: The geographical location to analyze (e.g., \"Times Square\").\n    :param min_fare: The minimum fare threshold for surge areas in dollars (e.g., 25.0).\n    :return:\n        dict: A dictionary with the following keys:\n            - surge_areas (list[dict]): A list of dictionaries with each surge area's details.\n                - area (str): The specific area within the location.\n                - demand (int): The demand level in that area.\n                - availability (int): The number of available drivers in that area.\n                - estimated_earnings (float): The estimated earnings potential per ride.\n    :raises ValueError: If start_time, end_time, location, or min_fare are invalid.\n    \"\"\"\n    if not (start_time and end_time and location and min_fare):\n        raise ValueError(\"Start time, end time, location, and minimum fare must be provided.\")\n    if start_time == \"17:00\" and end_time == \"19:00\" and location == \"Times Square\":\n        return {\n            \"surge_areas\": [\n                {\n                    \"area\": \"West 42nd St and Broadway\",\n                    \"demand\": 90,\n                    \"availability\": 10,\n                    \"estimated_earnings\": 35.0\n                },\n                {\n                    \"area\": \"West 45th St and Broadway\",\n                    \"demand\": 85,\n                    \"availability\": 5,\n                    \"estimated_earnings\": 45.0\n                }\n            ]\n        }\n    return {}\ndef display_heatmap(surge_areas: list) -> bool:\n    \"\"\"\n    Displays a heatmap on a map with high demand and low driver availability areas highlighted.\n    \n    :param surge_areas: A list of dictionaries with surge area details.\n    :return: True if the heatmap was successfully displayed, False otherwise.\n    :raises ValueError: If surge_areas is empty or not in the correct format.\n    \"\"\"\n    if not surge_areas:\n        raise ValueError(\"Surge areas list must be provided and not empty.\")\n    if isinstance(surge_areas, list) and surge_areas and all(\"area\" in area for area in surge_areas):\n        print(\"Heatmap displayed with surge areas highlighted.\")\n        return True\n    return False\ndef check_surge_availability(surge_areas: list, min_fare: float) -> list:\n    \"\"\"\n    Checks the surge areas for available rides that meet the minimum fare requirement.\n    \n    :param surge_areas: A list of dictionaries with surge area details.\n    :param min_fare: The minimum fare threshold for surge areas in dollars (e.g., 25.0).\n    :return: A list of dictionaries with surge areas that meet the minimum fare requirement.\n    :raises ValueError: If surge_areas or min_fare are invalid.\n    \"\"\"\n    if not surge_areas or not min_fare:\n        raise ValueError(\"Surge areas list and minimum fare must be provided.\")\n    if not isinstance(surge_areas, list) or not isinstance(min_fare, float):\n        raise ValueError(\"Invalid type for surge areas list or minimum fare.\")\n    \n    available_areas = [area for area in surge_areas if area[\"estimated_earnings\"] >= min_fare]\n    return available_areas\ndef suggest_ride_location(surge_areas: list) -> str:\n    \"\"\"\n    Suggests an optimal location for John to position himself for maximum profit based on surge areas.\n    \n    :param surge_areas: A list of dictionaries with surge area details.\n    :return: A string representing the suggested area for optimal positioning.\n    :raises ValueError: If surge_areas is empty or not in the correct format.\n    \"\"\"\n    if not surge_areas:\n        raise ValueError(\"Surge areas list must be provided and not empty.\")\n    if isinstance(surge_areas, list) and surge_areas and all(\"area\" in area for area in surge_areas):\n        # Suggest the area with the highest estimated earnings\n        suggested_area = max(surge_areas, key=lambda x: x[\"estimated_earnings\"])[\"area\"]\n        return suggested_area\n    return \"\"", "user_query": "Can you show me surge areas in Times Square between 17:00 and 19:00 with minimum fare of $25.00?", "checklist": {"functions": ["get_surge_areas", "display_heatmap", "check_surge_availability", "suggest_ride_location"], "values": [{"surge_areas": [{"area": "West 42nd St and Broadway", "demand": 90, "availability": 10, "estimated_earnings": 35.0}, {"area": "West 45th St and Broadway", "demand": 85, "availability": 5, "estimated_earnings": 45.0}]}, true, [{"area": "West 42nd St and Broadway", "demand": 90, "availability": 10, "estimated_earnings": 35.0}, {"area": "West 45th St and Broadway", "demand": 85, "availability": 5, "estimated_earnings": 45.0}], "West 45th St and Broadway"]}}
{"difficulty": "hard", "function_schema_python": "def get_surge_areas(start_time: str, end_time: str, location: str, min_fare: float) -> dict:\n    \"\"\"Retrieves surge areas with the highest demand and least driver availability within a specified time frame and location.\n\n    :param start_time: The start time of the period in \"HH:MM\" format (e.g., \"17:00\").\n    :param end_time: The end time of the period in \"HH:MM\" format (e.g., \"19:00\").\n    :param location: The geographical location to analyze (e.g., \"Times Square\").\n    :param min_fare: The minimum fare threshold for surge areas in dollars (e.g., 25.0).\n    :return:\n        dict: A dictionary with the following keys:\n            - surge_areas (list[dict]): A list of dictionaries with each surge area's details.\n                - area (str): The specific area within the location.\n                - demand (int): The demand level in that area.\n                - availability (int): The number of available drivers in that area.\n                - estimated_earnings (float): The estimated earnings potential per ride.\n    :raises ValueError: If start_time, end_time, location, or min_fare are invalid.\"\"\"\n    pass\ndef display_heatmap(surge_areas: list) -> bool:\n    \"\"\"Displays a heatmap on a map with high demand and low driver availability areas highlighted.\n\n    :param surge_areas: A list of dictionaries with surge area details.\n    :return: True if the heatmap was successfully displayed, False otherwise.\n    :raises ValueError: If surge_areas is empty or not in the correct format.\"\"\"\n    pass\ndef check_surge_availability(surge_areas: list, min_fare: float) -> list:\n    \"\"\"Checks the surge areas for available rides that meet the minimum fare requirement.\n\n    :param surge_areas: A list of dictionaries with surge area details.\n    :param min_fare: The minimum fare threshold for surge areas in dollars (e.g., 25.0).\n    :return: A list of dictionaries with surge areas that meet the minimum fare requirement.\n    :raises ValueError: If surge_areas or min_fare are invalid.\"\"\"\n    pass\ndef suggest_ride_location(surge_areas: list) -> str:\n    \"\"\"Suggests an optimal location for John to position himself for maximum profit based on surge areas.\n\n    :param surge_areas: A list of dictionaries with surge area details.\n    :return: A string representing the suggested area for optimal positioning.\n    :raises ValueError: If surge_areas is empty or not in the correct format.\"\"\"\n    pass\n", "function_schema_json": [{"name": "get_surge_areas", "description": "Retrieves surge areas with the highest demand and least driver availability within a specified time frame and location.", "parameters": {"type": "object", "properties": {"start_time": {"type": "string", "description": "The start time of the period in \"HH:MM\" format (e.g., \"17:00\")."}, "end_time": {"type": "string", "description": "The end time of the period in \"HH:MM\" format (e.g., \"19:00\")."}, "location": {"type": "string", "description": "The geographical location to analyze (e.g., \"Times Square\")."}, "min_fare": {"type": "number", "description": "The minimum fare threshold for surge areas in dollars (e.g., 25.0)."}}, "required": ["start_time", "end_time", "location", "min_fare"], "additionalProperties": false}}, {"name": "display_heatmap", "description": "Displays a heatmap on a map with high demand and low driver availability areas highlighted.", "parameters": {"type": "object", "properties": {"surge_areas": {"type": "array", "description": "A list of dictionaries with surge area details."}}, "required": ["surge_areas"], "additionalProperties": false}}, {"name": "check_surge_availability", "description": "Checks the surge areas for available rides that meet the minimum fare requirement.", "parameters": {"type": "object", "properties": {"surge_areas": {"type": "array", "description": "A list of dictionaries with surge area details."}, "min_fare": {"type": "number", "description": "The minimum fare threshold for surge areas in dollars (e.g., 25.0)."}}, "required": ["surge_areas", "min_fare"], "additionalProperties": false}}, {"name": "suggest_ride_location", "description": "Suggests an optimal location for John to position himself for maximum profit based on surge areas.", "parameters": {"type": "object", "properties": {"surge_areas": {"type": "array", "description": "A list of dictionaries with surge area details."}}, "required": ["surge_areas"], "additionalProperties": false}}], "mock_functions": "def get_surge_areas(start_time: str, end_time: str, location: str, min_fare: float) -> dict:\n    \"\"\"\n    Retrieves surge areas with the highest demand and least driver availability within a specified time frame and location.\n    \n    :param start_time: The start time of the period in \"HH:MM\" format (e.g., \"17:00\").\n    :param end_time: The end time of the period in \"HH:MM\" format (e.g., \"19:00\").\n    :param location: The geographical location to analyze (e.g., \"Times Square\").\n    :param min_fare: The minimum fare threshold for surge areas in dollars (e.g., 25.0).\n    :return:\n        dict: A dictionary with the following keys:\n            - surge_areas (list[dict]): A list of dictionaries with each surge area's details.\n                - area (str): The specific area within the location.\n                - demand (int): The demand level in that area.\n                - availability (int): The number of available drivers in that area.\n                - estimated_earnings (float): The estimated earnings potential per ride.\n    :raises ValueError: If start_time, end_time, location, or min_fare are invalid.\n    \"\"\"\n    if not (start_time and end_time and location and min_fare):\n        raise ValueError(\"Start time, end time, location, and minimum fare must be provided.\")\n    if start_time == \"17:00\" and end_time == \"19:00\" and location == \"Times Square\":\n        return {\n            \"surge_areas\": [\n                {\n                    \"area\": \"West 42nd St and Broadway\",\n                    \"demand\": 90,\n                    \"availability\": 10,\n                    \"estimated_earnings\": 35.0\n                },\n                {\n                    \"area\": \"West 45th St and Broadway\",\n                    \"demand\": 85,\n                    \"availability\": 5,\n                    \"estimated_earnings\": 45.0\n                }\n            ]\n        }\n    return {}\ndef display_heatmap(surge_areas: list) -> bool:\n    \"\"\"\n    Displays a heatmap on a map with high demand and low driver availability areas highlighted.\n    \n    :param surge_areas: A list of dictionaries with surge area details.\n    :return: True if the heatmap was successfully displayed, False otherwise.\n    :raises ValueError: If surge_areas is empty or not in the correct format.\n    \"\"\"\n    if not surge_areas:\n        raise ValueError(\"Surge areas list must be provided and not empty.\")\n    if isinstance(surge_areas, list) and surge_areas and all(\"area\" in area for area in surge_areas):\n        print(\"Heatmap displayed with surge areas highlighted.\")\n        return True\n    return False\ndef check_surge_availability(surge_areas: list, min_fare: float) -> list:\n    \"\"\"\n    Checks the surge areas for available rides that meet the minimum fare requirement.\n    \n    :param surge_areas: A list of dictionaries with surge area details.\n    :param min_fare: The minimum fare threshold for surge areas in dollars (e.g., 25.0).\n    :return: A list of dictionaries with surge areas that meet the minimum fare requirement.\n    :raises ValueError: If surge_areas or min_fare are invalid.\n    \"\"\"\n    if not surge_areas or not min_fare:\n        raise ValueError(\"Surge areas list and minimum fare must be provided.\")\n    if not isinstance(surge_areas, list) or not isinstance(min_fare, float):\n        raise ValueError(\"Invalid type for surge areas list or minimum fare.\")\n    \n    available_areas = [area for area in surge_areas if area[\"estimated_earnings\"] >= min_fare]\n    return available_areas\ndef suggest_ride_location(surge_areas: list) -> str:\n    \"\"\"\n    Suggests an optimal location for John to position himself for maximum profit based on surge areas.\n    \n    :param surge_areas: A list of dictionaries with surge area details.\n    :return: A string representing the suggested area for optimal positioning.\n    :raises ValueError: If surge_areas is empty or not in the correct format.\n    \"\"\"\n    if not surge_areas:\n        raise ValueError(\"Surge areas list must be provided and not empty.\")\n    if isinstance(surge_areas, list) and surge_areas and all(\"area\" in area for area in surge_areas):\n        # Suggest the area with the highest estimated earnings\n        suggested_area = max(surge_areas, key=lambda x: x[\"estimated_earnings\"])[\"area\"]\n        return suggested_area\n    return \"\"", "user_query": "This is John. Please find surge areas in Times Square between 17:00 and 19:00 with $25.00 minimum fare, show them on heatmap, and suggest the best location for maximum earnings.", "checklist": {"functions": ["get_surge_areas", "display_heatmap", "check_surge_availability", "suggest_ride_location"], "values": [{"surge_areas": [{"area": "West 42nd St and Broadway", "demand": 90, "availability": 10, "estimated_earnings": 35.0}, {"area": "West 45th St and Broadway", "demand": 85, "availability": 5, "estimated_earnings": 45.0}]}, true, [{"area": "West 42nd St and Broadway", "demand": 90, "availability": 10, "estimated_earnings": 35.0}, {"area": "West 45th St and Broadway", "demand": 85, "availability": 5, "estimated_earnings": 45.0}], "West 45th St and Broadway"]}}
{"difficulty": "hard", "function_schema_python": "def get_order_details(order_id: str) -> dict:\n    \"\"\"Retrieves the details of a specific order.\n\n    :param order_id: The unique identifier of the order.\n    :return: A dictionary containing order details with keys:\n        - items (list[dict]): List of ordered items with 'name' and 'price'\n        - total (float): Total order amount\n        - status (str): Order status\n        - timestamp (str): Order timestamp\n    :raises ValueError: If order_id is invalid or empty\"\"\"\n    pass\ndef verify_original_transaction(transaction_id: str) -> dict:\n    \"\"\"Verifies the original transaction details from payment processor.\n\n    :param transaction_id: The unique identifier of the transaction\n    :return: A dictionary containing transaction details with keys:\n        - items (list[dict]): List of items in original transaction\n        - amount (float): Transaction amount\n        - timestamp (str): Transaction timestamp\n    :raises ValueError: If transaction_id is invalid\"\"\"\n    pass\ndef correct_order_record(order_id: str, transaction_id: str) -> bool:\n    \"\"\"Corrects the order record based on the verified transaction.\n\n    :param order_id: The unique identifier of the order to correct\n    :param transaction_id: The transaction ID to reference\n    :return: True if correction was successful, False otherwise\n    :raises ValueError: If either ID is invalid\"\"\"\n    pass\ndef send_correction_confirmation(email: str, order_id: str) -> bool:\n    \"\"\"Sends a confirmation email about the order correction.\n\n    :param email: The recipient's email address\n    :param order_id: The order ID that was corrected\n    :return: True if email was sent successfully, False otherwise\n    :raises ValueError: If email is invalid or order_id is empty\"\"\"\n    pass\n", "function_schema_json": [{"name": "get_order_details", "description": "Retrieves the details of a specific order.", "parameters": {"type": "object", "properties": {"order_id": {"type": "string", "description": "The unique identifier of the order."}}, "required": ["order_id"], "additionalProperties": false}}, {"name": "verify_original_transaction", "description": "Verifies the original transaction details from payment processor.", "parameters": {"type": "object", "properties": {"transaction_id": {"type": "string", "description": "The unique identifier of the transaction"}}, "required": ["transaction_id"], "additionalProperties": false}}, {"name": "correct_order_record", "description": "Corrects the order record based on the verified transaction.", "parameters": {"type": "object", "properties": {"order_id": {"type": "string", "description": "The unique identifier of the order to correct"}, "transaction_id": {"type": "string", "description": "The transaction ID to reference"}}, "required": ["order_id", "transaction_id"], "additionalProperties": false}}, {"name": "send_correction_confirmation", "description": "Sends a confirmation email about the order correction.", "parameters": {"type": "object", "properties": {"email": {"type": "string", "description": "The recipient's email address"}, "order_id": {"type": "string", "description": "The order ID that was corrected"}}, "required": ["email", "order_id"], "additionalProperties": false}}], "mock_functions": "def get_order_details(order_id: str) -> dict:\n    \"\"\"\n    Retrieves the details of a specific order.\n    \n    :param order_id: The unique identifier of the order.\n    :return: A dictionary containing order details with keys:\n        - items (list[dict]): List of ordered items with 'name' and 'price'\n        - total (float): Total order amount\n        - status (str): Order status\n        - timestamp (str): Order timestamp\n    :raises ValueError: If order_id is invalid or empty\n    \"\"\"\n    if not order_id:\n        raise ValueError(\"Order ID cannot be empty\")\n    if order_id == \"ORDER123\":\n        return {\n            \"items\": [\n                {\"name\": \"Vegetarian Platter\", \"price\": 22.00},\n                {\"name\": \"Miso Soup\", \"price\": 5.00}\n            ],\n            \"total\": 27.00,\n            \"status\": \"Delivered\",\n            \"timestamp\": \"2023-07-20 18:30:00\"\n        }\n    raise ValueError(\"Invalid order ID\")\ndef verify_original_transaction(transaction_id: str) -> dict:\n    \"\"\"\n    Verifies the original transaction details from payment processor.\n    \n    :param transaction_id: The unique identifier of the transaction\n    :return: A dictionary containing transaction details with keys:\n        - items (list[dict]): List of items in original transaction\n        - amount (float): Transaction amount\n        - timestamp (str): Transaction timestamp\n    :raises ValueError: If transaction_id is invalid\n    \"\"\"\n    if not transaction_id:\n        raise ValueError(\"Transaction ID cannot be empty\")\n    if transaction_id == \"TXN456\":\n        return {\n            \"items\": [\n                {\"name\": \"Sushi Combo\", \"price\": 22.00},\n                {\"name\": \"Miso Soup\", \"price\": 5.00}\n            ],\n            \"amount\": 27.00,\n            \"timestamp\": \"2023-07-20 18:30:00\"\n        }\n    raise ValueError(\"Invalid transaction ID\")\ndef correct_order_record(order_id: str, transaction_id: str) -> bool:\n    \"\"\"\n    Corrects the order record based on the verified transaction.\n    \n    :param order_id: The unique identifier of the order to correct\n    :param transaction_id: The transaction ID to reference\n    :return: True if correction was successful, False otherwise\n    :raises ValueError: If either ID is invalid\n    \"\"\"\n    if not order_id or not transaction_id:\n        raise ValueError(\"Both order ID and transaction ID are required\")\n    if order_id == \"ORDER123\" and transaction_id == \"TXN456\":\n        return True\n    return False\ndef send_correction_confirmation(email: str, order_id: str) -> bool:\n    \"\"\"\n    Sends a confirmation email about the order correction.\n    \n    :param email: The recipient's email address\n    :param order_id: The order ID that was corrected\n    :return: True if email was sent successfully, False otherwise\n    :raises ValueError: If email is invalid or order_id is empty\n    \"\"\"\n    if not email or not order_id:\n        raise ValueError(\"Email and order ID are required\")\n    if email == \"mark@email.com\" and order_id == \"ORDER123\":\n        return True\n    return False", "user_query": "Mark here. My order ID is ORDER123, and the transaction ID is TXN456. Please correct the order record and send a confirmation email to mark@email.com.", "checklist": {"functions": ["get_order_details", "verify_original_transaction", "correct_order_record", "send_correction_confirmation"], "values": [{"items": [{"name": "Vegetarian Platter", "price": 22.0}, {"name": "Miso Soup", "price": 5.0}], "total": 27.0, "status": "Delivered", "timestamp": "2023-07-20 18:30:00"}, {"items": [{"name": "Sushi Combo", "price": 22.0}, {"name": "Miso Soup", "price": 5.0}], "amount": 27.0, "timestamp": "2023-07-20 18:30:00"}, true, true]}}
{"difficulty": "hard", "function_schema_python": "def search_news_articles(search_engine: str, query: str, start_year: int, end_year: int) -> list:\n    \"\"\"Searches for news articles using a specified search engine within a given date range.\n\n    :param search_engine: The name of the search engine to use (e.g., 'serper', 'duckduckgo').\n    :param query: The search query (e.g., 'Korean War').\n    :param start_year: The start year of the search date range (e.g., 1950).\n    :param end_year: The end year of the search date range (e.g., 1960).\n    :return: A list of article URLs found.\n    :raises ValueError: If start_year or end_year is not within 1950-1960 or search_engine is not recognized.\"\"\"\n    pass\ndef fetch_article_content(url: str, scraper_tool: str) -> str:\n    \"\"\"Fetches the content of a news article using a specified scraping tool.\n\n    :param url: The URL of the article to be scraped.\n    :param scraper_tool: The scraping tool to use (e.g., 'scrapy', 'beautifulsoup').\n    :return: The text content of the article.\n    :raises ValueError: If the url is empty or the scraper_tool is not recognized.\"\"\"\n    pass\ndef analyze_language_and_tone(article_content: str, nlp_tool: str) -> dict:\n    \"\"\"Analyzes the language and tone of an article using a specified natural language processing tool.\n\n    :param article_content: The text content of the article to be analyzed.\n    :param nlp_tool: The natural language processing tool to use (e.g., 'spacy').\n    :return: A dictionary containing the language and tone analysis results.\n        dict: Expected keys:\n            - language_style (str): The style of writing (e.g., formal, informal).\n            - tone (str): The emotional tone (e.g., neutral, positive, negative).\n            - keyword_frequency (dict): A dictionary of keyword frequencies.\n    :raises ValueError: If article_content is empty or nlp_tool is not recognized.\"\"\"\n    pass\ndef create_timeline_visualization(analysis_results: list, visualization_tool: str) -> str:\n    \"\"\"Creates a timeline visualization of news articles analysis results using a specified visualization tool.\n\n    :param analysis_results: A list of analysis results (one per article).\n    :param visualization_tool: The visualization tool to use (e.g., 'pandas').\n    :return: A string representing the  URL to view the timeline visualization.\n    :raises ValueError: If analysis_results is empty or visualization_tool is not recognized.\"\"\"\n    pass\n", "function_schema_json": [{"name": "search_news_articles", "description": "Searches for news articles using a specified search engine within a given date range.", "parameters": {"type": "object", "properties": {"search_engine": {"type": "string", "description": "The name of the search engine to use (e.g., 'serper', 'duckduckgo')."}, "query": {"type": "string", "description": "The search query (e.g., 'Korean War')."}, "start_year": {"type": "integer", "description": "The start year of the search date range (e.g., 1950)."}, "end_year": {"type": "integer", "description": "The end year of the search date range (e.g., 1960)."}}, "required": ["search_engine", "query", "start_year", "end_year"], "additionalProperties": false}}, {"name": "fetch_article_content", "description": "Fetches the content of a news article using a specified scraping tool.", "parameters": {"type": "object", "properties": {"url": {"type": "string", "description": "The URL of the article to be scraped."}, "scraper_tool": {"type": "string", "description": "The scraping tool to use (e.g., 'scrapy', 'beautifulsoup')."}}, "required": ["url", "scraper_tool"], "additionalProperties": false}}, {"name": "analyze_language_and_tone", "description": "Analyzes the language and tone of an article using a specified natural language processing tool.", "parameters": {"type": "object", "properties": {"article_content": {"type": "string", "description": "The text content of the article to be analyzed."}, "nlp_tool": {"type": "string", "description": "The natural language processing tool to use (e.g., 'spacy')."}}, "required": ["article_content", "nlp_tool"], "additionalProperties": false}}, {"name": "create_timeline_visualization", "description": "Creates a timeline visualization of news articles analysis results using a specified visualization tool.", "parameters": {"type": "object", "properties": {"analysis_results": {"type": "array", "description": "A list of analysis results (one per article)."}, "visualization_tool": {"type": "string", "description": "The visualization tool to use (e.g., 'pandas')."}}, "required": ["analysis_results", "visualization_tool"], "additionalProperties": false}}], "mock_functions": "def search_news_articles(search_engine: str, query: str, start_year: int, end_year: int) -> list:\n    \"\"\"\n    Searches for news articles using a specified search engine within a given date range.\n    \n    :param search_engine: The name of the search engine to use (e.g., 'serper', 'duckduckgo').\n    :param query: The search query (e.g., 'Korean War').\n    :param start_year: The start year of the search date range (e.g., 1950).\n    :param end_year: The end year of the search date range (e.g., 1960).\n    :return: A list of article URLs found.\n    :raises ValueError: If start_year or end_year is not within 1950-1960 or search_engine is not recognized.\n    \"\"\"\n    valid_engines = ['serper', 'duckduckgo']\n    if search_engine not in valid_engines:\n        raise ValueError(f\"Search engine must be one of {valid_engines}.\")\n    if not 1950 <= start_year <= 1960 or not 1950 <= end_year <= 1960:\n        raise ValueError(\"Start year and end year must be between 1950 and 1960, inclusive.\")\n    \n    mock_articles = [\"https://www.washingtonpost.com/1950-article\", \"https://www.timesoflondon.com/1955-article\"]\n    return mock_articles\ndef fetch_article_content(url: str, scraper_tool: str) -> str:\n    \"\"\"\n    Fetches the content of a news article using a specified scraping tool.\n    \n    :param url: The URL of the article to be scraped.\n    :param scraper_tool: The scraping tool to use (e.g., 'scrapy', 'beautifulsoup').\n    :return: The text content of the article.\n    :raises ValueError: If the url is empty or the scraper_tool is not recognized.\n    \"\"\"\n    valid_tools = ['scrapy', 'beautifulsoup']\n    if scraper_tool not in valid_tools:\n        raise ValueError(f\"Scraper tool must be one of {valid_tools}.\")\n    if not url:\n        raise ValueError(\"URL must not be empty.\")\n\n    mock_content = (\"Title: Korean War Analysis\\n\"\n                    \"Date: September 1, 1950\\n\"\n                    \"Content: The Korean War, which began on June 25, 1950, was an armed conflict between North \"\n                    \"Korea and South Korea that was part of the Cold War. The war caused widespread devastation in \"\n                    \"Korea and sharpened the ideological divisions between the Soviet Union and the United States.\")\n    return mock_content\ndef analyze_language_and_tone(article_content: str, nlp_tool: str) -> dict:\n    \"\"\"\n    Analyzes the language and tone of an article using a specified natural language processing tool.\n    \n    :param article_content: The text content of the article to be analyzed.\n    :param nlp_tool: The natural language processing tool to use (e.g., 'spacy').\n    :return: A dictionary containing the language and tone analysis results.\n        dict: Expected keys:\n            - language_style (str): The style of writing (e.g., formal, informal).\n            - tone (str): The emotional tone (e.g., neutral, positive, negative).\n            - keyword_frequency (dict): A dictionary of keyword frequencies.\n    :raises ValueError: If article_content is empty or nlp_tool is not recognized.\n    \"\"\"\n    valid_tools = ['spacy']\n    if nlp_tool not in valid_tools:\n        raise ValueError(f\"NLP tool must be one of {valid_tools}.\")\n    if not article_content:\n        raise ValueError(\"Article content must not be empty.\")\n    \n    mock_analysis = {\n        \"language_style\": \"formal\",\n        \"tone\": \"neutral\",\n        \"keyword_frequency\": {\n            \"korean\": 2,\n            \"war\": 2,\n            \"conflict\": 1,\n            \"soviet\": 1,\n            \"united\": 1,\n            \"states\": 1\n        }\n    }\n    return mock_analysis\ndef create_timeline_visualization(analysis_results: list, visualization_tool: str) -> str:\n    \"\"\"\n    Creates a timeline visualization of news articles analysis results using a specified visualization tool.\n    \n    :param analysis_results: A list of analysis results (one per article).\n    :param visualization_tool: The visualization tool to use (e.g., 'pandas').\n    :return: A string representing the  URL to view the timeline visualization.\n    :raises ValueError: If analysis_results is empty or visualization_tool is not recognized.\n    \"\"\"\n    valid_tools = ['pandas']\n    if visualization_tool not in valid_tools:\n        raise ValueError(f\"Visualization tool must be one of {valid_tools}.\")\n    if not analysis_results:\n        raise ValueError(\"Analysis results must not be empty.\")\n    \n    mock_url = \"https://visualize-your-timeline.com/1950-1960-korean-war\"\n    return mock_url", "user_query": "This is James. Please search for Korean War articles between 1950 and 1960 using serper, fetch their content with beautifulsoup, analyze their language and tone with spacy, and create a timeline visualization using pandas to show how reporting changed over time.", "checklist": {"functions": ["search_news_articles", "fetch_article_content", "analyze_language_and_tone", "create_timeline_visualization"], "values": [["https://www.washingtonpost.com/1950-article", "https://www.timesoflondon.com/1955-article"], "Title: Korean War Analysis\nDate: September 1, 1950\nContent: The Korean War, which began on June 25, 1950, was an armed conflict between North Korea and South Korea that was part of the Cold War. The war caused widespread devastation in Korea and sharpened the ideological divisions between the Soviet Union and the United States.", {"language_style": "formal", "tone": "neutral", "keyword_frequency": {"korean": 2, "war": 2, "conflict": 1, "soviet": 1, "united": 1, "states": 1}}, "https://visualize-your-timeline.com/1950-1960-korean-war"]}}
{"difficulty": "hard", "function_schema_python": "def scholar_search(keyword: str) -> list:\n    \"\"\"Searches for experts in battery technology based on a given keyword.\n\n    :param keyword: The search term used to identify relevant research.\n    :return: A list of dictionaries, each representing an expert with keys:\n        - name (str): The name of the expert.\n        - publication (str): A title of a relevant publication.\n        - institution (str): The institution the expert is affiliated with.\n    :raises ValueError: If the keyword is not a string.\"\"\"\n    pass\ndef risk_management(company_id: str, search_papers: list) -> dict:\n    \"\"\"Assesses the financial and technological risks for a company based on its ID and related research papers.\n\n    :param company_id: The ID of the company to assess (e.g., \"VT-472\").\n    :param search_papers: A list of dictionaries representing relevant research papers.\n    :return: A dictionary with the following keys:\n        - financial_risk (str): Description of financial risks.\n        - technological_risk (str): Description of technological risks.\n    :raises ValueError: If company_id is not a string or search_papers is not a list.\"\"\"\n    pass\ndef data_aggregation(risk_profile: dict, experts: list) -> dict:\n    \"\"\"Compiles a comprehensive risk profile for a company by aggregating data from risk management and scholar search.\n\n    :param risk_profile: A dictionary representing the financial and technological risks.\n    :param experts: A list of dictionaries representing experts from scholar search.\n    :return: A dictionary with the following keys:\n        - company_id (str): The ID of the company.\n        - financial_risk (str): Description of financial risks.\n        - technological_risk (str): Description of technological risks.\n        - experts (list): List of relevant experts.\n    :raises ValueError: If risk_profile is not a dictionary or experts is not a list.\"\"\"\n    pass\ndef generate_report(aggregated_data: dict) -> str:\n    \"\"\"Generates a summary report of key risks and potential mitigation strategies based on aggregated data.\n\n    :param aggregated_data: A dictionary representing the aggregated risk profile.\n    :return: A string summarizing key risks and potential mitigation strategies.\n    :raises ValueError: If aggregated_data is not a dictionary.\"\"\"\n    pass\n", "function_schema_json": [{"name": "scholar_search", "description": "Searches for experts in battery technology based on a given keyword.", "parameters": {"type": "object", "properties": {"keyword": {"type": "string", "description": "The search term used to identify relevant research."}}, "required": ["keyword"], "additionalProperties": false}}, {"name": "risk_management", "description": "Assesses the financial and technological risks for a company based on its ID and related research papers.", "parameters": {"type": "object", "properties": {"company_id": {"type": "string", "description": "The ID of the company to assess (e.g., \"VT-472\")."}, "search_papers": {"type": "array", "description": "A list of dictionaries representing relevant research papers."}}, "required": ["company_id", "search_papers"], "additionalProperties": false}}, {"name": "data_aggregation", "description": "Compiles a comprehensive risk profile for a company by aggregating data from risk management and scholar search.", "parameters": {"type": "object", "properties": {"risk_profile": {"type": "object", "description": "A dictionary representing the financial and technological risks."}, "experts": {"type": "array", "description": "A list of dictionaries representing experts from scholar search."}}, "required": ["risk_profile", "experts"], "additionalProperties": false}}, {"name": "generate_report", "description": "Generates a summary report of key risks and potential mitigation strategies based on aggregated data.", "parameters": {"type": "object", "properties": {"aggregated_data": {"type": "object", "description": "A dictionary representing the aggregated risk profile."}}, "required": ["aggregated_data"], "additionalProperties": false}}], "mock_functions": "def scholar_search(keyword: str) -> list:\n    \"\"\"\n    Searches for experts in battery technology based on a given keyword.\n    \n    :param keyword: The search term used to identify relevant research.\n    :return: A list of dictionaries, each representing an expert with keys:\n        - name (str): The name of the expert.\n        - publication (str): A title of a relevant publication.\n        - institution (str): The institution the expert is affiliated with.\n    :raises ValueError: If the keyword is not a string.\n    \"\"\"\n    if not isinstance(keyword, str):\n        raise ValueError(\"The keyword must be a string.\")\n    if keyword.lower() == \"solid-state battery advancements\":\n        return [\n            {\"name\": \"Dr. Jane Doe\", \"publication\": \"Advancements in Solid-State Batteries\", \"institution\": \"Stanford University\"},\n            {\"name\": \"Prof. John Smith\", \"publication\": \"Solid-State Battery Innovations\", \"institution\": \"MIT\"},\n        ]\n    return []\ndef risk_management(company_id: str, search_papers: list) -> dict:\n    \"\"\"\n    Assesses the financial and technological risks for a company based on its ID and related research papers.\n    \n    :param company_id: The ID of the company to assess (e.g., \"VT-472\").\n    :param search_papers: A list of dictionaries representing relevant research papers.\n    :return: A dictionary with the following keys:\n        - financial_risk (str): Description of financial risks.\n        - technological_risk (str): Description of technological risks.\n    :raises ValueError: If company_id is not a string or search_papers is not a list.\n    \"\"\"\n    if not isinstance(company_id, str) or not isinstance(search_papers, list):\n        raise ValueError(\"company_id must be a string and search_papers must be a list.\")\n    if company_id == \"VT-472\":\n        return {\n            \"financial_risk\": \"High volatility in market valuations due to competition.\",\n            \"technological_risk\": \"Uncertainty in the scalability of solid-state battery technology.\"\n        }\n    return {}\ndef data_aggregation(risk_profile: dict, experts: list) -> dict:\n    \"\"\"\n    Compiles a comprehensive risk profile for a company by aggregating data from risk management and scholar search.\n    \n    :param risk_profile: A dictionary representing the financial and technological risks.\n    :param experts: A list of dictionaries representing experts from scholar search.\n    :return: A dictionary with the following keys:\n        - company_id (str): The ID of the company.\n        - financial_risk (str): Description of financial risks.\n        - technological_risk (str): Description of technological risks.\n        - experts (list): List of relevant experts.\n    :raises ValueError: If risk_profile is not a dictionary or experts is not a list.\n    \"\"\"\n    if not isinstance(risk_profile, dict) or not isinstance(experts, list):\n        raise ValueError(\"risk_profile must be a dictionary and experts must be a list.\")\n    return {\n        \"company_id\": \"VT-472\",\n        \"financial_risk\": risk_profile.get(\"financial_risk\", \"\"),\n        \"technological_risk\": risk_profile.get(\"technological_risk\", \"\"),\n        \"experts\": experts\n    }\ndef generate_report(aggregated_data: dict) -> str:\n    \"\"\"\n    Generates a summary report of key risks and potential mitigation strategies based on aggregated data.\n    \n    :param aggregated_data: A dictionary representing the aggregated risk profile.\n    :return: A string summarizing key risks and potential mitigation strategies.\n    :raises ValueError: If aggregated_data is not a dictionary.\n    \"\"\"\n    if not isinstance(aggregated_data, dict):\n        raise ValueError(\"aggregated_data must be a dictionary.\")\n    return (\n        f\"Company ID: {aggregated_data['company_id']}\\n\"\n        f\"Financial Risk: {aggregated_data['financial_risk']}\\n\"\n        f\"Technological Risk: {aggregated_data['technological_risk']}\\n\"\n        f\"Relevant Experts:\\n\"\n        f\"{', '.join([expert['name'] for expert in aggregated_data['experts']])}\\n\"\n        \"Mitigation Strategies: Implement diversification strategies and invest in R&D.\"\n    )", "user_query": "Assess the risk for VoltTech (VT-472) using Risk Management, considering experts found via Scholar Search with \"solid-state battery advancements\" as the keyword.", "checklist": {"functions": ["scholar_search", "risk_management", "data_aggregation", "generate_report"], "values": [[{"name": "Dr. Jane Doe", "publication": "Advancements in Solid-State Batteries", "institution": "Stanford University"}, {"name": "Prof. John Smith", "publication": "Solid-State Battery Innovations", "institution": "MIT"}], {"financial_risk": "High volatility in market valuations due to competition.", "technological_risk": "Uncertainty in the scalability of solid-state battery technology."}, {"company_id": "VT-472", "financial_risk": "High volatility in market valuations due to competition.", "technological_risk": "Uncertainty in the scalability of solid-state battery technology.", "experts": [{"name": "Dr. Jane Doe", "publication": "Advancements in Solid-State Batteries", "institution": "Stanford University"}, {"name": "Prof. John Smith", "publication": "Solid-State Battery Innovations", "institution": "MIT"}]}, "Company ID: VT-472\nFinancial Risk: High volatility in market valuations due to competition.\nTechnological Risk: Uncertainty in the scalability of solid-state battery technology.\nRelevant Experts:\nDr. Jane Doe, Prof. John Smith\nMitigation Strategies: Implement diversification strategies and invest in R&D."]}}
{"difficulty": "hard", "function_schema_python": "def scholar_search(keyword: str) -> list:\n    \"\"\"Searches for experts in battery technology based on a given keyword.\n\n    :param keyword: The search term used to identify relevant research.\n    :return: A list of dictionaries, each representing an expert with keys:\n        - name (str): The name of the expert.\n        - publication (str): A title of a relevant publication.\n        - institution (str): The institution the expert is affiliated with.\n    :raises ValueError: If the keyword is not a string.\"\"\"\n    pass\ndef risk_management(company_id: str, search_papers: list) -> dict:\n    \"\"\"Assesses the financial and technological risks for a company based on its ID and related research papers.\n\n    :param company_id: The ID of the company to assess (e.g., \"VT-472\").\n    :param search_papers: A list of dictionaries representing relevant research papers.\n    :return: A dictionary with the following keys:\n        - financial_risk (str): Description of financial risks.\n        - technological_risk (str): Description of technological risks.\n    :raises ValueError: If company_id is not a string or search_papers is not a list.\"\"\"\n    pass\ndef data_aggregation(risk_profile: dict, experts: list) -> dict:\n    \"\"\"Compiles a comprehensive risk profile for a company by aggregating data from risk management and scholar search.\n\n    :param risk_profile: A dictionary representing the financial and technological risks.\n    :param experts: A list of dictionaries representing experts from scholar search.\n    :return: A dictionary with the following keys:\n        - company_id (str): The ID of the company.\n        - financial_risk (str): Description of financial risks.\n        - technological_risk (str): Description of technological risks.\n        - experts (list): List of relevant experts.\n    :raises ValueError: If risk_profile is not a dictionary or experts is not a list.\"\"\"\n    pass\ndef generate_report(aggregated_data: dict) -> str:\n    \"\"\"Generates a summary report of key risks and potential mitigation strategies based on aggregated data.\n\n    :param aggregated_data: A dictionary representing the aggregated risk profile.\n    :return: A string summarizing key risks and potential mitigation strategies.\n    :raises ValueError: If aggregated_data is not a dictionary.\"\"\"\n    pass\n", "function_schema_json": [{"name": "scholar_search", "description": "Searches for experts in battery technology based on a given keyword.", "parameters": {"type": "object", "properties": {"keyword": {"type": "string", "description": "The search term used to identify relevant research."}}, "required": ["keyword"], "additionalProperties": false}}, {"name": "risk_management", "description": "Assesses the financial and technological risks for a company based on its ID and related research papers.", "parameters": {"type": "object", "properties": {"company_id": {"type": "string", "description": "The ID of the company to assess (e.g., \"VT-472\")."}, "search_papers": {"type": "array", "description": "A list of dictionaries representing relevant research papers."}}, "required": ["company_id", "search_papers"], "additionalProperties": false}}, {"name": "data_aggregation", "description": "Compiles a comprehensive risk profile for a company by aggregating data from risk management and scholar search.", "parameters": {"type": "object", "properties": {"risk_profile": {"type": "object", "description": "A dictionary representing the financial and technological risks."}, "experts": {"type": "array", "description": "A list of dictionaries representing experts from scholar search."}}, "required": ["risk_profile", "experts"], "additionalProperties": false}}, {"name": "generate_report", "description": "Generates a summary report of key risks and potential mitigation strategies based on aggregated data.", "parameters": {"type": "object", "properties": {"aggregated_data": {"type": "object", "description": "A dictionary representing the aggregated risk profile."}}, "required": ["aggregated_data"], "additionalProperties": false}}], "mock_functions": "def scholar_search(keyword: str) -> list:\n    \"\"\"\n    Searches for experts in battery technology based on a given keyword.\n    \n    :param keyword: The search term used to identify relevant research.\n    :return: A list of dictionaries, each representing an expert with keys:\n        - name (str): The name of the expert.\n        - publication (str): A title of a relevant publication.\n        - institution (str): The institution the expert is affiliated with.\n    :raises ValueError: If the keyword is not a string.\n    \"\"\"\n    if not isinstance(keyword, str):\n        raise ValueError(\"The keyword must be a string.\")\n    if keyword.lower() == \"solid-state battery advancements\":\n        return [\n            {\"name\": \"Dr. Jane Doe\", \"publication\": \"Advancements in Solid-State Batteries\", \"institution\": \"Stanford University\"},\n            {\"name\": \"Prof. John Smith\", \"publication\": \"Solid-State Battery Innovations\", \"institution\": \"MIT\"},\n        ]\n    return []\ndef risk_management(company_id: str, search_papers: list) -> dict:\n    \"\"\"\n    Assesses the financial and technological risks for a company based on its ID and related research papers.\n    \n    :param company_id: The ID of the company to assess (e.g., \"VT-472\").\n    :param search_papers: A list of dictionaries representing relevant research papers.\n    :return: A dictionary with the following keys:\n        - financial_risk (str): Description of financial risks.\n        - technological_risk (str): Description of technological risks.\n    :raises ValueError: If company_id is not a string or search_papers is not a list.\n    \"\"\"\n    if not isinstance(company_id, str) or not isinstance(search_papers, list):\n        raise ValueError(\"company_id must be a string and search_papers must be a list.\")\n    if company_id == \"VT-472\":\n        return {\n            \"financial_risk\": \"High volatility in market valuations due to competition.\",\n            \"technological_risk\": \"Uncertainty in the scalability of solid-state battery technology.\"\n        }\n    return {}\ndef data_aggregation(risk_profile: dict, experts: list) -> dict:\n    \"\"\"\n    Compiles a comprehensive risk profile for a company by aggregating data from risk management and scholar search.\n    \n    :param risk_profile: A dictionary representing the financial and technological risks.\n    :param experts: A list of dictionaries representing experts from scholar search.\n    :return: A dictionary with the following keys:\n        - company_id (str): The ID of the company.\n        - financial_risk (str): Description of financial risks.\n        - technological_risk (str): Description of technological risks.\n        - experts (list): List of relevant experts.\n    :raises ValueError: If risk_profile is not a dictionary or experts is not a list.\n    \"\"\"\n    if not isinstance(risk_profile, dict) or not isinstance(experts, list):\n        raise ValueError(\"risk_profile must be a dictionary and experts must be a list.\")\n    return {\n        \"company_id\": \"VT-472\",\n        \"financial_risk\": risk_profile.get(\"financial_risk\", \"\"),\n        \"technological_risk\": risk_profile.get(\"technological_risk\", \"\"),\n        \"experts\": experts\n    }\ndef generate_report(aggregated_data: dict) -> str:\n    \"\"\"\n    Generates a summary report of key risks and potential mitigation strategies based on aggregated data.\n    \n    :param aggregated_data: A dictionary representing the aggregated risk profile.\n    :return: A string summarizing key risks and potential mitigation strategies.\n    :raises ValueError: If aggregated_data is not a dictionary.\n    \"\"\"\n    if not isinstance(aggregated_data, dict):\n        raise ValueError(\"aggregated_data must be a dictionary.\")\n    return (\n        f\"Company ID: {aggregated_data['company_id']}\\n\"\n        f\"Financial Risk: {aggregated_data['financial_risk']}\\n\"\n        f\"Technological Risk: {aggregated_data['technological_risk']}\\n\"\n        f\"Relevant Experts:\\n\"\n        f\"{', '.join([expert['name'] for expert in aggregated_data['experts']])}\\n\"\n        \"Mitigation Strategies: Implement diversification strategies and invest in R&D.\"\n    )", "user_query": "Mark from Redwood Capital requests a risk assessment report for VoltTech (VT-472). Aggregate data from Risk Management and Scholar Search (keyword: \"solid-state battery advancements\") to generate the report.", "checklist": {"functions": ["scholar_search", "risk_management", "data_aggregation", "generate_report"], "values": [[{"name": "Dr. Jane Doe", "publication": "Advancements in Solid-State Batteries", "institution": "Stanford University"}, {"name": "Prof. John Smith", "publication": "Solid-State Battery Innovations", "institution": "MIT"}], {"financial_risk": "High volatility in market valuations due to competition.", "technological_risk": "Uncertainty in the scalability of solid-state battery technology."}, {"company_id": "VT-472", "financial_risk": "High volatility in market valuations due to competition.", "technological_risk": "Uncertainty in the scalability of solid-state battery technology.", "experts": [{"name": "Dr. Jane Doe", "publication": "Advancements in Solid-State Batteries", "institution": "Stanford University"}, {"name": "Prof. John Smith", "publication": "Solid-State Battery Innovations", "institution": "MIT"}]}, "Company ID: VT-472\nFinancial Risk: High volatility in market valuations due to competition.\nTechnological Risk: Uncertainty in the scalability of solid-state battery technology.\nRelevant Experts:\nDr. Jane Doe, Prof. John Smith\nMitigation Strategies: Implement diversification strategies and invest in R&D."]}}
{"difficulty": "hard", "function_schema_python": "def verify_user_alt(username: str, security_question_answer: str) -> bool:\n    \"\"\"Verifies user identity using alternative methods.\n\n    :param username: The username of the user to verify.\n    :param security_question_answer: The answer to a previously set security question.\n    :return: True if the user is verified, False otherwise.\n    :raises ValueError: If the username or security question answer is empty.\"\"\"\n    pass\ndef check_access_control(user_id: int) -> bool:\n    \"\"\"Checks user access permissions.\n\n    :param user_id: The ID of the user to check.\n    :return: True if the user has proper access, False otherwise.\n    :raises ValueError: If the user ID is not provided or invalid.\"\"\"\n    pass\ndef check_calendar_sync(user_id: int) -> bool:\n    \"\"\"Checks for calendar synchronization issues.\n\n    :param user_id: The ID of the user to check.\n    :return: True if there are no synchronization issues, False otherwise.\n    :raises ValueError: If the user ID is not provided or invalid.\"\"\"\n    pass\ndef reset_password(user_id: int) -> dict:\n    \"\"\"Initiates a secure password reset process.\n\n    :param user_id: The ID of the user to reset the password for.\n    :return:\n        dict: A dictionary with the following keys:\n            - status (bool): True if the password reset is initiated successfully, False otherwise.\n            - message (str): A status message.\n    :raises ValueError: If the user ID is not provided or invalid.\"\"\"\n    pass\n", "function_schema_json": [{"name": "verify_user_alt", "description": "Verifies user identity using alternative methods.", "parameters": {"type": "object", "properties": {"username": {"type": "string", "description": "The username of the user to verify."}, "security_question_answer": {"type": "string", "description": "The answer to a previously set security question."}}, "required": ["username", "security_question_answer"], "additionalProperties": false}}, {"name": "check_access_control", "description": "Checks user access permissions.", "parameters": {"type": "object", "properties": {"user_id": {"type": "integer", "description": "The ID of the user to check."}}, "required": ["user_id"], "additionalProperties": false}}, {"name": "check_calendar_sync", "description": "Checks for calendar synchronization issues.", "parameters": {"type": "object", "properties": {"user_id": {"type": "integer", "description": "The ID of the user to check."}}, "required": ["user_id"], "additionalProperties": false}}, {"name": "reset_password", "description": "Initiates a secure password reset process.", "parameters": {"type": "object", "properties": {"user_id": {"type": "integer", "description": "The ID of the user to reset the password for."}}, "required": ["user_id"], "additionalProperties": false}}], "mock_functions": "def verify_user_alt(username: str, security_question_answer: str) -> bool:\n    \"\"\"\n    Verifies user identity using alternative methods.\n    \n    :param username: The username of the user to verify.\n    :param security_question_answer: The answer to a previously set security question.\n    :return: True if the user is verified, False otherwise.\n    :raises ValueError: If the username or security question answer is empty.\n    \"\"\"\n    if not username or not security_question_answer:\n        raise ValueError(\"Username and security question answer must be provided.\")\n    if username == \"john.doe123\" and security_question_answer == \"mydogspot\":\n        return True\n    return False\ndef check_access_control(user_id: int) -> bool:\n    \"\"\"\n    Checks user access permissions.\n    \n    :param user_id: The ID of the user to check.\n    :return: True if the user has proper access, False otherwise.\n    :raises ValueError: If the user ID is not provided or invalid.\n    \"\"\"\n    if not user_id:\n        raise ValueError(\"User ID must be provided.\")\n    if user_id == 9876:\n        return True\n    return False\ndef check_calendar_sync(user_id: int) -> bool:\n    \"\"\"\n    Checks for calendar synchronization issues.\n    \n    :param user_id: The ID of the user to check.\n    :return: True if there are no synchronization issues, False otherwise.\n    :raises ValueError: If the user ID is not provided or invalid.\n    \"\"\"\n    if not user_id:\n        raise ValueError(\"User ID must be provided.\")\n    if user_id == 9876:\n        return False  # Simulate a synchronization issue\n    return True\ndef reset_password(user_id: int) -> dict:\n    \"\"\"\n    Initiates a secure password reset process.\n    \n    :param user_id: The ID of the user to reset the password for.\n    :return:\n        dict: A dictionary with the following keys:\n            - status (bool): True if the password reset is initiated successfully, False otherwise.\n            - message (str): A status message.\n    :raises ValueError: If the user ID is not provided or invalid.\n    \"\"\"\n    if not user_id:\n        raise ValueError(\"User ID must be provided.\")\n    if user_id == 9876:\n        return {\n            \"status\": True,\n            \"message\": \"Password reset initiated successfully.\"\n        }\n    return {\n        \"status\": False,\n        \"message\": \"Failed to initiate password reset.\"\n    }", "user_query": "This is John. Please check why my appointments are not showing by verifying my identity with username 'john.doe123' and answer 'mydogspot', then verify access with user ID 9876, and check if there are calendar sync issues, resetting my password if necessary.", "checklist": {"functions": ["verify_user_alt", "check_access_control", "check_calendar_sync", "reset_password"], "values": [true, true, false, {"status": true, "message": "Password reset initiated successfully."}]}}
{"difficulty": "hard", "function_schema_python": "def extract_website_data(source_id: str, start_date: str, end_date: str) -> dict:\n    \"\"\"Extracts website analytics data from a specified source between given dates.\n\n    :param source_id: The identifier of the data source (e.g., \"GT-Web-Analytics-2024\").\n    :param start_date: The start date in the format \"YYYY-MM-DD\".\n    :param end_date: The end date in the format \"YYYY-MM-DD\".\n    :return:\n        dict: A dictionary with the following keys:\n            - user_ids (list[int]): List of user IDs.\n            - timestamps (list[str]): List of timestamps in the format \"YYYY-MM-DD HH:MM:SS\".\n            - product_ids (list[str]): List of product IDs.\n            - visits (list[int]): Number of visits for each user/product entry.\n    :raises ValueError: If any parameter is invalid.\"\"\"\n    pass\ndef extract_social_media_data(source_id: str, start_date: str, end_date: str) -> dict:\n    \"\"\"Extracts social media engagement data from a specified source between given dates.\n\n    :param source_id: The identifier of the data source (e.g., \"GT-Social-2024\").\n    :param start_date: The start date in the format \"YYYY-MM-DD\".\n    :param end_date: The end date in the format \"YYYY-MM-DD\".\n    :return:\n        dict: A dictionary with the following keys:\n            - user_ids (list[int]): List of user IDs.\n            - timestamps (list[str]): List of timestamps in the format \"YYYY-MM-DD HH:MM:SS\".\n            - product_ids (list[str]): List of product IDs.\n            - likes (list[int]): Number of likes for each user/product entry.\n            - shares (list[int]): Number of shares for each user/product entry.\n            - comments (list[int]): Number of comments for each user/product entry.\n    :raises ValueError: If any parameter is invalid.\"\"\"\n    pass\ndef aggregate_daily_engagement(web_data: dict, social_data: dict) -> dict:\n    \"\"\"Aggregates daily engagement data from website and social media sources for each product.\n\n    :param web_data: Website analytics data dictionary.\n    :param social_data: Social media engagement data dictionary.\n    :return:\n        dict: A dictionary with the following keys:\n            - product_ids (list[str]): List of product IDs.\n            - dates (list[str]): List of dates in the format \"YYYY-MM-DD\".\n            - visits (list[int]): Total website visits for each product and date.\n            - likes (list[int]): Total likes for each product and date.\n            - shares (list[int]): Total shares for each product and date.\n            - comments (list[int]): Total comments for each product and date.\n    :raises ValueError: If any parameter is invalid.\"\"\"\n    pass\ndef generate_engagement_graph(aggregated_data: dict) -> str:\n    \"\"\"Generates a graph visualizing combined daily engagement metrics for each product.\n\n    :param aggregated_data: Aggregated engagement data dictionary.\n    :return:\n        str: A string representation of the generated graph.\n    :raises ValueError: If the aggregated data is invalid.\"\"\"\n    pass\n", "function_schema_json": [{"name": "extract_website_data", "description": "Extracts website analytics data from a specified source between given dates.", "parameters": {"type": "object", "properties": {"source_id": {"type": "string", "description": "The identifier of the data source (e.g., \"GT-Web-Analytics-2024\")."}, "start_date": {"type": "string", "description": "The start date in the format \"YYYY-MM-DD\"."}, "end_date": {"type": "string", "description": "The end date in the format \"YYYY-MM-DD\"."}}, "required": ["source_id", "start_date", "end_date"], "additionalProperties": false}}, {"name": "extract_social_media_data", "description": "Extracts social media engagement data from a specified source between given dates.", "parameters": {"type": "object", "properties": {"source_id": {"type": "string", "description": "The identifier of the data source (e.g., \"GT-Social-2024\")."}, "start_date": {"type": "string", "description": "The start date in the format \"YYYY-MM-DD\"."}, "end_date": {"type": "string", "description": "The end date in the format \"YYYY-MM-DD\"."}}, "required": ["source_id", "start_date", "end_date"], "additionalProperties": false}}, {"name": "aggregate_daily_engagement", "description": "Aggregates daily engagement data from website and social media sources for each product.", "parameters": {"type": "object", "properties": {"web_data": {"type": "object", "description": "Website analytics data dictionary."}, "social_data": {"type": "object", "description": "Social media engagement data dictionary."}}, "required": ["web_data", "social_data"], "additionalProperties": false}}, {"name": "generate_engagement_graph", "description": "Generates a graph visualizing combined daily engagement metrics for each product.", "parameters": {"type": "object", "properties": {"aggregated_data": {"type": "object", "description": "Aggregated engagement data dictionary."}}, "required": ["aggregated_data"], "additionalProperties": false}}], "mock_functions": "def extract_website_data(source_id: str, start_date: str, end_date: str) -> dict:\n    \"\"\"\n    Extracts website analytics data from a specified source between given dates.\n    \n    :param source_id: The identifier of the data source (e.g., \"GT-Web-Analytics-2024\").\n    :param start_date: The start date in the format \"YYYY-MM-DD\".\n    :param end_date: The end date in the format \"YYYY-MM-DD\".\n    :return:\n        dict: A dictionary with the following keys:\n            - user_ids (list[int]): List of user IDs.\n            - timestamps (list[str]): List of timestamps in the format \"YYYY-MM-DD HH:MM:SS\".\n            - product_ids (list[str]): List of product IDs.\n            - visits (list[int]): Number of visits for each user/product entry.\n    :raises ValueError: If any parameter is invalid.\n    \"\"\"\n    if not source_id or not start_date or not end_date:\n        raise ValueError(\"Source ID, start date, and end date must be provided.\")\n    if source_id != \"GT-Web-Analytics-2024\":\n        raise ValueError(\"Invalid source ID.\")\n    if start_date > end_date:\n        raise ValueError(\"Start date must be before end date.\")\n    \n    # Mock data\n    return {\n        \"user_ids\": [101, 102, 103],\n        \"timestamps\": [\"2024-07-01 12:34:56\", \"2024-07-01 15:01:01\", \"2024-07-02 08:23:45\"],\n        \"product_ids\": [\"P001\", \"P002\", \"P001\"],\n        \"visits\": [1, 1, 2]\n    }\ndef extract_social_media_data(source_id: str, start_date: str, end_date: str) -> dict:\n    \"\"\"\n    Extracts social media engagement data from a specified source between given dates.\n    \n    :param source_id: The identifier of the data source (e.g., \"GT-Social-2024\").\n    :param start_date: The start date in the format \"YYYY-MM-DD\".\n    :param end_date: The end date in the format \"YYYY-MM-DD\".\n    :return:\n        dict: A dictionary with the following keys:\n            - user_ids (list[int]): List of user IDs.\n            - timestamps (list[str]): List of timestamps in the format \"YYYY-MM-DD HH:MM:SS\".\n            - product_ids (list[str]): List of product IDs.\n            - likes (list[int]): Number of likes for each user/product entry.\n            - shares (list[int]): Number of shares for each user/product entry.\n            - comments (list[int]): Number of comments for each user/product entry.\n    :raises ValueError: If any parameter is invalid.\n    \"\"\"\n    if not source_id or not start_date or not end_date:\n        raise ValueError(\"Source ID, start date, and end date must be provided.\")\n    if source_id != \"GT-Social-2024\":\n        raise ValueError(\"Invalid source ID.\")\n    if start_date > end_date:\n        raise ValueError(\"Start date must be before end date.\")\n    \n    # Mock data\n    return {\n        \"user_ids\": [101, 102, 103],\n        \"timestamps\": [\"2024-07-01 13:01:01\", \"2024-07-01 16:34:56\", \"2024-07-02 09:30:45\"],\n        \"product_ids\": [\"P001\", \"P002\", \"P001\"],\n        \"likes\": [5, 3, 7],\n        \"shares\": [2, 1, 3],\n        \"comments\": [1, 0, 2]\n    }\ndef aggregate_daily_engagement(web_data: dict, social_data: dict) -> dict:\n    \"\"\"\n    Aggregates daily engagement data from website and social media sources for each product.\n    \n    :param web_data: Website analytics data dictionary.\n    :param social_data: Social media engagement data dictionary.\n    :return:\n        dict: A dictionary with the following keys:\n            - product_ids (list[str]): List of product IDs.\n            - dates (list[str]): List of dates in the format \"YYYY-MM-DD\".\n            - visits (list[int]): Total website visits for each product and date.\n            - likes (list[int]): Total likes for each product and date.\n            - shares (list[int]): Total shares for each product and date.\n            - comments (list[int]): Total comments for each product and date.\n    :raises ValueError: If any parameter is invalid.\n    \"\"\"\n    if not web_data or not social_data:\n        raise ValueError(\"Website and social data must be provided.\")\n    \n    # Mock aggregation logic\n    aggregated_data = {\n        \"product_ids\": [\"P001\", \"P001\", \"P002\"],\n        \"dates\": [\"2024-07-01\", \"2024-07-02\", \"2024-07-01\"],\n        \"visits\": [3, 2, 1],\n        \"likes\": [12, 7, 3],\n        \"shares\": [5, 3, 1],\n        \"comments\": [3, 2, 0]\n    }\n    return aggregated_data\ndef generate_engagement_graph(aggregated_data: dict) -> str:\n    \"\"\"\n    Generates a graph visualizing combined daily engagement metrics for each product.\n    \n    :param aggregated_data: Aggregated engagement data dictionary.\n    :return:\n        str: A string representation of the generated graph.\n    :raises ValueError: If the aggregated data is invalid.\n    \"\"\"\n    if not aggregated_data:\n        raise ValueError(\"Aggregated data must be provided.\")\n    \n    # Mock graph generation logic\n    return f\"Graph generated for products: {aggregated_data['product_ids']} on dates: {aggregated_data['dates']} with combined metrics.\"", "user_query": "David from Global Trends Inc. again.  Extract website data from GT-Web-Analytics-2024 and social media data from GT-Social-2024, both between 2024-07-01 and 2024-08-31.", "checklist": {"functions": ["extract_website_data", "extract_social_media_data", "aggregate_daily_engagement", "generate_engagement_graph"], "values": [{"user_ids": [101, 102, 103], "timestamps": ["2024-07-01 12:34:56", "2024-07-01 15:01:01", "2024-07-02 08:23:45"], "product_ids": ["P001", "P002", "P001"], "visits": [1, 1, 2]}, {"user_ids": [101, 102, 103], "timestamps": ["2024-07-01 13:01:01", "2024-07-01 16:34:56", "2024-07-02 09:30:45"], "product_ids": ["P001", "P002", "P001"], "likes": [5, 3, 7], "shares": [2, 1, 3], "comments": [1, 0, 2]}, {"product_ids": ["P001", "P001", "P002"], "dates": ["2024-07-01", "2024-07-02", "2024-07-01"], "visits": [3, 2, 1], "likes": [12, 7, 3], "shares": [5, 3, 1], "comments": [3, 2, 0]}, "Graph generated for products: ['P001', 'P001', 'P002'] on dates: ['2024-07-01', '2024-07-02', '2024-07-01'] with combined metrics."]}}
{"difficulty": "hard", "function_schema_python": "def access_calendar(calendar_id: str) -> list:\n    \"\"\"Accesses a calendar and retrieves appointments.\n\n    :param calendar_id: The ID of the calendar to access (e.g., \"dr_lee@cityskinclinic.com\").\n    :return: A list of appointment dictionaries. Each dictionary contains:\n        - 'date': str (e.g., \"2024-08-10\")\n        - 'time': str (e.g., \"10:00\")\n        - 'patient': str (e.g., \"Jane Doe\")\n    :raises ValueError: If the calendar ID is invalid.\"\"\"\n    pass\ndef cancel_appointment(calendar_id: str, date: str, time: str, patient_name: str) -> bool:\n    \"\"\"Cancels an existing appointment.\n\n    :param calendar_id: The ID of the calendar.\n    :param date: The date of the appointment.\n    :param time: The time of the appointment.\n    :param patient_name: The patient's name\n    :return: True if the appointment was successfully cancelled, False otherwise.\"\"\"\n    pass\ndef find_available_slots(calendar_id: str, date: str, start_time: str) -> list:\n    \"\"\"Finds available time slots in a calendar.\n\n    :param calendar_id: The ID of the calendar.\n    :param date: The date to search for slots.\n    :param start_time: The earliest time to consider.\n    :return: A list of available time slots (e.g., [\"14:00\", \"14:30\", \"15:00\"]).\"\"\"\n    pass\ndef reschedule_appointment(calendar_id: str, date: str, time: str, patient_name: str) -> bool:\n    \"\"\"Reschedules an appointment.\n\n    :param calendar_id: The ID of the calendar.\n    :param date: The new date of the appointment.\n    :param time: The new time of the appointment.\n    :param patient_name: The patient's name\n    :return: True if the appointment was successfully rescheduled, False otherwise.\"\"\"\n    pass\ndef confirm_appointment(patient_name: str, date: str, time: str) -> bool:\n    \"\"\"Confirms the new appointment time with the patient.\n\n    :param patient_name: The patient's name.\n    :param date: The new appointment date.\n    :param time: The new appointment time.\n    :return: True if the appointment was confirmed.\"\"\"\n    pass\n", "function_schema_json": [{"name": "access_calendar", "description": "Accesses a calendar and retrieves appointments.", "parameters": {"type": "object", "properties": {"calendar_id": {"type": "string", "description": "The ID of the calendar to access (e.g., \"dr_lee@cityskinclinic.com\")."}}, "required": ["calendar_id"], "additionalProperties": false}}, {"name": "cancel_appointment", "description": "Cancels an existing appointment.", "parameters": {"type": "object", "properties": {"calendar_id": {"type": "string", "description": "The ID of the calendar."}, "date": {"type": "string", "description": "The date of the appointment."}, "time": {"type": "string", "description": "The time of the appointment."}, "patient_name": {"type": "string", "description": "The patient's name"}}, "required": ["calendar_id", "date", "time", "patient_name"], "additionalProperties": false}}, {"name": "find_available_slots", "description": "Finds available time slots in a calendar.", "parameters": {"type": "object", "properties": {"calendar_id": {"type": "string", "description": "The ID of the calendar."}, "date": {"type": "string", "description": "The date to search for slots."}, "start_time": {"type": "string", "description": "The earliest time to consider."}}, "required": ["calendar_id", "date", "start_time"], "additionalProperties": false}}, {"name": "reschedule_appointment", "description": "Reschedules an appointment.", "parameters": {"type": "object", "properties": {"calendar_id": {"type": "string", "description": "The ID of the calendar."}, "date": {"type": "string", "description": "The new date of the appointment."}, "time": {"type": "string", "description": "The new time of the appointment."}, "patient_name": {"type": "string", "description": "The patient's name"}}, "required": ["calendar_id", "date", "time", "patient_name"], "additionalProperties": false}}, {"name": "confirm_appointment", "description": "Confirms the new appointment time with the patient.", "parameters": {"type": "object", "properties": {"patient_name": {"type": "string", "description": "The patient's name."}, "date": {"type": "string", "description": "The new appointment date."}, "time": {"type": "string", "description": "The new appointment time."}}, "required": ["patient_name", "date", "time"], "additionalProperties": false}}], "mock_functions": "def access_calendar(calendar_id: str) -> list:\n    \"\"\"\n    Accesses a calendar and retrieves appointments.\n\n    :param calendar_id: The ID of the calendar to access (e.g., \"dr_lee@cityskinclinic.com\").\n    :return: A list of appointment dictionaries. Each dictionary contains:\n        - 'date': str (e.g., \"2024-08-10\")\n        - 'time': str (e.g., \"10:00\")\n        - 'patient': str (e.g., \"Jane Doe\")\n    :raises ValueError: If the calendar ID is invalid.\n    \"\"\"\n    if calendar_id == \"dr_lee@cityskinclinic.com\":\n        return [\n            {'date': '2024-08-10', 'time': '10:00', 'patient': 'Jane Doe'},\n            {'date': '2024-08-12', 'time': '09:00', 'patient': 'John Smith'}\n        ]\n    return []\ndef cancel_appointment(calendar_id: str, date: str, time: str, patient_name:str) -> bool:\n    \"\"\"\n    Cancels an existing appointment.\n\n    :param calendar_id: The ID of the calendar.\n    :param date: The date of the appointment.\n    :param time: The time of the appointment.\n    :param patient_name: The patient's name\n    :return: True if the appointment was successfully cancelled, False otherwise.\n    \"\"\"\n    if calendar_id == \"dr_lee@cityskinclinic.com\" and date == \"2024-08-10\" and time == \"10:00\" and patient_name == \"Jane Doe\":\n        return True\n    return False\ndef find_available_slots(calendar_id: str, date: str, start_time: str) -> list:\n    \"\"\"\n    Finds available time slots in a calendar.\n\n    :param calendar_id: The ID of the calendar.\n    :param date: The date to search for slots.\n    :param start_time: The earliest time to consider.\n    :return: A list of available time slots (e.g., [\"14:00\", \"14:30\", \"15:00\"]).\n    \"\"\"\n    if calendar_id == \"dr_lee@cityskinclinic.com\" and date == \"2024-08-11\" and start_time == \"14:00\":\n        return [\"14:00\", \"14:30\", \"15:00\"]\n    return []\ndef reschedule_appointment(calendar_id: str, date: str, time: str, patient_name: str) -> bool:\n    \"\"\"\n    Reschedules an appointment.\n\n    :param calendar_id: The ID of the calendar.\n    :param date: The new date of the appointment.\n    :param time: The new time of the appointment.\n    :param patient_name: The patient's name\n    :return: True if the appointment was successfully rescheduled, False otherwise.\n    \"\"\"\n    if calendar_id == \"dr_lee@cityskinclinic.com\" and date == \"2024-08-11\" and time == \"14:00\" and patient_name == \"Jane Doe\":\n        return True\n    return False\ndef confirm_appointment(patient_name: str, date: str, time: str) -> bool:\n    \"\"\"\n    Confirms the new appointment time with the patient.\n\n    :param patient_name: The patient's name.\n    :param date: The new appointment date.\n    :param time: The new appointment time.\n    :return: True if the appointment was confirmed.\n    \"\"\"\n    if patient_name == \"Jane Doe\" and date == \"2024-08-11\" and time == \"14:00\":\n        return True\n    return False", "user_query": "Jane Doe needs to reschedule her appointment with Dr. Lee (dr_lee@cityskinclinic.com) on August 10th at 10:00 AM to August 11th, after 2:00 PM.  Cancel the old appointment, find a new time slot on August 11th, reschedule the appointment, and confirm the new time with Jane Doe.", "checklist": {"functions": ["access_calendar", "cancel_appointment", "find_available_slots", "reschedule_appointment", "confirm_appointment"], "values": [[{"date": "2024-08-10", "time": "10:00", "patient": "Jane Doe"}, {"date": "2024-08-12", "time": "09:00", "patient": "John Smith"}], true, ["14:00", "14:30", "15:00"], true, true]}}
{"difficulty": "hard", "function_schema_python": "def check_network_latency(data_center: str, load_balancer: str) -> dict:\n    \"\"\"Checks the network latency between a load balancer and the database cluster in a specific data center.\n\n    :param data_center: The data center identifier (e.g., \"DC-EAST\", \"DC-WEST\").\n    :param load_balancer: The load balancer identifier (e.g., \"LB-01\", \"LB-02\").\n    :return: A dictionary with the following keys:\n        - latency (int): The current network latency in milliseconds.\n        - normal_latency (int): The normal network latency in milliseconds.\n    :raises ValueError: If the data center or load balancer is invalid.\"\"\"\n    pass\ndef get_load_balancer_status(data_center: str, load_balancer: str) -> dict:\n    \"\"\"Retrieves the status of a load balancer in a specific data center.\n\n    :param data_center: The data center identifier (e.g., \"DC-EAST\", \"DC-WEST\").\n    :param load_balancer: The load balancer identifier (e.g., \"LB-01\", \"LB-02\").\n    :return: A dictionary with the following keys:\n        - status (str): The status of the load balancer (e.g., \"UP\", \"DOWN\").\n        - last_check_time (str): The last time the status was checked.\n    :raises ValueError: If the data center or load balancer is invalid.\"\"\"\n    pass\ndef check_database_cluster_health(data_center: str) -> dict:\n    \"\"\"Checks the health of the database cluster in a specific data center.\n\n    :param data_center: The data center identifier (e.g., \"DC-EAST\", \"DC-WEST\").\n    :return: A dictionary with the following keys:\n        - health (str): The health status of the database cluster (e.g., \"OK\", \"DEGRADED\").\n        - last_check_time (str): The last time the health was checked.\n    :raises ValueError: If the data center is invalid.\"\"\"\n    pass\ndef get_scheduled_maintenance_history(data_center: str) -> list:\n    \"\"\"Retrieves the scheduled maintenance history for network switches in a specific data center.\n\n    :param data_center: The data center identifier (e.g., \"DC-EAST\", \"DC-WEST\").\n    :return: A list of maintenance events with the following keys:\n        - event_time (str): The time of the scheduled maintenance.\n        - event_description (str): A description of the scheduled maintenance.\n        - affected_assets (list[str]): A list of assets affected by the maintenance.\n    :raises ValueError: If the data center is invalid.\"\"\"\n    pass\n", "function_schema_json": [{"name": "check_network_latency", "description": "Checks the network latency between a load balancer and the database cluster in a specific data center.", "parameters": {"type": "object", "properties": {"data_center": {"type": "string", "description": "The data center identifier (e.g., \"DC-EAST\", \"DC-WEST\")."}, "load_balancer": {"type": "string", "description": "The load balancer identifier (e.g., \"LB-01\", \"LB-02\")."}}, "required": ["data_center", "load_balancer"], "additionalProperties": false}}, {"name": "get_load_balancer_status", "description": "Retrieves the status of a load balancer in a specific data center.", "parameters": {"type": "object", "properties": {"data_center": {"type": "string", "description": "The data center identifier (e.g., \"DC-EAST\", \"DC-WEST\")."}, "load_balancer": {"type": "string", "description": "The load balancer identifier (e.g., \"LB-01\", \"LB-02\")."}}, "required": ["data_center", "load_balancer"], "additionalProperties": false}}, {"name": "check_database_cluster_health", "description": "Checks the health of the database cluster in a specific data center.", "parameters": {"type": "object", "properties": {"data_center": {"type": "string", "description": "The data center identifier (e.g., \"DC-EAST\", \"DC-WEST\")."}}, "required": ["data_center"], "additionalProperties": false}}, {"name": "get_scheduled_maintenance_history", "description": "Retrieves the scheduled maintenance history for network switches in a specific data center.", "parameters": {"type": "object", "properties": {"data_center": {"type": "string", "description": "The data center identifier (e.g., \"DC-EAST\", \"DC-WEST\")."}}, "required": ["data_center"], "additionalProperties": false}}], "mock_functions": "def check_network_latency(data_center: str, load_balancer: str) -> dict:\n    \"\"\"\n    Checks the network latency between a load balancer and the database cluster in a specific data center.\n    \n    :param data_center: The data center identifier (e.g., \"DC-EAST\", \"DC-WEST\").\n    :param load_balancer: The load balancer identifier (e.g., \"LB-01\", \"LB-02\").\n    :return: A dictionary with the following keys:\n        - latency (int): The current network latency in milliseconds.\n        - normal_latency (int): The normal network latency in milliseconds.\n    :raises ValueError: If the data center or load balancer is invalid.\n    \"\"\"\n    if data_center not in [\"DC-EAST\", \"DC-WEST\"]:\n        raise ValueError(\"Invalid data center identifier.\")\n    if load_balancer not in [\"LB-01\", \"LB-02\"]:\n        raise ValueError(\"Invalid load balancer identifier.\")\n    \n    # Mock logic: Simulate increased latency for load balancers after maintenance.\n    normal_latency = 5\n    if load_balancer in [\"LB-01\", \"LB-02\"]:\n        latency = 75\n    else:\n        latency = normal_latency\n    \n    return {\n        \"latency\": latency,\n        \"normal_latency\": normal_latency\n    }\ndef get_load_balancer_status(data_center: str, load_balancer: str) -> dict:\n    \"\"\"\n    Retrieves the status of a load balancer in a specific data center.\n    \n    :param data_center: The data center identifier (e.g., \"DC-EAST\", \"DC-WEST\").\n    :param load_balancer: The load balancer identifier (e.g., \"LB-01\", \"LB-02\").\n    :return: A dictionary with the following keys:\n        - status (str): The status of the load balancer (e.g., \"UP\", \"DOWN\").\n        - last_check_time (str): The last time the status was checked.\n    :raises ValueError: If the data center or load balancer is invalid.\n    \"\"\"\n    if data_center not in [\"DC-EAST\", \"DC-WEST\"]:\n        raise ValueError(\"Invalid data center identifier.\")\n    if load_balancer not in [\"LB-01\", \"LB-02\"]:\n        raise ValueError(\"Invalid load balancer identifier.\")\n    \n    # Mock logic: Simulate load balancer status.\n    if load_balancer in [\"LB-01\", \"LB-02\"]:\n        status = \"UP\"\n        last_check_time = \"2023-10-05 07:45:00 PST\"\n    else:\n        status = \"UNKNOWN\"\n        last_check_time = \"2023-10-05 07:45:00 PST\"\n    \n    return {\n        \"status\": status,\n        \"last_check_time\": last_check_time\n    }\ndef check_database_cluster_health(data_center: str) -> dict:\n    \"\"\"\n    Checks the health of the database cluster in a specific data center.\n    \n    :param data_center: The data center identifier (e.g., \"DC-EAST\", \"DC-WEST\").\n    :return: A dictionary with the following keys:\n        - health (str): The health status of the database cluster (e.g., \"OK\", \"DEGRADED\").\n        - last_check_time (str): The last time the health was checked.\n    :raises ValueError: If the data center is invalid.\n    \"\"\"\n    if data_center not in [\"DC-EAST\", \"DC-WEST\"]:\n        raise ValueError(\"Invalid data center identifier.\")\n    \n    # Mock logic: Simulate database cluster health.\n    health = \"OK\"\n    last_check_time = \"2023-10-05 07:45:00 PST\"\n    \n    return {\n        \"health\": health,\n        \"last_check_time\": last_check_time\n    }\ndef get_scheduled_maintenance_history(data_center: str) -> list:\n    \"\"\"\n    Retrieves the scheduled maintenance history for network switches in a specific data center.\n    \n    :param data_center: The data center identifier (e.g., \"DC-EAST\", \"DC-WEST\").\n    :return: A list of maintenance events with the following keys:\n        - event_time (str): The time of the scheduled maintenance.\n        - event_description (str): A description of the scheduled maintenance.\n        - affected_assets (list[str]): A list of assets affected by the maintenance.\n    :raises ValueError: If the data center is invalid.\n    \"\"\"\n    if data_center not in [\"DC-EAST\", \"DC-WEST\"]:\n        raise ValueError(\"Invalid data center identifier.\")\n    \n    # Mock logic: Simulate a maintenance history.\n    maintenance_history = [\n        {\n            \"event_time\": \"2023-10-05 03:45:00 PST\",\n            \"event_description\": \"Scheduled maintenance on network switches.\",\n            \"affected_assets\": [\"Switch-01\", \"Switch-02\", \"Switch-03\"]\n        },\n        {\n            \"event_time\": \"2023-09-27 03:45:00 PST\",\n            \"event_description\": \"Quarterly maintenance on network switches.\",\n            \"affected_assets\": [\"Switch-04\", \"Switch-05\", \"Switch-06\"]\n        }\n    ]\n    \n    return maintenance_history", "user_query": "Marcus Rodriguez here.  Check network latency between LB-01 and DB-CLUSTER-A in both data centers. Get the scheduled maintenance history for DC-EAST and DC-WEST since 23:45 PST on 2023-10-04, and also check the database cluster health for both data centers.", "checklist": {"functions": ["check_network_latency", "check_database_cluster_health", "get_scheduled_maintenance_history"], "values": [{"latency": 75, "normal_latency": 5}, {"latency": 75, "normal_latency": 5}, {"health": "OK", "last_check_time": "2023-10-05 07:45:00 PST"}, {"health": "OK", "last_check_time": "2023-10-05 07:45:00 PST"}, [{"event_time": "2023-10-05 03:45:00 PST", "event_description": "Scheduled maintenance on network switches.", "affected_assets": ["Switch-01", "Switch-02", "Switch-03"]}], [{"event_time": "2023-10-05 03:45:00 PST", "event_description": "Scheduled maintenance on network switches.", "affected_assets": ["Switch-01", "Switch-02", "Switch-03"]}]]}}
{"difficulty": "hard", "function_schema_python": "def identify_large_files(directory: str, size_threshold_mb: int) -> list:\n    \"\"\"Identifies files larger than a specified size in a given directory.\n\n    :param directory: The directory to search.\n    :param size_threshold_mb: The size threshold in MB.\n    :return: A list of file paths exceeding the size threshold.\"\"\"\n    pass\ndef archive_old_files(directory: str, days_threshold: int) -> list:\n    \"\"\"Archives files older than a specified number of days.\n\n    :param directory: The directory to process.\n    :param days_threshold: The age threshold in days.\n    :return: A list of archived file paths.\"\"\"\n    pass\ndef generate_filesystem_report(directory: str) -> dict:\n    \"\"\"Generates a report of file system usage.\n\n    :param directory: The directory to analyze.\n    :return: A dictionary containing usage statistics.\"\"\"\n    pass\ndef remove_temp_files(directory: str, days_threshold: int) -> list:\n    \"\"\"Removes temporary files that haven't been accessed in a specified number of days.\n\n    :param directory: The directory to clean.\n    :param days_threshold: The inactivity threshold in days.\n    :return: A list of removed file paths.\"\"\"\n    pass\n", "function_schema_json": [{"name": "identify_large_files", "description": "Identifies files larger than a specified size in a given directory.", "parameters": {"type": "object", "properties": {"directory": {"type": "string", "description": "The directory to search."}, "size_threshold_mb": {"type": "integer", "description": "The size threshold in MB."}}, "required": ["directory", "size_threshold_mb"], "additionalProperties": false}}, {"name": "archive_old_files", "description": "Archives files older than a specified number of days.", "parameters": {"type": "object", "properties": {"directory": {"type": "string", "description": "The directory to process."}, "days_threshold": {"type": "integer", "description": "The age threshold in days."}}, "required": ["directory", "days_threshold"], "additionalProperties": false}}, {"name": "generate_filesystem_report", "description": "Generates a report of file system usage.", "parameters": {"type": "object", "properties": {"directory": {"type": "string", "description": "The directory to analyze."}}, "required": ["directory"], "additionalProperties": false}}, {"name": "remove_temp_files", "description": "Removes temporary files that haven't been accessed in a specified number of days.", "parameters": {"type": "object", "properties": {"directory": {"type": "string", "description": "The directory to clean."}, "days_threshold": {"type": "integer", "description": "The inactivity threshold in days."}}, "required": ["directory", "days_threshold"], "additionalProperties": false}}], "mock_functions": "def identify_large_files(directory: str, size_threshold_mb: int) -> list:\n    \"\"\"\n    Identifies files larger than a specified size in a given directory.\n\n    :param directory: The directory to search.\n    :param size_threshold_mb: The size threshold in MB.\n    :return: A list of file paths exceeding the size threshold.\n    \"\"\"\n    large_files = []\n    if not directory or size_threshold_mb <= 0:\n        return []  # or raise ValueError for stricter input validation\n\n    # Mock implementation\n    if directory == \"/dev/projects\" and size_threshold_mb >= 500:\n        large_files = [\n            \"/dev/projects/project_a/large_file_1.zip\",\n            \"/dev/projects/project_b/large_dataset.csv\"\n        ]\n\n    return large_files\ndef archive_old_files(directory: str, days_threshold: int) -> list:\n    \"\"\"\n    Archives files older than a specified number of days.\n\n    :param directory: The directory to process.\n    :param days_threshold: The age threshold in days.\n    :return: A list of archived file paths.\n    \"\"\"\n    archived_files = []\n\n    if not directory or days_threshold <= 0:\n        return [] # or raise ValueError\n\n    # Mock implementation\n    if directory == \"/dev/projects\" and days_threshold >= 180:\n        archived_files = [\n            \"/dev/projects/project_a/old_report.pdf\",\n            \"/dev/projects/project_b/archive_data.tar.gz\"\n        ]\n    return archived_files\ndef generate_filesystem_report(directory: str) -> dict:\n    \"\"\"\n    Generates a report of file system usage.\n\n    :param directory: The directory to analyze.\n    :return: A dictionary containing usage statistics.\n    \"\"\"\n    if not directory:\n        return {}\n\n    # Mock implementation\n    if directory == \"/dev/projects\":\n        return {\n            \"total_space\": \"100GB\",\n            \"used_space\": \"60GB\",\n            \"free_space\": \"40GB\"\n        }\n    return {}\ndef remove_temp_files(directory: str, days_threshold: int) -> list:\n    \"\"\"\n    Removes temporary files that haven't been accessed in a specified number of days.\n\n    :param directory: The directory to clean.\n    :param days_threshold: The inactivity threshold in days.\n    :return: A list of removed file paths.\n    \"\"\"\n    removed_files = []\n\n    if not directory or days_threshold <= 0:\n        return [] # or raise ValueError\n    \n    if directory == \"/tmp\" and days_threshold >= 30:\n        removed_files = [\n            \"/tmp/temp_file_1.txt\",\n            \"/tmp/temp_file_2.log\"\n        ]\n\n    return removed_files", "user_query": "Can you identify large files over 500MB in the directory /dev/projects?", "checklist": {"functions": ["identify_large_files", "archive_old_files", "generate_filesystem_report", "remove_temp_files"], "values": [["/dev/projects/project_a/large_file_1.zip", "/dev/projects/project_b/large_dataset.csv"], ["/dev/projects/project_a/old_report.pdf", "/dev/projects/project_b/archive_data.tar.gz"], {"total_space": "100GB", "used_space": "60GB", "free_space": "40GB"}, ["/tmp/temp_file_1.txt", "/tmp/temp_file_2.log"]]}}
{"difficulty": "hard", "function_schema_python": "def get_system_resources() -> dict:\n    \"\"\"Retrieves current system resource usage statistics.\n\n    :return: Dictionary containing system resource information\n        - cpu_percent (float): CPU usage percentage\n        - memory_percent (float): Memory usage percentage\n        - disk_usage (float): Disk usage percentage\n        - network_usage (dict): Network interface statistics\n    :raises RuntimeError: If unable to retrieve system statistics\"\"\"\n    pass\ndef list_resource_intensive_processes() -> list:\n    \"\"\"Lists all processes consuming significant system resources.\n\n    :return: List of dictionaries containing process information\n        - pid (int): Process ID\n        - name (str): Process name\n        - cpu_percent (float): CPU usage percentage\n        - memory_percent (float): Memory usage percentage\n    :raises RuntimeError: If unable to retrieve process list\"\"\"\n    pass\ndef terminate_process(pid: int) -> bool:\n    \"\"\"Terminates a specific process by its process ID.\n\n    :param pid: Process ID to terminate\n    :return: True if process was successfully terminated, False otherwise\n    :raises ValueError: If pid is invalid\n    :raises PermissionError: If user lacks permission to terminate the process\"\"\"\n    pass\ndef optimize_system_resources(target_cpu_percent: float) -> bool:\n    \"\"\"Automatically optimizes system resources by managing processes.\n\n    :param target_cpu_percent: Target CPU usage percentage to achieve\n    :return: True if optimization was successful, False otherwise\n    :raises ValueError: If target_cpu_percent is not between 0 and 100\"\"\"\n    pass\n", "function_schema_json": [{"name": "get_system_resources", "description": "Retrieves current system resource usage statistics.", "parameters": {"type": "object", "properties": {}, "required": [], "additionalProperties": false}}, {"name": "list_resource_intensive_processes", "description": "Lists all processes consuming significant system resources.", "parameters": {"type": "object", "properties": {}, "required": [], "additionalProperties": false}}, {"name": "terminate_process", "description": "Terminates a specific process by its process ID.", "parameters": {"type": "object", "properties": {"pid": {"type": "integer", "description": "Process ID to terminate"}}, "required": ["pid"], "additionalProperties": false}}, {"name": "optimize_system_resources", "description": "Automatically optimizes system resources by managing processes.", "parameters": {"type": "object", "properties": {"target_cpu_percent": {"type": "number", "description": "Target CPU usage percentage to achieve"}}, "required": ["target_cpu_percent"], "additionalProperties": false}}], "mock_functions": "def get_system_resources() -> dict:\n    \"\"\"\n    Retrieves current system resource usage statistics.\n    \n    :return: Dictionary containing system resource information\n        - cpu_percent (float): CPU usage percentage\n        - memory_percent (float): Memory usage percentage\n        - disk_usage (float): Disk usage percentage\n        - network_usage (dict): Network interface statistics\n    :raises RuntimeError: If unable to retrieve system statistics\n    \"\"\"\n    return {\n        \"cpu_percent\": 85.5,\n        \"memory_percent\": 92.3,\n        \"disk_usage\": 76.8,\n        \"network_usage\": {\n            \"bytes_sent\": 1024567,\n            \"bytes_received\": 2048976\n        }\n    }\ndef list_resource_intensive_processes() -> list:\n    \"\"\"\n    Lists all processes consuming significant system resources.\n    \n    :return: List of dictionaries containing process information\n        - pid (int): Process ID\n        - name (str): Process name\n        - cpu_percent (float): CPU usage percentage\n        - memory_percent (float): Memory usage percentage\n    :raises RuntimeError: If unable to retrieve process list\n    \"\"\"\n    return [\n        {\n            \"pid\": 1234,\n            \"name\": \"data_processing.py\",\n            \"cpu_percent\": 75.5,\n            \"memory_percent\": 45.2\n        },\n        {\n            \"pid\": 5678,\n            \"name\": \"chrome\",\n            \"cpu_percent\": 25.8,\n            \"memory_percent\": 32.1\n        }\n    ]\ndef terminate_process(pid: int) -> bool:\n    \"\"\"\n    Terminates a specific process by its process ID.\n    \n    :param pid: Process ID to terminate\n    :return: True if process was successfully terminated, False otherwise\n    :raises ValueError: If pid is invalid\n    :raises PermissionError: If user lacks permission to terminate the process\n    \"\"\"\n    if not isinstance(pid, int) or pid <= 0:\n        raise ValueError(\"Invalid process ID\")\n    if pid == 1234:\n        return True\n    return False\ndef optimize_system_resources(target_cpu_percent: float = 70.0) -> bool:\n    \"\"\"\n    Automatically optimizes system resources by managing processes.\n    \n    :param target_cpu_percent: Target CPU usage percentage to achieve\n    :return: True if optimization was successful, False otherwise\n    :raises ValueError: If target_cpu_percent is not between 0 and 100\n    \"\"\"\n    if not 0 <= target_cpu_percent <= 100:\n        raise ValueError(\"Target CPU percentage must be between 0 and 100\")\n    return True if target_cpu_percent == 70.0 else False", "user_query": "This is Alex. Please terminate the 'data_processing.py' process with PID 1234, then optimize system resources to achieve a target CPU usage of 70%.", "checklist": {"functions": ["get_system_resources", "list_resource_intensive_processes", "terminate_process", "optimize_system_resources"], "values": [{"cpu_percent": 85.5, "memory_percent": 92.3, "disk_usage": 76.8, "network_usage": {"bytes_sent": 1024567, "bytes_received": 2048976}}, [{"pid": 1234, "name": "data_processing.py", "cpu_percent": 75.5, "memory_percent": 45.2}, {"pid": 5678, "name": "chrome", "cpu_percent": 25.8, "memory_percent": 32.1}], true, true]}}
{"difficulty": "hard", "function_schema_python": "def get_employee_birthdays(month: str, year: int) -> List[Tuple[str, str]]:\n    \"\"\"Retrieves employee birthdays for a given month and year.\n\n    :param month: The month for which to retrieve birthdays (e.g., \"January\", \"February\").\n    :param year: The year for which to retrieve birthdays.\n    :return: A list of tuples, where each tuple contains (employee_name, birthday_date).\"\"\"\n    pass\ndef create_calendar_event(date: str, time: str, timezone: str, attendees: List[str], reminder_category: str) -> bool:\n    \"\"\"Creates a calendar event with specified details.\n\n    :param date: The date of the event (e.g., \"2024-01-15\").\n    :param time: The time of the event (e.g., \"10:00 AM\").\n    :param timezone: The timezone for the event (e.g., \"EST\", \"PST\", \"GMT\").\n    :param attendees: A list of employee names to invite.\n    :param reminder_category: The reminder category (e.g., \"department-wide\", \"team-specific\").\n    :return: True if the event was created successfully, False otherwise.\"\"\"\n    pass\ndef set_event_permissions(event_id: str, permissions: Dict[str, bool]) -> bool:\n    \"\"\"Sets permissions for a calendar event.\n\n    :param event_id: The ID of the event.\n    :param permissions: A dictionary of permissions, where keys are employee names and values are booleans\n                       indicating whether the employee has permission to view/modify the event.\n    :return: True if permissions were set successfully, False otherwise.\"\"\"\n    pass\ndef sync_with_microsoft_365(calendar_data: dict) -> bool:\n    \"\"\"Syncs calendar data with Microsoft 365.\n\n    :param calendar_data: A dictionary containing calendar data to sync.\n    :return: True if sync was successful, False otherwise.\"\"\"\n    pass\n", "function_schema_json": [{"name": "get_employee_birthdays", "description": "Retrieves employee birthdays for a given month and year.", "parameters": {"type": "object", "properties": {"month": {"type": "string", "description": "The month for which to retrieve birthdays (e.g., \"January\", \"February\")."}, "year": {"type": "integer", "description": "The year for which to retrieve birthdays."}}, "required": ["month", "year"], "additionalProperties": false}}, {"name": "create_calendar_event", "description": "Creates a calendar event with specified details.", "parameters": {"type": "object", "properties": {"date": {"type": "string", "description": "The date of the event (e.g., \"2024-01-15\")."}, "time": {"type": "string", "description": "The time of the event (e.g., \"10:00 AM\")."}, "timezone": {"type": "string", "description": "The timezone for the event (e.g., \"EST\", \"PST\", \"GMT\")."}, "attendees": {"type": "array", "items": {"type": "string"}, "description": "A list of employee names to invite."}, "reminder_category": {"type": "string", "description": "The reminder category (e.g., \"department-wide\", \"team-specific\")."}}, "required": ["date", "time", "timezone", "attendees", "reminder_category"], "additionalProperties": false}}, {"name": "set_event_permissions", "description": "Sets permissions for a calendar event.", "parameters": {"type": "object", "properties": {"event_id": {"type": "string", "description": "The ID of the event."}, "permissions": {"type": "object", "description": "A dictionary of permissions, where keys are employee names and values are booleans"}}, "required": ["event_id", "permissions"], "additionalProperties": false}}, {"name": "sync_with_microsoft_365", "description": "Syncs calendar data with Microsoft 365.", "parameters": {"type": "object", "properties": {"calendar_data": {"type": "object", "description": "A dictionary containing calendar data to sync."}}, "required": ["calendar_data"], "additionalProperties": false}}], "mock_functions": "def get_employee_birthdays(month: str, year: int) -> List[Tuple[str, str]]:\n    \"\"\"\n    Retrieves employee birthdays for a given month and year.\n\n    :param month: The month for which to retrieve birthdays (e.g., \"January\", \"February\").\n    :param year: The year for which to retrieve birthdays.\n    :return: A list of tuples, where each tuple contains (employee_name, birthday_date).\n    \"\"\"\n    if month == \"January\" and year == 2024:  # Example mock data\n        return [(\"Alice\", \"2024-01-15\"), (\"Bob\", \"2024-01-22\")]\n    return []\ndef create_calendar_event(date: str, time: str, timezone: str, attendees: List[str], reminder_category: str) -> bool:\n    \"\"\"\n    Creates a calendar event with specified details.\n\n    :param date: The date of the event (e.g., \"2024-01-15\").\n    :param time: The time of the event (e.g., \"10:00 AM\").\n    :param timezone: The timezone for the event (e.g., \"EST\", \"PST\", \"GMT\").\n    :param attendees: A list of employee names to invite.\n    :param reminder_category: The reminder category (e.g., \"department-wide\", \"team-specific\").\n    :return: True if the event was created successfully, False otherwise.\n    \"\"\"\n    if date and time and timezone and attendees and reminder_category:\n        return True  # Mock success\n    return False\ndef set_event_permissions(event_id: str, permissions: Dict[str, bool]) -> bool:\n    \"\"\"\n    Sets permissions for a calendar event.\n\n    :param event_id: The ID of the event.\n    :param permissions: A dictionary of permissions, where keys are employee names and values are booleans\n                       indicating whether the employee has permission to view/modify the event.\n    :return: True if permissions were set successfully, False otherwise.\n    \"\"\"\n    if event_id and permissions:\n        return True  # Mock success\n    return False\ndef sync_with_microsoft_365(calendar_data: dict) -> bool:\n    \"\"\"\n    Syncs calendar data with Microsoft 365.\n\n    :param calendar_data: A dictionary containing calendar data to sync.\n    :return: True if sync was successful, False otherwise.\n    \"\"\"\n\n    if calendar_data:\n        return True\n    return False", "user_query": "This is Marcus Chen from Global Solutions Inc. Please create a calendar event for Bob's birthday on January 22, 2024, at 3:00 PM PST for a team-specific reminder, set permissions so only Bob can modify the event, and sync it with Microsoft 365.", "checklist": {"functions": ["get_employee_birthdays", "create_calendar_event", "set_event_permissions", "sync_with_microsoft_365"], "values": [[["Alice", "2024-01-15"], ["Bob", "2024-01-22"]], true, true, true]}}
{"difficulty": "hard", "function_schema_python": "def capture_network_traffic(interface: str, duration: int) -> list:\n    \"\"\"Captures network traffic on a specified network interface for a specific duration.\n\n    :param interface: The network interface to capture traffic from (e.g., \"eth0\").\n    :param duration: The duration in seconds to capture traffic.\n    :return: A list of captured packets.\n    :raises ValueError: If the interface or duration is invalid.\"\"\"\n    pass\ndef container_resource_usage(container_id: str) -> dict:\n    \"\"\"Retrieves resource usage statistics for a specific Docker container.\n\n    :param container_id: The ID of the Docker container.\n    :return:\n        dict: A dictionary with the following keys:\n            - cpu_usage (float): CPU usage percentage.\n            - memory_usage (str): Memory usage in \"X MiB / Y MiB\" format.\n            - network_io (dict): Network I/O statistics with 'received' and 'sent' keys.\n            - block_io (dict): Block I/O statistics with 'read' and 'write' keys.\n    :raises ValueError: If the container ID is empty.\"\"\"\n    pass\ndef system_process_info(pid: int) -> dict:\n    \"\"\"Retrieves detailed information about a system process given its PID.\n\n    :param pid: The Process ID (PID).\n    :return:\n        dict: A dictionary with the following keys:\n            - name (str): Process name.\n            - status (str): Process status (e.g., 'running').\n            - cpu_usage (float): CPU usage percentage.\n            - memory_usage (str): Memory usage in \"X MiB\" format.\n            - num_threads (int): Number of threads.\n    :raises ValueError: If the PID is not a positive integer.\"\"\"\n    pass\ndef execute_command(command: str, timeout: int) -> dict:\n    \"\"\"Executes a system command and returns the output.\n\n    :param command: The command to execute.\n    :param timeout: The maximum time in seconds to wait for the command to complete.\n    :return:\n        dict: A dictionary with the following keys:\n            - return_code (int): The return code of the command.\n            - output (str): The output of the command.\n    :raises ValueError: If the command or timeout is invalid.\"\"\"\n    pass\ndef get_environment_variables() -> dict:\n    \"\"\"Retrieves the current environment variables.\n\n    :return:\n        dict: A dictionary of environment variables with key-value pairs.\"\"\"\n    pass\n", "function_schema_json": [{"name": "capture_network_traffic", "description": "Captures network traffic on a specified network interface for a specific duration.", "parameters": {"type": "object", "properties": {"interface": {"type": "string", "description": "The network interface to capture traffic from (e.g., \"eth0\")."}, "duration": {"type": "integer", "description": "The duration in seconds to capture traffic."}}, "required": ["interface", "duration"], "additionalProperties": false}}, {"name": "container_resource_usage", "description": "Retrieves resource usage statistics for a specific Docker container.", "parameters": {"type": "object", "properties": {"container_id": {"type": "string", "description": "The ID of the Docker container."}}, "required": ["container_id"], "additionalProperties": false}}, {"name": "system_process_info", "description": "Retrieves detailed information about a system process given its PID.", "parameters": {"type": "object", "properties": {"pid": {"type": "integer", "description": "The Process ID (PID)."}}, "required": ["pid"], "additionalProperties": false}}, {"name": "execute_command", "description": "Executes a system command and returns the output.", "parameters": {"type": "object", "properties": {"command": {"type": "string", "description": "The command to execute."}, "timeout": {"type": "integer", "description": "The maximum time in seconds to wait for the command to complete."}}, "required": ["command", "timeout"], "additionalProperties": false}}, {"name": "get_environment_variables", "description": "Retrieves the current environment variables.", "parameters": {"type": "object", "properties": {}, "required": [], "additionalProperties": false}}], "mock_functions": "def capture_network_traffic(interface: str, duration: int) -> list:\n    \"\"\"\n    Captures network traffic on a specified network interface for a specific duration.\n    \n    :param interface: The network interface to capture traffic from (e.g., \"eth0\").\n    :param duration: The duration in seconds to capture traffic.\n    :return: A list of captured packets.\n    :raises ValueError: If the interface or duration is invalid.\n    \"\"\"\n    if not interface or duration <= 0:\n        raise ValueError(\"Interface must be provided and duration must be greater than 0.\")\n    return [f\"Packet_{i}\" for i in range(1, 101)]  # Mock list of captured packets\ndef container_resource_usage(container_id: str) -> dict:\n    \"\"\"\n    Retrieves resource usage statistics for a specific Docker container.\n    \n    :param container_id: The ID of the Docker container.\n    :return:\n        dict: A dictionary with the following keys:\n            - cpu_usage (float): CPU usage percentage.\n            - memory_usage (str): Memory usage in \"X MiB / Y MiB\" format.\n            - network_io (dict): Network I/O statistics with 'received' and 'sent' keys.\n            - block_io (dict): Block I/O statistics with 'read' and 'write' keys.\n    :raises ValueError: If the container ID is empty.\n    \"\"\"\n    if not container_id:\n        raise ValueError(\"Container ID must be provided.\")\n    return {\n        \"cpu_usage\": 12.5,\n        \"memory_usage\": \"512 MiB / 2048 MiB\",\n        \"network_io\": {\"received\": \"10.5 MiB\", \"sent\": \"7.8 MiB\"},\n        \"block_io\": {\"read\": \"1.2 MiB\", \"write\": \"0.8 MiB\"}\n    }\ndef system_process_info(pid: int) -> dict:\n    \"\"\"\n    Retrieves detailed information about a system process given its PID.\n    \n    :param pid: The Process ID (PID).\n    :return:\n        dict: A dictionary with the following keys:\n            - name (str): Process name.\n            - status (str): Process status (e.g., 'running').\n            - cpu_usage (float): CPU usage percentage.\n            - memory_usage (str): Memory usage in \"X MiB\" format.\n            - num_threads (int): Number of threads.\n    :raises ValueError: If the PID is not a positive integer.\n    \"\"\"\n    if pid <= 0:\n        raise ValueError(\"PID must be a positive integer.\")\n    return {\n        \"name\": \"sample_process\",\n        \"status\": \"running\",\n        \"cpu_usage\": 5.3,\n        \"memory_usage\": \"256 MiB\",\n        \"num_threads\": 10\n    }\ndef execute_command(command: str, timeout: int) -> dict:\n    \"\"\"\n    Executes a system command and returns the output.\n    \n    :param command: The command to execute.\n    :param timeout: The maximum time in seconds to wait for the command to complete.\n    :return:\n        dict: A dictionary with the following keys:\n            - return_code (int): The return code of the command.\n            - output (str): The output of the command.\n    :raises ValueError: If the command or timeout is invalid.\n    \"\"\"\n    if not command or timeout <= 0:\n        raise ValueError(\"Command must be provided and timeout must be greater than 0.\")\n    return {\n        \"return_code\": 0,\n        \"output\": f\"Command '{command}' executed successfully.\"\n    }\ndef get_environment_variables() -> dict:\n    \"\"\"\n    Retrieves the current environment variables.\n    \n    :return:\n        dict: A dictionary of environment variables with key-value pairs.\n    \"\"\"\n    return {\n        \"PATH\": \"/usr/local/bin:/usr/bin:/bin\",\n        \"HOME\": \"/home/mark\",\n        \"LANG\": \"en_US.UTF-8\"\n    }", "user_query": "This is Mark. I need to check the resource usage of container `def456uvw`, get system process information for PID 12345, and execute the command `ls -l /tmp` with a timeout of 30 seconds.  Also, please show me the current environment variables.", "checklist": {"functions": ["container_resource_usage", "system_process_info", "execute_command", "get_environment_variables"], "values": [{"cpu_usage": 12.5, "memory_usage": "512 MiB / 2048 MiB", "network_io": {"received": "10.5 MiB", "sent": "7.8 MiB"}, "block_io": {"read": "1.2 MiB", "write": "0.8 MiB"}}, {"name": "sample_process", "status": "running", "cpu_usage": 5.3, "memory_usage": "256 MiB", "num_threads": 10}, {"return_code": 0, "output": "Command 'ls -l /tmp' executed successfully."}, {"PATH": "/usr/local/bin:/usr/bin:/bin", "HOME": "/home/mark", "LANG": "en_US.UTF-8"}]}}
{"difficulty": "hard", "function_schema_python": "def get_employee_birthdays(month: str, year: int) -> List[Tuple[str, str]]:\n    \"\"\"Retrieves employee birthdays for a given month and year.\n\n    :param month: The month for which to retrieve birthdays (e.g., \"January\", \"February\").\n    :param year: The year for which to retrieve birthdays.\n    :return: A list of tuples, where each tuple contains (employee_name, birthday_date).\"\"\"\n    pass\ndef create_calendar_event(date: str, time: str, timezone: str, attendees: List[str], reminder_category: str) -> bool:\n    \"\"\"Creates a calendar event with specified details.\n\n    :param date: The date of the event (e.g., \"2024-01-15\").\n    :param time: The time of the event (e.g., \"10:00 AM\").\n    :param timezone: The timezone for the event (e.g., \"EST\", \"PST\", \"GMT\").\n    :param attendees: A list of employee names to invite.\n    :param reminder_category: The reminder category (e.g., \"department-wide\", \"team-specific\").\n    :return: True if the event was created successfully, False otherwise.\"\"\"\n    pass\ndef set_event_permissions(event_id: str, permissions: Dict[str, bool]) -> bool:\n    \"\"\"Sets permissions for a calendar event.\n\n    :param event_id: The ID of the event.\n    :param permissions: A dictionary of permissions, where keys are employee names and values are booleans\n                       indicating whether the employee has permission to view/modify the event.\n    :return: True if permissions were set successfully, False otherwise.\"\"\"\n    pass\ndef sync_with_microsoft_365(calendar_data: dict) -> bool:\n    \"\"\"Syncs calendar data with Microsoft 365.\n\n    :param calendar_data: A dictionary containing calendar data to sync.\n    :return: True if sync was successful, False otherwise.\"\"\"\n    pass\n", "function_schema_json": [{"name": "get_employee_birthdays", "description": "Retrieves employee birthdays for a given month and year.", "parameters": {"type": "object", "properties": {"month": {"type": "string", "description": "The month for which to retrieve birthdays (e.g., \"January\", \"February\")."}, "year": {"type": "integer", "description": "The year for which to retrieve birthdays."}}, "required": ["month", "year"], "additionalProperties": false}}, {"name": "create_calendar_event", "description": "Creates a calendar event with specified details.", "parameters": {"type": "object", "properties": {"date": {"type": "string", "description": "The date of the event (e.g., \"2024-01-15\")."}, "time": {"type": "string", "description": "The time of the event (e.g., \"10:00 AM\")."}, "timezone": {"type": "string", "description": "The timezone for the event (e.g., \"EST\", \"PST\", \"GMT\")."}, "attendees": {"type": "array", "items": {"type": "string"}, "description": "A list of employee names to invite."}, "reminder_category": {"type": "string", "description": "The reminder category (e.g., \"department-wide\", \"team-specific\")."}}, "required": ["date", "time", "timezone", "attendees", "reminder_category"], "additionalProperties": false}}, {"name": "set_event_permissions", "description": "Sets permissions for a calendar event.", "parameters": {"type": "object", "properties": {"event_id": {"type": "string", "description": "The ID of the event."}, "permissions": {"type": "object", "description": "A dictionary of permissions, where keys are employee names and values are booleans"}}, "required": ["event_id", "permissions"], "additionalProperties": false}}, {"name": "sync_with_microsoft_365", "description": "Syncs calendar data with Microsoft 365.", "parameters": {"type": "object", "properties": {"calendar_data": {"type": "object", "description": "A dictionary containing calendar data to sync."}}, "required": ["calendar_data"], "additionalProperties": false}}], "mock_functions": "def get_employee_birthdays(month: str, year: int) -> List[Tuple[str, str]]:\n    \"\"\"\n    Retrieves employee birthdays for a given month and year.\n\n    :param month: The month for which to retrieve birthdays (e.g., \"January\", \"February\").\n    :param year: The year for which to retrieve birthdays.\n    :return: A list of tuples, where each tuple contains (employee_name, birthday_date).\n    \"\"\"\n    if month == \"January\" and year == 2024:  # Example mock data\n        return [(\"Alice\", \"2024-01-15\"), (\"Bob\", \"2024-01-22\")]\n    return []\ndef create_calendar_event(date: str, time: str, timezone: str, attendees: List[str], reminder_category: str) -> bool:\n    \"\"\"\n    Creates a calendar event with specified details.\n\n    :param date: The date of the event (e.g., \"2024-01-15\").\n    :param time: The time of the event (e.g., \"10:00 AM\").\n    :param timezone: The timezone for the event (e.g., \"EST\", \"PST\", \"GMT\").\n    :param attendees: A list of employee names to invite.\n    :param reminder_category: The reminder category (e.g., \"department-wide\", \"team-specific\").\n    :return: True if the event was created successfully, False otherwise.\n    \"\"\"\n    if date and time and timezone and attendees and reminder_category:\n        return True  # Mock success\n    return False\ndef set_event_permissions(event_id: str, permissions: Dict[str, bool]) -> bool:\n    \"\"\"\n    Sets permissions for a calendar event.\n\n    :param event_id: The ID of the event.\n    :param permissions: A dictionary of permissions, where keys are employee names and values are booleans\n                       indicating whether the employee has permission to view/modify the event.\n    :return: True if permissions were set successfully, False otherwise.\n    \"\"\"\n    if event_id and permissions:\n        return True  # Mock success\n    return False\ndef sync_with_microsoft_365(calendar_data: dict) -> bool:\n    \"\"\"\n    Syncs calendar data with Microsoft 365.\n\n    :param calendar_data: A dictionary containing calendar data to sync.\n    :return: True if sync was successful, False otherwise.\n    \"\"\"\n\n    if calendar_data:\n        return True\n    return False", "user_query": "This is Marcus Chen from Global Solutions Inc. Could you create a calendar event for Alice's birthday on January 15, 2024, at 10:00 AM EST for a department-wide reminder?", "checklist": {"functions": ["get_employee_birthdays", "create_calendar_event", "set_event_permissions", "sync_with_microsoft_365"], "values": [[["Alice", "2024-01-15"], ["Bob", "2024-01-22"]], true, true, true]}}
{"difficulty": "hard", "function_schema_python": "def scrape_patient_data(url: str, file_format: str) -> str:\n    \"\"\"Scrapes patient health data from a specified URL in the given format.\n\n    :param url: The URL from which to scrape the data.\n    :param file_format: The format of the data file (e.g., \"CSV\", \"XML\", \"JSON\").\n    :return: A string indicating the success of the task.\n    :raises ValueError: If an unsupported file format is provided.\"\"\"\n    pass\ndef transform_with_polars(df: object, transformation_config: dict) -> object:\n    \"\"\"Transforms a DataFrame using Polars based on the provided configuration.\n\n    :param df: The input DataFrame to be transformed.\n    :param transformation_config: A dictionary containing transformation rules.\n    :return: The transformed DataFrame.\n    :raises ValueError: If the DataFrame or transformation_config is invalid.\"\"\"\n    pass\ndef normalize_data(df: object, normalization_rules: dict) -> object:\n    \"\"\"Normalizes a DataFrame based on given normalization rules.\n\n    :param df: The input DataFrame to be normalized.\n    :param normalization_rules: A dictionary containing normalization rules.\n    :return: The normalized DataFrame.\n    :raises ValueError: If the DataFrame or normalization_rules is invalid.\"\"\"\n    pass\ndef convert_units(df: object, conversion_rules: dict) -> object:\n    \"\"\"Converts units of measurement in a DataFrame based on given rules.\n\n    :param df: The input DataFrame containing raw measurements.\n    :param conversion_rules: A dictionary containing unit conversion rules.\n    :return: The DataFrame with converted measurements.\n    :raises ValueError: If the DataFrame or conversion_rules is invalid.\"\"\"\n    pass\ndef ensure_data_integrity(df: object, validation_rules: dict) -> bool:\n    \"\"\"Ensures the integrity of data in a DataFrame using specified validation rules.\n\n    :param df: The DataFrame to be validated.\n    :param validation_rules: A dictionary containing validation rules.\n    :return: True if data integrity is ensured, False otherwise.\n    :raises ValueError: If the DataFrame or validation_rules is invalid.\"\"\"\n    pass\ndef create_airflow_dag(dag_id: str, task_details: list) -> dict:\n    \"\"\"Creates an Airflow DAG with the specified tasks.\n\n    :param dag_id: The unique identifier for the DAG.\n    :param task_details: A list of dictionaries containing task details.\n    :return: A dictionary representing the DAG with the following keys:\n        - dag_id (str): The ID of the DAG.\n        - tasks (list[dict]): A list of dictionaries representing each task.\n    :raises ValueError: If dag_id is empty or task_details is invalid.\"\"\"\n    pass\n", "function_schema_json": [{"name": "scrape_patient_data", "description": "Scrapes patient health data from a specified URL in the given format.", "parameters": {"type": "object", "properties": {"url": {"type": "string", "description": "The URL from which to scrape the data."}, "file_format": {"type": "string", "description": "The format of the data file (e.g., \"CSV\", \"XML\", \"JSON\")."}}, "required": ["url", "file_format"], "additionalProperties": false}}, {"name": "transform_with_polars", "description": "Transforms a DataFrame using Polars based on the provided configuration.", "parameters": {"type": "object", "properties": {"df": {"type": "string", "description": "The input DataFrame to be transformed."}, "transformation_config": {"type": "object", "description": "A dictionary containing transformation rules."}}, "required": ["df", "transformation_config"], "additionalProperties": false}}, {"name": "normalize_data", "description": "Normalizes a DataFrame based on given normalization rules.", "parameters": {"type": "object", "properties": {"df": {"type": "string", "description": "The input DataFrame to be normalized."}, "normalization_rules": {"type": "object", "description": "A dictionary containing normalization rules."}}, "required": ["df", "normalization_rules"], "additionalProperties": false}}, {"name": "convert_units", "description": "Converts units of measurement in a DataFrame based on given rules.", "parameters": {"type": "object", "properties": {"df": {"type": "string", "description": "The input DataFrame containing raw measurements."}, "conversion_rules": {"type": "object", "description": "A dictionary containing unit conversion rules."}}, "required": ["df", "conversion_rules"], "additionalProperties": false}}, {"name": "ensure_data_integrity", "description": "Ensures the integrity of data in a DataFrame using specified validation rules.", "parameters": {"type": "object", "properties": {"df": {"type": "string", "description": "The DataFrame to be validated."}, "validation_rules": {"type": "object", "description": "A dictionary containing validation rules."}}, "required": ["df", "validation_rules"], "additionalProperties": false}}, {"name": "create_airflow_dag", "description": "Creates an Airflow DAG with the specified tasks.", "parameters": {"type": "object", "properties": {"dag_id": {"type": "string", "description": "The unique identifier for the DAG."}, "task_details": {"type": "array", "description": "A list of dictionaries containing task details."}}, "required": ["dag_id", "task_details"], "additionalProperties": false}}], "mock_functions": "def scrape_patient_data(url: str, file_format: str) -> str:\n    \"\"\"\n    Scrapes patient health data from a specified URL in the given format.\n    \n    :param url: The URL from which to scrape the data.\n    :param file_format: The format of the data file (e.g., \"CSV\", \"XML\", \"JSON\").\n    :return: A string indicating the success of the task.\n    :raises ValueError: If an unsupported file format is provided.\n    \"\"\"\n    if file_format.upper() not in [\"CSV\", \"XML\", \"JSON\"]:\n        raise ValueError(\"Unsupported file format. Please use 'CSV', 'XML', or 'JSON'.\")\n    return f\"Data successfully scraped from {url} in {file_format} format.\"\ndef transform_with_polars(df: object, transformation_config: dict) -> object:\n    \"\"\"\n    Transforms a DataFrame using Polars based on the provided configuration.\n    \n    :param df: The input DataFrame to be transformed.\n    :param transformation_config: A dictionary containing transformation rules.\n    :return: The transformed DataFrame.\n    :raises ValueError: If the DataFrame or transformation_config is invalid.\n    \"\"\"\n    if not df or not isinstance(transformation_config, dict):\n        raise ValueError(\"Invalid DataFrame or transformation configuration.\")\n    # Mock implementation: Return a new DataFrame object\n    transformed_df = df  # In a real scenario, df would be transformed\n    return transformed_df\ndef normalize_data(df: object, normalization_rules: dict) -> object:\n    \"\"\"\n    Normalizes a DataFrame based on given normalization rules.\n    \n    :param df: The input DataFrame to be normalized.\n    :param normalization_rules: A dictionary containing normalization rules.\n    :return: The normalized DataFrame.\n    :raises ValueError: If the DataFrame or normalization_rules is invalid.\n    \"\"\"\n    if not df or not isinstance(normalization_rules, dict):\n        raise ValueError(\"Invalid DataFrame or normalization rules.\")\n    # Mock implementation: Return a new DataFrame object\n    normalized_df = df  # In a real scenario, df would be normalized\n    return normalized_df\ndef convert_units(df: object, conversion_rules: dict) -> object:\n    \"\"\"\n    Converts units of measurement in a DataFrame based on given rules.\n    \n    :param df: The input DataFrame containing raw measurements.\n    :param conversion_rules: A dictionary containing unit conversion rules.\n    :return: The DataFrame with converted measurements.\n    :raises ValueError: If the DataFrame or conversion_rules is invalid.\n    \"\"\"\n    if not df or not isinstance(conversion_rules, dict):\n        raise ValueError(\"Invalid DataFrame or conversion rules.\")\n    # Mock implementation: Return a new DataFrame object\n    converted_df = df  # In a real scenario, df would have new units\n    return converted_df\ndef ensure_data_integrity(df: object, validation_rules: dict) -> bool:\n    \"\"\"\n    Ensures the integrity of data in a DataFrame using specified validation rules.\n    \n    :param df: The DataFrame to be validated.\n    :param validation_rules: A dictionary containing validation rules.\n    :return: True if data integrity is ensured, False otherwise.\n    :raises ValueError: If the DataFrame or validation_rules is invalid.\n    \"\"\"\n    if not df or not isinstance(validation_rules, dict):\n        raise ValueError(\"Invalid DataFrame or validation rules.\")\n    # Mock implementation: Assume data integrity is ensured\n    data_integrity_ensured = True\n    return data_integrity_ensured\ndef create_airflow_dag(dag_id: str, task_details: list) -> dict:\n    \"\"\"\n    Creates an Airflow DAG with the specified tasks.\n    \n    :param dag_id: The unique identifier for the DAG.\n    :param task_details: A list of dictionaries containing task details.\n    :return: A dictionary representing the DAG with the following keys:\n        - dag_id (str): The ID of the DAG.\n        - tasks (list[dict]): A list of dictionaries representing each task.\n    :raises ValueError: If dag_id is empty or task_details is invalid.\n    \"\"\"\n    if not dag_id or not isinstance(task_details, list):\n        raise ValueError(\"dag_id must be non-empty, and task_details must be a list.\")\n    # Mock implementation: Create a DAG representation as a dictionary\n    dag_representation = {\n        \"dag_id\": dag_id,\n        \"tasks\": task_details\n    }\n    return dag_representation", "user_query": "This is Sarah from MedTech Healthcare. Create an Airflow DAG with tasks to scrape patient data from https://clinicdata.medtech.com/records, transform the data using Polars, convert medical measurement units (like weight from lbs to kg), ensure data integrity with validation rules, and prepare it for our centralized health analytics platform.", "checklist": {"functions": ["scrape_patient_data", "transform_with_polars", "normalize_data", "convert_units", "ensure_data_integrity", "create_airflow_dag"], "values": ["Data successfully scraped from https://clinicdata.medtech.com/records in CSV format.", {}, {}, {}, true, {"dag_id": "medtech_health_pipeline", "tasks": [{"task_id": "scrape_data", "type": "scrapy"}, {"task_id": "transform_data", "type": "polars"}, {"task_id": "convert_units", "type": "custom"}, {"task_id": "ensure_integrity", "type": "custom"}]}]}}
{"difficulty": "hard", "function_schema_python": "def add_event_to_calendar(event_name: str, date: str, time: str, location: str) -> bool:\n    \"\"\"Adds an event to the family calendar.\n\n    :param event_name: The name of the event (e.g., \"Soccer Practice\").\n    :param date: The event date (e.g., \"2023-10-05\").\n    :param time: The event time (e.g., \"17:00\").\n    :param location: The event location (e.g., \"Central Park\").\n    :return: True if the event was successfully added, False otherwise.\n    :raises ValueError: If any parameter is invalid.\"\"\"\n    pass\ndef check_for_schedule_overlaps(date: str, time: str) -> list:\n    \"\"\"Checks for any schedule overlaps for a given date and time.\n\n    :param date: The date to check for overlaps (e.g., \"2023-10-05\").\n    :param time: The time to check for overlaps (e.g., \"17:00\").\n    :return: A list of overlapping event names.\"\"\"\n    pass\ndef send_email_to_caregivers(subject: str, body: str, recipients: list) -> bool:\n    \"\"\"Sends an email to caregivers regarding an update.\n\n    :param subject: The subject of the email (e.g., \"Schedule Update\").\n    :param body: The body of the email.\n    :param recipients: A list of email addresses for caregivers.\n    :return: True if the email was successfully sent, False otherwise.\n    :raises ValueError: If subject, body, or recipients are invalid.\"\"\"\n    pass\ndef get_google_maps_directions(origin: str, destination: str) -> dict:\n    \"\"\"Retrieves directions from Google Maps.\n\n    :param origin: The starting address.\n    :param destination: The destination address.\n    :return:\n        dict: A dictionary with the following keys:\n            - steps (list[str]): The list of steps in directions.\n            - estimated_time (str): Estimated time in \"1 hour 30 minutes\" format.\n    :raises ValueError: If origin or destination is empty.\"\"\"\n    pass\ndef sync_calendars(calendar_name: str, user_email: str) -> bool:\n    \"\"\"Syncs the family calendar with a user's calendar.\n\n    :param calendar_name: The name of the calendar to sync (e.g., \"David Chen Family\").\n    :param user_email: The email address of the user to sync with.\n    :return: True if the calendars are successfully synced, False otherwise.\n    :raises ValueError: If calendar_name or user_email is empty.\"\"\"\n    pass\ndef update_event_location(event_name: str, new_location: str) -> bool:\n    \"\"\"Updates the location of an existing event in the calendar.\n\n    :param event_name: The name of the event to update (e.g., \"Soccer Practice\").\n    :param new_location: The new location for the event.\n    :return: True if the event location is successfully updated, False otherwise.\n    :raises ValueError: If event_name or new_location is empty.\"\"\"\n    pass\n", "function_schema_json": [{"name": "add_event_to_calendar", "description": "Adds an event to the family calendar.", "parameters": {"type": "object", "properties": {"event_name": {"type": "string", "description": "The name of the event (e.g., \"Soccer Practice\")."}, "date": {"type": "string", "description": "The event date (e.g., \"2023-10-05\")."}, "time": {"type": "string", "description": "The event time (e.g., \"17:00\")."}, "location": {"type": "string", "description": "The event location (e.g., \"Central Park\")."}}, "required": ["event_name", "date", "time", "location"], "additionalProperties": false}}, {"name": "check_for_schedule_overlaps", "description": "Checks for any schedule overlaps for a given date and time.", "parameters": {"type": "object", "properties": {"date": {"type": "string", "description": "The date to check for overlaps (e.g., \"2023-10-05\")."}, "time": {"type": "string", "description": "The time to check for overlaps (e.g., \"17:00\")."}}, "required": ["date", "time"], "additionalProperties": false}}, {"name": "send_email_to_caregivers", "description": "Sends an email to caregivers regarding an update.", "parameters": {"type": "object", "properties": {"subject": {"type": "string", "description": "The subject of the email (e.g., \"Schedule Update\")."}, "body": {"type": "string", "description": "The body of the email."}, "recipients": {"type": "array", "description": "A list of email addresses for caregivers."}}, "required": ["subject", "body", "recipients"], "additionalProperties": false}}, {"name": "get_google_maps_directions", "description": "Retrieves directions from Google Maps.", "parameters": {"type": "object", "properties": {"origin": {"type": "string", "description": "The starting address."}, "destination": {"type": "string", "description": "The destination address."}}, "required": ["origin", "destination"], "additionalProperties": false}}, {"name": "sync_calendars", "description": "Syncs the family calendar with a user's calendar.", "parameters": {"type": "object", "properties": {"calendar_name": {"type": "string", "description": "The name of the calendar to sync (e.g., \"David Chen Family\")."}, "user_email": {"type": "string", "description": "The email address of the user to sync with."}}, "required": ["calendar_name", "user_email"], "additionalProperties": false}}, {"name": "update_event_location", "description": "Updates the location of an existing event in the calendar.", "parameters": {"type": "object", "properties": {"event_name": {"type": "string", "description": "The name of the event to update (e.g., \"Soccer Practice\")."}, "new_location": {"type": "string", "description": "The new location for the event."}}, "required": ["event_name", "new_location"], "additionalProperties": false}}], "mock_functions": "def add_event_to_calendar(event_name: str, date: str, time: str, location: str) -> bool:\n    \"\"\"\n    Adds an event to the family calendar.\n    \n    :param event_name: The name of the event (e.g., \"Soccer Practice\").\n    :param date: The event date (e.g., \"2023-10-05\").\n    :param time: The event time (e.g., \"17:00\").\n    :param location: The event location (e.g., \"Central Park\").\n    :return: True if the event was successfully added, False otherwise.\n    :raises ValueError: If any parameter is invalid.\n    \"\"\"\n    if not event_name or not date or not time or not location:\n        raise ValueError(\"Event name, date, time, and location must be provided.\")\n    return True\ndef check_for_schedule_overlaps(date: str, time: str) -> list:\n    \"\"\"\n    Checks for any schedule overlaps for a given date and time.\n    \n    :param date: The date to check for overlaps (e.g., \"2023-10-05\").\n    :param time: The time to check for overlaps (e.g., \"17:00\").\n    :return: A list of overlapping event names.\n    \"\"\"\n    # Mock logic: For demonstration, assume overlaps for the given date and time.\n    if date == \"2023-10-05\" and time == \"17:00\":\n        return [\"Music Lesson\", \"Weekend Visit\"]\n    return []\ndef send_email_to_caregivers(subject: str, body: str, recipients: list) -> bool:\n    \"\"\"\n    Sends an email to caregivers regarding an update.\n    \n    :param subject: The subject of the email (e.g., \"Schedule Update\").\n    :param body: The body of the email.\n    :param recipients: A list of email addresses for caregivers.\n    :return: True if the email was successfully sent, False otherwise.\n    :raises ValueError: If subject, body, or recipients are invalid.\n    \"\"\"\n    if not subject or not body or not recipients:\n        raise ValueError(\"Subject, body, and recipients must be provided.\")\n    return True\ndef get_google_maps_directions(origin: str, destination: str) -> dict:\n    \"\"\"\n    Retrieves directions from Google Maps.\n    \n    :param origin: The starting address.\n    :param destination: The destination address.\n    :return:\n        dict: A dictionary with the following keys:\n            - steps (list[str]): The list of steps in directions.\n            - estimated_time (str): Estimated time in \"1 hour 30 minutes\" format.\n    :raises ValueError: If origin or destination is empty.\n    \"\"\"\n    if not origin or not destination:\n        raise ValueError(\"Origin and destination must not be empty.\")\n    return {\n        \"steps\": [\n            \"Head north on Elm St.\",\n            \"Take exit 5 towards Maple Ave.\",\n            \"Turn left onto Oak St.\",\n            \"Arrive at destination: School\"\n        ],\n        \"estimated_time\": \"30 minutes\"\n    }\ndef sync_calendars(calendar_name: str, user_email: str) -> bool:\n    \"\"\"\n    Syncs the family calendar with a user's calendar.\n    \n    :param calendar_name: The name of the calendar to sync (e.g., \"David Chen Family\").\n    :param user_email: The email address of the user to sync with.\n    :return: True if the calendars are successfully synced, False otherwise.\n    :raises ValueError: If calendar_name or user_email is empty.\n    \"\"\"\n    if not calendar_name or not user_email:\n        raise ValueError(\"Calendar name and user email must be provided.\")\n    return True\ndef update_event_location(event_name: str, new_location: str) -> bool:\n    \"\"\"\n    Updates the location of an existing event in the calendar.\n    \n    :param event_name: The name of the event to update (e.g., \"Soccer Practice\").\n    :param new_location: The new location for the event.\n    :return: True if the event location is successfully updated, False otherwise.\n    :raises ValueError: If event_name or new_location is empty.\n    \"\"\"\n    if not event_name or not new_location:\n        raise ValueError(\"Event name and new location must be provided.\")\n    return True", "user_query": "David Chen here. I need to add a soccer practice for my 12-year-old at Central Park Community Field on 2023-10-05 at 17:00. Can you check for overlaps, get Google Maps directions from our home at 123 Maple Drive to the field, and then sync the calendar with my co-parent's email david.coparent@family.com?", "checklist": {"functions": ["check_for_schedule_overlaps", "add_event_to_calendar", "get_google_maps_directions", "sync_calendars"], "values": [["Music Lesson", "Weekend Visit"], true, {"steps": ["Head north on Elm St.", "Take exit 5 towards Maple Ave.", "Turn left onto Oak St.", "Arrive at destination: School"], "estimated_time": "30 minutes"}, true]}}
{"difficulty": "hard", "function_schema_python": "def create_graphql_schema(entities: List[str]) -> str:\n    \"\"\"Creates a GraphQL schema based on the provided entities.\n\n    :param entities: A list of entity names.\n    :return: A string representing the GraphQL schema.\"\"\"\n    pass\ndef execute_graphql_query(schema: str, query: str) -> List[Dict[str, Any]]:\n    \"\"\"Executes a GraphQL query against the provided schema.\n\n    :param schema: The GraphQL schema.\n    :param query: The GraphQL query.\n    :return: A list of dictionaries, each representing a result.\"\"\"\n    pass\ndef generate_email_invitation(recipient: str, interests: List[str], demographics: str) -> str:\n    \"\"\"Generates a customized email invitation.\n\n    :param recipient: The recipient's name.\n    :param interests: A list of the recipient's interests.\n    :param demographics: The recipient's demographic information (e.g., \"family\", \"young professional\").\n    :return: The generated email invitation string.\"\"\"\n    pass\ndef send_email(recipient: str, email_content: str) -> bool:\n    \"\"\"Sends an email.\n\n    :param recipient: The recipient's email address.\n    :param email_content: The email content.\n    :return: True if the email was sent successfully, False otherwise.\"\"\"\n    pass\n", "function_schema_json": [{"name": "create_graphql_schema", "description": "Creates a GraphQL schema based on the provided entities.", "parameters": {"type": "object", "properties": {"entities": {"type": "array", "items": {"type": "string"}, "description": "A list of entity names."}}, "required": ["entities"], "additionalProperties": false}}, {"name": "execute_graphql_query", "description": "Executes a GraphQL query against the provided schema.", "parameters": {"type": "object", "properties": {"schema": {"type": "string", "description": "The GraphQL schema."}, "query": {"type": "string", "description": "The GraphQL query."}}, "required": ["schema", "query"], "additionalProperties": false}}, {"name": "generate_email_invitation", "description": "Generates a customized email invitation.", "parameters": {"type": "object", "properties": {"recipient": {"type": "string", "description": "The recipient's name."}, "interests": {"type": "array", "items": {"type": "string"}, "description": "A list of the recipient's interests."}, "demographics": {"type": "string", "description": "The recipient's demographic information (e.g., \"family\", \"young professional\")."}}, "required": ["recipient", "interests", "demographics"], "additionalProperties": false}}, {"name": "send_email", "description": "Sends an email.", "parameters": {"type": "object", "properties": {"recipient": {"type": "string", "description": "The recipient's email address."}, "email_content": {"type": "string", "description": "The email content."}}, "required": ["recipient", "email_content"], "additionalProperties": false}}], "mock_functions": "def create_graphql_schema(entities: List[str]) -> str:\n    \"\"\"\n    Creates a GraphQL schema based on the provided entities.\n\n    :param entities: A list of entity names.\n    :return: A string representing the GraphQL schema.\n    \"\"\"\n    schema = \"type Query {\\n\"\n    for entity in entities:\n        schema += f\"  {entity}(id: ID!): {entity.capitalize()}Type\\n\"\n    schema += \"}\\n\"\n    \n    for entity in entities:\n        schema += f\"type {entity.capitalize()}Type {{\\n  id: ID!\\n  name: String!\\n}}\\n\"\n    return schema\ndef execute_graphql_query(schema: str, query: str) -> List[Dict[str, Any]]:\n    \"\"\"\n    Executes a GraphQL query against the provided schema.\n\n    :param schema: The GraphQL schema.\n    :param query: The GraphQL query.\n    :return: A list of dictionaries, each representing a result.\n    \"\"\"\n    # Mock logic: Returns a predefined result if the query mentions \"interests\".\n    if \"interests\" in query:\n        return [\n            {\"id\": \"1\", \"name\": \"Pikachu\", \"interests\": [\"anime\", \"gaming\"]},\n            {\"id\": \"2\", \"name\": \"Ash\", \"interests\": [\"pokemon\", \"travel\"]},\n        ]\n    return []\ndef generate_email_invitation(recipient: str, interests: List[str], demographics: str) -> str:\n    \"\"\"\n    Generates a customized email invitation.\n\n    :param recipient: The recipient's name.\n    :param interests: A list of the recipient's interests.\n    :param demographics: The recipient's demographic information (e.g., \"family\", \"young professional\").\n    :return: The generated email invitation string.\n    \"\"\"\n    email = f\"Dear {recipient},\\n\\n\"\n    if \"family\" in demographics.lower() and \"pokemon\" in interests:\n        email += \"Bring your kids to the new Pikachu-themed cafe! We have a dedicated play area.\\n\\n\"\n    elif \"young professional\" in demographics.lower():\n        email += \"The new Pikachu cafe offers great workspaces and fast internet!\\n\\n\"\n    email += \"Join us for the grand opening!\\n\\nSincerely,\\nSunny\"\n    return email\ndef send_email(recipient: str, email_content: str) -> bool:\n    \"\"\"\n    Sends an email.\n\n    :param recipient: The recipient's email address.\n    :param email_content: The email content.\n    :return: True if the email was sent successfully, False otherwise.\n    \"\"\"\n    # Mock logic: Always returns True for simplicity.\n    return True", "user_query": "This is Maya. Please execute a GraphQL query to find residents with interests in \"pokemon\" and \"anime\", and generate email invitations for them as \"young professional\" demographic.", "checklist": {"functions": ["create_graphql_schema", "execute_graphql_query", "generate_email_invitation", "send_email"], "values": ["type Query {\n  Resident(id: ID!): ResidentType\n}\ntype ResidentType {\n  id: ID!\n  name: String!\n}", [{"id": "1", "name": "Pikachu", "interests": ["anime", "gaming"]}, {"id": "2", "name": "Ash", "interests": ["pokemon", "travel"]}], "Dear Pikachu,\n\nThe new Pikachu cafe offers great workspaces and fast internet!\n\nJoin us for the grand opening!\n\nSincerely,\nSunny", true]}}
{"difficulty": "hard", "function_schema_python": "def fetch_market_data(asset: str) -> dict:\n    \"\"\"Fetches real-time market data for a given asset.\n\n    :param asset: The ticker symbol of the asset (e.g., \"AAPL\").\n    :return:\n        dict: A dictionary with the following keys:\n            - price (float): The current price of the asset.\n            - volatility (float): The current volatility of the asset.\n    :raises ValueError: If the asset symbol is invalid.\"\"\"\n    pass\ndef calculate_risk_exposure(portfolio: dict, risk_parameters: dict) -> dict:\n    \"\"\"Calculates the risk exposure of a portfolio based on given risk parameters.\n\n    :param portfolio: A dictionary with asset symbols as keys and their quantities as values.\n    :param risk_parameters: A dictionary with risk parameters, such as maximum allowed volatility.\n    :return:\n        dict: A dictionary with the following keys:\n            - total_value (float): The total value of the portfolio.\n            - risk_exposure (float): The overall risk exposure of the portfolio.\n    :raises ValueError: If portfolio or risk parameters are invalid.\"\"\"\n    pass\ndef adjust_risk_parameters(risk_parameters: dict, market_data: dict, economic_indicators: dict) -> dict:\n    \"\"\"Adjusts risk parameters based on real-time market data and economic indicators.\n\n    :param risk_parameters: Existing risk parameters to be adjusted.\n    :param market_data: Real-time market data for all assets in the portfolio.\n    :param economic_indicators: Economic indicators that might affect risk appetite.\n    :return:\n        dict: Adjusted risk parameters with the following keys:\n            - max_volatility (float): The new maximum allowed volatility.\n            - risk_tolerance (float): The new risk tolerance level.\n    :raises ValueError: If any parameters are invalid.\"\"\"\n    pass\ndef monitor_and_adjust_risk(portfolio: dict, market_data: dict, economic_indicators: dict) -> dict:\n    \"\"\"Monitors the risk of the trading portfolio and adjusts risk parameters if necessary.\n\n    :param portfolio: Current portfolio structure with asset symbols and quantities.\n    :param market_data: Latest market data for all assets in the portfolio.\n    :param economic_indicators: Current economic indicators affecting the market.\n    :return:\n        dict: Adjusted risk parameters with the following keys:\n            - max_volatility (float): The new maximum allowed volatility.\n            - risk_tolerance (float): The new risk tolerance level.\n    :raises ValueError: If any parameters are invalid.\"\"\"\n    pass\ndef fetch_economic_indicators() -> dict:\n    \"\"\"Fetches the latest economic indicators from a reliable source.\n\n    :return:\n        dict: A dictionary with the following keys:\n            - interest_rate (float): The current interest rate.\n            - gdp_growth (float): The GDP growth rate.\n            - unemployment_rate (float): The unemployment rate.\"\"\"\n    pass\n", "function_schema_json": [{"name": "fetch_market_data", "description": "Fetches real-time market data for a given asset.", "parameters": {"type": "object", "properties": {"asset": {"type": "string", "description": "The ticker symbol of the asset (e.g., \"AAPL\")."}}, "required": ["asset"], "additionalProperties": false}}, {"name": "calculate_risk_exposure", "description": "Calculates the risk exposure of a portfolio based on given risk parameters.", "parameters": {"type": "object", "properties": {"portfolio": {"type": "object", "description": "A dictionary with asset symbols as keys and their quantities as values."}, "risk_parameters": {"type": "object", "description": "A dictionary with risk parameters, such as maximum allowed volatility."}}, "required": ["portfolio", "risk_parameters"], "additionalProperties": false}}, {"name": "adjust_risk_parameters", "description": "Adjusts risk parameters based on real-time market data and economic indicators.", "parameters": {"type": "object", "properties": {"risk_parameters": {"type": "object", "description": "Existing risk parameters to be adjusted."}, "market_data": {"type": "object", "description": "Real-time market data for all assets in the portfolio."}, "economic_indicators": {"type": "object", "description": "Economic indicators that might affect risk appetite."}}, "required": ["risk_parameters", "market_data", "economic_indicators"], "additionalProperties": false}}, {"name": "monitor_and_adjust_risk", "description": "Monitors the risk of the trading portfolio and adjusts risk parameters if necessary.", "parameters": {"type": "object", "properties": {"portfolio": {"type": "object", "description": "Current portfolio structure with asset symbols and quantities."}, "market_data": {"type": "object", "description": "Latest market data for all assets in the portfolio."}, "economic_indicators": {"type": "object", "description": "Current economic indicators affecting the market."}}, "required": ["portfolio", "market_data", "economic_indicators"], "additionalProperties": false}}, {"name": "fetch_economic_indicators", "description": "Fetches the latest economic indicators from a reliable source.", "parameters": {"type": "object", "properties": {}, "required": [], "additionalProperties": false}}], "mock_functions": "def fetch_market_data(asset: str) -> dict:\n    \"\"\"\n    Fetches real-time market data for a given asset.\n    \n    :param asset: The ticker symbol of the asset (e.g., \"AAPL\").\n    :return:\n        dict: A dictionary with the following keys:\n            - price (float): The current price of the asset.\n            - volatility (float): The current volatility of the asset.\n    :raises ValueError: If the asset symbol is invalid.\n    \"\"\"\n    if not asset:\n        raise ValueError(\"Asset symbol must be provided.\")\n    if asset in [\"AAPL\", \"GOOGL\", \"MSFT\"]:\n        return {\n            \"price\": 150.25,\n            \"volatility\": 0.20\n        }\n    return {}\ndef calculate_risk_exposure(portfolio: dict, risk_parameters: dict) -> dict:\n    \"\"\"\n    Calculates the risk exposure of a portfolio based on given risk parameters.\n    \n    :param portfolio: A dictionary with asset symbols as keys and their quantities as values.\n    :param risk_parameters: A dictionary with risk parameters, such as maximum allowed volatility.\n    :return:\n        dict: A dictionary with the following keys:\n            - total_value (float): The total value of the portfolio.\n            - risk_exposure (float): The overall risk exposure of the portfolio.\n    :raises ValueError: If portfolio or risk parameters are invalid.\n    \"\"\"\n    if not portfolio or not risk_parameters:\n        raise ValueError(\"Portfolio and risk parameters must be provided.\")\n    if risk_parameters.get('max_volatility') is None:\n        raise ValueError(\"Risk parameters must include 'max_volatility'.\")\n    \n    total_value = 0.0\n    for asset, quantity in portfolio.items():\n        asset_data = fetch_market_data(asset)\n        if asset_data:\n            total_value += asset_data['price'] * quantity\n    \n    return {\n        \"total_value\": total_value,\n        \"risk_exposure\": 0.15  # Mocked risk exposure value\n    }\ndef adjust_risk_parameters(risk_parameters: dict, market_data: dict, economic_indicators: dict) -> dict:\n    \"\"\"\n    Adjusts risk parameters based on real-time market data and economic indicators.\n    \n    :param risk_parameters: Existing risk parameters to be adjusted.\n    :param market_data: Real-time market data for all assets in the portfolio.\n    :param economic_indicators: Economic indicators that might affect risk appetite.\n    :return:\n        dict: Adjusted risk parameters with the following keys:\n            - max_volatility (float): The new maximum allowed volatility.\n            - risk_tolerance (float): The new risk tolerance level.\n    :raises ValueError: If any parameters are invalid.\n    \"\"\"\n    if not risk_parameters or not market_data or not economic_indicators:\n        raise ValueError(\"Risk parameters, market data, and economic indicators must be provided.\")\n    \n    # Mock logic to adjust parameters based on market data and economic indicators\n    adjusted_max_volatility = 0.18  # Example adjustment\n    adjusted_risk_tolerance = 0.5\n    \n    return {\n        \"max_volatility\": adjusted_max_volatility,\n        \"risk_tolerance\": adjusted_risk_tolerance\n    }\ndef monitor_and_adjust_risk(portfolio: dict, market_data: dict, economic_indicators: dict) -> dict:\n    \"\"\"\n    Monitors the risk of the trading portfolio and adjusts risk parameters if necessary.\n    \n    :param portfolio: Current portfolio structure with asset symbols and quantities.\n    :param market_data: Latest market data for all assets in the portfolio.\n    :param economic_indicators: Current economic indicators affecting the market.\n    :return:\n        dict: Adjusted risk parameters with the following keys:\n            - max_volatility (float): The new maximum allowed volatility.\n            - risk_tolerance (float): The new risk tolerance level.\n    :raises ValueError: If any parameters are invalid.\n    \"\"\"\n    if not portfolio or not market_data or not economic_indicators:\n        raise ValueError(\"Portfolio, market data, and economic indicators must be provided.\")\n    \n    current_risk_parameters = {\n        \"max_volatility\": 0.20,\n        \"risk_tolerance\": 0.4\n    }\n    \n    adjusted_risk_parameters = adjust_risk_parameters(current_risk_parameters, market_data, economic_indicators)\n    \n    return adjusted_risk_parameters\ndef fetch_economic_indicators() -> dict:\n    \"\"\"\n    Fetches the latest economic indicators from a reliable source.\n    \n    :return:\n        dict: A dictionary with the following keys:\n            - interest_rate (float): The current interest rate.\n            - gdp_growth (float): The GDP growth rate.\n            - unemployment_rate (float): The unemployment rate.\n    \"\"\"\n    return {\n        \"interest_rate\": 2.5,\n        \"gdp_growth\": 2.3,\n        \"unemployment_rate\": 3.6\n    }", "user_query": "This is Emily. Monitor my portfolio: {\"AAPL\": 100, \"GOOGL\": 50, \"MSFT\": 75} using current market data and economic indicators to adjust risk parameters. Return the adjusted max volatility and risk tolerance.", "checklist": {"functions": ["fetch_market_data", "calculate_risk_exposure", "adjust_risk_parameters", "monitor_and_adjust_risk", "fetch_economic_indicators"], "values": [{"price": 150.25, "volatility": 0.2}, {"total_value": 33806.25, "risk_exposure": 0.15}, {"max_volatility": 0.18, "risk_tolerance": 0.5}, {"max_volatility": 0.18, "risk_tolerance": 0.5}, {"interest_rate": 2.5, "gdp_growth": 2.3, "unemployment_rate": 3.6}]}}
{"difficulty": "hard", "function_schema_python": "def load_csv_data(file_path: str) -> list:\n    \"\"\"Loads data from a CSV file into a list of dictionaries.\n\n    :param file_path: The file path of the CSV to be loaded.\n    :return: A list of dictionaries representing the CSV rows.\n    :raises FileNotFoundError: If the file path does not exist.\n    :raises ValueError: If the file is not a valid CSV.\"\"\"\n    pass\ndef get_top_sellers(data: list, num_products: int) -> list:\n    \"\"\"Identifies the top-selling products based on sales data.\n\n    :param data: A list of dictionaries containing sales data.\n    :param num_products: The number of top-selling products to return.\n    :return: A list of dictionaries with the top-selling products.\"\"\"\n    pass\ndef get_lowest_sellers(data: list, num_products: int) -> list:\n    \"\"\"Identifies the lowest-selling products based on sales data.\n\n    :param data: A list of dictionaries containing sales data.\n    :param num_products: The number of lowest-selling products to return.\n    :return: A list of dictionaries with the lowest-selling products.\"\"\"\n    pass\ndef get_regional_sales_trends(data: list) -> dict:\n    \"\"\"Identifies regional sales trends based on sales data.\n\n    :param data: A list of dictionaries containing sales data.\n    :return: A dictionary with regional sales trends.\"\"\"\n    pass\ndef get_peak_sales_days(data: list, num_days: int) -> list:\n    \"\"\"Identifies days with the highest sales activity based on sales data.\n\n    :param data: A list of dictionaries containing sales data.\n    :param num_days: The number of days with peak sales activity to return.\n    :return: A list of dictionaries with the days and their respective sales.\"\"\"\n    pass\n", "function_schema_json": [{"name": "load_csv_data", "description": "Loads data from a CSV file into a list of dictionaries.", "parameters": {"type": "object", "properties": {"file_path": {"type": "string", "description": "The file path of the CSV to be loaded."}}, "required": ["file_path"], "additionalProperties": false}}, {"name": "get_top_sellers", "description": "Identifies the top-selling products based on sales data.", "parameters": {"type": "object", "properties": {"data": {"type": "array", "description": "A list of dictionaries containing sales data."}, "num_products": {"type": "integer", "description": "The number of top-selling products to return."}}, "required": ["data", "num_products"], "additionalProperties": false}}, {"name": "get_lowest_sellers", "description": "Identifies the lowest-selling products based on sales data.", "parameters": {"type": "object", "properties": {"data": {"type": "array", "description": "A list of dictionaries containing sales data."}, "num_products": {"type": "integer", "description": "The number of lowest-selling products to return."}}, "required": ["data", "num_products"], "additionalProperties": false}}, {"name": "get_regional_sales_trends", "description": "Identifies regional sales trends based on sales data.", "parameters": {"type": "object", "properties": {"data": {"type": "array", "description": "A list of dictionaries containing sales data."}}, "required": ["data"], "additionalProperties": false}}, {"name": "get_peak_sales_days", "description": "Identifies days with the highest sales activity based on sales data.", "parameters": {"type": "object", "properties": {"data": {"type": "array", "description": "A list of dictionaries containing sales data."}, "num_days": {"type": "integer", "description": "The number of days with peak sales activity to return."}}, "required": ["data", "num_days"], "additionalProperties": false}}], "mock_functions": "def load_csv_data(file_path: str) -> list:\n    \"\"\"\n    Loads data from a CSV file into a list of dictionaries.\n    \n    :param file_path: The file path of the CSV to be loaded.\n    :return: A list of dictionaries representing the CSV rows.\n    :raises FileNotFoundError: If the file path does not exist.\n    :raises ValueError: If the file is not a valid CSV.\n    \"\"\"\n    if file_path.endswith('.csv'):\n        # Mock logic: Return a list of dictionaries representing the CSV rows\n        return [\n            {\"product_id\": \"P001\", \"product_name\": \"Dress\", \"sales\": 150, \"region\": \"North\", \"date\": \"2023-09-15\"},\n            {\"product_id\": \"P002\", \"product_name\": \"Jacket\", \"sales\": 200, \"region\": \"South\", \"date\": \"2023-09-16\"},\n            {\"product_id\": \"P003\", \"product_name\": \"Skirt\", \"sales\": 250, \"region\": \"East\", \"date\": \"2023-09-17\"},\n            {\"product_id\": \"P001\", \"product_name\": \"Dress\", \"sales\": 100, \"region\": \"West\", \"date\": \"2023-09-18\"},\n            {\"product_id\": \"P002\", \"product_name\": \"Jacket\", \"sales\": 300, \"region\": \"North\", \"date\": \"2023-09-19\"},\n            {\"product_id\": \"P003\", \"product_name\": \"Skirt\", \"sales\": 200, \"region\": \"South\", \"date\": \"2023-09-20\"},\n        ]\n    else:\n        raise ValueError(\"Provided file is not a valid CSV.\")\ndef get_top_sellers(data: list, num_products: int = 5) -> list:\n    \"\"\"\n    Identifies the top-selling products based on sales data.\n    \n    :param data: A list of dictionaries containing sales data.\n    :param num_products: The number of top-selling products to return.\n    :return: A list of dictionaries with the top-selling products.\n    \"\"\"\n    from collections import Counter\n    \n    # Mock logic: Sum the sales for each product and return the top num_products\n    product_sales = Counter((item['product_name'] for item in data))\n    top_products = product_sales.most_common(num_products)\n    \n    top_sellers = [{'product_name': name, 'total_sales': sales} for name, sales in top_products]\n    return top_sellers\ndef get_lowest_sellers(data: list, num_products: int = 5) -> list:\n    \"\"\"\n    Identifies the lowest-selling products based on sales data.\n    \n    :param data: A list of dictionaries containing sales data.\n    :param num_products: The number of lowest-selling products to return.\n    :return: A list of dictionaries with the lowest-selling products.\n    \"\"\"\n    from collections import Counter\n    \n    # Mock logic: Sum the sales for each product and return the lowest num_products\n    product_sales = Counter((item['product_name'] for item in data))\n    lowest_products = product_sales.most_common()[:-num_products-1:-1]\n    \n    lowest_sellers = [{'product_name': name, 'total_sales': sales} for name, sales in lowest_products]\n    return lowest_sellers\ndef get_regional_sales_trends(data: list) -> dict:\n    \"\"\"\n    Identifies regional sales trends based on sales data.\n    \n    :param data: A list of dictionaries containing sales data.\n    :return: A dictionary with regional sales trends.\n    \"\"\"\n    from collections import defaultdict\n    \n    # Mock logic: Sum the sales for each region\n    region_sales = defaultdict(int)\n    for item in data:\n        region_sales[item['region']] += item['sales']\n    \n    return dict(region_sales)\ndef get_peak_sales_days(data: list, num_days: int = 5) -> list:\n    \"\"\"\n    Identifies days with the highest sales activity based on sales data.\n    \n    :param data: A list of dictionaries containing sales data.\n    :param num_days: The number of days with peak sales activity to return.\n    :return: A list of dictionaries with the days and their respective sales.\n    \"\"\"\n    from collections import Counter\n    \n    # Mock logic: Sum the sales for each date and return the top num_days\n    date_sales = Counter((item['date'] for item in data))\n    peak_dates = date_sales.most_common(num_days)\n    \n    peak_sales_days = [{'date': date, 'total_sales': sales} for date, sales in peak_dates]\n    return peak_sales_days", "user_query": "Emma here. Analyze 'seasonal_sale_data.csv' to get the top 2 selling products, the lowest 2 selling products, regional sales trends, and the 2 days with peak sales.", "checklist": {"functions": ["load_csv_data", "get_top_sellers", "get_lowest_sellers", "get_regional_sales_trends", "get_peak_sales_days"], "values": [[{"product_id": "P001", "product_name": "Dress", "sales": 150, "region": "North", "date": "2023-09-15"}, {"product_id": "P002", "product_name": "Jacket", "sales": 200, "region": "South", "date": "2023-09-16"}, {"product_id": "P003", "product_name": "Skirt", "sales": 250, "region": "East", "date": "2023-09-17"}, {"product_id": "P001", "product_name": "Dress", "sales": 100, "region": "West", "date": "2023-09-18"}, {"product_id": "P002", "product_name": "Jacket", "sales": 300, "region": "North", "date": "2023-09-19"}, {"product_id": "P003", "product_name": "Skirt", "sales": 200, "region": "South", "date": "2023-09-20"}], [{"product_name": "Jacket", "total_sales": 500}, {"product_name": "Skirt", "total_sales": 450}], [{"product_name": "Dress", "total_sales": 250}, {"product_name": "Skirt", "total_sales": 450}], {"North": 450, "South": 400, "East": 250, "West": 100}, [{"date": "2023-09-19", "total_sales": 300}, {"date": "2023-09-17", "total_sales": 250}]]}}
{"difficulty": "hard", "function_schema_python": "def load_dataset(file_path: str) -> list:\n    \"\"\"Loads a dataset from a specified file path.\n\n    :param file_path: The path to the dataset file.\n    :return: A list of dictionaries, where each dictionary represents a row in the dataset.\n    :raises FileNotFoundError: If the file does not exist at the specified path.\n    :raises ValueError: If the file cannot be read.\"\"\"\n    pass\ndef identify_errors(dataset: list) -> dict:\n    \"\"\"Identifies errors in the dataset, such as missing values or incorrect unit labels.\n\n    :param dataset: A list of dictionaries representing the dataset.\n    :return: A dictionary with the following keys:\n        - missing_values (list[dict]): Rows with missing temperature values.\n        - incorrect_units (list[dict]): Rows with incorrect or unknown unit labels.\"\"\"\n    pass\ndef normalize_temperature(dataset: list) -> list:\n    \"\"\"Normalizes the temperature data to Celsius.\n\n    :param dataset: A list of dictionaries representing the dataset.\n    :return: A list of dictionaries with the temperature values normalized to Celsius.\"\"\"\n    pass\ndef save_normalized_dataset(file_path: str, normalized_dataset: list) -> bool:\n    \"\"\"Saves the normalized dataset to a specified file path.\n\n    :param file_path: The path where the dataset file will be saved.\n    :param normalized_dataset: A list of dictionaries representing the normalized dataset.\n    :return: True if the dataset was saved successfully, False otherwise.\n    :raises ValueError: If the file path is invalid.\"\"\"\n    pass\n", "function_schema_json": [{"name": "load_dataset", "description": "Loads a dataset from a specified file path.", "parameters": {"type": "object", "properties": {"file_path": {"type": "string", "description": "The path to the dataset file."}}, "required": ["file_path"], "additionalProperties": false}}, {"name": "identify_errors", "description": "Identifies errors in the dataset, such as missing values or incorrect unit labels.", "parameters": {"type": "object", "properties": {"dataset": {"type": "array", "description": "A list of dictionaries representing the dataset."}}, "required": ["dataset"], "additionalProperties": false}}, {"name": "normalize_temperature", "description": "Normalizes the temperature data to Celsius.", "parameters": {"type": "object", "properties": {"dataset": {"type": "array", "description": "A list of dictionaries representing the dataset."}}, "required": ["dataset"], "additionalProperties": false}}, {"name": "save_normalized_dataset", "description": "Saves the normalized dataset to a specified file path.", "parameters": {"type": "object", "properties": {"file_path": {"type": "string", "description": "The path where the dataset file will be saved."}, "normalized_dataset": {"type": "array", "description": "A list of dictionaries representing the normalized dataset."}}, "required": ["file_path", "normalized_dataset"], "additionalProperties": false}}], "mock_functions": "def load_dataset(file_path: str) -> list:\n    \"\"\"\n    Loads a dataset from a specified file path.\n    \n    :param file_path: The path to the dataset file.\n    :return: A list of dictionaries, where each dictionary represents a row in the dataset.\n    :raises FileNotFoundError: If the file does not exist at the specified path.\n    :raises ValueError: If the file cannot be read.\n    \"\"\"\n    if file_path == \"climate_data.csv\":\n        return [\n            {\"Station ID\": \"S001\", \"Date\": \"2021-01-01\", \"Time\": \"12:00\", \"Temperature\": \"32.0\", \"Unit\": \"Fahrenheit\"},\n            {\"Station ID\": \"S002\", \"Date\": \"2021-01-01\", \"Time\": \"13:00\", \"Temperature\": \"273.15\", \"Unit\": \"Kelvin\"},\n            {\"Station ID\": \"S003\", \"Date\": \"2021-01-01\", \"Time\": \"14:00\", \"Temperature\": \"22.0\", \"Unit\": \"Celsius\"},\n            {\"Station ID\": \"S001\", \"Date\": \"2021-01-01\", \"Time\": \"15:00\", \"Temperature\": None, \"Unit\": \"Fahrenheit\"},\n            {\"Station ID\": \"S002\", \"Date\": \"2021-01-01\", \"Time\": \"16:00\", \"Temperature\": \"100.0\", \"Unit\": \"Celsius\"},\n        ]\n    else:\n        raise FileNotFoundError(\"File not found at the specified path.\")\ndef identify_errors(dataset: list) -> dict:\n    \"\"\"\n    Identifies errors in the dataset, such as missing values or incorrect unit labels.\n    \n    :param dataset: A list of dictionaries representing the dataset.\n    :return: A dictionary with the following keys:\n        - missing_values (list[dict]): Rows with missing temperature values.\n        - incorrect_units (list[dict]): Rows with incorrect or unknown unit labels.\n    \"\"\"\n    missing_values = [row for row in dataset if row[\"Temperature\"] is None]\n    incorrect_units = [row for row in dataset if row[\"Unit\"] not in [\"Celsius\", \"Fahrenheit\", \"Kelvin\"]]\n    return {\n        \"missing_values\": missing_values,\n        \"incorrect_units\": incorrect_units\n    }\ndef normalize_temperature(dataset: list) -> list:\n    \"\"\"\n    Normalizes the temperature data to Celsius.\n    \n    :param dataset: A list of dictionaries representing the dataset.\n    :return: A list of dictionaries with the temperature values normalized to Celsius.\n    \"\"\"\n    def to_celsius(temp: float, unit: str) -> float:\n        if unit == \"Fahrenheit\":\n            return (temp - 32) * 5 / 9\n        elif unit == \"Kelvin\":\n            return temp - 273.15\n        return temp\n\n    for row in dataset:\n        if row[\"Temperature\"] is not None:\n            row[\"Temperature\"] = to_celsius(float(row[\"Temperature\"]), row[\"Unit\"])\n        row[\"Unit\"] = \"Celsius\"\n    return dataset\ndef save_normalized_dataset(file_path: str, normalized_dataset: list) -> bool:\n    \"\"\"\n    Saves the normalized dataset to a specified file path.\n    \n    :param file_path: The path where the dataset file will be saved.\n    :param normalized_dataset: A list of dictionaries representing the normalized dataset.\n    :return: True if the dataset was saved successfully, False otherwise.\n    :raises ValueError: If the file path is invalid.\n    \"\"\"\n    if file_path == \"normalized_climate_data.csv\":\n        return True\n    else:\n        raise ValueError(\"Invalid file path.\")", "user_query": "This is Rahul. Please load climate_data.csv, normalize the temperature data to Celsius, and then save the normalized dataset to normalized_climate_data.csv.  Let me know if there are any errors in the dataset before normalizing.", "checklist": {"functions": ["load_dataset", "identify_errors", "normalize_temperature", "save_normalized_dataset"], "values": [[{"Station ID": "S001", "Date": "2021-01-01", "Time": "12:00", "Temperature": "32.0", "Unit": "Fahrenheit"}, {"Station ID": "S002", "Date": "2021-01-01", "Time": "13:00", "Temperature": "273.15", "Unit": "Kelvin"}, {"Station ID": "S003", "Date": "2021-01-01", "Time": "14:00", "Temperature": "22.0", "Unit": "Celsius"}, {"Station ID": "S001", "Date": "2021-01-01", "Time": "15:00", "Temperature": null, "Unit": "Fahrenheit"}, {"Station ID": "S002", "Date": "2021-01-01", "Time": "16:00", "Temperature": "100.0", "Unit": "Celsius"}], {"missing_values": [{"Station ID": "S001", "Date": "2021-01-01", "Time": "15:00", "Temperature": null, "Unit": "Fahrenheit"}], "incorrect_units": []}, [{"Station ID": "S001", "Date": "2021-01-01", "Time": "12:00", "Temperature": 0.0, "Unit": "Celsius"}, {"Station ID": "S002", "Date": "2021-01-01", "Time": "13:00", "Temperature": 0.0, "Unit": "Celsius"}, {"Station ID": "S003", "Date": "2021-01-01", "Time": "14:00", "Temperature": 22.0, "Unit": "Celsius"}, {"Station ID": "S001", "Date": "2021-01-01", "Time": "15:00", "Temperature": null, "Unit": "Celsius"}, {"Station ID": "S002", "Date": "2021-01-01", "Time": "16:00", "Temperature": 100.0, "Unit": "Celsius"}], true]}}
{"difficulty": "hard", "function_schema_python": "def get_pending_orders(system: str) -> int:\n    \"\"\"Retrieves the number of pending orders from the specified system.\n\n    :param system: The name of the order management system (e.g., \"Order Fulfillment Orchestrator\").\n    :return: The number of pending orders.\n    :raises ValueError: If the system name is invalid.\"\"\"\n    pass\ndef get_fulfillment_center_capacity(center_id: str) -> float:\n    \"\"\"Retrieves the current operating capacity of a fulfillment center.\n\n    :param center_id: The ID of the fulfillment center (e.g., \"FC-West\").\n    :return: The operating capacity as a percentage (e.g., 0.85 for 85%).\n    :raises ValueError: If the center ID is invalid.\"\"\"\n    pass\ndef get_inventory_levels(product_id: str, fulfillment_center_id: str) -> int:\n    \"\"\"Retrieves the inventory level of a specific product at a given fulfillment center.\n\n    :param product_id: The ID of the product.\n    :param fulfillment_center_id: The ID of the fulfillment center.\n    :return: The current inventory level.\n    :raises ValueError: If the product ID or fulfillment center ID is invalid.\"\"\"\n    pass\ndef optimize_order_distribution(orders: int, fulfillment_centers: List[str], inventory_levels: Dict[str, int], capacities: Dict[str, float]) -> Dict[str, int]:\n    \"\"\"Optimizes the distribution of orders across fulfillment centers.\n\n    :param orders: The total number of orders to distribute.\n    :param fulfillment_centers: A list of fulfillment center IDs.\n    :param inventory_levels: A dictionary mapping fulfillment center IDs to inventory levels.\n    :param capacities: A dictionary mapping fulfillment center IDs to operating capacities.\n    :return: A dictionary mapping fulfillment center IDs to the number of orders assigned to each.\"\"\"\n    pass\n", "function_schema_json": [{"name": "get_pending_orders", "description": "Retrieves the number of pending orders from the specified system.", "parameters": {"type": "object", "properties": {"system": {"type": "string", "description": "The name of the order management system (e.g., \"Order Fulfillment Orchestrator\")."}}, "required": ["system"], "additionalProperties": false}}, {"name": "get_fulfillment_center_capacity", "description": "Retrieves the current operating capacity of a fulfillment center.", "parameters": {"type": "object", "properties": {"center_id": {"type": "string", "description": "The ID of the fulfillment center (e.g., \"FC-West\")."}}, "required": ["center_id"], "additionalProperties": false}}, {"name": "get_inventory_levels", "description": "Retrieves the inventory level of a specific product at a given fulfillment center.", "parameters": {"type": "object", "properties": {"product_id": {"type": "string", "description": "The ID of the product."}, "fulfillment_center_id": {"type": "string", "description": "The ID of the fulfillment center."}}, "required": ["product_id", "fulfillment_center_id"], "additionalProperties": false}}, {"name": "optimize_order_distribution", "description": "Optimizes the distribution of orders across fulfillment centers.", "parameters": {"type": "object", "properties": {"orders": {"type": "integer", "description": "The total number of orders to distribute."}, "fulfillment_centers": {"type": "array", "items": {"type": "string"}, "description": "A list of fulfillment center IDs."}, "inventory_levels": {"type": "object", "description": "A dictionary mapping fulfillment center IDs to inventory levels."}, "capacities": {"type": "object", "description": "A dictionary mapping fulfillment center IDs to operating capacities."}}, "required": ["orders", "fulfillment_centers", "inventory_levels", "capacities"], "additionalProperties": false}}], "mock_functions": "def get_pending_orders(system: str) -> int:\n    \"\"\"\n    Retrieves the number of pending orders from the specified system.\n\n    :param system: The name of the order management system (e.g., \"Order Fulfillment Orchestrator\").\n    :return: The number of pending orders.\n    :raises ValueError: If the system name is invalid.\n    \"\"\"\n    if system == \"Order Fulfillment Orchestrator\":\n        return 2500\n    raise ValueError(\"Invalid system name.\")\ndef get_fulfillment_center_capacity(center_id: str) -> float:\n    \"\"\"\n    Retrieves the current operating capacity of a fulfillment center.\n\n    :param center_id: The ID of the fulfillment center (e.g., \"FC-West\").\n    :return: The operating capacity as a percentage (e.g., 0.85 for 85%).\n    :raises ValueError: If the center ID is invalid.\n    \"\"\"\n    capacities = {\n        \"FC-West\": 0.85,\n        \"FC-Central\": 0.60,\n        \"FC-East\": 0.75,\n    }\n    if center_id in capacities:\n        return capacities[center_id]\n    raise ValueError(\"Invalid fulfillment center ID.\")\ndef get_inventory_levels(product_id: str, fulfillment_center_id: str) -> int:\n    \"\"\"\n    Retrieves the inventory level of a specific product at a given fulfillment center.\n\n    :param product_id: The ID of the product.\n    :param fulfillment_center_id: The ID of the fulfillment center.\n    :return: The current inventory level.\n    :raises ValueError: If the product ID or fulfillment center ID is invalid.\n    \"\"\"\n    if product_id == \"GT-500\" and fulfillment_center_id in [\"FC-West\", \"FC-Central\", \"FC-East\"]:\n        # Mock inventory levels\n        inventory = {\n            \"FC-West\": 500,\n            \"FC-Central\": 1200,\n            \"FC-East\": 800,\n        }\n        return inventory[fulfillment_center_id]\n    raise ValueError(\"Invalid product or fulfillment center ID.\")\ndef optimize_order_distribution(orders: int, fulfillment_centers: List[str], inventory_levels: Dict[str, int], capacities: Dict[str, float]) -> Dict[str, int]:\n    \"\"\"\n    Optimizes the distribution of orders across fulfillment centers.\n\n    :param orders: The total number of orders to distribute.\n    :param fulfillment_centers: A list of fulfillment center IDs.\n    :param inventory_levels: A dictionary mapping fulfillment center IDs to inventory levels.\n    :param capacities: A dictionary mapping fulfillment center IDs to operating capacities.\n    :return: A dictionary mapping fulfillment center IDs to the number of orders assigned to each.\n    \"\"\"\n    if orders == 2500 and fulfillment_centers == [\"FC-West\", \"FC-Central\", \"FC-East\"] and isinstance(inventory_levels, dict) and isinstance(capacities, dict) :\n        return {\n            \"FC-West\": 700,\n            \"FC-Central\": 1000,\n            \"FC-East\": 800,\n        }\n    return {}", "user_query": "This is Sarah Chen from TechGear Electronics. Could you optimize the distribution of 2,500 orders for the GT-500 model across FC-West, FC-Central, and FC-East considering their current capacities and inventory levels?", "checklist": {"functions": ["get_fulfillment_center_capacity", "get_inventory_levels", "optimize_order_distribution"], "values": [2500, {"FC-West": 0.85, "FC-Central": 0.6, "FC-East": 0.75}, {"FC-West": 500, "FC-Central": 1200, "FC-East": 800}, {"FC-West": 700, "FC-Central": 1000, "FC-East": 800}]}}
{"difficulty": "hard", "function_schema_python": "def extract_sales_data(warehouse_id: str) -> list:\n    \"\"\"Extracts sales data from the specified warehouse.\n\n    :param warehouse_id: The ID of the warehouse to extract data from (e.g., \"WA-2024-Q1\").\n    :return: A list of dictionaries, each representing a sales record with the following keys:\n        - product_category (str): The category of the product.\n        - revenue (float): The revenue generated from the sale.\n    :raises ValueError: If the warehouse_id is not recognized.\"\"\"\n    pass\ndef extract_customer_data(warehouse_id: str) -> list:\n    \"\"\"Extracts customer demographic data from the specified warehouse.\n\n    :param warehouse_id: The ID of the warehouse to extract data from (e.g., \"WC-2024\").\n    :return: A list of dictionaries, each representing a customer record with the following keys:\n        - product_category (str): The category of the product.\n        - customer_age (int): The age of the customer.\n        - customer_location (str): The location of the customer.\n    :raises ValueError: If the warehouse_id is not recognized.\"\"\"\n    pass\ndef aggregate_sales_data(sales_data: list) -> dict:\n    \"\"\"Aggregates sales data by product category.\n\n    :param sales_data: A list of sales records, where each record is a dictionary with the following keys:\n        - product_category (str): The category of the product.\n        - revenue (float): The revenue generated from the sale.\n    :return: A dictionary with aggregated sales revenue by product category, where the keys are product categories \n             and the values are the aggregated revenues (float).\"\"\"\n    pass\ndef consolidate_data(sales_data_aggregated: dict, customer_data: list) -> dict:\n    \"\"\"Consolidates aggregated sales data with customer demographic data.\n\n    :param sales_data_aggregated: A dictionary with aggregated sales revenue by product category.\n    :param customer_data: A list of customer records.\n    :return: A consolidated dictionary with the following keys:\n        - product_category (str): The category of the product.\n        - total_revenue (float): The total revenue for the product category.\n        - customer_info (list): A list of dictionaries with customer demographic information for the product category.\"\"\"\n    pass\ndef generate_report(consolidated_data: dict) -> str:\n    \"\"\"Generates a report from the consolidated data.\n\n    :param consolidated_data: A consolidated dictionary with product category, total revenue, and customer information.\n    :return: A string representing the report.\"\"\"\n    pass\n", "function_schema_json": [{"name": "extract_sales_data", "description": "Extracts sales data from the specified warehouse.", "parameters": {"type": "object", "properties": {"warehouse_id": {"type": "string", "description": "The ID of the warehouse to extract data from (e.g., \"WA-2024-Q1\")."}}, "required": ["warehouse_id"], "additionalProperties": false}}, {"name": "extract_customer_data", "description": "Extracts customer demographic data from the specified warehouse.", "parameters": {"type": "object", "properties": {"warehouse_id": {"type": "string", "description": "The ID of the warehouse to extract data from (e.g., \"WC-2024\")."}}, "required": ["warehouse_id"], "additionalProperties": false}}, {"name": "aggregate_sales_data", "description": "Aggregates sales data by product category.", "parameters": {"type": "object", "properties": {"sales_data": {"type": "array", "description": "A list of sales records, where each record is a dictionary with the following keys:"}}, "required": ["sales_data"], "additionalProperties": false}}, {"name": "consolidate_data", "description": "Consolidates aggregated sales data with customer demographic data.", "parameters": {"type": "object", "properties": {"sales_data_aggregated": {"type": "object", "description": "A dictionary with aggregated sales revenue by product category."}, "customer_data": {"type": "array", "description": "A list of customer records."}}, "required": ["sales_data_aggregated", "customer_data"], "additionalProperties": false}}, {"name": "generate_report", "description": "Generates a report from the consolidated data.", "parameters": {"type": "object", "properties": {"consolidated_data": {"type": "object", "description": "A consolidated dictionary with product category, total revenue, and customer information."}}, "required": ["consolidated_data"], "additionalProperties": false}}], "mock_functions": "def extract_sales_data(warehouse_id: str) -> list:\n    \"\"\"\n    Extracts sales data from the specified warehouse.\n    \n    :param warehouse_id: The ID of the warehouse to extract data from (e.g., \"WA-2024-Q1\").\n    :return: A list of dictionaries, each representing a sales record with the following keys:\n        - product_category (str): The category of the product.\n        - revenue (float): The revenue generated from the sale.\n    :raises ValueError: If the warehouse_id is not recognized.\n    \"\"\"\n    if warehouse_id not in [\"WA-2024-Q1\", \"WB-2024-Q2\"]:\n        raise ValueError(\"Unrecognized warehouse ID.\")\n    \n    # Mock data for demonstration\n    if warehouse_id == \"WA-2024-Q1\":\n        return [\n            {\"product_category\": \"Electronics\", \"revenue\": 1500.0},\n            {\"product_category\": \"Clothing\", \"revenue\": 2000.0},\n            {\"product_category\": \"Electronics\", \"revenue\": 2500.0},\n        ]\n    elif warehouse_id == \"WB-2024-Q2\":\n        return [\n            {\"product_category\": \"Clothing\", \"revenue\": 1200.0},\n            {\"product_category\": \"Home Appliances\", \"revenue\": 4000.0},\n            {\"product_category\": \"Clothing\", \"revenue\": 1800.0},\n        ]\ndef extract_customer_data(warehouse_id: str) -> list:\n    \"\"\"\n    Extracts customer demographic data from the specified warehouse.\n    \n    :param warehouse_id: The ID of the warehouse to extract data from (e.g., \"WC-2024\").\n    :return: A list of dictionaries, each representing a customer record with the following keys:\n        - product_category (str): The category of the product.\n        - customer_age (int): The age of the customer.\n        - customer_location (str): The location of the customer.\n    :raises ValueError: If the warehouse_id is not recognized.\n    \"\"\"\n    if warehouse_id != \"WC-2024\":\n        raise ValueError(\"Unrecognized warehouse ID.\")\n    \n    # Mock data for demonstration\n    return [\n        {\"product_category\": \"Electronics\", \"customer_age\": 30, \"customer_location\": \"New York\"},\n        {\"product_category\": \"Clothing\", \"customer_age\": 25, \"customer_location\": \"Los Angeles\"},\n        {\"product_category\": \"Home Appliances\", \"customer_age\": 45, \"customer_location\": \"Chicago\"},\n    ]\ndef aggregate_sales_data(sales_data: list) -> dict:\n    \"\"\"\n    Aggregates sales data by product category.\n    \n    :param sales_data: A list of sales records, where each record is a dictionary with the following keys:\n        - product_category (str): The category of the product.\n        - revenue (float): The revenue generated from the sale.\n    :return: A dictionary with aggregated sales revenue by product category, where the keys are product categories \n             and the values are the aggregated revenues (float).\n    \"\"\"\n    aggregated_data = {}\n    for record in sales_data:\n        category = record[\"product_category\"]\n        revenue = record[\"revenue\"]\n        if category not in aggregated_data:\n            aggregated_data[category] = 0.0\n        aggregated_data[category] += revenue\n    \n    return aggregated_data\ndef consolidate_data(sales_data_aggregated: dict, customer_data: list) -> dict:\n    \"\"\"\n    Consolidates aggregated sales data with customer demographic data.\n    \n    :param sales_data_aggregated: A dictionary with aggregated sales revenue by product category.\n    :param customer_data: A list of customer records.\n    :return: A consolidated dictionary with the following keys:\n        - product_category (str): The category of the product.\n        - total_revenue (float): The total revenue for the product category.\n        - customer_info (list): A list of dictionaries with customer demographic information for the product category.\n    \"\"\"\n    consolidated = {}\n    for category, revenue in sales_data_aggregated.items():\n        associated_customers = [customer for customer in customer_data if customer[\"product_category\"] == category]\n        consolidated[category] = {\n            \"total_revenue\": revenue,\n            \"customer_info\": associated_customers\n        }\n    \n    return consolidated\ndef generate_report(consolidated_data: dict) -> str:\n    \"\"\"\n    Generates a report from the consolidated data.\n    \n    :param consolidated_data: A consolidated dictionary with product category, total revenue, and customer information.\n    :return: A string representing the report.\n    \"\"\"\n    report_lines = [\"Sales Report for Q1 and Q2 2024:\\n\"]\n    for category, details in consolidated_data.items():\n        report_lines.append(f\"Product Category: {category}\")\n        report_lines.append(f\"Total Revenue: ${details['total_revenue']:.2f}\")\n        report_lines.append(\"Customer Information:\")\n        for customer in details[\"customer_info\"]:\n            report_lines.append(f\"  Age: {customer['customer_age']}, Location: {customer['customer_location']}\")\n        report_lines.append(\"\")  # Separator between categories\n    \n    return \"\\n\".join(report_lines)", "user_query": "This is Sarah from Acme Corp. I need a sales report. Please extract sales data from warehouse IDs WA-2024-Q1 and WB-2024-Q2, aggregate it by product category, then consolidate that with customer demographics from warehouse WC-2024 and generate a report.", "checklist": {"functions": ["extract_sales_data", "extract_customer_data", "aggregate_sales_data", "consolidate_data", "generate_report"], "values": [[{"product_category": "Electronics", "revenue": 1500.0}, {"product_category": "Clothing", "revenue": 2000.0}, {"product_category": "Electronics", "revenue": 2500.0}, {"product_category": "Clothing", "revenue": 1200.0}, {"product_category": "Home Appliances", "revenue": 4000.0}, {"product_category": "Clothing", "revenue": 1800.0}], [{"product_category": "Electronics", "customer_age": 30, "customer_location": "New York"}, {"product_category": "Clothing", "customer_age": 25, "customer_location": "Los Angeles"}, {"product_category": "Home Appliances", "customer_age": 45, "customer_location": "Chicago"}], {"Electronics": 4000.0, "Clothing": 5000.0, "Home Appliances": 4000.0}, {"Electronics": {"total_revenue": 4000.0, "customer_info": [{"product_category": "Electronics", "customer_age": 30, "customer_location": "New York"}]}, "Clothing": {"total_revenue": 5000.0, "customer_info": [{"product_category": "Clothing", "customer_age": 25, "customer_location": "Los Angeles"}]}, "Home Appliances": {"total_revenue": 4000.0, "customer_info": [{"product_category": "Home Appliances", "customer_age": 45, "customer_location": "Chicago"}]}}, "Sales Report for Q1 and Q2 2024:\nProduct Category: Electronics\nTotal Revenue: $4000.00\nCustomer Information:\n  Age: 30, Location: New York\n\nProduct Category: Clothing\nTotal Revenue: $5000.00\nCustomer Information:\n  Age: 25, Location: Los Angeles\n\nProduct Category: Home Appliances\nTotal Revenue: $4000.00\nCustomer Information:\n  Age: 45, Location: Chicago\n\n"]}}
{"difficulty": "hard", "function_schema_python": "def get_overdue_invoices(quarter: str, year: int) -> list[dict]:\n    \"\"\"Retrieves all overdue invoices for a specific quarter.\n\n    :param quarter: The quarter (Q1, Q2, Q3, Q4).\n    :param year: The year for which to retrieve invoices.\n    :return: List of dictionaries containing invoice details.\n    :raises ValueError: If quarter format is invalid.\"\"\"\n    pass\ndef calculate_total_outstanding(invoices: list[dict]) -> float:\n    \"\"\"Calculates the total amount of outstanding payments.\n\n    :param invoices: List of invoice dictionaries with 'amount' key.\n    :return: Total outstanding amount.\n    :raises KeyError: If invoice dictionaries don't contain 'amount' key.\"\"\"\n    pass\ndef generate_overdue_report(invoices: list[dict]) -> dict:\n    \"\"\"Generates a detailed report of overdue invoices.\n\n    :param invoices: List of invoice dictionaries.\n    :return: Dictionary containing report details.\"\"\"\n    pass\ndef send_payment_reminder(client_id: str, amount: float, days_overdue: int) -> bool:\n    \"\"\"Sends a payment reminder to a client using Stripe's notification system.\n\n    :param client_id: The unique identifier for the client.\n    :param amount: The outstanding amount.\n    :param days_overdue: Number of days the payment is overdue.\n    :return: True if reminder sent successfully, False otherwise.\"\"\"\n    pass\n", "function_schema_json": [{"name": "get_overdue_invoices", "description": "Retrieves all overdue invoices for a specific quarter.", "parameters": {"type": "object", "properties": {"quarter": {"type": "string", "description": "The quarter (Q1, Q2, Q3, Q4)."}, "year": {"type": "integer", "description": "The year for which to retrieve invoices."}}, "required": ["quarter", "year"], "additionalProperties": false}}, {"name": "calculate_total_outstanding", "description": "Calculates the total amount of outstanding payments.", "parameters": {"type": "object", "properties": {"invoices": {"type": "array", "items": {"type": "object"}, "description": "List of invoice dictionaries with 'amount' key."}}, "required": ["invoices"], "additionalProperties": false}}, {"name": "generate_overdue_report", "description": "Generates a detailed report of overdue invoices.", "parameters": {"type": "object", "properties": {"invoices": {"type": "array", "items": {"type": "object"}, "description": "List of invoice dictionaries."}}, "required": ["invoices"], "additionalProperties": false}}, {"name": "send_payment_reminder", "description": "Sends a payment reminder to a client using Stripe's notification system.", "parameters": {"type": "object", "properties": {"client_id": {"type": "string", "description": "The unique identifier for the client."}, "amount": {"type": "number", "description": "The outstanding amount."}, "days_overdue": {"type": "integer", "description": "Number of days the payment is overdue."}}, "required": ["client_id", "amount", "days_overdue"], "additionalProperties": false}}], "mock_functions": "def get_overdue_invoices(quarter: str, year: int) -> list[dict]:\n    \"\"\"\n    Retrieves all overdue invoices for a specific quarter.\n    \n    :param quarter: The quarter (Q1, Q2, Q3, Q4).\n    :param year: The year for which to retrieve invoices.\n    :return: List of dictionaries containing invoice details.\n    :raises ValueError: If quarter format is invalid.\n    \"\"\"\n    if not quarter.upper() in ['Q1', 'Q2', 'Q3', 'Q4']:\n        raise ValueError(\"Invalid quarter format. Use Q1, Q2, Q3, or Q4\")\n    \n    if quarter.upper() == 'Q2' and year == 2023:\n        return [\n            {\"client_id\": \"CL001\", \"amount\": 5000, \"days_overdue\": 45},\n            {\"client_id\": \"CL002\", \"amount\": 7500, \"days_overdue\": 30}\n        ]\n    return []\ndef calculate_total_outstanding(invoices: list[dict]) -> float:\n    \"\"\"\n    Calculates the total amount of outstanding payments.\n    \n    :param invoices: List of invoice dictionaries with 'amount' key.\n    :return: Total outstanding amount.\n    :raises KeyError: If invoice dictionaries don't contain 'amount' key.\n    \"\"\"\n    if not all('amount' in invoice for invoice in invoices):\n        raise KeyError(\"All invoices must contain 'amount' key\")\n    \n    return sum(invoice['amount'] for invoice in invoices)\ndef generate_overdue_report(invoices: list[dict]) -> dict:\n    \"\"\"\n    Generates a detailed report of overdue invoices.\n    \n    :param invoices: List of invoice dictionaries.\n    :return: Dictionary containing report details.\n    \"\"\"\n    if not invoices:\n        return {\"status\": \"error\", \"message\": \"No invoices provided\"}\n    \n    return {\n        \"status\": \"success\",\n        \"total_overdue\": len(invoices),\n        \"total_amount\": sum(inv['amount'] for inv in invoices),\n        \"average_days_overdue\": sum(inv['days_overdue'] for inv in invoices) / len(invoices),\n        \"clients\": [inv['client_id'] for inv in invoices]\n    }\ndef send_payment_reminder(client_id: str, amount: float, days_overdue: int) -> bool:\n    \"\"\"\n    Sends a payment reminder to a client using Stripe's notification system.\n    \n    :param client_id: The unique identifier for the client.\n    :param amount: The outstanding amount.\n    :param days_overdue: Number of days the payment is overdue.\n    :return: True if reminder sent successfully, False otherwise.\n    \"\"\"\n    if not client_id.startswith(\"CL\") or amount <= 0 or days_overdue <= 0:\n        return False\n    return True", "user_query": "This is Ryan from Tech Solutions Inc. Please get all overdue invoices for Q2 2023, generate a detailed report, and send payment reminders to any clients with overdue amounts.", "checklist": {"functions": ["get_overdue_invoices", "calculate_total_outstanding", "generate_overdue_report", "send_payment_reminder"], "values": [[{"client_id": "CL001", "amount": 5000, "days_overdue": 45}, {"client_id": "CL002", "amount": 7500, "days_overdue": 30}], 12500.0, {"status": "success", "total_overdue": 2, "total_amount": 12500, "average_days_overdue": 37.5, "clients": ["CL001", "CL002"]}, [true, true]]}}
