{"difficulty": "hard", "function_schema_python": "def fine_tune_model(model_name: str, data_path: str) -> dict:\n    \"\"\"Fine-tunes a machine learning model using the provided data.\n\n    :param model_name: The name of the model to fine-tune (e.g., \"BankGuard\").\n    :param data_path: The file path to the data used for fine-tuning.\n    :return:\n        dict: A dictionary with the following keys:\n            - success (bool): Flag indicating if the fine-tuning was successful.\n            - message (str): A status message.\n    :raises ValueError: If model_name or data_path is empty.\"\"\"\n    pass\ndef integrate_model_with_pentest(model_name: str, pen_test_tools: list) -> dict:\n    \"\"\"Integrates a machine learning model with traditional pentesting tools.\n\n    :param model_name: The name of the model to integrate (e.g., \"BankGuard\").\n    :param pen_test_tools: A list of traditional pentesting tools to integrate with.\n    :return:\n        dict: A dictionary with the following keys:\n            - success (bool): Flag indicating if the integration was successful.\n            - message (str): A status message.\n    :raises ValueError: If model_name is empty or pen_test_tools is not a list or is empty.\"\"\"\n    pass\ndef validate_model(model_name: str, test_data_path: str) -> dict:\n    \"\"\"Validates the accuracy of a machine learning model using test data.\n\n    :param model_name: The name of the model to validate (e.g., \"BankGuard\").\n    :param test_data_path: The file path to the test data.\n    :return:\n        dict: A dictionary with the following keys:\n            - success (bool): Flag indicating if the validation was successful.\n            - accuracy (float): The accuracy of the model (0.0 to 1.0).\n            - message (str): A status message.\n    :raises ValueError: If model_name or test_data_path is empty.\"\"\"\n    pass\ndef generate_attack_vectors(tool_name: str, target_url: str) -> list:\n    \"\"\"Generates attack vectors for a target using a specified pentesting tool.\n\n    :param tool_name: The name of the pentesting tool to use (e.g., \"nmap\").\n    :param target_url: The URL of the target to generate attack vectors for.\n    :return:\n        list: A list of generated attack vectors.\n    :raises ValueError: If tool_name or target_url is empty.\"\"\"\n    pass\ndef log_results_to_mlflow(model_name: str, results: dict) -> bool:\n    \"\"\"Logs the results of a machine learning model to MLflow.\n\n    :param model_name: The name of the model whose results are being logged.\n    :param results: A dictionary containing the results to log.\n    :return: True if the logging was successful, False otherwise.\n    :raises ValueError: If model_name is empty or results is not a dictionary.\"\"\"\n    pass\n", "function_schema_json": [{"name": "fine_tune_model", "description": "Fine-tunes a machine learning model using the provided data.", "parameters": {"type": "object", "properties": {"model_name": {"type": "string", "description": "The name of the model to fine-tune (e.g., \"BankGuard\")."}, "data_path": {"type": "string", "description": "The file path to the data used for fine-tuning."}}, "required": ["model_name", "data_path"], "additionalProperties": false}}, {"name": "integrate_model_with_pentest", "description": "Integrates a machine learning model with traditional pentesting tools.", "parameters": {"type": "object", "properties": {"model_name": {"type": "string", "description": "The name of the model to integrate (e.g., \"BankGuard\")."}, "pen_test_tools": {"type": "array", "description": "A list of traditional pentesting tools to integrate with."}}, "required": ["model_name", "pen_test_tools"], "additionalProperties": false}}, {"name": "validate_model", "description": "Validates the accuracy of a machine learning model using test data.", "parameters": {"type": "object", "properties": {"model_name": {"type": "string", "description": "The name of the model to validate (e.g., \"BankGuard\")."}, "test_data_path": {"type": "string", "description": "The file path to the test data."}}, "required": ["model_name", "test_data_path"], "additionalProperties": false}}, {"name": "generate_attack_vectors", "description": "Generates attack vectors for a target using a specified pentesting tool.", "parameters": {"type": "object", "properties": {"tool_name": {"type": "string", "description": "The name of the pentesting tool to use (e.g., \"nmap\")."}, "target_url": {"type": "string", "description": "The URL of the target to generate attack vectors for."}}, "required": ["tool_name", "target_url"], "additionalProperties": false}}, {"name": "log_results_to_mlflow", "description": "Logs the results of a machine learning model to MLflow.", "parameters": {"type": "object", "properties": {"model_name": {"type": "string", "description": "The name of the model whose results are being logged."}, "results": {"type": "object", "description": "A dictionary containing the results to log."}}, "required": ["model_name", "results"], "additionalProperties": false}}], "mock_functions": "def fine_tune_model(model_name: str, data_path: str) -> dict:\n    \"\"\"\n    Fine-tunes a machine learning model using the provided data.\n    \n    :param model_name: The name of the model to fine-tune (e.g., \"BankGuard\").\n    :param data_path: The file path to the data used for fine-tuning.\n    :return:\n        dict: A dictionary with the following keys:\n            - success (bool): Flag indicating if the fine-tuning was successful.\n            - message (str): A status message.\n    :raises ValueError: If model_name or data_path is empty.\n    \"\"\"\n    if not model_name or not data_path:\n        raise ValueError(\"Model name and data path must be provided.\")\n    if model_name.lower() == \"bankguard\" and data_path.lower() == \"path/to/data.csv\":\n        return {\n            \"success\": True,\n            \"message\": \"Model BankGuard fine-tuned successfully.\"\n        }\n    return {\n        \"success\": False,\n        \"message\": \"Failed to fine-tune model.\"\n    }\ndef integrate_model_with_pentest(model_name: str, pen_test_tools: list) -> dict:\n    \"\"\"\n    Integrates a machine learning model with traditional pentesting tools.\n    \n    :param model_name: The name of the model to integrate (e.g., \"BankGuard\").\n    :param pen_test_tools: A list of traditional pentesting tools to integrate with.\n    :return:\n        dict: A dictionary with the following keys:\n            - success (bool): Flag indicating if the integration was successful.\n            - message (str): A status message.\n    :raises ValueError: If model_name is empty or pen_test_tools is not a list or is empty.\n    \"\"\"\n    if not model_name:\n        raise ValueError(\"Model name must be provided.\")\n    if not isinstance(pen_test_tools, list) or not pen_test_tools:\n        raise ValueError(\"Pentesting tools must be provided in a non-empty list.\")\n    if model_name.lower() == \"bankguard\" and pen_test_tools == [\"nmap\", \"metasploit\"]:\n        return {\n            \"success\": True,\n            \"message\": \"Model BankGuard integrated with nmap and metasploit successfully.\"\n        }\n    return {\n        \"success\": False,\n        \"message\": \"Failed to integrate model.\"\n    }\ndef validate_model(model_name: str, test_data_path: str) -> dict:\n    \"\"\"\n    Validates the accuracy of a machine learning model using test data.\n    \n    :param model_name: The name of the model to validate (e.g., \"BankGuard\").\n    :param test_data_path: The file path to the test data.\n    :return:\n        dict: A dictionary with the following keys:\n            - success (bool): Flag indicating if the validation was successful.\n            - accuracy (float): The accuracy of the model (0.0 to 1.0).\n            - message (str): A status message.\n    :raises ValueError: If model_name or test_data_path is empty.\n    \"\"\"\n    if not model_name or not test_data_path:\n        raise ValueError(\"Model name and test data path must be provided.\")\n    if model_name.lower() == \"bankguard\" and test_data_path.lower() == \"path/to/test_data.csv\":\n        return {\n            \"success\": True,\n            \"accuracy\": 0.92,\n            \"message\": \"Model BankGuard validated successfully with 92% accuracy.\"\n        }\n    return {\n        \"success\": False,\n        \"accuracy\": 0.0,\n        \"message\": \"Failed to validate model.\"\n    }\ndef generate_attack_vectors(tool_name: str, target_url: str) -> list:\n    \"\"\"\n    Generates attack vectors for a target using a specified pentesting tool.\n    \n    :param tool_name: The name of the pentesting tool to use (e.g., \"nmap\").\n    :param target_url: The URL of the target to generate attack vectors for.\n    :return:\n        list: A list of generated attack vectors.\n    :raises ValueError: If tool_name or target_url is empty.\n    \"\"\"\n    if not tool_name or not target_url:\n        raise ValueError(\"Tool name and target URL must be provided.\")\n    if tool_name.lower() == \"nmap\" and target_url.lower() == \"https://onlinebanking.banksafe.com\":\n        return [\n            \"Nmap scan of HTTPS service on https://onlinebanking.banksafe.com\",\n            \"Detected open port 443 (HTTPS)\",\n            \"Service version: Apache/2.4.41 (Ubuntu)\"\n        ]\n    return []\ndef log_results_to_mlflow(model_name: str, results: dict) -> bool:\n    \"\"\"\n    Logs the results of a machine learning model to MLflow.\n    \n    :param model_name: The name of the model whose results are being logged.\n    :param results: A dictionary containing the results to log.\n    :return: True if the logging was successful, False otherwise.\n    :raises ValueError: If model_name is empty or results is not a dictionary.\n    \"\"\"\n    if not model_name:\n        raise ValueError(\"Model name must be provided.\")\n    if not isinstance(results, dict):\n        raise ValueError(\"Results must be provided in a dictionary.\")\n    if model_name.lower() == \"bankguard\" and isinstance(results, dict):\n        return True\n    return False", "user_query": "This is Ryan from BankSafe. Please generate attack vectors using nmap for https://onlinebanking.banksafe.com, then validate BankGuard model with path/to/test_data.csv and log the validation results to MLflow.", "checklist": {"functions": ["generate_attack_vectors", "validate_model", "log_results_to_mlflow"], "values": [["Nmap scan of HTTPS service on https://onlinebanking.banksafe.com", "Detected open port 443 (HTTPS)", "Service version: Apache/2.4.41 (Ubuntu)"], {"success": true, "accuracy": 0.92, "message": "Model BankGuard validated successfully with 92% accuracy."}, true]}}
{"difficulty": "hard", "function_schema_python": "def extract_contact_info_from_emails(email_thread_ids: list[str], contact_name: str) -> dict:\n    \"\"\"Extracts updated contact information from a chain of emails.\n\n    :param email_thread_ids: List of email IDs to analyze\n    :param contact_name: Name of the contact to search for\n    :return: Dictionary containing updated contact information with keys:\n        - email (str): Updated email address\n        - phone (str): Updated phone number\n        - last_updated (str): Timestamp of the most recent update\n    :raises ValueError: If email_thread_ids is empty or contact_name is invalid\"\"\"\n    pass\ndef update_salesforce_contact(deal_id: str, contact_info: dict) -> bool:\n    \"\"\"Updates contact information in Salesforce CRM.\n\n    :param deal_id: Salesforce Deal ID\n    :param contact_info: Dictionary containing contact information to update\n    :return: True if update successful, False otherwise\n    :raises ValueError: If deal_id is invalid or contact_info is incomplete\"\"\"\n    pass\ndef validate_email_thread(email_thread_ids: list[str], deal_id: str) -> bool:\n    \"\"\"Validates if the email thread is related to the specified deal.\n\n    :param email_thread_ids: List of email IDs to validate\n    :param deal_id: Salesforce Deal ID to check against\n    :return: True if email thread is related to deal, False otherwise\n    :raises ValueError: If email_thread_ids is empty or deal_id is invalid\"\"\"\n    pass\n", "function_schema_json": [{"name": "extract_contact_info_from_emails", "description": "Extracts updated contact information from a chain of emails.", "parameters": {"type": "object", "properties": {"email_thread_ids": {"type": "array", "items": {"type": "string"}, "description": "List of email IDs to analyze"}, "contact_name": {"type": "string", "description": "Name of the contact to search for"}}, "required": ["email_thread_ids", "contact_name"], "additionalProperties": false}}, {"name": "update_salesforce_contact", "description": "Updates contact information in Salesforce CRM.", "parameters": {"type": "object", "properties": {"deal_id": {"type": "string", "description": "Salesforce Deal ID"}, "contact_info": {"type": "object", "description": "Dictionary containing contact information to update"}}, "required": ["deal_id", "contact_info"], "additionalProperties": false}}, {"name": "validate_email_thread", "description": "Validates if the email thread is related to the specified deal.", "parameters": {"type": "object", "properties": {"email_thread_ids": {"type": "array", "items": {"type": "string"}, "description": "List of email IDs to validate"}, "deal_id": {"type": "string", "description": "Salesforce Deal ID to check against"}}, "required": ["email_thread_ids", "deal_id"], "additionalProperties": false}}], "mock_functions": "def extract_contact_info_from_emails(email_thread_ids: list[str], contact_name: str) -> dict:\n    \"\"\"\n    Extracts updated contact information from a chain of emails.\n    \n    :param email_thread_ids: List of email IDs to analyze\n    :param contact_name: Name of the contact to search for\n    :return: Dictionary containing updated contact information with keys:\n        - email (str): Updated email address\n        - phone (str): Updated phone number\n        - last_updated (str): Timestamp of the most recent update\n    :raises ValueError: If email_thread_ids is empty or contact_name is invalid\n    \"\"\"\n    if not email_thread_ids or not contact_name:\n        raise ValueError(\"Email thread IDs and contact name must be provided\")\n    \n    if contact_name.lower() == \"sarah jones\" and len(email_thread_ids) == 5:\n        return {\n            \"email\": \"sarah.jones@globexinc.com\",\n            \"phone\": \"+1-555-0123\",\n            \"last_updated\": \"2023-12-01T14:30:00Z\"\n        }\n    return {}\ndef update_salesforce_contact(deal_id: str, contact_info: dict) -> bool:\n    \"\"\"\n    Updates contact information in Salesforce CRM.\n    \n    :param deal_id: Salesforce Deal ID\n    :param contact_info: Dictionary containing contact information to update\n    :return: True if update successful, False otherwise\n    :raises ValueError: If deal_id is invalid or contact_info is incomplete\n    \"\"\"\n    required_keys = [\"email\", \"phone\", \"last_updated\"]\n    if not deal_id or not all(key in contact_info for key in required_keys):\n        raise ValueError(\"Invalid deal ID or incomplete contact information\")\n    \n    if (deal_id == \"789456\" and \n        contact_info[\"email\"] == \"sarah.jones@globexinc.com\" and \n        contact_info[\"phone\"] == \"+1-555-0123\"):\n        return True\n    return False\ndef validate_email_thread(email_thread_ids: list[str], deal_id: str) -> bool:\n    \"\"\"\n    Validates if the email thread is related to the specified deal.\n    \n    :param email_thread_ids: List of email IDs to validate\n    :param deal_id: Salesforce Deal ID to check against\n    :return: True if email thread is related to deal, False otherwise\n    :raises ValueError: If email_thread_ids is empty or deal_id is invalid\n    \"\"\"\n    if not email_thread_ids or not deal_id:\n        raise ValueError(\"Email thread IDs and deal ID must be provided\")\n    \n    if deal_id == \"789456\" and len(email_thread_ids) == 5:\n        return True\n    return False", "user_query": "This is John from Acme Corp. Could you extract updated contact information for Sarah Jones from the email thread IDs [\u2018email1\u2019, \u2018email2\u2019, \u2018email3\u2019, \u2018email4\u2019, \u2018email5\u2019] and update her record in Salesforce for Deal ID 789456?", "checklist": {"functions": ["validate_email_thread", "extract_contact_info_from_emails", "update_salesforce_contact"], "values": [true, {"email": "sarah.jones@globexinc.com", "phone": "+1-555-0123", "last_updated": "2023-12-01T14:30:00Z"}, true]}}
{"difficulty": "hard", "function_schema_python": "def get_surge_areas(start_time: str, end_time: str, location: str, min_fare: float) -> dict:\n    \"\"\"Retrieves surge areas with the highest demand and least driver availability within a specified time frame and location.\n\n    :param start_time: The start time of the period in \"HH:MM\" format (e.g., \"17:00\").\n    :param end_time: The end time of the period in \"HH:MM\" format (e.g., \"19:00\").\n    :param location: The geographical location to analyze (e.g., \"Times Square\").\n    :param min_fare: The minimum fare threshold for surge areas in dollars (e.g., 25.0).\n    :return:\n        dict: A dictionary with the following keys:\n            - surge_areas (list[dict]): A list of dictionaries with each surge area's details.\n                - area (str): The specific area within the location.\n                - demand (int): The demand level in that area.\n                - availability (int): The number of available drivers in that area.\n                - estimated_earnings (float): The estimated earnings potential per ride.\n    :raises ValueError: If start_time, end_time, location, or min_fare are invalid.\"\"\"\n    pass\ndef display_heatmap(surge_areas: list) -> bool:\n    \"\"\"Displays a heatmap on a map with high demand and low driver availability areas highlighted.\n\n    :param surge_areas: A list of dictionaries with surge area details.\n    :return: True if the heatmap was successfully displayed, False otherwise.\n    :raises ValueError: If surge_areas is empty or not in the correct format.\"\"\"\n    pass\ndef check_surge_availability(surge_areas: list, min_fare: float) -> list:\n    \"\"\"Checks the surge areas for available rides that meet the minimum fare requirement.\n\n    :param surge_areas: A list of dictionaries with surge area details.\n    :param min_fare: The minimum fare threshold for surge areas in dollars (e.g., 25.0).\n    :return: A list of dictionaries with surge areas that meet the minimum fare requirement.\n    :raises ValueError: If surge_areas or min_fare are invalid.\"\"\"\n    pass\ndef suggest_ride_location(surge_areas: list) -> str:\n    \"\"\"Suggests an optimal location for John to position himself for maximum profit based on surge areas.\n\n    :param surge_areas: A list of dictionaries with surge area details.\n    :return: A string representing the suggested area for optimal positioning.\n    :raises ValueError: If surge_areas is empty or not in the correct format.\"\"\"\n    pass\n", "function_schema_json": [{"name": "get_surge_areas", "description": "Retrieves surge areas with the highest demand and least driver availability within a specified time frame and location.", "parameters": {"type": "object", "properties": {"start_time": {"type": "string", "description": "The start time of the period in \"HH:MM\" format (e.g., \"17:00\")."}, "end_time": {"type": "string", "description": "The end time of the period in \"HH:MM\" format (e.g., \"19:00\")."}, "location": {"type": "string", "description": "The geographical location to analyze (e.g., \"Times Square\")."}, "min_fare": {"type": "number", "description": "The minimum fare threshold for surge areas in dollars (e.g., 25.0)."}}, "required": ["start_time", "end_time", "location", "min_fare"], "additionalProperties": false}}, {"name": "display_heatmap", "description": "Displays a heatmap on a map with high demand and low driver availability areas highlighted.", "parameters": {"type": "object", "properties": {"surge_areas": {"type": "array", "description": "A list of dictionaries with surge area details."}}, "required": ["surge_areas"], "additionalProperties": false}}, {"name": "check_surge_availability", "description": "Checks the surge areas for available rides that meet the minimum fare requirement.", "parameters": {"type": "object", "properties": {"surge_areas": {"type": "array", "description": "A list of dictionaries with surge area details."}, "min_fare": {"type": "number", "description": "The minimum fare threshold for surge areas in dollars (e.g., 25.0)."}}, "required": ["surge_areas", "min_fare"], "additionalProperties": false}}, {"name": "suggest_ride_location", "description": "Suggests an optimal location for John to position himself for maximum profit based on surge areas.", "parameters": {"type": "object", "properties": {"surge_areas": {"type": "array", "description": "A list of dictionaries with surge area details."}}, "required": ["surge_areas"], "additionalProperties": false}}], "mock_functions": "def get_surge_areas(start_time: str, end_time: str, location: str, min_fare: float) -> dict:\n    \"\"\"\n    Retrieves surge areas with the highest demand and least driver availability within a specified time frame and location.\n    \n    :param start_time: The start time of the period in \"HH:MM\" format (e.g., \"17:00\").\n    :param end_time: The end time of the period in \"HH:MM\" format (e.g., \"19:00\").\n    :param location: The geographical location to analyze (e.g., \"Times Square\").\n    :param min_fare: The minimum fare threshold for surge areas in dollars (e.g., 25.0).\n    :return:\n        dict: A dictionary with the following keys:\n            - surge_areas (list[dict]): A list of dictionaries with each surge area's details.\n                - area (str): The specific area within the location.\n                - demand (int): The demand level in that area.\n                - availability (int): The number of available drivers in that area.\n                - estimated_earnings (float): The estimated earnings potential per ride.\n    :raises ValueError: If start_time, end_time, location, or min_fare are invalid.\n    \"\"\"\n    if not (start_time and end_time and location and min_fare):\n        raise ValueError(\"Start time, end time, location, and minimum fare must be provided.\")\n    if start_time == \"17:00\" and end_time == \"19:00\" and location == \"Times Square\":\n        return {\n            \"surge_areas\": [\n                {\n                    \"area\": \"West 42nd St and Broadway\",\n                    \"demand\": 90,\n                    \"availability\": 10,\n                    \"estimated_earnings\": 35.0\n                },\n                {\n                    \"area\": \"West 45th St and Broadway\",\n                    \"demand\": 85,\n                    \"availability\": 5,\n                    \"estimated_earnings\": 45.0\n                }\n            ]\n        }\n    return {}\ndef display_heatmap(surge_areas: list) -> bool:\n    \"\"\"\n    Displays a heatmap on a map with high demand and low driver availability areas highlighted.\n    \n    :param surge_areas: A list of dictionaries with surge area details.\n    :return: True if the heatmap was successfully displayed, False otherwise.\n    :raises ValueError: If surge_areas is empty or not in the correct format.\n    \"\"\"\n    if not surge_areas:\n        raise ValueError(\"Surge areas list must be provided and not empty.\")\n    if isinstance(surge_areas, list) and surge_areas and all(\"area\" in area for area in surge_areas):\n        print(\"Heatmap displayed with surge areas highlighted.\")\n        return True\n    return False\ndef check_surge_availability(surge_areas: list, min_fare: float) -> list:\n    \"\"\"\n    Checks the surge areas for available rides that meet the minimum fare requirement.\n    \n    :param surge_areas: A list of dictionaries with surge area details.\n    :param min_fare: The minimum fare threshold for surge areas in dollars (e.g., 25.0).\n    :return: A list of dictionaries with surge areas that meet the minimum fare requirement.\n    :raises ValueError: If surge_areas or min_fare are invalid.\n    \"\"\"\n    if not surge_areas or not min_fare:\n        raise ValueError(\"Surge areas list and minimum fare must be provided.\")\n    if not isinstance(surge_areas, list) or not isinstance(min_fare, float):\n        raise ValueError(\"Invalid type for surge areas list or minimum fare.\")\n    \n    available_areas = [area for area in surge_areas if area[\"estimated_earnings\"] >= min_fare]\n    return available_areas\ndef suggest_ride_location(surge_areas: list) -> str:\n    \"\"\"\n    Suggests an optimal location for John to position himself for maximum profit based on surge areas.\n    \n    :param surge_areas: A list of dictionaries with surge area details.\n    :return: A string representing the suggested area for optimal positioning.\n    :raises ValueError: If surge_areas is empty or not in the correct format.\n    \"\"\"\n    if not surge_areas:\n        raise ValueError(\"Surge areas list must be provided and not empty.\")\n    if isinstance(surge_areas, list) and surge_areas and all(\"area\" in area for area in surge_areas):\n        # Suggest the area with the highest estimated earnings\n        suggested_area = max(surge_areas, key=lambda x: x[\"estimated_earnings\"])[\"area\"]\n        return suggested_area\n    return \"\"", "user_query": "This is John. Please find surge areas in Times Square between 17:00 and 19:00 with $25.00 minimum fare, show them on heatmap, and suggest the best location for maximum earnings.", "checklist": {"functions": ["get_surge_areas", "display_heatmap", "check_surge_availability", "suggest_ride_location"], "values": [{"surge_areas": [{"area": "West 42nd St and Broadway", "demand": 90, "availability": 10, "estimated_earnings": 35.0}, {"area": "West 45th St and Broadway", "demand": 85, "availability": 5, "estimated_earnings": 45.0}]}, true, [{"area": "West 42nd St and Broadway", "demand": 90, "availability": 10, "estimated_earnings": 35.0}, {"area": "West 45th St and Broadway", "demand": 85, "availability": 5, "estimated_earnings": 45.0}], "West 45th St and Broadway"]}}
{"difficulty": "hard", "function_schema_python": "def analyze_access_patterns(excel_file: str, sheet_name: str) -> dict:\n    \"\"\"Analyzes access patterns from an Excel file.\n\n    :param excel_file: Path to the Excel file.\n    :param sheet_name: Name of the sheet to analyze.\n    :return: \n        dict: A dictionary containing analysis results with the following keys:\n            - most_common_access_level (str): The most frequent access level.\n            - average_access_duration (float): The average access duration.\n    :raises FileNotFoundError: If the Excel file is not found.\n    :raises ValueError: If the sheet name is invalid.\"\"\"\n    pass\ndef modify_employee_permissions(excel_file: str, employee_id: int, new_access_level: str) -> bool:\n    \"\"\"Modifies employee permissions in the Excel file.\n\n    :param excel_file: Path to the Excel file.\n    :param employee_id: The ID of the employee.\n    :param new_access_level: The new access level for the employee.\n    :return: True if the modification was successful, False otherwise.\n    :raises FileNotFoundError: If the Excel file is not found.\n    :raises ValueError: If the employee ID or access level is invalid.\"\"\"\n    pass\ndef maintain_security_protocols(excel_file: str) -> bool:\n    \"\"\"Maintains security protocols by validating data integrity.\n\n    :param excel_file: Path to the Excel file.\n    :return: True if security protocols are maintained, False otherwise.\"\"\"\n    pass\ndef ensure_compliance(policy_document: str) -> bool:\n    \"\"\"Ensures compliance with company policies.\n\n    :param policy_document: The name of the policy document.\n    :return: True if compliant, False otherwise.\"\"\"\n    pass\n", "function_schema_json": [{"name": "analyze_access_patterns", "description": "Analyzes access patterns from an Excel file.", "parameters": {"type": "object", "properties": {"excel_file": {"type": "string", "description": "Path to the Excel file."}, "sheet_name": {"type": "string", "description": "Name of the sheet to analyze."}}, "required": ["excel_file", "sheet_name"], "additionalProperties": false}}, {"name": "modify_employee_permissions", "description": "Modifies employee permissions in the Excel file.", "parameters": {"type": "object", "properties": {"excel_file": {"type": "string", "description": "Path to the Excel file."}, "employee_id": {"type": "integer", "description": "The ID of the employee."}, "new_access_level": {"type": "string", "description": "The new access level for the employee."}}, "required": ["excel_file", "employee_id", "new_access_level"], "additionalProperties": false}}, {"name": "maintain_security_protocols", "description": "Maintains security protocols by validating data integrity.", "parameters": {"type": "object", "properties": {"excel_file": {"type": "string", "description": "Path to the Excel file."}}, "required": ["excel_file"], "additionalProperties": false}}, {"name": "ensure_compliance", "description": "Ensures compliance with company policies.", "parameters": {"type": "object", "properties": {"policy_document": {"type": "string", "description": "The name of the policy document."}}, "required": ["policy_document"], "additionalProperties": false}}], "mock_functions": "def analyze_access_patterns(excel_file: str, sheet_name: str) -> dict:\n    \"\"\"\n    Analyzes access patterns from an Excel file.\n\n    :param excel_file: Path to the Excel file.\n    :param sheet_name: Name of the sheet to analyze.\n    :return: \n        dict: A dictionary containing analysis results with the following keys:\n            - most_common_access_level (str): The most frequent access level.\n            - average_access_duration (float): The average access duration.\n    :raises FileNotFoundError: If the Excel file is not found.\n    :raises ValueError: If the sheet name is invalid.\n    \"\"\"\n    if excel_file == \"employee_access_2023.xlsx\":\n        if sheet_name == \"Access_Levels\":\n            return {\n                \"most_common_access_level\": \"Level 2\",\n                \"average_access_duration\": 3.5\n            }\n        else:\n            raise ValueError(\"Invalid sheet name.\")\n    else:\n        raise FileNotFoundError(\"Excel file not found.\")\ndef modify_employee_permissions(excel_file: str, employee_id: int, new_access_level: str) -> bool:\n    \"\"\"\n    Modifies employee permissions in the Excel file.\n\n    :param excel_file: Path to the Excel file.\n    :param employee_id: The ID of the employee.\n    :param new_access_level: The new access level for the employee.\n    :return: True if the modification was successful, False otherwise.\n    :raises FileNotFoundError: If the Excel file is not found.\n    :raises ValueError: If the employee ID or access level is invalid.\n    \"\"\"\n    if excel_file == \"employee_access_2023.xlsx\":\n        if employee_id == 185:\n            if new_access_level == \"Level 2\":\n                return True\n            else:\n                raise ValueError(\"Invalid access level.\")\n        else:\n            raise ValueError(\"Invalid employee ID.\")\n    else:\n        raise FileNotFoundError(\"Excel file not found.\")\ndef maintain_security_protocols(excel_file: str) -> bool:\n    \"\"\"\n    Maintains security protocols by validating data integrity.\n\n    :param excel_file: Path to the Excel file.\n    :return: True if security protocols are maintained, False otherwise.\n    \"\"\"\n    if excel_file == \"employee_access_2023.xlsx\":\n        return True\n    return False\ndef ensure_compliance(policy_document: str) -> bool:\n    \"\"\"\n    Ensures compliance with company policies.\n\n    :param policy_document: The name of the policy document.\n    :return: True if compliant, False otherwise.\n    \"\"\"\n    # Mock logic: Always compliant for this scenario.\n    return True", "user_query": "This is Sarah from HR. Could you first ensure the security protocols are maintained in employee_access_2023.xlsx, then verify compliance with our company policy, and if everything checks out, modify employee ID 185's access level to \"Level 2\"?", "checklist": {"functions": ["maintain_security_protocols", "ensure_compliance", "modify_employee_permissions"], "values": [true, true, true]}}
{"difficulty": "hard", "function_schema_python": "def load_excel_sheet(file_path: str, sheet_name: str) -> list:\n    \"\"\"Loads a specific sheet from an Excel file and returns its data as a list of lists.\n\n    :param file_path: The path to the Excel file.\n    :param sheet_name: The name of the sheet to load.\n    :return: A list of lists, where each inner list represents a row from the sheet.\n    :raises FileNotFoundError: If the file does not exist.\n    :raises KeyError: If the sheet name does not exist in the file.\"\"\"\n    pass\ndef analyze_access_patterns(data: list) -> dict:\n    \"\"\"Analyzes access patterns from the provided data to identify anomalies.\n\n    :param data: The data to analyze, typically from a loaded Excel sheet.\n    :return:\n        dict: A dictionary with the following keys:\n            - anomalies (list[dict]): A list of dictionaries, each representing an anomaly with details.\"\"\"\n    pass\ndef update_access_matrix(file_path: str, updates: list) -> bool:\n    \"\"\"Updates the access matrix Excel file with the provided updates.\n\n    :param file_path: The path to the Excel file to update.\n    :param updates: A list of updates to apply to the file.\n    :return: True if the updates were successfully applied, False otherwise.\n    :raises FileNotFoundError: If the file does not exist.\"\"\"\n    pass\ndef generate_audit_report(anomalies: list, report_path: str) -> bool:\n    \"\"\"Generates an audit report based on detected anomalies and saves it to the specified path.\n\n    :param anomalies: A list of anomalies detected.\n    :param report_path: The path where the audit report should be saved.\n    :return: True if the report was successfully generated, False otherwise.\n    :raises ValueError: If the report path is not provided.\"\"\"\n    pass\ndef get_employee_details(employee_id: str) -> dict:\n    \"\"\"Retrieves details for a specific employee based on their ID.\n\n    :param employee_id: The ID of the employee.\n    :return:\n        dict: A dictionary with the following keys:\n            - name (str): The employee's name.\n            - branch_id (str): The ID of the branch the employee belongs to.\n            - department (str): The department the employee works in.\n            - clearance_level (str): The security clearance level of the employee.\n    :raises ValueError: If the employee ID is empty.\"\"\"\n    pass\ndef validate_access_changes(updates: list) -> list:\n    \"\"\"Validates the proposed access changes against banking regulations.\n\n    :param updates: A list of access changes to validate.\n    :return: A list of updates that are valid according to regulations.\n    :raises ValueError: If the input is not a list.\"\"\"\n    pass\n", "function_schema_json": [{"name": "load_excel_sheet", "description": "Loads a specific sheet from an Excel file and returns its data as a list of lists.", "parameters": {"type": "object", "properties": {"file_path": {"type": "string", "description": "The path to the Excel file."}, "sheet_name": {"type": "string", "description": "The name of the sheet to load."}}, "required": ["file_path", "sheet_name"], "additionalProperties": false}}, {"name": "analyze_access_patterns", "description": "Analyzes access patterns from the provided data to identify anomalies.", "parameters": {"type": "object", "properties": {"data": {"type": "array", "description": "The data to analyze, typically from a loaded Excel sheet."}}, "required": ["data"], "additionalProperties": false}}, {"name": "update_access_matrix", "description": "Updates the access matrix Excel file with the provided updates.", "parameters": {"type": "object", "properties": {"file_path": {"type": "string", "description": "The path to the Excel file to update."}, "updates": {"type": "array", "description": "A list of updates to apply to the file."}}, "required": ["file_path", "updates"], "additionalProperties": false}}, {"name": "generate_audit_report", "description": "Generates an audit report based on detected anomalies and saves it to the specified path.", "parameters": {"type": "object", "properties": {"anomalies": {"type": "array", "description": "A list of anomalies detected."}, "report_path": {"type": "string", "description": "The path where the audit report should be saved."}}, "required": ["anomalies", "report_path"], "additionalProperties": false}}, {"name": "get_employee_details", "description": "Retrieves details for a specific employee based on their ID.", "parameters": {"type": "object", "properties": {"employee_id": {"type": "string", "description": "The ID of the employee."}}, "required": ["employee_id"], "additionalProperties": false}}, {"name": "validate_access_changes", "description": "Validates the proposed access changes against banking regulations.", "parameters": {"type": "object", "properties": {"updates": {"type": "array", "description": "A list of access changes to validate."}}, "required": ["updates"], "additionalProperties": false}}], "mock_functions": "def load_excel_sheet(file_path: str, sheet_name: str) -> list:\n    \"\"\"\n    Loads a specific sheet from an Excel file and returns its data as a list of lists.\n    \n    :param file_path: The path to the Excel file.\n    :param sheet_name: The name of the sheet to load.\n    :return: A list of lists, where each inner list represents a row from the sheet.\n    :raises FileNotFoundError: If the file does not exist.\n    :raises KeyError: If the sheet name does not exist in the file.\n    \"\"\"\n    # Mock logic: return mock data based on sheet name\n    mock_data = {\n        \"Clearance_Levels\": [[\"Employee_ID\", \"Name\", \"Branch_ID\", \"Clearance_Level\", \"Access_Type\", \"Department\", \"Supervisor_Name\", \"Date_Hired\"]],\n        \"Vault_Access\": [[\"Employee_ID\", \"Branch_ID\", \"Vault_ID\", \"Access_Type\", \"Last_Access_Date\"]],\n        \"Special_Permissions\": [[\"Employee_ID\", \"Permission_Type\", \"Last_Updated\", \"Description\"]]\n    }\n    if not file_path:\n        raise FileNotFoundError(\"File path must be provided.\")\n    if sheet_name in mock_data:\n        return mock_data[sheet_name]\n    else:\n        raise KeyError(f\"Sheet '{sheet_name}' does not exist in the file.\")\ndef analyze_access_patterns(data: list) -> dict:\n    \"\"\"\n    Analyzes access patterns from the provided data to identify anomalies.\n    \n    :param data: The data to analyze, typically from a loaded Excel sheet.\n    :return:\n        dict: A dictionary with the following keys:\n            - anomalies (list[dict]): A list of dictionaries, each representing an anomaly with details.\n    \"\"\"\n    # Mock logic: return mock anomalies only for specific data structure\n    expected_data = [[\"Employee_ID\", \"Branch_ID\", \"Vault_ID\", \"Access_Type\", \"Last_Access_Date\"]]\n    if data == expected_data:\n        return {\"anomalies\": [\n            {\"employee_id\": \"E123\", \"description\": \"Unusual access frequency to Vault Access sheet\"},\n            {\"employee_id\": \"E456\", \"description\": \"Accessed Vault Access sheet during non-working hours\"}\n        ]}\n    return {\"anomalies\": []}\ndef update_access_matrix(file_path: str, updates: list) -> bool:\n    \"\"\"\n    Updates the access matrix Excel file with the provided updates.\n    \n    :param file_path: The path to the Excel file to update.\n    :param updates: A list of updates to apply to the file.\n    :return: True if the updates were successfully applied, False otherwise.\n    :raises FileNotFoundError: If the file does not exist.\n    \"\"\"\n    # Mock logic: always return True\n    if not file_path:\n        raise FileNotFoundError(\"File path must be provided.\")\n    return True\ndef generate_audit_report(anomalies: list, report_path: str) -> bool:\n    \"\"\"\n    Generates an audit report based on detected anomalies and saves it to the specified path.\n    \n    :param anomalies: A list of anomalies detected.\n    :param report_path: The path where the audit report should be saved.\n    :return: True if the report was successfully generated, False otherwise.\n    :raises ValueError: If the report path is not provided.\n    \"\"\"\n    if not report_path:\n        raise ValueError(\"Report path must be provided.\")\n    \n    expected_anomalies = [\n        {\"employee_id\": \"E123\", \"description\": \"Unusual access frequency to Vault Access sheet\"},\n        {\"employee_id\": \"E456\", \"description\": \"Accessed Vault Access sheet during non-working hours\"}\n    ]\n    \n    return report_path == \"quarterly_audit_2024Q1.pdf\" and anomalies == expected_anomalies\ndef get_employee_details(employee_id: str) -> dict:\n    \"\"\"\n    Retrieves details for a specific employee based on their ID.\n    \n    :param employee_id: The ID of the employee.\n    :return:\n        dict: A dictionary with the following keys:\n            - name (str): The employee's name.\n            - branch_id (str): The ID of the branch the employee belongs to.\n            - department (str): The department the employee works in.\n            - clearance_level (str): The security clearance level of the employee.\n    :raises ValueError: If the employee ID is empty.\n    \"\"\"\n    # Mock logic: return mock data\n    if not employee_id:\n        raise ValueError(\"Employee ID must be provided.\")\n    mock_details = {\n        \"E123\": {\"name\": \"John Doe\", \"branch_id\": \"B01\", \"department\": \"IT\", \"clearance_level\": \"Level 4\"},\n        \"E456\": {\"name\": \"Jane Smith\", \"branch_id\": \"B02\", \"department\": \"Finance\", \"clearance_level\": \"Level 3\"}\n    }\n    return mock_details.get(employee_id, {})\ndef validate_access_changes(updates: list) -> list:\n    \"\"\"\n    Validates the proposed access changes against banking regulations.\n    \n    :param updates: A list of access changes to validate.\n    :return: A list of updates that are valid according to regulations.\n    :raises ValueError: If the input is not a list.\n    \"\"\"\n    # Mock logic: always return the original updates for simplicity\n    if not isinstance(updates, list):\n        raise ValueError(\"Updates must be provided as a list.\")\n    return updates", "user_query": "This is Marcus. Please analyze access patterns in Vault_Access sheet from branch_security_matrix.xlsx and generate an audit report to quarterly_audit_2024Q1.pdf.", "checklist": {"functions": ["load_excel_sheet", "analyze_access_patterns", "generate_audit_report"], "values": [[["Employee_ID", "Branch_ID", "Vault_ID", "Access_Type", "Last_Access_Date"]], {"anomalies": [{"employee_id": "E123", "description": "Unusual access frequency to Vault Access sheet"}, {"employee_id": "E456", "description": "Accessed Vault Access sheet during non-working hours"}]}, true]}}
{"difficulty": "hard", "function_schema_python": "def adjust_cache_partition_sizes(department_traffic: Dict[str, float]) -> Dict[str, int]:\n    \"\"\"Adjusts Memcached cache partition sizes based on department traffic.\n\n    :param department_traffic: A dictionary mapping department names to their traffic percentage.\n    :return: A dictionary mapping department names to their allocated cache size in MB.\"\"\"\n    pass\ndef update_cache_retention_policy(department: str, retention_time_ms: int) -> bool:\n    \"\"\"Updates the cache retention policy for a specific department.\n\n    :param department: The name of the department.\n    :param retention_time_ms: The new retention time in milliseconds.\n    :return: True if the policy was updated successfully, False otherwise.\"\"\"\n    pass\ndef optimize_prefetch_parameters(department: str, prefetch_amount: int) -> bool:\n    \"\"\"Optimizes prefetch parameters for a given department.\n\n    :param department: The department name.\n    :param prefetch_amount: The number of records to prefetch.\n    :return: True if optimization was successful, False otherwise.\"\"\"\n    pass\ndef get_current_response_time() -> int:\n    \"\"\"Retrieves the current average response time of the system.\n\n    :return: The average response time in milliseconds.\"\"\"\n    pass\ndef process_patient_record_request(request_id: str) -> Dict[str, str]:\n    \"\"\"Processes a patient record request.\n\n    :param request_id: The ID of the request.\n    :return: A dictionary containing the request status and data (if successful).\n        - status (str): \"success\" or \"failure\".\n        - data (str, optional): Patient record data if the request was successful.\"\"\"\n    pass\n", "function_schema_json": [{"name": "adjust_cache_partition_sizes", "description": "Adjusts Memcached cache partition sizes based on department traffic.", "parameters": {"type": "object", "properties": {"department_traffic": {"type": "object", "description": "A dictionary mapping department names to their traffic percentage."}}, "required": ["department_traffic"], "additionalProperties": false}}, {"name": "update_cache_retention_policy", "description": "Updates the cache retention policy for a specific department.", "parameters": {"type": "object", "properties": {"department": {"type": "string", "description": "The name of the department."}, "retention_time_ms": {"type": "integer", "description": "The new retention time in milliseconds."}}, "required": ["department", "retention_time_ms"], "additionalProperties": false}}, {"name": "optimize_prefetch_parameters", "description": "Optimizes prefetch parameters for a given department.", "parameters": {"type": "object", "properties": {"department": {"type": "string", "description": "The department name."}, "prefetch_amount": {"type": "integer", "description": "The number of records to prefetch."}}, "required": ["department", "prefetch_amount"], "additionalProperties": false}}, {"name": "get_current_response_time", "description": "Retrieves the current average response time of the system.", "parameters": {"type": "object", "properties": {}, "required": [], "additionalProperties": false}}, {"name": "process_patient_record_request", "description": "Processes a patient record request.", "parameters": {"type": "object", "properties": {"request_id": {"type": "string", "description": "The ID of the request."}}, "required": ["request_id"], "additionalProperties": false}}], "mock_functions": "def adjust_cache_partition_sizes(department_traffic: Dict[str, float]) -> Dict[str, int]:\n    \"\"\"\n    Adjusts Memcached cache partition sizes based on department traffic.\n\n    :param department_traffic: A dictionary mapping department names to their traffic percentage.\n    :return: A dictionary mapping department names to their allocated cache size in MB.\n    \"\"\"\n    total_cache = 6 * 1024  # Total cache size (L1 + L2) in MB\n    allocated_cache = {}\n    for department, traffic in department_traffic.items():\n        allocated_cache[department] = int(total_cache * traffic)\n    return allocated_cache\ndef update_cache_retention_policy(department: str, retention_time_ms: int) -> bool:\n    \"\"\"\n    Updates the cache retention policy for a specific department.\n\n    :param department: The name of the department.\n    :param retention_time_ms: The new retention time in milliseconds.\n    :return: True if the policy was updated successfully, False otherwise.\n    \"\"\"\n    if retention_time_ms < 0:\n        return False  # Invalid retention time\n    # Mock implementation: Always return True for valid input\n    return True\ndef optimize_prefetch_parameters(department: str, prefetch_amount: int) -> bool:\n    \"\"\"\n    Optimizes prefetch parameters for a given department.\n\n    :param department: The department name.\n    :param prefetch_amount: The number of records to prefetch.\n    :return: True if optimization was successful, False otherwise.\n    \"\"\"\n    return department == \"Outpatient\" and prefetch_amount == 500\ndef get_current_response_time() -> int:\n    \"\"\"\n    Retrieves the current average response time of the system.\n\n    :return: The average response time in milliseconds.\n    \"\"\"\n    # Mock implementation: Simulate improved response time after optimization\n    return 150\ndef process_patient_record_request(request_id: str) -> Dict[str, str]:\n    \"\"\"\n    Processes a patient record request.\n\n    :param request_id: The ID of the request.\n    :return: A dictionary containing the request status and data (if successful).\n        - status (str): \"success\" or \"failure\".\n        - data (str, optional): Patient record data if the request was successful.\n    \"\"\"\n    if request_id == \"REQ-12345\":\n        return {\"status\": \"success\", \"data\": f\"Record data for {request_id}\"}\n    else:\n        return {\"status\": \"failure\"}", "user_query": "Marcus here. Optimize prefetch parameters for the Outpatient department to 500 records. After that, get the current response time and process a patient record request with ID \"REQ-12345\".", "checklist": {"functions": ["optimize_prefetch_parameters", "get_current_response_time", "process_patient_record_request"], "values": [true, 150, {"status": "success", "data": "Record data for REQ-12345"}]}}
{"difficulty": "hard", "function_schema_python": "def get_order_details(order_id: str) -> dict:\n    \"\"\"Retrieves the details of a specific order.\n\n    :param order_id: The unique identifier of the order.\n    :return: A dictionary containing order details with keys:\n        - items (list[dict]): List of ordered items with 'name' and 'price'\n        - total (float): Total order amount\n        - status (str): Order status\n        - timestamp (str): Order timestamp\n    :raises ValueError: If order_id is invalid or empty\"\"\"\n    pass\ndef verify_original_transaction(transaction_id: str) -> dict:\n    \"\"\"Verifies the original transaction details from payment processor.\n\n    :param transaction_id: The unique identifier of the transaction\n    :return: A dictionary containing transaction details with keys:\n        - items (list[dict]): List of items in original transaction\n        - amount (float): Transaction amount\n        - timestamp (str): Transaction timestamp\n    :raises ValueError: If transaction_id is invalid\"\"\"\n    pass\ndef correct_order_record(order_id: str, transaction_id: str) -> bool:\n    \"\"\"Corrects the order record based on the verified transaction.\n\n    :param order_id: The unique identifier of the order to correct\n    :param transaction_id: The transaction ID to reference\n    :return: True if correction was successful, False otherwise\n    :raises ValueError: If either ID is invalid\"\"\"\n    pass\ndef send_correction_confirmation(email: str, order_id: str) -> bool:\n    \"\"\"Sends a confirmation email about the order correction.\n\n    :param email: The recipient's email address\n    :param order_id: The order ID that was corrected\n    :return: True if email was sent successfully, False otherwise\n    :raises ValueError: If email is invalid or order_id is empty\"\"\"\n    pass\n", "function_schema_json": [{"name": "get_order_details", "description": "Retrieves the details of a specific order.", "parameters": {"type": "object", "properties": {"order_id": {"type": "string", "description": "The unique identifier of the order."}}, "required": ["order_id"], "additionalProperties": false}}, {"name": "verify_original_transaction", "description": "Verifies the original transaction details from payment processor.", "parameters": {"type": "object", "properties": {"transaction_id": {"type": "string", "description": "The unique identifier of the transaction"}}, "required": ["transaction_id"], "additionalProperties": false}}, {"name": "correct_order_record", "description": "Corrects the order record based on the verified transaction.", "parameters": {"type": "object", "properties": {"order_id": {"type": "string", "description": "The unique identifier of the order to correct"}, "transaction_id": {"type": "string", "description": "The transaction ID to reference"}}, "required": ["order_id", "transaction_id"], "additionalProperties": false}}, {"name": "send_correction_confirmation", "description": "Sends a confirmation email about the order correction.", "parameters": {"type": "object", "properties": {"email": {"type": "string", "description": "The recipient's email address"}, "order_id": {"type": "string", "description": "The order ID that was corrected"}}, "required": ["email", "order_id"], "additionalProperties": false}}], "mock_functions": "def get_order_details(order_id: str) -> dict:\n    \"\"\"\n    Retrieves the details of a specific order.\n    \n    :param order_id: The unique identifier of the order.\n    :return: A dictionary containing order details with keys:\n        - items (list[dict]): List of ordered items with 'name' and 'price'\n        - total (float): Total order amount\n        - status (str): Order status\n        - timestamp (str): Order timestamp\n    :raises ValueError: If order_id is invalid or empty\n    \"\"\"\n    if not order_id:\n        raise ValueError(\"Order ID cannot be empty\")\n    if order_id == \"ORDER123\":\n        return {\n            \"items\": [\n                {\"name\": \"Vegetarian Platter\", \"price\": 22.00},\n                {\"name\": \"Miso Soup\", \"price\": 5.00}\n            ],\n            \"total\": 27.00,\n            \"status\": \"Delivered\",\n            \"timestamp\": \"2023-07-20 18:30:00\"\n        }\n    raise ValueError(\"Invalid order ID\")\ndef verify_original_transaction(transaction_id: str) -> dict:\n    \"\"\"\n    Verifies the original transaction details from payment processor.\n    \n    :param transaction_id: The unique identifier of the transaction\n    :return: A dictionary containing transaction details with keys:\n        - items (list[dict]): List of items in original transaction\n        - amount (float): Transaction amount\n        - timestamp (str): Transaction timestamp\n    :raises ValueError: If transaction_id is invalid\n    \"\"\"\n    if not transaction_id:\n        raise ValueError(\"Transaction ID cannot be empty\")\n    if transaction_id == \"TXN456\":\n        return {\n            \"items\": [\n                {\"name\": \"Sushi Combo\", \"price\": 22.00},\n                {\"name\": \"Miso Soup\", \"price\": 5.00}\n            ],\n            \"amount\": 27.00,\n            \"timestamp\": \"2023-07-20 18:30:00\"\n        }\n    raise ValueError(\"Invalid transaction ID\")\ndef correct_order_record(order_id: str, transaction_id: str) -> bool:\n    \"\"\"\n    Corrects the order record based on the verified transaction.\n    \n    :param order_id: The unique identifier of the order to correct\n    :param transaction_id: The transaction ID to reference\n    :return: True if correction was successful, False otherwise\n    :raises ValueError: If either ID is invalid\n    \"\"\"\n    if not order_id or not transaction_id:\n        raise ValueError(\"Both order ID and transaction ID are required\")\n    if order_id == \"ORDER123\" and transaction_id == \"TXN456\":\n        return True\n    return False\ndef send_correction_confirmation(email: str, order_id: str) -> bool:\n    \"\"\"\n    Sends a confirmation email about the order correction.\n    \n    :param email: The recipient's email address\n    :param order_id: The order ID that was corrected\n    :return: True if email was sent successfully, False otherwise\n    :raises ValueError: If email is invalid or order_id is empty\n    \"\"\"\n    if not email or not order_id:\n        raise ValueError(\"Email and order ID are required\")\n    if email == \"mark@email.com\" and order_id == \"ORDER123\":\n        return True\n    return False", "user_query": "Mark here. My order ID is ORDER123, and the transaction ID is TXN456. Please correct the order record and send a confirmation email to mark@email.com.", "checklist": {"functions": ["get_order_details", "verify_original_transaction", "correct_order_record", "send_correction_confirmation"], "values": [{"items": [{"name": "Vegetarian Platter", "price": 22.0}, {"name": "Miso Soup", "price": 5.0}], "total": 27.0, "status": "Delivered", "timestamp": "2023-07-20 18:30:00"}, {"items": [{"name": "Sushi Combo", "price": 22.0}, {"name": "Miso Soup", "price": 5.0}], "amount": 27.0, "timestamp": "2023-07-20 18:30:00"}, true, true]}}
{"difficulty": "hard", "function_schema_python": "def parse_pdf_invoice(file_path: str, invoice_id: str) -> dict:\n    \"\"\"Parses a PDF invoice and extracts relevant information.\n\n    :param file_path: The file path to the PDF invoice.\n    :param invoice_id: The ID of the invoice to be parsed.\n    :return:\n        dict: A dictionary with the following keys:\n            - vendor_id (str): The ID of the vendor.\n            - invoice_date (str): The date of the invoice in \"YYYY-MM-DD\" format.\n            - itemized_costs (list[dict]): A list of itemized costs with keys 'description' (str) and 'amount' (float).\n            - total_amount (float): The total amount of the invoice.\n    :raises ValueError: If file_path or invoice_id is invalid.\"\"\"\n    pass\ndef record_payment_in_accounting_system(vendor_id: str, invoice_date: str, total_amount: float) -> bool:\n    \"\"\"Records a payment in the accounting system.\n\n    :param vendor_id: The ID of the vendor.\n    :param invoice_date: The date of the invoice in \"YYYY-MM-DD\" format.\n    :param total_amount: The total amount to be recorded.\n    :return: True if the payment was successfully recorded, False otherwise.\n    :raises ValueError: If any parameter is invalid.\"\"\"\n    pass\ndef generate_report_for_reconciliation(month: str, year: int) -> dict:\n    \"\"\"Generates a report for accounts payable reconciliation.\n\n    :param month: The month for reconciliation (e.g., \"February\").\n    :param year: The year for reconciliation (e.g., 2024).\n    :return:\n        dict: A dictionary with the following keys:\n            - month (str): The month of reconciliation.\n            - year (int): The year of reconciliation.\n            - total_payable (float): The total amount payable.\n            - vendor_invoices (list[dict]): A list of vendor invoices with keys 'vendor_id', 'invoice_id', 'total_amount'.\n    :raises ValueError: If month or year is invalid.\"\"\"\n    pass\n", "function_schema_json": [{"name": "parse_pdf_invoice", "description": "Parses a PDF invoice and extracts relevant information.", "parameters": {"type": "object", "properties": {"file_path": {"type": "string", "description": "The file path to the PDF invoice."}, "invoice_id": {"type": "string", "description": "The ID of the invoice to be parsed."}}, "required": ["file_path", "invoice_id"], "additionalProperties": false}}, {"name": "record_payment_in_accounting_system", "description": "Records a payment in the accounting system.", "parameters": {"type": "object", "properties": {"vendor_id": {"type": "string", "description": "The ID of the vendor."}, "invoice_date": {"type": "string", "description": "The date of the invoice in \"YYYY-MM-DD\" format."}, "total_amount": {"type": "number", "description": "The total amount to be recorded."}}, "required": ["vendor_id", "invoice_date", "total_amount"], "additionalProperties": false}}, {"name": "generate_report_for_reconciliation", "description": "Generates a report for accounts payable reconciliation.", "parameters": {"type": "object", "properties": {"month": {"type": "string", "description": "The month for reconciliation (e.g., \"February\")."}, "year": {"type": "integer", "description": "The year for reconciliation (e.g., 2024)."}}, "required": ["month", "year"], "additionalProperties": false}}], "mock_functions": "def parse_pdf_invoice(file_path: str, invoice_id: str) -> dict:\n    \"\"\"\n    Parses a PDF invoice and extracts relevant information.\n    \n    :param file_path: The file path to the PDF invoice.\n    :param invoice_id: The ID of the invoice to be parsed.\n    :return:\n        dict: A dictionary with the following keys:\n            - vendor_id (str): The ID of the vendor.\n            - invoice_date (str): The date of the invoice in \"YYYY-MM-DD\" format.\n            - itemized_costs (list[dict]): A list of itemized costs with keys 'description' (str) and 'amount' (float).\n            - total_amount (float): The total amount of the invoice.\n    :raises ValueError: If file_path or invoice_id is invalid.\n    \"\"\"\n    if not file_path or not invoice_id:\n        raise ValueError(\"File path and invoice ID must be provided.\")\n    \n    # Mock logic: If the invoice ID is correct, return a known result.\n    if invoice_id == \"GEB-2402-9876\" and file_path == \"/invoices/solar_invoice.pdf\":\n        return {\n            \"vendor_id\": \"SPS-555\",\n            \"invoice_date\": \"2024-02-15\",\n            \"itemized_costs\": [\n                {\"description\": \"Solar Panel Installation\", \"amount\": 2500.00},\n                {\"description\": \"Shipping and Handling\", \"amount\": 350.00},\n                {\"description\": \"Tax\", \"amount\": 400.00}\n            ],\n            \"total_amount\": 3250.00\n        }\n    return {}\ndef record_payment_in_accounting_system(vendor_id: str, invoice_date: str, total_amount: float) -> bool:\n    \"\"\"\n    Records a payment in the accounting system.\n    \n    :param vendor_id: The ID of the vendor.\n    :param invoice_date: The date of the invoice in \"YYYY-MM-DD\" format.\n    :param total_amount: The total amount to be recorded.\n    :return: True if the payment was successfully recorded, False otherwise.\n    :raises ValueError: If any parameter is invalid.\n    \"\"\"\n    if not vendor_id or not invoice_date or total_amount <= 0:\n        raise ValueError(\"Vendor ID, invoice date, and total amount must be provided and valid.\")\n    \n    # Mock logic: If all parameters are correct, return True.\n    if vendor_id == \"SPS-555\" and invoice_date == \"2024-02-15\" and total_amount == 3250.00:\n        return True\n    return False\ndef generate_report_for_reconciliation(month: str, year: int) -> dict:\n    \"\"\"\n    Generates a report for accounts payable reconciliation.\n    \n    :param month: The month for reconciliation (e.g., \"February\").\n    :param year: The year for reconciliation (e.g., 2024).\n    :return:\n        dict: A dictionary with the following keys:\n            - month (str): The month of reconciliation.\n            - year (int): The year of reconciliation.\n            - total_payable (float): The total amount payable.\n            - vendor_invoices (list[dict]): A list of vendor invoices with keys 'vendor_id', 'invoice_id', 'total_amount'.\n    :raises ValueError: If month or year is invalid.\n    \"\"\"\n    if not month or not isinstance(year, int):\n        raise ValueError(\"Month and year must be provided and valid.\")\n    \n    # Mock logic: If the month and year are correct, return a known result.\n    if month.lower() == \"february\" and year == 2024:\n        return {\n            \"month\": \"February\",\n            \"year\": 2024,\n            \"total_payable\": 12000.00,\n            \"vendor_invoices\": [\n                {\"vendor_id\": \"SPS-555\", \"invoice_id\": \"GEB-2402-9876\", \"total_amount\": 3250.00},\n                {\"vendor_id\": \"VEN-123\", \"invoice_id\": \"GEB-2402-1234\", \"total_amount\": 4500.00},\n                {\"vendor_id\": \"VEN-456\", \"invoice_id\": \"GEB-2402-5678\", \"total_amount\": 4250.00}\n            ]\n        }\n    return {}", "user_query": "This is David from Green Energy Bills. Please parse the corrupted PDF from \"/invoices/solar_invoice.pdf\" for invoice ID GEB-2402-9876, record the payment in the accounting system, and generate a reconciliation report for February 2024.", "checklist": {"functions": ["parse_pdf_invoice", "record_payment_in_accounting_system", "generate_report_for_reconciliation"], "values": [{"vendor_id": "SPS-555", "invoice_date": "2024-02-15", "itemized_costs": [{"description": "Solar Panel Installation", "amount": 2500.0}, {"description": "Shipping and Handling", "amount": 350.0}, {"description": "Tax", "amount": 400.0}], "total_amount": 3250.0}, true, {"month": "February", "year": 2024, "total_payable": 12000.0, "vendor_invoices": [{"vendor_id": "SPS-555", "invoice_id": "GEB-2402-9876", "total_amount": 3250.0}, {"vendor_id": "VEN-123", "invoice_id": "GEB-2402-1234", "total_amount": 4500.0}, {"vendor_id": "VEN-456", "invoice_id": "GEB-2402-5678", "total_amount": 4250.0}]}]}}